{"expand":"schema,names","startAt":0,"maxResults":50,"total":65,"issues":[{"expand":"operations,versionedRepresentations,editmeta,changelog,renderedFields","id":"279628","self":"https://arthrex.atlassian.net/rest/agile/1.0/issue/279628","key":"MOB-929","fields":{"resolution":null,"customfield_12930":null,"customfield_12923":null,"customfield_12924":null,"customfield_12929":null,"lastViewed":null,"customfield_11700":null,"customfield_12912":null,"customfield_11702":null,"customfield_11701":null,"customfield_12914":null,"aggregatetimeoriginalestimate":null,"customfield_12916":null,"customfield_12915":null,"customfield_12918":null,"customfield_12917":null,"issuelinks":[{"id":"170221","self":"https://arthrex.atlassian.net/rest/api/2/issueLink/170221","type":{"id":"10001","name":"Cloners","inward":"is cloned by","outward":"clones","self":"https://arthrex.atlassian.net/rest/api/2/issueLinkType/10001"},"outwardIssue":{"id":"268511","key":"MOB-809","self":"https://arthrex.atlassian.net/rest/api/2/issue/268511","fields":{"summary":"UX/UI","status":{"self":"https://arthrex.atlassian.net/rest/api/2/status/10001","description":"","iconUrl":"https://arthrex.atlassian.net/images/icons/subtask.gif","name":"Done","id":"10001","statusCategory":{"self":"https://arthrex.atlassian.net/rest/api/2/statuscategory/3","id":3,"key":"done","colorName":"green","name":"Done"}},"priority":{"self":"https://arthrex.atlassian.net/rest/api/2/priority/4","iconUrl":"https://s3.amazonaws.com/arthrex-public/jira/priorities/minor.png","name":"Minor","id":"4"},"issuetype":{"self":"https://arthrex.atlassian.net/rest/api/2/issuetype/3","id":"3","description":"A task that needs to be done.","iconUrl":"https://arthrex.atlassian.net/rest/api/2/universal_avatar/view/type/issuetype/avatar/10318?size=medium","name":"Task","subtask":false,"avatarId":10318,"hierarchyLevel":0}}}}],"assignee":{"self":"https://arthrex.atlassian.net/rest/api/2/user?accountId=60bac9915fa6f1006fee00b2","accountId":"60bac9915fa6f1006fee00b2","emailAddress":"johnny.ansari@arthrex.com","avatarUrls":{"48x48":"https://secure.gravatar.com/avatar/d887eff1f5130dfab59a6de736562de4?d=https%3A%2F%2Favatar-management--avatars.us-west-2.prod.public.atl-paas.net%2Finitials%2FJA-5.png","24x24":"https://secure.gravatar.com/avatar/d887eff1f5130dfab59a6de736562de4?d=https%3A%2F%2Favatar-management--avatars.us-west-2.prod.public.atl-paas.net%2Finitials%2FJA-5.png","16x16":"https://secure.gravatar.com/avatar/d887eff1f5130dfab59a6de736562de4?d=https%3A%2F%2Favatar-management--avatars.us-west-2.prod.public.atl-paas.net%2Finitials%2FJA-5.png","32x32":"https://secure.gravatar.com/avatar/d887eff1f5130dfab59a6de736562de4?d=https%3A%2F%2Favatar-management--avatars.us-west-2.prod.public.atl-paas.net%2Finitials%2FJA-5.png"},"displayName":"Johnny Ansari","active":true,"timeZone":"America/New_York","accountType":"atlassian"},"customfield_12919":null,"customfield_11810":null,"customfield_12901":null,"customfield_11812":null,"customfield_11811":null,"customfield_12903":null,"customfield_11814":null,"customfield_11813":null,"customfield_12902":null,"customfield_12905":null,"customfield_11816":null,"customfield_12904":null,"customfield_11815":null,"customfield_11818":null,"customfield_11817":null,"customfield_12906":null,"subtasks":[{"id":"297639","key":"MOB-1056","self":"https://arthrex.atlassian.net/rest/api/2/issue/297639","fields":{"summary":"Rep app PPTX stuff ","status":{"self":"https://arthrex.atlassian.net/rest/api/2/status/10201","description":"This status is managed internally by JIRA Software","iconUrl":"https://arthrex.atlassian.net/images/icons/subtask.gif","name":"In Review","id":"10201","statusCategory":{"self":"https://arthrex.atlassian.net/rest/api/2/statuscategory/4","id":4,"key":"indeterminate","colorName":"yellow","name":"In Progress"}},"priority":{"self":"https://arthrex.atlassian.net/rest/api/2/priority/4","iconUrl":"https://s3.amazonaws.com/arthrex-public/jira/priorities/minor.png","name":"Minor","id":"4"},"issuetype":{"self":"https://arthrex.atlassian.net/rest/api/2/issuetype/5","id":"5","description":"The sub-task of the issue","iconUrl":"https://arthrex.atlassian.net/rest/api/2/universal_avatar/view/type/issuetype/avatar/10316?size=medium","name":"Sub-task","subtask":true,"avatarId":10316,"hierarchyLevel":-1}}},{"id":"299481","key":"MOB-1066","self":"https://arthrex.atlassian.net/rest/api/2/issue/299481","fields":{"summary":"Onsite Testflight Beta for Naples Agency 7/6","status":{"self":"https://arthrex.atlassian.net/rest/api/2/status/10001","description":"","iconUrl":"https://arthrex.atlassian.net/images/icons/subtask.gif","name":"Done","id":"10001","statusCategory":{"self":"https://arthrex.atlassian.net/rest/api/2/statuscategory/3","id":3,"key":"done","colorName":"green","name":"Done"}},"priority":{"self":"https://arthrex.atlassian.net/rest/api/2/priority/4","iconUrl":"https://s3.amazonaws.com/arthrex-public/jira/priorities/minor.png","name":"Minor","id":"4"},"issuetype":{"self":"https://arthrex.atlassian.net/rest/api/2/issuetype/5","id":"5","description":"The sub-task of the issue","iconUrl":"https://arthrex.atlassian.net/rest/api/2/universal_avatar/view/type/issuetype/avatar/10316?size=medium","name":"Sub-task","subtask":true,"avatarId":10316,"hierarchyLevel":-1}}},{"id":"296829","key":"MOB-1053","self":"https://arthrex.atlassian.net/rest/api/2/issue/296829","fields":{"summary":"Things to test document for Beta","status":{"self":"https://arthrex.atlassian.net/rest/api/2/status/10001","description":"","iconUrl":"https://arthrex.atlassian.net/images/icons/subtask.gif","name":"Done","id":"10001","statusCategory":{"self":"https://arthrex.atlassian.net/rest/api/2/statuscategory/3","id":3,"key":"done","colorName":"green","name":"Done"}},"priority":{"self":"https://arthrex.atlassian.net/rest/api/2/priority/4","iconUrl":"https://s3.amazonaws.com/arthrex-public/jira/priorities/minor.png","name":"Minor","id":"4"},"issuetype":{"self":"https://arthrex.atlassian.net/rest/api/2/issuetype/5","id":"5","description":"The sub-task of the issue","iconUrl":"https://arthrex.atlassian.net/rest/api/2/universal_avatar/view/type/issuetype/avatar/10316?size=medium","name":"Sub-task","subtask":true,"avatarId":10316,"hierarchyLevel":-1}}},{"id":"299480","key":"MOB-1065","self":"https://arthrex.atlassian.net/rest/api/2/issue/299480","fields":{"summary":"Send Out Early Access Email","status":{"self":"https://arthrex.atlassian.net/rest/api/2/status/10001","description":"","iconUrl":"https://arthrex.atlassian.net/images/icons/subtask.gif","name":"Done","id":"10001","statusCategory":{"self":"https://arthrex.atlassian.net/rest/api/2/statuscategory/3","id":3,"key":"done","colorName":"green","name":"Done"}},"priority":{"self":"https://arthrex.atlassian.net/rest/api/2/priority/4","iconUrl":"https://s3.amazonaws.com/arthrex-public/jira/priorities/minor.png","name":"Minor","id":"4"},"issuetype":{"self":"https://arthrex.atlassian.net/rest/api/2/issuetype/5","id":"5","description":"The sub-task of the issue","iconUrl":"https://arthrex.atlassian.net/rest/api/2/universal_avatar/view/type/issuetype/avatar/10316?size=medium","name":"Sub-task","subtask":true,"avatarId":10316,"hierarchyLevel":-1}}},{"id":"268522","key":"MOB-811","self":"https://arthrex.atlassian.net/rest/api/2/issue/268522","fields":{"summary":"Discover Feed Exploration","status":{"self":"https://arthrex.atlassian.net/rest/api/2/status/3","description":"This issue is being actively worked on at the moment by the assignee.","iconUrl":"https://arthrex.atlassian.net/images/icons/statuses/inprogress.png","name":"Working","id":"3","statusCategory":{"self":"https://arthrex.atlassian.net/rest/api/2/statuscategory/4","id":4,"key":"indeterminate","colorName":"yellow","name":"In Progress"}},"priority":{"self":"https://arthrex.atlassian.net/rest/api/2/priority/4","iconUrl":"https://s3.amazonaws.com/arthrex-public/jira/priorities/minor.png","name":"Minor","id":"4"},"issuetype":{"self":"https://arthrex.atlassian.net/rest/api/2/issuetype/5","id":"5","description":"The sub-task of the issue","iconUrl":"https://arthrex.atlassian.net/rest/api/2/universal_avatar/view/type/issuetype/avatar/10316?size=medium","name":"Sub-task","subtask":true,"avatarId":10316,"hierarchyLevel":-1}}},{"id":"274752","key":"MOB-854","self":"https://arthrex.atlassian.net/rest/api/2/issue/274752","fields":{"summary":"Rep APP Logo","status":{"self":"https://arthrex.atlassian.net/rest/api/2/status/10001","description":"","iconUrl":"https://arthrex.atlassian.net/images/icons/subtask.gif","name":"Done","id":"10001","statusCategory":{"self":"https://arthrex.atlassian.net/rest/api/2/statuscategory/3","id":3,"key":"done","colorName":"green","name":"Done"}},"priority":{"self":"https://arthrex.atlassian.net/rest/api/2/priority/4","iconUrl":"https://s3.amazonaws.com/arthrex-public/jira/priorities/minor.png","name":"Minor","id":"4"},"issuetype":{"self":"https://arthrex.atlassian.net/rest/api/2/issuetype/5","id":"5","description":"The sub-task of the issue","iconUrl":"https://arthrex.atlassian.net/rest/api/2/universal_avatar/view/type/issuetype/avatar/10316?size=medium","name":"Sub-task","subtask":true,"avatarId":10316,"hierarchyLevel":-1}}},{"id":"281424","key":"MOB-960","self":"https://arthrex.atlassian.net/rest/api/2/issue/281424","fields":{"summary":"Arthrex.com Space for Download ","status":{"self":"https://arthrex.atlassian.net/rest/api/2/status/10201","description":"This status is managed internally by JIRA Software","iconUrl":"https://arthrex.atlassian.net/images/icons/subtask.gif","name":"In Review","id":"10201","statusCategory":{"self":"https://arthrex.atlassian.net/rest/api/2/statuscategory/4","id":4,"key":"indeterminate","colorName":"yellow","name":"In Progress"}},"priority":{"self":"https://arthrex.atlassian.net/rest/api/2/priority/4","iconUrl":"https://s3.amazonaws.com/arthrex-public/jira/priorities/minor.png","name":"Minor","id":"4"},"issuetype":{"self":"https://arthrex.atlassian.net/rest/api/2/issuetype/5","id":"5","description":"The sub-task of the issue","iconUrl":"https://arthrex.atlassian.net/rest/api/2/universal_avatar/view/type/issuetype/avatar/10316?size=medium","name":"Sub-task","subtask":true,"avatarId":10316,"hierarchyLevel":-1}}},{"id":"285994","key":"MOB-992","self":"https://arthrex.atlassian.net/rest/api/2/issue/285994","fields":{"summary":"Beta Feedback Work","status":{"self":"https://arthrex.atlassian.net/rest/api/2/status/10001","description":"","iconUrl":"https://arthrex.atlassian.net/images/icons/subtask.gif","name":"Done","id":"10001","statusCategory":{"self":"https://arthrex.atlassian.net/rest/api/2/statuscategory/3","id":3,"key":"done","colorName":"green","name":"Done"}},"priority":{"self":"https://arthrex.atlassian.net/rest/api/2/priority/4","iconUrl":"https://s3.amazonaws.com/arthrex-public/jira/priorities/minor.png","name":"Minor","id":"4"},"issuetype":{"self":"https://arthrex.atlassian.net/rest/api/2/issuetype/5","id":"5","description":"The sub-task of the issue","iconUrl":"https://arthrex.atlassian.net/rest/api/2/universal_avatar/view/type/issuetype/avatar/10316?size=medium","name":"Sub-task","subtask":true,"avatarId":10316,"hierarchyLevel":-1}}},{"id":"293230","key":"MOB-1014","self":"https://arthrex.atlassian.net/rest/api/2/issue/293230","fields":{"summary":"MRM Assets for the REP App","status":{"self":"https://arthrex.atlassian.net/rest/api/2/status/10201","description":"This status is managed internally by JIRA Software","iconUrl":"https://arthrex.atlassian.net/images/icons/subtask.gif","name":"In Review","id":"10201","statusCategory":{"self":"https://arthrex.atlassian.net/rest/api/2/statuscategory/4","id":4,"key":"indeterminate","colorName":"yellow","name":"In Progress"}},"priority":{"self":"https://arthrex.atlassian.net/rest/api/2/priority/3","iconUrl":"https://s3.amazonaws.com/arthrex-public/jira/priorities/major.png","name":"Major","id":"3"},"issuetype":{"self":"https://arthrex.atlassian.net/rest/api/2/issuetype/5","id":"5","description":"The sub-task of the issue","iconUrl":"https://arthrex.atlassian.net/rest/api/2/universal_avatar/view/type/issuetype/avatar/10316?size=medium","name":"Sub-task","subtask":true,"avatarId":10316,"hierarchyLevel":-1}}},{"id":"295340","key":"MOB-1033","self":"https://arthrex.atlassian.net/rest/api/2/issue/295340","fields":{"summary":"Additional on boarding screen/view ","status":{"self":"https://arthrex.atlassian.net/rest/api/2/status/10001","description":"","iconUrl":"https://arthrex.atlassian.net/images/icons/subtask.gif","name":"Done","id":"10001","statusCategory":{"self":"https://arthrex.atlassian.net/rest/api/2/statuscategory/3","id":3,"key":"done","colorName":"green","name":"Done"}},"priority":{"self":"https://arthrex.atlassian.net/rest/api/2/priority/4","iconUrl":"https://s3.amazonaws.com/arthrex-public/jira/priorities/minor.png","name":"Minor","id":"4"},"issuetype":{"self":"https://arthrex.atlassian.net/rest/api/2/issuetype/5","id":"5","description":"The sub-task of the issue","iconUrl":"https://arthrex.atlassian.net/rest/api/2/universal_avatar/view/type/issuetype/avatar/10316?size=medium","name":"Sub-task","subtask":true,"avatarId":10316,"hierarchyLevel":-1}}},{"id":"279629","key":"MOB-930","self":"https://arthrex.atlassian.net/rest/api/2/issue/279629","fields":{"summary":"App Store Requirements ","status":{"self":"https://arthrex.atlassian.net/rest/api/2/status/10001","description":"","iconUrl":"https://arthrex.atlassian.net/images/icons/subtask.gif","name":"Done","id":"10001","statusCategory":{"self":"https://arthrex.atlassian.net/rest/api/2/statuscategory/3","id":3,"key":"done","colorName":"green","name":"Done"}},"priority":{"self":"https://arthrex.atlassian.net/rest/api/2/priority/4","iconUrl":"https://s3.amazonaws.com/arthrex-public/jira/priorities/minor.png","name":"Minor","id":"4"},"issuetype":{"self":"https://arthrex.atlassian.net/rest/api/2/issuetype/5","id":"5","description":"The sub-task of the issue","iconUrl":"https://arthrex.atlassian.net/rest/api/2/universal_avatar/view/type/issuetype/avatar/10316?size=medium","name":"Sub-task","subtask":true,"avatarId":10316,"hierarchyLevel":-1}}},{"id":"281398","key":"MOB-954","self":"https://arthrex.atlassian.net/rest/api/2/issue/281398","fields":{"summary":"Future state visuals for App Store Images","status":{"self":"https://arthrex.atlassian.net/rest/api/2/status/10001","description":"","iconUrl":"https://arthrex.atlassian.net/images/icons/subtask.gif","name":"Done","id":"10001","statusCategory":{"self":"https://arthrex.atlassian.net/rest/api/2/statuscategory/3","id":3,"key":"done","colorName":"green","name":"Done"}},"priority":{"self":"https://arthrex.atlassian.net/rest/api/2/priority/4","iconUrl":"https://s3.amazonaws.com/arthrex-public/jira/priorities/minor.png","name":"Minor","id":"4"},"issuetype":{"self":"https://arthrex.atlassian.net/rest/api/2/issuetype/5","id":"5","description":"The sub-task of the issue","iconUrl":"https://arthrex.atlassian.net/rest/api/2/universal_avatar/view/type/issuetype/avatar/10316?size=medium","name":"Sub-task","subtask":true,"avatarId":10316,"hierarchyLevel":-1}}},{"id":"299482","key":"MOB-1067","self":"https://arthrex.atlassian.net/rest/api/2/issue/299482","fields":{"summary":"Craft Early Access Email for Gotham ","status":{"self":"https://arthrex.atlassian.net/rest/api/2/status/10001","description":"","iconUrl":"https://arthrex.atlassian.net/images/icons/subtask.gif","name":"Done","id":"10001","statusCategory":{"self":"https://arthrex.atlassian.net/rest/api/2/statuscategory/3","id":3,"key":"done","colorName":"green","name":"Done"}},"priority":{"self":"https://arthrex.atlassian.net/rest/api/2/priority/4","iconUrl":"https://s3.amazonaws.com/arthrex-public/jira/priorities/minor.png","name":"Minor","id":"4"},"issuetype":{"self":"https://arthrex.atlassian.net/rest/api/2/issuetype/5","id":"5","description":"The sub-task of the issue","iconUrl":"https://arthrex.atlassian.net/rest/api/2/universal_avatar/view/type/issuetype/avatar/10316?size=medium","name":"Sub-task","subtask":true,"avatarId":10316,"hierarchyLevel":-1}}},{"id":"296824","key":"MOB-1052","self":"https://arthrex.atlassian.net/rest/api/2/issue/296824","fields":{"summary":"Post Early Access Survey for Gotham Beta","status":{"self":"https://arthrex.atlassian.net/rest/api/2/status/10201","description":"This status is managed internally by JIRA Software","iconUrl":"https://arthrex.atlassian.net/images/icons/subtask.gif","name":"In Review","id":"10201","statusCategory":{"self":"https://arthrex.atlassian.net/rest/api/2/statuscategory/4","id":4,"key":"indeterminate","colorName":"yellow","name":"In Progress"}},"priority":{"self":"https://arthrex.atlassian.net/rest/api/2/priority/4","iconUrl":"https://s3.amazonaws.com/arthrex-public/jira/priorities/minor.png","name":"Minor","id":"4"},"issuetype":{"self":"https://arthrex.atlassian.net/rest/api/2/issuetype/5","id":"5","description":"The sub-task of the issue","iconUrl":"https://arthrex.atlassian.net/rest/api/2/universal_avatar/view/type/issuetype/avatar/10316?size=medium","name":"Sub-task","subtask":true,"avatarId":10316,"hierarchyLevel":-1}}},{"id":"296823","key":"MOB-1051","self":"https://arthrex.atlassian.net/rest/api/2/issue/296823","fields":{"summary":"How to get access to the App Document IOS & Andriod Full Launch","status":{"self":"https://arthrex.atlassian.net/rest/api/2/status/10000","description":"","iconUrl":"https://arthrex.atlassian.net/images/icons/subtask.gif","name":"To Do","id":"10000","statusCategory":{"self":"https://arthrex.atlassian.net/rest/api/2/statuscategory/2","id":2,"key":"new","colorName":"blue-gray","name":"To Do"}},"priority":{"self":"https://arthrex.atlassian.net/rest/api/2/priority/4","iconUrl":"https://s3.amazonaws.com/arthrex-public/jira/priorities/minor.png","name":"Minor","id":"4"},"issuetype":{"self":"https://arthrex.atlassian.net/rest/api/2/issuetype/5","id":"5","description":"The sub-task of the issue","iconUrl":"https://arthrex.atlassian.net/rest/api/2/universal_avatar/view/type/issuetype/avatar/10316?size=medium","name":"Sub-task","subtask":true,"avatarId":10316,"hierarchyLevel":-1}}},{"id":"281404","key":"MOB-957","self":"https://arthrex.atlassian.net/rest/api/2/issue/281404","fields":{"summary":"Post-MVP UI Rep app Arthrex-com Salesforce Content","status":{"self":"https://arthrex.atlassian.net/rest/api/2/status/10000","description":"","iconUrl":"https://arthrex.atlassian.net/images/icons/subtask.gif","name":"To Do","id":"10000","statusCategory":{"self":"https://arthrex.atlassian.net/rest/api/2/statuscategory/2","id":2,"key":"new","colorName":"blue-gray","name":"To Do"}},"priority":{"self":"https://arthrex.atlassian.net/rest/api/2/priority/4","iconUrl":"https://s3.amazonaws.com/arthrex-public/jira/priorities/minor.png","name":"Minor","id":"4"},"issuetype":{"self":"https://arthrex.atlassian.net/rest/api/2/issuetype/5","id":"5","description":"The sub-task of the issue","iconUrl":"https://arthrex.atlassian.net/rest/api/2/universal_avatar/view/type/issuetype/avatar/10316?size=medium","name":"Sub-task","subtask":true,"avatarId":10316,"hierarchyLevel":-1}}},{"id":"281405","key":"MOB-958","self":"https://arthrex.atlassian.net/rest/api/2/issue/281405","fields":{"summary":"Replacement online form via Marketing Cloud","status":{"self":"https://arthrex.atlassian.net/rest/api/2/status/10000","description":"","iconUrl":"https://arthrex.atlassian.net/images/icons/subtask.gif","name":"To Do","id":"10000","statusCategory":{"self":"https://arthrex.atlassian.net/rest/api/2/statuscategory/2","id":2,"key":"new","colorName":"blue-gray","name":"To Do"}},"priority":{"self":"https://arthrex.atlassian.net/rest/api/2/priority/4","iconUrl":"https://s3.amazonaws.com/arthrex-public/jira/priorities/minor.png","name":"Minor","id":"4"},"issuetype":{"self":"https://arthrex.atlassian.net/rest/api/2/issuetype/5","id":"5","description":"The sub-task of the issue","iconUrl":"https://arthrex.atlassian.net/rest/api/2/universal_avatar/view/type/issuetype/avatar/10316?size=medium","name":"Sub-task","subtask":true,"avatarId":10316,"hierarchyLevel":-1}}},{"id":"287873","key":"MOB-993","self":"https://arthrex.atlassian.net/rest/api/2/issue/287873","fields":{"summary":"Taxonomy Filters","status":{"self":"https://arthrex.atlassian.net/rest/api/2/status/3","description":"This issue is being actively worked on at the moment by the assignee.","iconUrl":"https://arthrex.atlassian.net/images/icons/statuses/inprogress.png","name":"Working","id":"3","statusCategory":{"self":"https://arthrex.atlassian.net/rest/api/2/statuscategory/4","id":4,"key":"indeterminate","colorName":"yellow","name":"In Progress"}},"priority":{"self":"https://arthrex.atlassian.net/rest/api/2/priority/4","iconUrl":"https://s3.amazonaws.com/arthrex-public/jira/priorities/minor.png","name":"Minor","id":"4"},"issuetype":{"self":"https://arthrex.atlassian.net/rest/api/2/issuetype/5","id":"5","description":"The sub-task of the issue","iconUrl":"https://arthrex.atlassian.net/rest/api/2/universal_avatar/view/type/issuetype/avatar/10316?size=medium","name":"Sub-task","subtask":true,"avatarId":10316,"hierarchyLevel":-1}}},{"id":"285992","key":"MOB-990","self":"https://arthrex.atlassian.net/rest/api/2/issue/285992","fields":{"summary":"Privacy Policy in the Settings","status":{"self":"https://arthrex.atlassian.net/rest/api/2/status/10001","description":"","iconUrl":"https://arthrex.atlassian.net/images/icons/subtask.gif","name":"Done","id":"10001","statusCategory":{"self":"https://arthrex.atlassian.net/rest/api/2/statuscategory/3","id":3,"key":"done","colorName":"green","name":"Done"}},"priority":{"self":"https://arthrex.atlassian.net/rest/api/2/priority/4","iconUrl":"https://s3.amazonaws.com/arthrex-public/jira/priorities/minor.png","name":"Minor","id":"4"},"issuetype":{"self":"https://arthrex.atlassian.net/rest/api/2/issuetype/5","id":"5","description":"The sub-task of the issue","iconUrl":"https://arthrex.atlassian.net/rest/api/2/universal_avatar/view/type/issuetype/avatar/10316?size=medium","name":"Sub-task","subtask":true,"avatarId":10316,"hierarchyLevel":-1}}},{"id":"279707","key":"MOB-932","self":"https://arthrex.atlassian.net/rest/api/2/issue/279707","fields":{"summary":"Loading Screen ","status":{"self":"https://arthrex.atlassian.net/rest/api/2/status/10001","description":"","iconUrl":"https://arthrex.atlassian.net/images/icons/subtask.gif","name":"Done","id":"10001","statusCategory":{"self":"https://arthrex.atlassian.net/rest/api/2/statuscategory/3","id":3,"key":"done","colorName":"green","name":"Done"}},"priority":{"self":"https://arthrex.atlassian.net/rest/api/2/priority/4","iconUrl":"https://s3.amazonaws.com/arthrex-public/jira/priorities/minor.png","name":"Minor","id":"4"},"issuetype":{"self":"https://arthrex.atlassian.net/rest/api/2/issuetype/5","id":"5","description":"The sub-task of the issue","iconUrl":"https://arthrex.atlassian.net/rest/api/2/universal_avatar/view/type/issuetype/avatar/10316?size=medium","name":"Sub-task","subtask":true,"avatarId":10316,"hierarchyLevel":-1}}},{"id":"278449","key":"MOB-913","self":"https://arthrex.atlassian.net/rest/api/2/issue/278449","fields":{"summary":"Re-create Nav Bar with Rep app logo","status":{"self":"https://arthrex.atlassian.net/rest/api/2/status/10001","description":"","iconUrl":"https://arthrex.atlassian.net/images/icons/subtask.gif","name":"Done","id":"10001","statusCategory":{"self":"https://arthrex.atlassian.net/rest/api/2/statuscategory/3","id":3,"key":"done","colorName":"green","name":"Done"}},"priority":{"self":"https://arthrex.atlassian.net/rest/api/2/priority/4","iconUrl":"https://s3.amazonaws.com/arthrex-public/jira/priorities/minor.png","name":"Minor","id":"4"},"issuetype":{"self":"https://arthrex.atlassian.net/rest/api/2/issuetype/5","id":"5","description":"The sub-task of the issue","iconUrl":"https://arthrex.atlassian.net/rest/api/2/universal_avatar/view/type/issuetype/avatar/10316?size=medium","name":"Sub-task","subtask":true,"avatarId":10316,"hierarchyLevel":-1}}},{"id":"281401","key":"MOB-956","self":"https://arthrex.atlassian.net/rest/api/2/issue/281401","fields":{"summary":"Return to the Surgeon App once they are inside the Rep App","status":{"self":"https://arthrex.atlassian.net/rest/api/2/status/10001","description":"","iconUrl":"https://arthrex.atlassian.net/images/icons/subtask.gif","name":"Done","id":"10001","statusCategory":{"self":"https://arthrex.atlassian.net/rest/api/2/statuscategory/3","id":3,"key":"done","colorName":"green","name":"Done"}},"priority":{"self":"https://arthrex.atlassian.net/rest/api/2/priority/4","iconUrl":"https://s3.amazonaws.com/arthrex-public/jira/priorities/minor.png","name":"Minor","id":"4"},"issuetype":{"self":"https://arthrex.atlassian.net/rest/api/2/issuetype/5","id":"5","description":"The sub-task of the issue","iconUrl":"https://arthrex.atlassian.net/rest/api/2/universal_avatar/view/type/issuetype/avatar/10316?size=medium","name":"Sub-task","subtask":true,"avatarId":10316,"hierarchyLevel":-1}}},{"id":"281400","key":"MOB-955","self":"https://arthrex.atlassian.net/rest/api/2/issue/281400","fields":{"summary":"Surgeon App announcement banner","status":{"self":"https://arthrex.atlassian.net/rest/api/2/status/10001","description":"","iconUrl":"https://arthrex.atlassian.net/images/icons/subtask.gif","name":"Done","id":"10001","statusCategory":{"self":"https://arthrex.atlassian.net/rest/api/2/statuscategory/3","id":3,"key":"done","colorName":"green","name":"Done"}},"priority":{"self":"https://arthrex.atlassian.net/rest/api/2/priority/4","iconUrl":"https://s3.amazonaws.com/arthrex-public/jira/priorities/minor.png","name":"Minor","id":"4"},"issuetype":{"self":"https://arthrex.atlassian.net/rest/api/2/issuetype/5","id":"5","description":"The sub-task of the issue","iconUrl":"https://arthrex.atlassian.net/rest/api/2/universal_avatar/view/type/issuetype/avatar/10316?size=medium","name":"Sub-task","subtask":true,"avatarId":10316,"hierarchyLevel":-1}}},{"id":"281409","key":"MOB-959","self":"https://arthrex.atlassian.net/rest/api/2/issue/281409","fields":{"summary":"Sales Summit Material","status":{"self":"https://arthrex.atlassian.net/rest/api/2/status/10001","description":"","iconUrl":"https://arthrex.atlassian.net/images/icons/subtask.gif","name":"Done","id":"10001","statusCategory":{"self":"https://arthrex.atlassian.net/rest/api/2/statuscategory/3","id":3,"key":"done","colorName":"green","name":"Done"}},"priority":{"self":"https://arthrex.atlassian.net/rest/api/2/priority/4","iconUrl":"https://s3.amazonaws.com/arthrex-public/jira/priorities/minor.png","name":"Minor","id":"4"},"issuetype":{"self":"https://arthrex.atlassian.net/rest/api/2/issuetype/5","id":"5","description":"The sub-task of the issue","iconUrl":"https://arthrex.atlassian.net/rest/api/2/universal_avatar/view/type/issuetype/avatar/10316?size=medium","name":"Sub-task","subtask":true,"avatarId":10316,"hierarchyLevel":-1}}}],"customfield_11801":null,"customfield_11800":null,"customfield_11802":null,"customfield_11805":null,"customfield_11804":null,"customfield_11807":null,"closedSprints":[{"id":2001,"self":"https://arthrex.atlassian.net/rest/agile/1.0/sprint/2001","state":"closed","name":"A Team: 7/11/22 - 7/15/22","startDate":"2022-07-11T13:56:18.821Z","endDate":"2022-07-16T02:15:00.000Z","completeDate":"2022-07-15T21:39:31.202Z","originBoardId":286,"goal":"Prep for Submission of v1.0.0 Rep App iOS Release"},{"id":1955,"self":"https://arthrex.atlassian.net/rest/agile/1.0/sprint/1955","state":"closed","name":"A Team: 6/27/22 - 7/1/22","startDate":"2022-06-27T13:39:51.053Z","endDate":"2022-07-01T16:03:00.000Z","completeDate":"2022-07-01T20:26:58.126Z","originBoardId":286,"goal":""},{"id":1940,"self":"https://arthrex.atlassian.net/rest/agile/1.0/sprint/1940","state":"closed","name":"A Team: 6/13/22 - 6/17/22","startDate":"2022-06-13T13:23:11.454Z","endDate":"2022-06-17T13:12:00.000Z","completeDate":"2022-06-17T21:12:57.348Z","originBoardId":286,"goal":""},{"id":1861,"self":"https://arthrex.atlassian.net/rest/agile/1.0/sprint/1861","state":"closed","name":"A Team: 4/18/22 - 4/22/22","startDate":"2022-04-18T13:19:51.131Z","endDate":"2022-04-22T21:22:00.000Z","completeDate":"2022-04-23T00:50:05.964Z","originBoardId":286,"goal":""},{"id":1862,"self":"https://arthrex.atlassian.net/rest/agile/1.0/sprint/1862","state":"closed","name":"A Team: 4/25/22 - 4/29/22","startDate":"2022-04-25T13:38:51.319Z","endDate":"2022-04-29T21:00:00.000Z","completeDate":"2022-04-29T20:44:00.021Z","originBoardId":286,"goal":""},{"id":1929,"self":"https://arthrex.atlassian.net/rest/agile/1.0/sprint/1929","state":"closed","name":"A Team: 5/31/22 - 6/10/22","startDate":"2022-05-31T13:20:11.464Z","endDate":"2022-06-10T14:13:00.000Z","completeDate":"2022-06-10T21:09:52.636Z","originBoardId":286,"goal":""},{"id":1881,"self":"https://arthrex.atlassian.net/rest/agile/1.0/sprint/1881","state":"closed","name":"A Team: 5/2/22 - 5/6/22","startDate":"2022-05-02T13:24:03.040Z","endDate":"2022-05-06T21:59:00.000Z","completeDate":"2022-05-06T20:33:28.823Z","originBoardId":286,"goal":""},{"id":1915,"self":"https://arthrex.atlassian.net/rest/agile/1.0/sprint/1915","state":"closed","name":"A Team: 5/16/22 - 5/20/22","startDate":"2022-05-16T13:45:22.501Z","endDate":"2022-05-20T21:11:00.000Z","completeDate":"2022-05-20T20:48:44.357Z","originBoardId":286,"goal":""},{"id":1916,"self":"https://arthrex.atlassian.net/rest/agile/1.0/sprint/1916","state":"closed","name":"A Team: 5/23/22 - 5/27/22","startDate":"2022-05-23T13:46:32.935Z","endDate":"2022-05-27T18:12:00.000Z","completeDate":"2022-05-27T21:18:43.799Z","originBoardId":286,"goal":""},{"id":1965,"self":"https://arthrex.atlassian.net/rest/agile/1.0/sprint/1965","state":"closed","name":"A Team: 7/5/22 - 7/8/22","startDate":"2022-07-05T13:38:21.073Z","endDate":"2022-07-08T17:26:00.000Z","completeDate":"2022-07-08T21:28:08.661Z","originBoardId":286,"goal":""},{"id":1952,"self":"https://arthrex.atlassian.net/rest/agile/1.0/sprint/1952","state":"closed","name":"A Team: 6/20/22 - 6/24/22","startDate":"2022-06-20T13:46:12.904Z","endDate":"2022-06-24T12:12:00.000Z","completeDate":"2022-06-24T20:31:59.550Z","originBoardId":286,"goal":""},{"id":1904,"self":"https://arthrex.atlassian.net/rest/agile/1.0/sprint/1904","state":"closed","name":"A Team: 5/9/22 - 5/13/22","startDate":"2022-05-09T13:36:27.141Z","endDate":"2022-05-13T21:43:00.000Z","completeDate":"2022-05-13T20:16:27.067Z","originBoardId":286,"goal":""}],"customfield_11806":null,"customfield_11809":null,"votes":{"self":"https://arthrex.atlassian.net/rest/api/2/issue/MOB-929/votes","votes":0,"hasVoted":false},"worklog":{"startAt":0,"maxResults":20,"total":0,"worklogs":[]},"customfield_11808":null,"issuetype":{"self":"https://arthrex.atlassian.net/rest/api/2/issuetype/3","id":"3","description":"A task that needs to be done.","iconUrl":"https://arthrex.atlassian.net/rest/api/2/universal_avatar/view/type/issuetype/avatar/10318?size=medium","name":"Task","subtask":false,"avatarId":10318,"hierarchyLevel":0},"sprint":{"id":1661,"self":"https://arthrex.atlassian.net/rest/agile/1.0/sprint/1661","state":"active","name":"A Team: 7/18/22 - 7/22/22","startDate":"2022-07-18T13:46:00.383Z","endDate":"2022-07-23T02:21:00.000Z","originBoardId":286,"goal":"AMOBS v1.0.0 and RAI v1.0.0 Releases"},"customfield_10700":null,"customfield_10701":[],"customfield_10702":null,"customfield_11901":{"self":"https://arthrex.atlassian.net/rest/api/2/customFieldOption/11506","value":"No","id":"11506"},"customfield_14050":null,"timetracking":{},"customfield_10803":null,"customfield_10806":null,"customfield_14047":null,"customfield_14048":null,"customfield_14046":null,"customfield_14049":null,"environment":null,"duedate":null,"customfield_13980":null,"customfield_13861":null,"customfield_11441":null,"customfield_13740":null,"customfield_12772":null,"customfield_13982":null,"customfield_11440":null,"customfield_13742":null,"customfield_12774":null,"customfield_11443":null,"customfield_12411":null,"customfield_11200":{"self":"https://arthrex.atlassian.net/rest/api/2/customFieldOption/10601","value":"N","id":"10601"},"customfield_13741":null,"customfield_12773":null,"customfield_11442":null,"customfield_11201":null,"customfield_13623":null,"customfield_12776":null,"customfield_12413":null,"customfield_11202":null,"customfield_13744":null,"customfield_13986":null,"customfield_12533":null,"customfield_12412":null,"customfield_11444":null,"customfield_13985":null,"customfield_12775":null,"customfield_13743":null,"customfield_13614":null,"customfield_11435":null,"customfield_13613":null,"customfield_12645":null,"customfield_13616":null,"customfield_13737":null,"customfield_13979":null,"customfield_11438":null,"customfield_11437":null,"customfield_13615":null,"customfield_13739":null,"customfield_13617":null,"customfield_11439":null,"customfield_13738":null,"customfield_12409":null,"customfield_12761":null,"customfield_11430":null,"customfield_12760":null,"customfield_10100":"2|hz3er3:149mdvk8zv8zthuf1","customfield_13610":null,"customfield_12762":null,"customfield_11431":null,"customfield_13975":null,"customfield_13612":null,"customfield_11434":null,"customfield_13611":null,"customfield_12514":null,"customfield_11303":null,"customfield_12998":null,"customfield_11425":null,"customfield_12756":null,"customfield_13603":null,"customfield_13602":null,"customfield_12755":null,"customfield_11304":null,"customfield_12997":null,"customfield_12513":null,"customfield_13726":null,"customfield_11427":null,"customfield_12758":null,"customfield_13605":null,"customfield_12999":null,"customfield_12757":null,"customfield_13604":null,"timeestimate":null,"customfield_13606":null,"customfield_12759":null,"customfield_11428":null,"customfield_13969":null,"customfield_13727":null,"customfield_13608":null,"customfield_13729":null,"status":{"self":"https://arthrex.atlassian.net/rest/api/2/status/3","description":"This issue is being actively worked on at the moment by the assignee.","iconUrl":"https://arthrex.atlassian.net/images/icons/statuses/inprogress.png","name":"Working","id":"3","statusCategory":{"self":"https://arthrex.atlassian.net/rest/api/2/statuscategory/4","id":4,"key":"indeterminate","colorName":"yellow","name":"In Progress"}},"customfield_12750":null,"customfield_12510":null,"customfield_12752":null,"customfield_12751":null,"customfield_11300":{"self":"https://arthrex.atlassian.net/rest/api/2/customFieldOption/10700","value":"User Stories:1","id":"10700"},"customfield_11420":null,"customfield_11301":null,"customfield_12996":null,"customfield_12754":null,"customfield_13601":null,"customfield_11422":null,"customfield_12753":null,"customfield_12511":null,"customfield_13600":null,"customfield_12745":null,"customfield_11414":null,"customfield_12503":null,"customfield_12744":null,"customfield_12502":null,"customfield_13836":null,"customfield_13715":null,"customfield_12747":null,"customfield_12505":null,"customfield_12504":null,"customfield_12746":null,"customfield_13835":null,"customfield_11415":null,"customfield_13956":null,"customfield_12507":null,"aggregatetimeestimate":null,"customfield_12749":null,"customfield_11418":null,"customfield_12748":null,"customfield_13716":null,"customfield_13837":null,"customfield_12508":null,"customfield_11419":null,"creator":{"self":"https://arthrex.atlassian.net/rest/api/2/user?accountId=5dfa6aa75697460cb3d97763","accountId":"5dfa6aa75697460cb3d97763","emailAddress":"patrick.maguschak2@arthrex.com","avatarUrls":{"48x48":"https://avatar-management--avatars.us-west-2.prod.public.atl-paas.net/5dfa6aa75697460cb3d97763/5f2aaf98-63fd-4e3a-a29b-7e163f497fd8/48","24x24":"https://avatar-management--avatars.us-west-2.prod.public.atl-paas.net/5dfa6aa75697460cb3d97763/5f2aaf98-63fd-4e3a-a29b-7e163f497fd8/24","16x16":"https://avatar-management--avatars.us-west-2.prod.public.atl-paas.net/5dfa6aa75697460cb3d97763/5f2aaf98-63fd-4e3a-a29b-7e163f497fd8/16","32x32":"https://avatar-management--avatars.us-west-2.prod.public.atl-paas.net/5dfa6aa75697460cb3d97763/5f2aaf98-63fd-4e3a-a29b-7e163f497fd8/32"},"displayName":"Patrick Maguschak","active":true,"timeZone":"America/New_York","accountType":"atlassian"},"customfield_13830":null,"customfield_10200":null,"customfield_12743":null,"customfield_10202":null,"customfield_13831":null,"customfield_12500":null,"customfield_13702":null,"customfield_11403":{"self":"https://arthrex.atlassian.net/rest/api/2/customFieldOption/10806","value":"Hotline","id":"10806"},"customfield_12975":null,"customfield_11523":null,"customfield_13701":null,"customfield_11402":null,"customfield_13825":null,"customfield_13704":null,"customfield_11526":null,"customfield_13824":null,"customfield_13703":null,"customfield_11404":null,"customfield_13827":null,"customfield_12738":null,"customfield_13826":null,"customfield_13705":null,"customfield_13829":null,"customfield_11529":null,"timespent":null,"customfield_12972":null,"aggregatetimespent":null,"customfield_11522":null,"customfield_13700":null,"customfield_12974":null,"customfield_11401":null,"customfield_11400":null,"customfield_11521":null,"customfield_13933":null,"customfield_12843":null,"customfield_11512":null,"customfield_13932":null,"customfield_11514":null,"customfield_11519":null,"workratio":-1,"customfield_12840":null,"customfield_13931":null,"customfield_10300":null,"customfield_11511":null,"customfield_12842":null,"customfield_10301":null,"customfield_11510":null,"customfield_13930":null,"customfield_12841":null,"customfield_11502":null,"customfield_12833":null,"customfield_13801":null,"customfield_13800":null,"customfield_11501":{"hasEpicLinkFieldDependency":false,"showField":false,"nonEditableReason":{"reason":"PLUGIN_LICENSE_ERROR","message":"The Parent Link is only available to Jira Premium users."}},"customfield_12832":null,"customfield_12835":null,"customfield_11504":null,"customfield_13803":null,"customfield_12955":null,"customfield_13802":null,"customfield_12834":null,"customfield_11506":null,"customfield_12958":null,"customfield_13926":null,"customfield_13805":null,"customfield_12837":null,"customfield_13925":null,"customfield_12836":null,"customfield_11505":null,"customfield_13804":null,"customfield_12839":null,"customfield_12838":null,"customfield_13808":null,"customfield_12831":null,"customfield_11500":null,"customfield_12830":null,"customfield_12822":null,"customfield_12942":null,"customfield_12824":null,"customfield_12823":null,"flagged":false,"customfield_12825":null,"customfield_12828":null,"customfield_12827":null,"customfield_10400":null,"customfield_12811":null,"customfield_12932":null,"customfield_12934":null,"customfield_12933":null,"customfield_13904":null,"customfield_12936":null,"customfield_12935":null,"customfield_13903":null,"customfield_12938":null,"customfield_13906":null,"customfield_13905":null,"customfield_12937":null,"customfield_13908":null,"customfield_12939":null,"customfield_13909":null,"customfield_12490":null,"customfield_12372":null,"customfield_12493":null,"customfield_12492":null,"customfield_13463":null,"customfield_12374":null,"customfield_12495":null,"customfield_12494":null,"customfield_13465":null,"customfield_12376":null,"customfield_13464":null,"customfield_13343":null,"customfield_12496":"{panel:bgColor=#FFC400}\r\nThese fields are used to populate request forms in the customer portal. Do not manually change these fields.\r\n{panel}","customfield_13467":null,"customfield_13225":null,"customfield_12499":null,"customfield_13466":null,"customfield_13469":null,"customfield_13468":null,"customfield_13690":null,"customfield_12480":null,"customfield_12482":null,"customfield_13692":null,"customfield_13691":null,"customfield_12481":null,"customfield_12484":null,"customfield_12000":null,"customfield_13694":null,"customfield_13693":null,"customfield_12483":null,"customfield_12362":null,"customfield_13696":null,"customfield_13212":null,"customfield_12002":null,"customfield_13695":null,"customfield_13211":null,"customfield_12001":null,"customfield_13335":null,"customfield_13698":null,"customfield_12488":null,"customfield_12004":null,"customfield_12003":null,"customfield_13213":null,"customfield_13697":null,"customfield_12489":null,"labels":[],"customfield_13336":null,"customfield_12005":null,"customfield_13699":null,"customfield_13449":null,"customfield_13207":null,"components":[],"customfield_13681":null,"customfield_12471":null,"customfield_12470":null,"customfield_13680":null,"customfield_13683":null,"customfield_12473":null,"customfield_12110":null,"customfield_12472":null,"customfield_13682":null,"customfield_12112":null,"customfield_13685":null,"customfield_12475":null,"customfield_13322":null,"customfield_12474":null,"customfield_13684":null,"customfield_12111":null,"customfield_12477":null,"customfield_12114":{"self":"https://arthrex.atlassian.net/rest/api/2/customFieldOption/11922","value":"No","id":"11922"},"customfield_13687":null,"customfield_13686":null,"customfield_12476":null,"customfield_12358":null,"customfield_13689":null,"customfield_12479":null,"customfield_13688":null,"customfield_12478":null,"customfield_13325":null,"customfield_12357":null,"customfield_12106":null,"customfield_12348":"{panel:title=Alert|titleBGColor=#FFC400|bgColor=#FFFAE6}\r\nPlease make sure that the correct issue type is selected. To select a different issue type, move the issue.\r\n{panel}","customfield_13679":null,"customfield_12469":null,"customfield_12109":null,"customfield_12108":null,"customfield_12341":null,"customfield_13672":null,"customfield_12340":null,"customfield_12464":null,"reporter":{"self":"https://arthrex.atlassian.net/rest/api/2/user?accountId=5dfa6aa75697460cb3d97763","accountId":"5dfa6aa75697460cb3d97763","emailAddress":"patrick.maguschak2@arthrex.com","avatarUrls":{"48x48":"https://avatar-management--avatars.us-west-2.prod.public.atl-paas.net/5dfa6aa75697460cb3d97763/5f2aaf98-63fd-4e3a-a29b-7e163f497fd8/48","24x24":"https://avatar-management--avatars.us-west-2.prod.public.atl-paas.net/5dfa6aa75697460cb3d97763/5f2aaf98-63fd-4e3a-a29b-7e163f497fd8/24","16x16":"https://avatar-management--avatars.us-west-2.prod.public.atl-paas.net/5dfa6aa75697460cb3d97763/5f2aaf98-63fd-4e3a-a29b-7e163f497fd8/16","32x32":"https://avatar-management--avatars.us-west-2.prod.public.atl-paas.net/5dfa6aa75697460cb3d97763/5f2aaf98-63fd-4e3a-a29b-7e163f497fd8/32"},"displayName":"Patrick Maguschak","active":true,"timeZone":"America/New_York","accountType":"atlassian"},"customfield_13674":null,"customfield_13795":null,"customfield_12343":"{panel:title=Info|titleBGColor=#C0B6F2|bgColor=#EAE6FF}\r\nUse this transition to escalate this issue to another team.\r\n\r\nPlease note that if you select *MRM-DAM Technical*, Jira will automatically create a ticket in Footprints. If you do not wish to create a new Footprints ticket, please select *Disable emails to Footprints* below.\r\n\r\nIf you do not want to be reminded to follow-up on this issue, please select *Disable escalation follow-up* below.\r\n{panel}","customfield_12101":null,"customfield_12463":null,"customfield_12342":null,"customfield_13673":null,"customfield_12466":null,"customfield_13676":null,"customfield_12345":null,"customfield_12103":null,"customfield_13797":null,"customfield_13675":null,"customfield_13796":null,"customfield_12344":"{panel:title=Info|titleBGColor=#C0B6F2|bgColor=#EAE6FF}\r\nUse this transition to respond to the reporter and request participants.\r\n\r\nIf you do not want to be reminded to follow-up on this issue, select *Disable customer follow-up* below.\r\n{panel}","customfield_13799":null,"customfield_12468":null,"customfield_12347":"{panel:bgColor=#FFC400}\r\n*Note*\r\nThese fields are used to populate request forms in the customer portal. Do not manually change these fields.\r\n{panel}","customfield_13678":null,"customfield_13798":null,"customfield_12104":null,"customfield_13677":null,"customfield_12467":null,"customfield_12346":null,"progress":{"progress":0,"total":0},"customfield_13780":null,"customfield_12570":null,"customfield_12330":null,"customfield_13782":null,"project":{"self":"https://arthrex.atlassian.net/rest/api/2/project/12262","id":"12262","key":"MOB","name":"A Team","projectTypeKey":"software","simplified":false,"avatarUrls":{"48x48":"https://arthrex.atlassian.net/rest/api/2/universal_avatar/view/type/project/avatar/13447","24x24":"https://arthrex.atlassian.net/rest/api/2/universal_avatar/view/type/project/avatar/13447?size=small","16x16":"https://arthrex.atlassian.net/rest/api/2/universal_avatar/view/type/project/avatar/13447?size=xsmall","32x32":"https://arthrex.atlassian.net/rest/api/2/universal_avatar/view/type/project/avatar/13447?size=medium"},"projectCategory":{"self":"https://arthrex.atlassian.net/rest/api/2/projectCategory/10103","id":"10103","description":"","name":"Digital Media - Mobile"}},"customfield_12571":null,"customfield_12332":null,"customfield_12331":null,"customfield_13783":null,"customfield_12333":null,"customfield_12336":null,"customfield_12335":null,"customfield_13779":null,"customfield_12327":null,"customfield_12569":null,"customfield_12568":null,"customfield_12329":null,"customfield_12328":null,"resolutiondate":null,"watches":{"self":"https://arthrex.atlassian.net/rest/api/2/issue/MOB-929/watchers","watchCount":1,"isWatching":false},"customfield_13890":null,"customfield_12561":null,"customfield_13771":null,"customfield_13892":null,"customfield_13770":null,"customfield_13891":null,"customfield_12321":null,"customfield_13652":null,"customfield_12563":null,"customfield_12200":null,"customfield_12562":null,"customfield_13772":null,"customfield_12320":null,"customfield_12202":null,"customfield_12323":null,"customfield_12201":null,"customfield_12322":null,"customfield_12564":null,"customfield_13656":null,"customfield_12567":null,"customfield_12324":null,"customfield_13655":null,"customfield_12203":null,"customfield_12566":null,"customfield_12558":null,"customfield_13407":null,"customfield_13769":null,"customfield_12319":null,"updated":"2022-07-21T07:57:22.774-0400","customfield_12790":null,"timeoriginalestimate":null,"customfield_13760":null,"customfield_12550":null,"customfield_12792":null,"customfield_12791":null,"description":"On going UX/UI efforts details would be listed within subtasks.","customfield_13762":null,"customfield_12794":null,"customfield_12552":null,"customfield_12551":null,"customfield_11100":" ","customfield_13761":null,"customfield_13640":null,"customfield_12554":null,"customfield_11101":null,"customfield_13764":null,"customfield_11102":{"self":"https://arthrex.atlassian.net/rest/api/2/customFieldOption/10500","value":"1-None","id":"10500"},"customfield_12553":null,"customfield_12795":null,"customfield_13763":null,"customfield_13645":null,"customfield_13765":null,"customfield_12555":null,"customfield_11104":null,"customfield_13757":null,"customfield_12305":null,"customfield_12547":null,"customfield_13636":null,"customfield_12426":null,"customfield_10005":[{"id":1952,"name":"A Team: 6/20/22 - 6/24/22","state":"closed","boardId":286,"goal":"","startDate":"2022-06-20T13:46:12.904Z","endDate":"2022-06-24T12:12:00.000Z","completeDate":"2022-06-24T20:31:59.550Z"},{"id":1904,"name":"A Team: 5/9/22 - 5/13/22","state":"closed","boardId":286,"goal":"","startDate":"2022-05-09T13:36:27.141Z","endDate":"2022-05-13T21:43:00.000Z","completeDate":"2022-05-13T20:16:27.067Z"},{"id":2001,"name":"A Team: 7/11/22 - 7/15/22","state":"closed","boardId":286,"goal":"Prep for Submission of v1.0.0 Rep App iOS Release","startDate":"2022-07-11T13:56:18.821Z","endDate":"2022-07-16T02:15:00.000Z","completeDate":"2022-07-15T21:39:31.202Z"},{"id":1955,"name":"A Team: 6/27/22 - 7/1/22","state":"closed","boardId":286,"goal":"","startDate":"2022-06-27T13:39:51.053Z","endDate":"2022-07-01T16:03:00.000Z","completeDate":"2022-07-01T20:26:58.126Z"},{"id":1940,"name":"A Team: 6/13/22 - 6/17/22","state":"closed","boardId":286,"goal":"","startDate":"2022-06-13T13:23:11.454Z","endDate":"2022-06-17T13:12:00.000Z","completeDate":"2022-06-17T21:12:57.348Z"},{"id":1861,"name":"A Team: 4/18/22 - 4/22/22","state":"closed","boardId":286,"goal":"","startDate":"2022-04-18T13:19:51.131Z","endDate":"2022-04-22T21:22:00.000Z","completeDate":"2022-04-23T00:50:05.964Z"},{"id":1862,"name":"A Team: 4/25/22 - 4/29/22","state":"closed","boardId":286,"goal":"","startDate":"2022-04-25T13:38:51.319Z","endDate":"2022-04-29T21:00:00.000Z","completeDate":"2022-04-29T20:44:00.021Z"},{"id":1929,"name":"A Team: 5/31/22 - 6/10/22","state":"closed","boardId":286,"goal":"","startDate":"2022-05-31T13:20:11.464Z","endDate":"2022-06-10T14:13:00.000Z","completeDate":"2022-06-10T21:09:52.636Z"},{"id":1881,"name":"A Team: 5/2/22 - 5/6/22","state":"closed","boardId":286,"goal":"","startDate":"2022-05-02T13:24:03.040Z","endDate":"2022-05-06T21:59:00.000Z","completeDate":"2022-05-06T20:33:28.823Z"},{"id":1915,"name":"A Team: 5/16/22 - 5/20/22","state":"closed","boardId":286,"goal":"","startDate":"2022-05-16T13:45:22.501Z","endDate":"2022-05-20T21:11:00.000Z","completeDate":"2022-05-20T20:48:44.357Z"},{"id":1916,"name":"A Team: 5/23/22 - 5/27/22","state":"closed","boardId":286,"goal":"","startDate":"2022-05-23T13:46:32.935Z","endDate":"2022-05-27T18:12:00.000Z","completeDate":"2022-05-27T21:18:43.799Z"},{"id":1965,"name":"A Team: 7/5/22 - 7/8/22","state":"closed","boardId":286,"goal":"","startDate":"2022-07-05T13:38:21.073Z","endDate":"2022-07-08T17:26:00.000Z","completeDate":"2022-07-08T21:28:08.661Z"},{"id":1661,"name":"A Team: 7/18/22 - 7/22/22","state":"active","boardId":286,"goal":"AMOBS v1.0.0 and RAI v1.0.0 Releases","startDate":"2022-07-18T13:46:00.383Z","endDate":"2022-07-23T02:21:00.000Z"}],"customfield_12789":null,"customfield_12425":null,"customfield_12304":null,"customfield_13756":null,"customfield_12788":null,"customfield_12546":null,"customfield_10006":null,"customfield_13998":null,"customfield_12428":null,"customfield_13759":null,"customfield_12307":null,"customfield_12549":null,"customfield_13758":null,"customfield_12306":null,"customfield_12427":null,"customfield_12548":null,"customfield_12309":null,"customfield_12429":null,"customfield_12308":null,"summary":"UX/UI","customfield_11450":{"self":"https://arthrex.atlassian.net/rest/api/2/customFieldOption/10989","value":"Always","id":"10989"},"customfield_12781":null,"customfield_12780":null,"customfield_13993":null,"customfield_13751":null,"customfield_12420":null,"customfield_12541":null,"customfield_12783":null,"customfield_12782":null,"customfield_12540":null,"customfield_13750":null,"customfield_13991":null,"customfield_10000":null,"customfield_12422":null,"customfield_12785":null,"customfield_13753":null,"customfield_13996":null,"customfield_10001":null,"customfield_13752":null,"customfield_12784":null,"customfield_12300":"{}","customfield_10002":null,"customfield_13997":null,"customfield_13755":null,"customfield_12787":null,"customfield_12303":null,"customfield_12545":null,"customfield_13994":null,"customfield_13995":null,"customfield_12544":null,"customfield_13754":null,"customfield_12786":null,"customfield_12423":null,"customfield_12778":null,"customfield_13746":null,"customfield_13989":null,"customfield_12415":null,"customfield_11447":null,"customfield_13745":null,"customfield_12414":null,"customfield_12777":null,"customfield_12417":null,"customfield_13987":null,"customfield_11449":{"self":"https://arthrex.atlassian.net/rest/api/2/customFieldOption/10986","value":"Live Site","id":"10986"},"customfield_13748":null,"customfield_12779":null,"customfield_13505":[],"customfield_11448":null,"customfield_12416":null,"customfield_12419":null,"customfield_13749":null,"customfield_12418":null,"comment":{"comments":[],"self":"https://arthrex.atlassian.net/rest/api/2/issue/279628/comment","maxResults":0,"total":0,"startAt":0},"statuscategorychangedate":"2022-07-01T11:13:28.289-0400","customfield_13063":"Testing message","customfield_14033":null,"customfield_13062":null,"customfield_13067":null,"customfield_13066":null,"fixVersions":[],"customfield_10900":null,"customfield_13052":null,"customfield_13294":null,"customfield_13053":null,"epic":null,"customfield_13057":null,"priority":{"self":"https://arthrex.atlassian.net/rest/api/2/priority/4","iconUrl":"https://s3.amazonaws.com/arthrex-public/jira/priorities/minor.png","name":"Minor","id":"4"},"customfield_14028":null,"versions":[],"customfield_13045":null,"customfield_14014":null,"customfield_14015":null,"customfield_13047":null,"customfield_14013":null,"customfield_13046":null,"customfield_14016":null,"customfield_14017":null,"customfield_13391":null,"customfield_13272":null,"customfield_13392":null,"customfield_13274":null,"customfield_13273":null,"aggregateprogress":{"progress":0,"total":0},"customfield_13279":null,"customfield_13380":null,"issuerestriction":{"issuerestrictions":{},"shouldDisplay":false},"customfield_13371":null,"created":"2022-04-12T09:54:39.962-0400","customfield_13373":null,"customfield_13494":null,"customfield_13375":null,"customfield_13012":null,"customfield_13011":null,"customfield_13377":null,"customfield_13376":null,"customfield_13379":null,"customfield_13016":null,"customfield_13378":null,"customfield_13017":null,"customfield_13360":null,"customfield_13362":null,"customfield_13361":null,"customfield_13122":null,"customfield_13364":null,"customfield_13001":null,"customfield_13000":null,"customfield_13363":null,"customfield_13366":"150 GB","customfield_13365":null,"customfield_13002":null,"customfield_13368":null,"customfield_13367":null,"customfield_13369":null,"security":null,"attachment":[],"customfield_13470":null,"customfield_13471":null,"customfield_12385":null,"customfield_13355":null,"customfield_12386":null,"customfield_13599":null,"customfield_13357":null,"customfield_12388":null,"customfield_13356":null,"customfield_13359":null,"customfield_13358":null}},{"expand":"operations,versionedRepresentations,editmeta,changelog,renderedFields","id":"297639","self":"https://arthrex.atlassian.net/rest/agile/1.0/issue/297639","key":"MOB-1056","fields":{"parent":{"id":"279628","key":"MOB-929","self":"https://arthrex.atlassian.net/rest/api/2/issue/279628","fields":{"summary":"UX/UI","status":{"self":"https://arthrex.atlassian.net/rest/api/2/status/3","description":"This issue is being actively worked on at the moment by the assignee.","iconUrl":"https://arthrex.atlassian.net/images/icons/statuses/inprogress.png","name":"Working","id":"3","statusCategory":{"self":"https://arthrex.atlassian.net/rest/api/2/statuscategory/4","id":4,"key":"indeterminate","colorName":"yellow","name":"In Progress"}},"priority":{"self":"https://arthrex.atlassian.net/rest/api/2/priority/4","iconUrl":"https://s3.amazonaws.com/arthrex-public/jira/priorities/minor.png","name":"Minor","id":"4"},"issuetype":{"self":"https://arthrex.atlassian.net/rest/api/2/issuetype/3","id":"3","description":"A task that needs to be done.","iconUrl":"https://arthrex.atlassian.net/rest/api/2/universal_avatar/view/type/issuetype/avatar/10318?size=medium","name":"Task","subtask":false,"avatarId":10318,"hierarchyLevel":0}}},"resolution":null,"customfield_12930":null,"customfield_12923":null,"customfield_12924":null,"customfield_12929":null,"lastViewed":null,"customfield_11700":null,"customfield_12912":null,"customfield_11702":null,"customfield_11701":null,"customfield_12914":null,"aggregatetimeoriginalestimate":null,"customfield_12916":null,"customfield_12915":null,"customfield_12918":null,"customfield_12917":null,"issuelinks":[],"assignee":{"self":"https://arthrex.atlassian.net/rest/api/2/user?accountId=60bac9915fa6f1006fee00b2","accountId":"60bac9915fa6f1006fee00b2","emailAddress":"johnny.ansari@arthrex.com","avatarUrls":{"48x48":"https://secure.gravatar.com/avatar/d887eff1f5130dfab59a6de736562de4?d=https%3A%2F%2Favatar-management--avatars.us-west-2.prod.public.atl-paas.net%2Finitials%2FJA-5.png","24x24":"https://secure.gravatar.com/avatar/d887eff1f5130dfab59a6de736562de4?d=https%3A%2F%2Favatar-management--avatars.us-west-2.prod.public.atl-paas.net%2Finitials%2FJA-5.png","16x16":"https://secure.gravatar.com/avatar/d887eff1f5130dfab59a6de736562de4?d=https%3A%2F%2Favatar-management--avatars.us-west-2.prod.public.atl-paas.net%2Finitials%2FJA-5.png","32x32":"https://secure.gravatar.com/avatar/d887eff1f5130dfab59a6de736562de4?d=https%3A%2F%2Favatar-management--avatars.us-west-2.prod.public.atl-paas.net%2Finitials%2FJA-5.png"},"displayName":"Johnny Ansari","active":true,"timeZone":"America/New_York","accountType":"atlassian"},"customfield_12919":null,"customfield_11810":null,"customfield_12901":null,"customfield_11812":null,"customfield_11811":null,"customfield_11814":null,"customfield_12903":null,"customfield_12902":null,"customfield_11813":null,"customfield_11816":null,"customfield_12905":null,"customfield_11815":null,"customfield_12904":null,"customfield_11818":null,"customfield_12906":null,"customfield_11817":null,"subtasks":[],"customfield_11801":null,"customfield_11800":null,"customfield_11802":null,"customfield_11805":null,"customfield_11804":null,"customfield_11807":null,"closedSprints":[{"id":2001,"self":"https://arthrex.atlassian.net/rest/agile/1.0/sprint/2001","state":"closed","name":"A Team: 7/11/22 - 7/15/22","startDate":"2022-07-11T13:56:18.821Z","endDate":"2022-07-16T02:15:00.000Z","completeDate":"2022-07-15T21:39:31.202Z","originBoardId":286,"goal":"Prep for Submission of v1.0.0 Rep App iOS Release"},{"id":1955,"self":"https://arthrex.atlassian.net/rest/agile/1.0/sprint/1955","state":"closed","name":"A Team: 6/27/22 - 7/1/22","startDate":"2022-06-27T13:39:51.053Z","endDate":"2022-07-01T16:03:00.000Z","completeDate":"2022-07-01T20:26:58.126Z","originBoardId":286,"goal":""},{"id":1940,"self":"https://arthrex.atlassian.net/rest/agile/1.0/sprint/1940","state":"closed","name":"A Team: 6/13/22 - 6/17/22","startDate":"2022-06-13T13:23:11.454Z","endDate":"2022-06-17T13:12:00.000Z","completeDate":"2022-06-17T21:12:57.348Z","originBoardId":286,"goal":""},{"id":1861,"self":"https://arthrex.atlassian.net/rest/agile/1.0/sprint/1861","state":"closed","name":"A Team: 4/18/22 - 4/22/22","startDate":"2022-04-18T13:19:51.131Z","endDate":"2022-04-22T21:22:00.000Z","completeDate":"2022-04-23T00:50:05.964Z","originBoardId":286,"goal":""},{"id":1862,"self":"https://arthrex.atlassian.net/rest/agile/1.0/sprint/1862","state":"closed","name":"A Team: 4/25/22 - 4/29/22","startDate":"2022-04-25T13:38:51.319Z","endDate":"2022-04-29T21:00:00.000Z","completeDate":"2022-04-29T20:44:00.021Z","originBoardId":286,"goal":""},{"id":1929,"self":"https://arthrex.atlassian.net/rest/agile/1.0/sprint/1929","state":"closed","name":"A Team: 5/31/22 - 6/10/22","startDate":"2022-05-31T13:20:11.464Z","endDate":"2022-06-10T14:13:00.000Z","completeDate":"2022-06-10T21:09:52.636Z","originBoardId":286,"goal":""},{"id":1881,"self":"https://arthrex.atlassian.net/rest/agile/1.0/sprint/1881","state":"closed","name":"A Team: 5/2/22 - 5/6/22","startDate":"2022-05-02T13:24:03.040Z","endDate":"2022-05-06T21:59:00.000Z","completeDate":"2022-05-06T20:33:28.823Z","originBoardId":286,"goal":""},{"id":1915,"self":"https://arthrex.atlassian.net/rest/agile/1.0/sprint/1915","state":"closed","name":"A Team: 5/16/22 - 5/20/22","startDate":"2022-05-16T13:45:22.501Z","endDate":"2022-05-20T21:11:00.000Z","completeDate":"2022-05-20T20:48:44.357Z","originBoardId":286,"goal":""},{"id":1916,"self":"https://arthrex.atlassian.net/rest/agile/1.0/sprint/1916","state":"closed","name":"A Team: 5/23/22 - 5/27/22","startDate":"2022-05-23T13:46:32.935Z","endDate":"2022-05-27T18:12:00.000Z","completeDate":"2022-05-27T21:18:43.799Z","originBoardId":286,"goal":""},{"id":1965,"self":"https://arthrex.atlassian.net/rest/agile/1.0/sprint/1965","state":"closed","name":"A Team: 7/5/22 - 7/8/22","startDate":"2022-07-05T13:38:21.073Z","endDate":"2022-07-08T17:26:00.000Z","completeDate":"2022-07-08T21:28:08.661Z","originBoardId":286,"goal":""},{"id":1952,"self":"https://arthrex.atlassian.net/rest/agile/1.0/sprint/1952","state":"closed","name":"A Team: 6/20/22 - 6/24/22","startDate":"2022-06-20T13:46:12.904Z","endDate":"2022-06-24T12:12:00.000Z","completeDate":"2022-06-24T20:31:59.550Z","originBoardId":286,"goal":""},{"id":1904,"self":"https://arthrex.atlassian.net/rest/agile/1.0/sprint/1904","state":"closed","name":"A Team: 5/9/22 - 5/13/22","startDate":"2022-05-09T13:36:27.141Z","endDate":"2022-05-13T21:43:00.000Z","completeDate":"2022-05-13T20:16:27.067Z","originBoardId":286,"goal":""}],"customfield_11806":null,"customfield_11809":null,"votes":{"self":"https://arthrex.atlassian.net/rest/api/2/issue/MOB-1056/votes","votes":0,"hasVoted":false},"worklog":{"startAt":0,"maxResults":20,"total":0,"worklogs":[]},"customfield_11808":null,"issuetype":{"self":"https://arthrex.atlassian.net/rest/api/2/issuetype/5","id":"5","description":"The sub-task of the issue","iconUrl":"https://arthrex.atlassian.net/rest/api/2/universal_avatar/view/type/issuetype/avatar/10316?size=medium","name":"Sub-task","subtask":true,"avatarId":10316,"hierarchyLevel":-1},"sprint":{"id":1661,"self":"https://arthrex.atlassian.net/rest/agile/1.0/sprint/1661","state":"active","name":"A Team: 7/18/22 - 7/22/22","startDate":"2022-07-18T13:46:00.383Z","endDate":"2022-07-23T02:21:00.000Z","originBoardId":286,"goal":"AMOBS v1.0.0 and RAI v1.0.0 Releases"},"customfield_10700":null,"customfield_10701":[],"customfield_10702":null,"customfield_11901":{"self":"https://arthrex.atlassian.net/rest/api/2/customFieldOption/11506","value":"No","id":"11506"},"customfield_14050":null,"timetracking":{},"customfield_10803":null,"customfield_10806":null,"customfield_14047":null,"customfield_14048":null,"customfield_14046":null,"customfield_14049":null,"environment":null,"duedate":null,"customfield_13980":null,"customfield_11441":null,"customfield_13982":null,"customfield_12772":null,"customfield_13740":null,"customfield_13861":null,"customfield_11440":null,"customfield_11443":null,"customfield_12774":null,"customfield_11200":null,"customfield_12411":null,"customfield_13742":null,"customfield_11442":null,"customfield_13741":null,"customfield_11201":null,"customfield_12773":null,"customfield_12413":null,"customfield_11202":null,"customfield_13744":null,"customfield_13986":null,"customfield_12776":null,"customfield_13623":null,"customfield_12775":null,"customfield_11444":null,"customfield_12412":null,"customfield_13743":null,"customfield_12533":null,"customfield_13985":null,"customfield_13614":null,"customfield_11435":null,"customfield_13613":null,"customfield_12645":null,"customfield_13616":null,"customfield_13979":null,"customfield_11438":null,"customfield_13737":null,"customfield_13615":null,"customfield_11437":null,"customfield_13739":null,"customfield_13617":null,"customfield_11439":null,"customfield_13738":null,"customfield_12409":null,"customfield_11430":null,"customfield_12761":null,"customfield_12760":null,"customfield_13610":null,"customfield_10100":"2|i0223z:","customfield_11431":null,"customfield_12762":null,"customfield_13612":null,"customfield_11434":null,"customfield_13975":null,"customfield_13611":null,"customfield_12514":null,"customfield_11425":null,"customfield_13603":null,"customfield_12998":null,"customfield_11303":null,"customfield_12756":null,"customfield_12997":null,"customfield_13602":null,"customfield_11304":null,"customfield_12513":null,"customfield_12755":null,"customfield_13726":null,"customfield_11427":null,"customfield_13605":null,"customfield_12758":null,"customfield_12999":null,"customfield_13604":null,"customfield_12757":null,"timeestimate":null,"customfield_13969":null,"customfield_11428":null,"customfield_13727":null,"customfield_12759":null,"customfield_13606":null,"customfield_13608":null,"customfield_13729":null,"status":{"self":"https://arthrex.atlassian.net/rest/api/2/status/10201","description":"This status is managed internally by JIRA Software","iconUrl":"https://arthrex.atlassian.net/images/icons/subtask.gif","name":"In Review","id":"10201","statusCategory":{"self":"https://arthrex.atlassian.net/rest/api/2/statuscategory/4","id":4,"key":"indeterminate","colorName":"yellow","name":"In Progress"}},"customfield_12750":null,"customfield_12510":null,"customfield_12752":null,"customfield_11420":null,"customfield_11300":{"self":"https://arthrex.atlassian.net/rest/api/2/customFieldOption/10700","value":"User Stories:1","id":"10700"},"customfield_12751":null,"customfield_11301":null,"customfield_12996":null,"customfield_12754":null,"customfield_13601":null,"customfield_12753":null,"customfield_13600":null,"customfield_12511":null,"customfield_11422":null,"customfield_12745":null,"customfield_11414":null,"customfield_12503":null,"customfield_12502":null,"customfield_12744":null,"customfield_13836":null,"customfield_12505":null,"customfield_12747":null,"customfield_13715":null,"customfield_13835":null,"customfield_11415":null,"customfield_12504":null,"customfield_13956":null,"customfield_12746":null,"customfield_12507":null,"customfield_11418":null,"aggregatetimeestimate":null,"customfield_12749":null,"customfield_13837":null,"customfield_13716":null,"customfield_12748":null,"customfield_12508":null,"customfield_11419":null,"creator":{"self":"https://arthrex.atlassian.net/rest/api/2/user?accountId=5dfa6aa75697460cb3d97763","accountId":"5dfa6aa75697460cb3d97763","emailAddress":"patrick.maguschak2@arthrex.com","avatarUrls":{"48x48":"https://avatar-management--avatars.us-west-2.prod.public.atl-paas.net/5dfa6aa75697460cb3d97763/5f2aaf98-63fd-4e3a-a29b-7e163f497fd8/48","24x24":"https://avatar-management--avatars.us-west-2.prod.public.atl-paas.net/5dfa6aa75697460cb3d97763/5f2aaf98-63fd-4e3a-a29b-7e163f497fd8/24","16x16":"https://avatar-management--avatars.us-west-2.prod.public.atl-paas.net/5dfa6aa75697460cb3d97763/5f2aaf98-63fd-4e3a-a29b-7e163f497fd8/16","32x32":"https://avatar-management--avatars.us-west-2.prod.public.atl-paas.net/5dfa6aa75697460cb3d97763/5f2aaf98-63fd-4e3a-a29b-7e163f497fd8/32"},"displayName":"Patrick Maguschak","active":true,"timeZone":"America/New_York","accountType":"atlassian"},"customfield_13830":null,"customfield_10200":"* Dig Media creates Roadmap slide as discussed to show iterative approach (small screen grabs/mocks to display features)\n** This will be from a lot of the future state mock-ups to give a more rough image of what it may look like in the future. (See image below)\n\n* Dig Medica creates a Fireworks montage slide to introduce the new Surgeon App\n** this Montage slide will be the same images on the road map but just all in one place to \"explode onto the screen\"\n* Digital Media creates more comparison slides (old functionality vs new functionality) slides\n** This will be a lot of what the future mock-ups in side by side view to what the surgeon app is curren","customfield_12743":null,"customfield_10202":null,"customfield_13831":null,"customfield_12500":null,"customfield_11403":{"self":"https://arthrex.atlassian.net/rest/api/2/customFieldOption/10806","value":"Hotline","id":"10806"},"customfield_13702":null,"customfield_11523":null,"customfield_13701":null,"customfield_12975":null,"customfield_11402":null,"customfield_13825":null,"customfield_13704":null,"customfield_11526":null,"customfield_13824":null,"customfield_13703":null,"customfield_11404":null,"customfield_12738":null,"customfield_13827":null,"customfield_13826":null,"customfield_13705":null,"customfield_13829":null,"customfield_11529":null,"timespent":null,"customfield_12972":null,"aggregatetimespent":null,"customfield_11401":null,"customfield_12974":null,"customfield_11522":null,"customfield_13700":null,"customfield_11400":null,"customfield_11521":null,"customfield_13933":null,"customfield_12843":null,"customfield_13932":null,"customfield_11512":null,"customfield_11514":null,"customfield_11519":null,"workratio":-1,"customfield_12840":null,"customfield_11511":null,"customfield_12842":null,"customfield_13931":null,"customfield_10300":null,"customfield_12841":null,"customfield_10301":null,"customfield_11510":null,"customfield_13930":null,"customfield_12833":null,"customfield_11502":null,"customfield_13801":null,"customfield_13800":null,"customfield_12832":null,"customfield_11501":{"hasEpicLinkFieldDependency":false,"showField":false,"nonEditableReason":{"reason":"PLUGIN_LICENSE_ERROR","message":"The Parent Link is only available to Jira Premium users."}},"customfield_11504":null,"customfield_12835":null,"customfield_13803":null,"customfield_12834":null,"customfield_13802":null,"customfield_12955":null,"customfield_12958":null,"customfield_13926":null,"customfield_13805":null,"customfield_12837":null,"customfield_11506":null,"customfield_13804":null,"customfield_12836":null,"customfield_13925":null,"customfield_11505":null,"customfield_12839":null,"customfield_12838":null,"customfield_13808":null,"customfield_11500":null,"customfield_12831":null,"customfield_12830":null,"customfield_12822":null,"customfield_12942":null,"customfield_12824":null,"customfield_12823":null,"flagged":false,"customfield_12825":null,"customfield_12828":null,"customfield_12827":null,"customfield_10400":null,"customfield_12932":null,"customfield_12811":null,"customfield_12934":null,"customfield_12933":null,"customfield_12936":null,"customfield_13904":null,"customfield_12935":null,"customfield_13903":null,"customfield_13906":null,"customfield_12938":null,"customfield_12937":null,"customfield_13905":null,"customfield_13908":null,"customfield_12939":null,"customfield_13909":null,"customfield_12490":null,"customfield_12493":null,"customfield_12372":null,"customfield_12492":null,"customfield_13463":null,"customfield_12374":null,"customfield_12495":null,"customfield_12494":null,"customfield_13465":null,"customfield_12376":null,"customfield_12496":"{panel:bgColor=#FFC400}\r\nThese fields are used to populate request forms in the customer portal. Do not manually change these fields.\r\n{panel}","customfield_13343":null,"customfield_13464":null,"customfield_13225":null,"customfield_13467":null,"customfield_12499":null,"customfield_13466":null,"customfield_13469":null,"customfield_13468":null,"customfield_12480":null,"customfield_13690":null,"customfield_13692":null,"customfield_12482":null,"customfield_13691":null,"customfield_12481":null,"customfield_12000":null,"customfield_13694":null,"customfield_12484":null,"customfield_13693":null,"customfield_12362":null,"customfield_12483":null,"customfield_13696":null,"customfield_13212":null,"customfield_12002":null,"customfield_13211":null,"customfield_13695":null,"customfield_12001":null,"customfield_12004":null,"customfield_13698":null,"customfield_12488":null,"customfield_13335":null,"customfield_13213":null,"customfield_12003":null,"customfield_13697":null,"customfield_12489":null,"customfield_13699":null,"labels":[],"customfield_13336":null,"customfield_12005":null,"customfield_13207":null,"customfield_13449":null,"components":[],"customfield_12471":null,"customfield_13681":null,"customfield_13680":null,"customfield_12470":null,"customfield_12473":null,"customfield_13683":null,"customfield_12110":null,"customfield_13682":null,"customfield_12472":null,"customfield_12112":null,"customfield_13685":null,"customfield_12475":null,"customfield_13322":null,"customfield_12111":null,"customfield_12474":null,"customfield_13684":null,"customfield_12477":null,"customfield_13687":null,"customfield_12114":{"self":"https://arthrex.atlassian.net/rest/api/2/customFieldOption/11922","value":"No","id":"11922"},"customfield_13686":null,"customfield_12476":null,"customfield_13689":null,"customfield_12358":null,"customfield_12479":null,"customfield_12357":null,"customfield_12478":null,"customfield_13325":null,"customfield_13688":null,"customfield_12348":"{panel:title=Alert|titleBGColor=#FFC400|bgColor=#FFFAE6}\r\nPlease make sure that the correct issue type is selected. To select a different issue type, move the issue.\r\n{panel}","customfield_12106":null,"customfield_12469":null,"customfield_13679":null,"customfield_12109":null,"customfield_12108":null,"customfield_13672":null,"customfield_12341":null,"customfield_12340":null,"customfield_12343":"{panel:title=Info|titleBGColor=#C0B6F2|bgColor=#EAE6FF}\r\nUse this transition to escalate this issue to another team.\r\n\r\nPlease note that if you select *MRM-DAM Technical*, Jira will automatically create a ticket in Footprints. If you do not wish to create a new Footprints ticket, please select *Disable emails to Footprints* below.\r\n\r\nIf you do not want to be reminded to follow-up on this issue, please select *Disable escalation follow-up* below.\r\n{panel}","customfield_13795":null,"customfield_12464":null,"reporter":{"self":"https://arthrex.atlassian.net/rest/api/2/user?accountId=5dfa6aa75697460cb3d97763","accountId":"5dfa6aa75697460cb3d97763","emailAddress":"patrick.maguschak2@arthrex.com","avatarUrls":{"48x48":"https://avatar-management--avatars.us-west-2.prod.public.atl-paas.net/5dfa6aa75697460cb3d97763/5f2aaf98-63fd-4e3a-a29b-7e163f497fd8/48","24x24":"https://avatar-management--avatars.us-west-2.prod.public.atl-paas.net/5dfa6aa75697460cb3d97763/5f2aaf98-63fd-4e3a-a29b-7e163f497fd8/24","16x16":"https://avatar-management--avatars.us-west-2.prod.public.atl-paas.net/5dfa6aa75697460cb3d97763/5f2aaf98-63fd-4e3a-a29b-7e163f497fd8/16","32x32":"https://avatar-management--avatars.us-west-2.prod.public.atl-paas.net/5dfa6aa75697460cb3d97763/5f2aaf98-63fd-4e3a-a29b-7e163f497fd8/32"},"displayName":"Patrick Maguschak","active":true,"timeZone":"America/New_York","accountType":"atlassian"},"customfield_13674":null,"customfield_12101":null,"customfield_12463":null,"customfield_12342":null,"customfield_13673":null,"customfield_12466":null,"customfield_12345":null,"customfield_12103":null,"customfield_13676":null,"customfield_13797":null,"customfield_13796":null,"customfield_12344":"{panel:title=Info|titleBGColor=#C0B6F2|bgColor=#EAE6FF}\r\nUse this transition to respond to the reporter and request participants.\r\n\r\nIf you do not want to be reminded to follow-up on this issue, select *Disable customer follow-up* below.\r\n{panel}","customfield_13675":null,"customfield_13799":null,"customfield_12468":null,"customfield_13678":null,"customfield_12347":"{panel:bgColor=#FFC400}\r\n*Note*\r\nThese fields are used to populate request forms in the customer portal. Do not manually change these fields.\r\n{panel}","customfield_13798":null,"customfield_12346":null,"customfield_13677":null,"customfield_12467":null,"customfield_12104":null,"progress":{"progress":0,"total":0},"customfield_12570":null,"customfield_13780":null,"customfield_13782":null,"customfield_12330":null,"customfield_12571":null,"project":{"self":"https://arthrex.atlassian.net/rest/api/2/project/12262","id":"12262","key":"MOB","name":"A Team","projectTypeKey":"software","simplified":false,"avatarUrls":{"48x48":"https://arthrex.atlassian.net/rest/api/2/universal_avatar/view/type/project/avatar/13447","24x24":"https://arthrex.atlassian.net/rest/api/2/universal_avatar/view/type/project/avatar/13447?size=small","16x16":"https://arthrex.atlassian.net/rest/api/2/universal_avatar/view/type/project/avatar/13447?size=xsmall","32x32":"https://arthrex.atlassian.net/rest/api/2/universal_avatar/view/type/project/avatar/13447?size=medium"},"projectCategory":{"self":"https://arthrex.atlassian.net/rest/api/2/projectCategory/10103","id":"10103","description":"","name":"Digital Media - Mobile"}},"customfield_12332":null,"customfield_13783":null,"customfield_12331":null,"customfield_12333":null,"customfield_12336":null,"customfield_12335":null,"customfield_12327":null,"customfield_12569":null,"customfield_13779":null,"customfield_12568":null,"customfield_12329":null,"customfield_12328":null,"resolutiondate":null,"watches":{"self":"https://arthrex.atlassian.net/rest/api/2/issue/MOB-1056/watchers","watchCount":1,"isWatching":false},"customfield_13890":null,"customfield_13892":null,"customfield_12561":null,"customfield_13771":null,"customfield_13770":null,"customfield_13891":null,"customfield_12563":null,"customfield_13652":null,"customfield_12200":null,"customfield_12321":null,"customfield_12320":null,"customfield_13772":null,"customfield_12562":null,"customfield_12202":null,"customfield_12323":null,"customfield_12564":null,"customfield_12201":null,"customfield_12322":null,"customfield_13656":null,"customfield_12567":null,"customfield_12324":null,"customfield_13655":null,"customfield_12203":null,"customfield_12566":null,"customfield_12558":null,"customfield_13407":null,"customfield_13769":null,"customfield_12319":null,"updated":"2022-06-27T16:23:05.774-0400","customfield_12790":null,"timeoriginalestimate":null,"customfield_13760":null,"customfield_12792":null,"customfield_12550":null,"description":"Rough Mock Ups \nECI Playbooks Pro\n\nDiscover Screen and [Arthrex.com|http://Arthrex.com] Sales Resources\n\nProduct and Procedure Content\n\nProduct Catalog\n\nSearch\n\nMy Library\n\n[Salesforce.com|http://Salesforce.com] Chatter Integration\n\nPush Notification","customfield_12791":null,"customfield_13762":null,"customfield_12794":null,"customfield_12552":null,"customfield_13761":null,"customfield_11100":" ","customfield_13640":null,"customfield_12551":null,"customfield_13764":null,"customfield_12554":null,"customfield_11101":null,"customfield_12795":null,"customfield_11102":{"self":"https://arthrex.atlassian.net/rest/api/2/customFieldOption/10500","value":"1-None","id":"10500"},"customfield_12553":null,"customfield_13763":null,"customfield_13645":null,"customfield_13765":null,"customfield_12555":null,"customfield_11104":null,"customfield_12305":null,"customfield_12789":null,"customfield_13757":null,"customfield_10005":[{"id":1952,"name":"A Team: 6/20/22 - 6/24/22","state":"closed","boardId":286,"goal":"","startDate":"2022-06-20T13:46:12.904Z","endDate":"2022-06-24T12:12:00.000Z","completeDate":"2022-06-24T20:31:59.550Z"},{"id":1904,"name":"A Team: 5/9/22 - 5/13/22","state":"closed","boardId":286,"goal":"","startDate":"2022-05-09T13:36:27.141Z","endDate":"2022-05-13T21:43:00.000Z","completeDate":"2022-05-13T20:16:27.067Z"},{"id":2001,"name":"A Team: 7/11/22 - 7/15/22","state":"closed","boardId":286,"goal":"Prep for Submission of v1.0.0 Rep App iOS Release","startDate":"2022-07-11T13:56:18.821Z","endDate":"2022-07-16T02:15:00.000Z","completeDate":"2022-07-15T21:39:31.202Z"},{"id":1955,"name":"A Team: 6/27/22 - 7/1/22","state":"closed","boardId":286,"goal":"","startDate":"2022-06-27T13:39:51.053Z","endDate":"2022-07-01T16:03:00.000Z","completeDate":"2022-07-01T20:26:58.126Z"},{"id":1940,"name":"A Team: 6/13/22 - 6/17/22","state":"closed","boardId":286,"goal":"","startDate":"2022-06-13T13:23:11.454Z","endDate":"2022-06-17T13:12:00.000Z","completeDate":"2022-06-17T21:12:57.348Z"},{"id":1861,"name":"A Team: 4/18/22 - 4/22/22","state":"closed","boardId":286,"goal":"","startDate":"2022-04-18T13:19:51.131Z","endDate":"2022-04-22T21:22:00.000Z","completeDate":"2022-04-23T00:50:05.964Z"},{"id":1862,"name":"A Team: 4/25/22 - 4/29/22","state":"closed","boardId":286,"goal":"","startDate":"2022-04-25T13:38:51.319Z","endDate":"2022-04-29T21:00:00.000Z","completeDate":"2022-04-29T20:44:00.021Z"},{"id":1929,"name":"A Team: 5/31/22 - 6/10/22","state":"closed","boardId":286,"goal":"","startDate":"2022-05-31T13:20:11.464Z","endDate":"2022-06-10T14:13:00.000Z","completeDate":"2022-06-10T21:09:52.636Z"},{"id":1881,"name":"A Team: 5/2/22 - 5/6/22","state":"closed","boardId":286,"goal":"","startDate":"2022-05-02T13:24:03.040Z","endDate":"2022-05-06T21:59:00.000Z","completeDate":"2022-05-06T20:33:28.823Z"},{"id":1915,"name":"A Team: 5/16/22 - 5/20/22","state":"closed","boardId":286,"goal":"","startDate":"2022-05-16T13:45:22.501Z","endDate":"2022-05-20T21:11:00.000Z","completeDate":"2022-05-20T20:48:44.357Z"},{"id":1916,"name":"A Team: 5/23/22 - 5/27/22","state":"closed","boardId":286,"goal":"","startDate":"2022-05-23T13:46:32.935Z","endDate":"2022-05-27T18:12:00.000Z","completeDate":"2022-05-27T21:18:43.799Z"},{"id":1965,"name":"A Team: 7/5/22 - 7/8/22","state":"closed","boardId":286,"goal":"","startDate":"2022-07-05T13:38:21.073Z","endDate":"2022-07-08T17:26:00.000Z","completeDate":"2022-07-08T21:28:08.661Z"},{"id":1661,"name":"A Team: 7/18/22 - 7/22/22","state":"active","boardId":286,"goal":"AMOBS v1.0.0 and RAI v1.0.0 Releases","startDate":"2022-07-18T13:46:00.383Z","endDate":"2022-07-23T02:21:00.000Z"}],"customfield_13636":null,"customfield_12547":null,"customfield_12426":null,"customfield_12788":null,"customfield_12304":null,"customfield_10006":null,"customfield_12425":null,"customfield_13756":null,"customfield_12546":null,"customfield_13759":null,"customfield_12428":null,"customfield_12307":null,"customfield_12549":null,"customfield_13998":null,"customfield_12306":null,"customfield_12548":null,"customfield_13758":null,"customfield_12427":null,"customfield_12309":null,"customfield_12308":null,"customfield_12429":null,"summary":"Rep app PPTX stuff ","customfield_12781":null,"customfield_11450":{"self":"https://arthrex.atlassian.net/rest/api/2/customFieldOption/10989","value":"Always","id":"10989"},"customfield_13993":null,"customfield_12780":null,"customfield_12420":null,"customfield_13751":null,"customfield_12541":null,"customfield_12783":null,"customfield_10000":null,"customfield_12782":null,"customfield_12540":null,"customfield_13750":null,"customfield_13991":null,"customfield_13996":null,"customfield_10001":null,"customfield_13753":null,"customfield_12422":null,"customfield_12785":null,"customfield_13752":null,"customfield_12300":"{}","customfield_12784":null,"customfield_13997":null,"customfield_12545":null,"customfield_12787":null,"customfield_13994":null,"customfield_13755":null,"customfield_12303":null,"customfield_12544":null,"customfield_12786":null,"customfield_12423":null,"customfield_13995":null,"customfield_13754":null,"customfield_12778":null,"customfield_13989":null,"customfield_11447":null,"customfield_12415":null,"customfield_13746":null,"customfield_12414":null,"customfield_12777":null,"customfield_13745":null,"customfield_13748":null,"customfield_12417":null,"customfield_13987":null,"customfield_11449":{"self":"https://arthrex.atlassian.net/rest/api/2/customFieldOption/10986","value":"Live Site","id":"10986"},"customfield_12416":null,"customfield_13505":[],"customfield_11448":null,"customfield_12779":null,"customfield_12419":null,"customfield_12418":null,"customfield_13749":null,"comment":{"comments":[],"self":"https://arthrex.atlassian.net/rest/api/2/issue/297639/comment","maxResults":0,"total":0,"startAt":0},"statuscategorychangedate":"2022-06-27T12:50:34.330-0400","customfield_13063":"Testing message","customfield_14033":null,"customfield_13062":null,"customfield_13067":null,"customfield_13066":null,"fixVersions":[],"customfield_10900":null,"customfield_13294":null,"customfield_13052":null,"customfield_13053":null,"epic":null,"customfield_13057":null,"priority":{"self":"https://arthrex.atlassian.net/rest/api/2/priority/4","iconUrl":"https://s3.amazonaws.com/arthrex-public/jira/priorities/minor.png","name":"Minor","id":"4"},"customfield_14028":null,"versions":[],"customfield_14014":null,"customfield_13045":null,"customfield_14015":null,"customfield_13047":null,"customfield_13046":null,"customfield_14013":null,"customfield_14016":null,"customfield_14017":null,"customfield_13391":null,"customfield_13272":null,"customfield_13392":null,"customfield_13274":null,"customfield_13273":null,"aggregateprogress":{"progress":0,"total":0},"customfield_13279":null,"customfield_13380":null,"issuerestriction":{"issuerestrictions":{},"shouldDisplay":false},"customfield_13371":null,"customfield_13494":null,"created":"2022-06-22T16:06:55.251-0400","customfield_13373":null,"customfield_13012":null,"customfield_13375":null,"customfield_13011":null,"customfield_13377":null,"customfield_13376":null,"customfield_13379":null,"customfield_13016":null,"customfield_13378":null,"customfield_13017":null,"customfield_13360":null,"customfield_13362":null,"customfield_13361":null,"customfield_13001":null,"customfield_13364":null,"customfield_13122":null,"customfield_13000":null,"customfield_13363":null,"customfield_13366":"150 GB","customfield_13002":null,"customfield_13365":null,"customfield_13368":null,"customfield_13367":null,"customfield_13369":null,"security":null,"attachment":[],"customfield_13470":null,"customfield_13471":null,"customfield_12385":null,"customfield_13355":null,"customfield_12386":null,"customfield_13599":null,"customfield_13357":null,"customfield_12388":null,"customfield_13356":null,"customfield_13359":null,"customfield_13358":null}},{"expand":"operations,versionedRepresentations,editmeta,changelog,renderedFields","id":"299481","self":"https://arthrex.atlassian.net/rest/agile/1.0/issue/299481","key":"MOB-1066","fields":{"parent":{"id":"279628","key":"MOB-929","self":"https://arthrex.atlassian.net/rest/api/2/issue/279628","fields":{"summary":"UX/UI","status":{"self":"https://arthrex.atlassian.net/rest/api/2/status/3","description":"This issue is being actively worked on at the moment by the assignee.","iconUrl":"https://arthrex.atlassian.net/images/icons/statuses/inprogress.png","name":"Working","id":"3","statusCategory":{"self":"https://arthrex.atlassian.net/rest/api/2/statuscategory/4","id":4,"key":"indeterminate","colorName":"yellow","name":"In Progress"}},"priority":{"self":"https://arthrex.atlassian.net/rest/api/2/priority/4","iconUrl":"https://s3.amazonaws.com/arthrex-public/jira/priorities/minor.png","name":"Minor","id":"4"},"issuetype":{"self":"https://arthrex.atlassian.net/rest/api/2/issuetype/3","id":"3","description":"A task that needs to be done.","iconUrl":"https://arthrex.atlassian.net/rest/api/2/universal_avatar/view/type/issuetype/avatar/10318?size=medium","name":"Task","subtask":false,"avatarId":10318,"hierarchyLevel":0}}},"resolution":{"self":"https://arthrex.atlassian.net/rest/api/2/resolution/10000","id":"10000","description":"The issue is done.","name":"Done"},"customfield_12930":null,"customfield_12923":null,"customfield_12924":null,"customfield_12929":null,"lastViewed":null,"customfield_11700":null,"customfield_11702":null,"customfield_12912":null,"customfield_11701":null,"customfield_12914":null,"aggregatetimeoriginalestimate":null,"customfield_12916":null,"customfield_12915":null,"customfield_12918":null,"customfield_12917":null,"issuelinks":[],"assignee":{"self":"https://arthrex.atlassian.net/rest/api/2/user?accountId=60bac9915fa6f1006fee00b2","accountId":"60bac9915fa6f1006fee00b2","emailAddress":"johnny.ansari@arthrex.com","avatarUrls":{"48x48":"https://secure.gravatar.com/avatar/d887eff1f5130dfab59a6de736562de4?d=https%3A%2F%2Favatar-management--avatars.us-west-2.prod.public.atl-paas.net%2Finitials%2FJA-5.png","24x24":"https://secure.gravatar.com/avatar/d887eff1f5130dfab59a6de736562de4?d=https%3A%2F%2Favatar-management--avatars.us-west-2.prod.public.atl-paas.net%2Finitials%2FJA-5.png","16x16":"https://secure.gravatar.com/avatar/d887eff1f5130dfab59a6de736562de4?d=https%3A%2F%2Favatar-management--avatars.us-west-2.prod.public.atl-paas.net%2Finitials%2FJA-5.png","32x32":"https://secure.gravatar.com/avatar/d887eff1f5130dfab59a6de736562de4?d=https%3A%2F%2Favatar-management--avatars.us-west-2.prod.public.atl-paas.net%2Finitials%2FJA-5.png"},"displayName":"Johnny Ansari","active":true,"timeZone":"America/New_York","accountType":"atlassian"},"customfield_12919":null,"customfield_11810":null,"customfield_11812":null,"customfield_12901":null,"customfield_11811":null,"customfield_11814":null,"customfield_12903":null,"customfield_12902":null,"customfield_11813":null,"customfield_11816":null,"customfield_12905":null,"customfield_11815":null,"customfield_12904":null,"customfield_11818":null,"customfield_11817":null,"customfield_12906":null,"subtasks":[],"customfield_11801":null,"customfield_11800":null,"customfield_11802":null,"customfield_11805":null,"customfield_11804":null,"customfield_11807":null,"closedSprints":[{"id":2001,"self":"https://arthrex.atlassian.net/rest/agile/1.0/sprint/2001","state":"closed","name":"A Team: 7/11/22 - 7/15/22","startDate":"2022-07-11T13:56:18.821Z","endDate":"2022-07-16T02:15:00.000Z","completeDate":"2022-07-15T21:39:31.202Z","originBoardId":286,"goal":"Prep for Submission of v1.0.0 Rep App iOS Release"},{"id":1955,"self":"https://arthrex.atlassian.net/rest/agile/1.0/sprint/1955","state":"closed","name":"A Team: 6/27/22 - 7/1/22","startDate":"2022-06-27T13:39:51.053Z","endDate":"2022-07-01T16:03:00.000Z","completeDate":"2022-07-01T20:26:58.126Z","originBoardId":286,"goal":""},{"id":1940,"self":"https://arthrex.atlassian.net/rest/agile/1.0/sprint/1940","state":"closed","name":"A Team: 6/13/22 - 6/17/22","startDate":"2022-06-13T13:23:11.454Z","endDate":"2022-06-17T13:12:00.000Z","completeDate":"2022-06-17T21:12:57.348Z","originBoardId":286,"goal":""},{"id":1861,"self":"https://arthrex.atlassian.net/rest/agile/1.0/sprint/1861","state":"closed","name":"A Team: 4/18/22 - 4/22/22","startDate":"2022-04-18T13:19:51.131Z","endDate":"2022-04-22T21:22:00.000Z","completeDate":"2022-04-23T00:50:05.964Z","originBoardId":286,"goal":""},{"id":1862,"self":"https://arthrex.atlassian.net/rest/agile/1.0/sprint/1862","state":"closed","name":"A Team: 4/25/22 - 4/29/22","startDate":"2022-04-25T13:38:51.319Z","endDate":"2022-04-29T21:00:00.000Z","completeDate":"2022-04-29T20:44:00.021Z","originBoardId":286,"goal":""},{"id":1929,"self":"https://arthrex.atlassian.net/rest/agile/1.0/sprint/1929","state":"closed","name":"A Team: 5/31/22 - 6/10/22","startDate":"2022-05-31T13:20:11.464Z","endDate":"2022-06-10T14:13:00.000Z","completeDate":"2022-06-10T21:09:52.636Z","originBoardId":286,"goal":""},{"id":1881,"self":"https://arthrex.atlassian.net/rest/agile/1.0/sprint/1881","state":"closed","name":"A Team: 5/2/22 - 5/6/22","startDate":"2022-05-02T13:24:03.040Z","endDate":"2022-05-06T21:59:00.000Z","completeDate":"2022-05-06T20:33:28.823Z","originBoardId":286,"goal":""},{"id":1915,"self":"https://arthrex.atlassian.net/rest/agile/1.0/sprint/1915","state":"closed","name":"A Team: 5/16/22 - 5/20/22","startDate":"2022-05-16T13:45:22.501Z","endDate":"2022-05-20T21:11:00.000Z","completeDate":"2022-05-20T20:48:44.357Z","originBoardId":286,"goal":""},{"id":1916,"self":"https://arthrex.atlassian.net/rest/agile/1.0/sprint/1916","state":"closed","name":"A Team: 5/23/22 - 5/27/22","startDate":"2022-05-23T13:46:32.935Z","endDate":"2022-05-27T18:12:00.000Z","completeDate":"2022-05-27T21:18:43.799Z","originBoardId":286,"goal":""},{"id":1965,"self":"https://arthrex.atlassian.net/rest/agile/1.0/sprint/1965","state":"closed","name":"A Team: 7/5/22 - 7/8/22","startDate":"2022-07-05T13:38:21.073Z","endDate":"2022-07-08T17:26:00.000Z","completeDate":"2022-07-08T21:28:08.661Z","originBoardId":286,"goal":""},{"id":1952,"self":"https://arthrex.atlassian.net/rest/agile/1.0/sprint/1952","state":"closed","name":"A Team: 6/20/22 - 6/24/22","startDate":"2022-06-20T13:46:12.904Z","endDate":"2022-06-24T12:12:00.000Z","completeDate":"2022-06-24T20:31:59.550Z","originBoardId":286,"goal":""},{"id":1904,"self":"https://arthrex.atlassian.net/rest/agile/1.0/sprint/1904","state":"closed","name":"A Team: 5/9/22 - 5/13/22","startDate":"2022-05-09T13:36:27.141Z","endDate":"2022-05-13T21:43:00.000Z","completeDate":"2022-05-13T20:16:27.067Z","originBoardId":286,"goal":""}],"customfield_11806":null,"customfield_11809":null,"votes":{"self":"https://arthrex.atlassian.net/rest/api/2/issue/MOB-1066/votes","votes":0,"hasVoted":false},"customfield_11808":null,"worklog":{"startAt":0,"maxResults":20,"total":0,"worklogs":[]},"issuetype":{"self":"https://arthrex.atlassian.net/rest/api/2/issuetype/5","id":"5","description":"The sub-task of the issue","iconUrl":"https://arthrex.atlassian.net/rest/api/2/universal_avatar/view/type/issuetype/avatar/10316?size=medium","name":"Sub-task","subtask":true,"avatarId":10316,"hierarchyLevel":-1},"sprint":{"id":1661,"self":"https://arthrex.atlassian.net/rest/agile/1.0/sprint/1661","state":"active","name":"A Team: 7/18/22 - 7/22/22","startDate":"2022-07-18T13:46:00.383Z","endDate":"2022-07-23T02:21:00.000Z","originBoardId":286,"goal":"AMOBS v1.0.0 and RAI v1.0.0 Releases"},"customfield_10700":null,"customfield_10701":[],"customfield_10702":null,"customfield_11901":{"self":"https://arthrex.atlassian.net/rest/api/2/customFieldOption/11506","value":"No","id":"11506"},"customfield_14050":null,"timetracking":{},"customfield_10803":null,"customfield_10806":null,"customfield_14047":null,"customfield_14048":null,"customfield_14046":null,"customfield_14049":null,"environment":null,"duedate":null,"customfield_13980":null,"customfield_11441":null,"customfield_12772":null,"customfield_13740":null,"customfield_13982":null,"customfield_13861":null,"customfield_11440":null,"customfield_13742":null,"customfield_11200":null,"customfield_12411":null,"customfield_11443":null,"customfield_12774":null,"customfield_13741":null,"customfield_12773":null,"customfield_11442":null,"customfield_11201":null,"customfield_12413":null,"customfield_13623":null,"customfield_13744":null,"customfield_12776":null,"customfield_13986":null,"customfield_11202":null,"customfield_13743":null,"customfield_13985":null,"customfield_12533":null,"customfield_12412":null,"customfield_12775":null,"customfield_11444":null,"customfield_13614":null,"customfield_11435":null,"customfield_12645":null,"customfield_13613":null,"customfield_13979":null,"customfield_13616":null,"customfield_11438":null,"customfield_13737":null,"customfield_11437":null,"customfield_13615":null,"customfield_13739":null,"customfield_11439":null,"customfield_13617":null,"customfield_13738":null,"customfield_12409":null,"customfield_12761":null,"customfield_11430":null,"customfield_12760":null,"customfield_10100":"2|i02243:","customfield_13610":null,"customfield_11431":null,"customfield_12762":null,"customfield_13975":null,"customfield_11434":null,"customfield_13612":null,"customfield_13611":null,"customfield_12998":null,"customfield_12514":null,"customfield_11425":null,"customfield_13603":null,"customfield_11303":"3_*:*_1_*:*_870594830_*|*_10000_*:*_1_*:*_92350051_*|*_10001_*:*_1_*:*_0","customfield_12756":null,"customfield_12755":null,"customfield_11304":null,"customfield_12513":null,"customfield_13602":null,"customfield_12997":null,"customfield_13726":null,"customfield_13605":null,"customfield_12758":null,"customfield_11427":null,"customfield_13604":null,"customfield_12999":null,"customfield_12757":null,"timeestimate":null,"customfield_13727":null,"customfield_13969":null,"customfield_12759":null,"customfield_13606":null,"customfield_11428":null,"customfield_13729":null,"customfield_13608":null,"status":{"self":"https://arthrex.atlassian.net/rest/api/2/status/10001","description":"","iconUrl":"https://arthrex.atlassian.net/images/icons/subtask.gif","name":"Done","id":"10001","statusCategory":{"self":"https://arthrex.atlassian.net/rest/api/2/statuscategory/3","id":3,"key":"done","colorName":"green","name":"Done"}},"customfield_12750":null,"customfield_12752":null,"customfield_12510":null,"customfield_11420":null,"customfield_12751":null,"customfield_11300":{"self":"https://arthrex.atlassian.net/rest/api/2/customFieldOption/10700","value":"User Stories:1","id":"10700"},"customfield_12996":null,"customfield_13601":null,"customfield_11301":null,"customfield_12754":null,"customfield_11422":null,"customfield_13600":null,"customfield_12753":null,"customfield_12511":null,"customfield_12503":null,"customfield_11414":null,"customfield_12745":null,"customfield_12502":null,"customfield_12744":null,"customfield_12747":null,"customfield_12505":null,"customfield_13836":null,"customfield_13715":null,"customfield_13956":null,"customfield_12504":null,"customfield_12746":null,"customfield_11415":null,"customfield_13835":null,"customfield_11418":null,"customfield_12507":null,"customfield_12749":null,"aggregatetimeestimate":null,"customfield_13837":null,"customfield_13716":null,"customfield_12748":null,"customfield_11419":null,"customfield_12508":null,"creator":{"self":"https://arthrex.atlassian.net/rest/api/2/user?accountId=5dfa6aa75697460cb3d97763","accountId":"5dfa6aa75697460cb3d97763","emailAddress":"patrick.maguschak2@arthrex.com","avatarUrls":{"48x48":"https://avatar-management--avatars.us-west-2.prod.public.atl-paas.net/5dfa6aa75697460cb3d97763/5f2aaf98-63fd-4e3a-a29b-7e163f497fd8/48","24x24":"https://avatar-management--avatars.us-west-2.prod.public.atl-paas.net/5dfa6aa75697460cb3d97763/5f2aaf98-63fd-4e3a-a29b-7e163f497fd8/24","16x16":"https://avatar-management--avatars.us-west-2.prod.public.atl-paas.net/5dfa6aa75697460cb3d97763/5f2aaf98-63fd-4e3a-a29b-7e163f497fd8/16","32x32":"https://avatar-management--avatars.us-west-2.prod.public.atl-paas.net/5dfa6aa75697460cb3d97763/5f2aaf98-63fd-4e3a-a29b-7e163f497fd8/32"},"displayName":"Patrick Maguschak","active":true,"timeZone":"America/New_York","accountType":"atlassian"},"customfield_13830":null,"customfield_10200":"Tye Morris\n\nMarc Milk\n\nAlbert Valdivia\n\nRyan Brick\n\nStan Matveyev\n\nRicardo Martinez\n\nChristi Zimmer (Office manager)","customfield_12743":null,"customfield_12500":null,"customfield_10202":null,"customfield_13831":null,"customfield_13702":null,"customfield_11403":{"self":"https://arthrex.atlassian.net/rest/api/2/customFieldOption/10806","value":"Hotline","id":"10806"},"customfield_11402":null,"customfield_13701":null,"customfield_12975":null,"customfield_11523":null,"customfield_11526":null,"customfield_13825":null,"customfield_13704":null,"customfield_13824":null,"customfield_13703":null,"customfield_11404":null,"customfield_12738":null,"customfield_13827":null,"customfield_13826":null,"customfield_13705":null,"customfield_13829":null,"customfield_11529":null,"timespent":null,"customfield_12972":null,"aggregatetimespent":null,"customfield_13700":null,"customfield_11401":null,"customfield_11522":null,"customfield_12974":null,"customfield_11521":null,"customfield_11400":null,"customfield_13933":null,"customfield_12843":null,"customfield_11512":null,"customfield_13932":null,"customfield_11514":null,"customfield_11519":"3_*:*_1_*:*_870594830_*|*_10000_*:*_1_*:*_92350051_*|*_10001_*:*_1_*:*_0","workratio":-1,"customfield_12840":null,"customfield_11511":null,"customfield_10300":null,"customfield_12842":null,"customfield_13931":null,"customfield_12841":null,"customfield_11510":null,"customfield_13930":null,"customfield_10301":null,"customfield_12833":null,"customfield_13801":null,"customfield_11502":null,"customfield_13800":null,"customfield_11501":{"hasEpicLinkFieldDependency":false,"showField":false,"nonEditableReason":{"reason":"PLUGIN_LICENSE_ERROR","message":"The Parent Link is only available to Jira Premium users."}},"customfield_12832":null,"customfield_11504":null,"customfield_12835":null,"customfield_13803":null,"customfield_12834":null,"customfield_12955":null,"customfield_13802":null,"customfield_11506":null,"customfield_13805":null,"customfield_12958":null,"customfield_13926":null,"customfield_12837":null,"customfield_13925":null,"customfield_11505":null,"customfield_12836":null,"customfield_13804":null,"customfield_12839":null,"customfield_12838":null,"customfield_13808":null,"customfield_11500":null,"customfield_12831":null,"customfield_12830":null,"customfield_12822":null,"customfield_12942":null,"customfield_12824":null,"customfield_12823":null,"flagged":false,"customfield_12825":null,"customfield_12828":null,"customfield_12827":null,"customfield_10400":null,"customfield_12811":null,"customfield_12932":null,"customfield_12934":null,"customfield_12933":null,"customfield_12936":null,"customfield_13904":null,"customfield_12935":null,"customfield_13903":null,"customfield_12938":null,"customfield_13906":null,"customfield_13905":null,"customfield_12937":null,"customfield_13908":null,"customfield_12939":null,"customfield_13909":null,"customfield_12490":null,"customfield_12372":null,"customfield_12493":null,"customfield_12492":null,"customfield_13463":null,"customfield_12374":null,"customfield_12495":null,"customfield_12494":null,"customfield_13465":null,"customfield_12376":null,"customfield_12496":"{panel:bgColor=#FFC400}\r\nThese fields are used to populate request forms in the customer portal. Do not manually change these fields.\r\n{panel}","customfield_13464":null,"customfield_13343":null,"customfield_12499":null,"customfield_13225":null,"customfield_13467":null,"customfield_13466":null,"customfield_13469":null,"customfield_13468":null,"customfield_12480":null,"customfield_13690":null,"customfield_12482":null,"customfield_13692":null,"customfield_13691":null,"customfield_12481":null,"customfield_12484":null,"customfield_12000":null,"customfield_13694":null,"customfield_12483":null,"customfield_13693":null,"customfield_12362":null,"customfield_13696":null,"customfield_13212":null,"customfield_12002":null,"customfield_13695":null,"customfield_12001":null,"customfield_13211":null,"customfield_12004":null,"customfield_13335":null,"customfield_13698":null,"customfield_12488":null,"customfield_13213":null,"customfield_13697":null,"customfield_12003":null,"customfield_12489":null,"customfield_13699":null,"customfield_12005":null,"customfield_13336":null,"labels":[],"customfield_13207":null,"customfield_13449":null,"components":[],"customfield_12471":null,"customfield_13681":null,"customfield_12470":null,"customfield_13680":null,"customfield_12110":null,"customfield_12473":null,"customfield_13683":null,"customfield_12472":null,"customfield_13682":null,"customfield_13685":null,"customfield_12112":null,"customfield_12475":null,"customfield_13322":null,"customfield_13684":null,"customfield_12474":null,"customfield_12111":null,"customfield_13687":null,"customfield_12114":{"self":"https://arthrex.atlassian.net/rest/api/2/customFieldOption/11922","value":"No","id":"11922"},"customfield_12477":null,"customfield_12476":null,"customfield_13686":null,"customfield_13689":null,"customfield_12358":null,"customfield_12479":null,"customfield_12357":null,"customfield_13688":null,"customfield_13325":null,"customfield_12478":null,"customfield_12348":"{panel:title=Alert|titleBGColor=#FFC400|bgColor=#FFFAE6}\r\nPlease make sure that the correct issue type is selected. To select a different issue type, move the issue.\r\n{panel}","customfield_12469":null,"customfield_12106":null,"customfield_13679":null,"customfield_12109":null,"customfield_12108":null,"customfield_12341":null,"customfield_13672":null,"customfield_12340":null,"customfield_12101":null,"customfield_12464":null,"reporter":{"self":"https://arthrex.atlassian.net/rest/api/2/user?accountId=5dfa6aa75697460cb3d97763","accountId":"5dfa6aa75697460cb3d97763","emailAddress":"patrick.maguschak2@arthrex.com","avatarUrls":{"48x48":"https://avatar-management--avatars.us-west-2.prod.public.atl-paas.net/5dfa6aa75697460cb3d97763/5f2aaf98-63fd-4e3a-a29b-7e163f497fd8/48","24x24":"https://avatar-management--avatars.us-west-2.prod.public.atl-paas.net/5dfa6aa75697460cb3d97763/5f2aaf98-63fd-4e3a-a29b-7e163f497fd8/24","16x16":"https://avatar-management--avatars.us-west-2.prod.public.atl-paas.net/5dfa6aa75697460cb3d97763/5f2aaf98-63fd-4e3a-a29b-7e163f497fd8/16","32x32":"https://avatar-management--avatars.us-west-2.prod.public.atl-paas.net/5dfa6aa75697460cb3d97763/5f2aaf98-63fd-4e3a-a29b-7e163f497fd8/32"},"displayName":"Patrick Maguschak","active":true,"timeZone":"America/New_York","accountType":"atlassian"},"customfield_13674":null,"customfield_12343":"{panel:title=Info|titleBGColor=#C0B6F2|bgColor=#EAE6FF}\r\nUse this transition to escalate this issue to another team.\r\n\r\nPlease note that if you select *MRM-DAM Technical*, Jira will automatically create a ticket in Footprints. If you do not wish to create a new Footprints ticket, please select *Disable emails to Footprints* below.\r\n\r\nIf you do not want to be reminded to follow-up on this issue, please select *Disable escalation follow-up* below.\r\n{panel}","customfield_13795":null,"customfield_12342":null,"customfield_12463":null,"customfield_13673":null,"customfield_12345":null,"customfield_12103":null,"customfield_13797":null,"customfield_12466":null,"customfield_13676":null,"customfield_13675":null,"customfield_13796":null,"customfield_12344":"{panel:title=Info|titleBGColor=#C0B6F2|bgColor=#EAE6FF}\r\nUse this transition to respond to the reporter and request participants.\r\n\r\nIf you do not want to be reminded to follow-up on this issue, select *Disable customer follow-up* below.\r\n{panel}","customfield_12347":"{panel:bgColor=#FFC400}\r\n*Note*\r\nThese fields are used to populate request forms in the customer portal. Do not manually change these fields.\r\n{panel}","customfield_13799":null,"customfield_13678":null,"customfield_12468":null,"customfield_12346":null,"customfield_13798":null,"customfield_13677":null,"customfield_12104":null,"customfield_12467":null,"progress":{"progress":0,"total":0},"customfield_12570":null,"customfield_13780":null,"customfield_12330":null,"customfield_13782":null,"project":{"self":"https://arthrex.atlassian.net/rest/api/2/project/12262","id":"12262","key":"MOB","name":"A Team","projectTypeKey":"software","simplified":false,"avatarUrls":{"48x48":"https://arthrex.atlassian.net/rest/api/2/universal_avatar/view/type/project/avatar/13447","24x24":"https://arthrex.atlassian.net/rest/api/2/universal_avatar/view/type/project/avatar/13447?size=small","16x16":"https://arthrex.atlassian.net/rest/api/2/universal_avatar/view/type/project/avatar/13447?size=xsmall","32x32":"https://arthrex.atlassian.net/rest/api/2/universal_avatar/view/type/project/avatar/13447?size=medium"},"projectCategory":{"self":"https://arthrex.atlassian.net/rest/api/2/projectCategory/10103","id":"10103","description":"","name":"Digital Media - Mobile"}},"customfield_12571":null,"customfield_12332":null,"customfield_13783":null,"customfield_12331":null,"customfield_12333":null,"customfield_12336":null,"customfield_12335":null,"customfield_12569":null,"customfield_12327":null,"customfield_13779":null,"customfield_12568":null,"customfield_12329":null,"customfield_12328":null,"resolutiondate":"2022-07-11T13:03:18.083-0400","watches":{"self":"https://arthrex.atlassian.net/rest/api/2/issue/MOB-1066/watchers","watchCount":1,"isWatching":false},"customfield_13890":null,"customfield_13771":null,"customfield_13892":null,"customfield_12561":null,"customfield_13770":null,"customfield_13891":null,"customfield_13652":null,"customfield_12200":null,"customfield_12563":null,"customfield_12321":null,"customfield_13772":null,"customfield_12562":null,"customfield_12320":null,"customfield_12202":null,"customfield_12323":null,"customfield_12322":null,"customfield_12201":null,"customfield_12564":null,"customfield_12567":null,"customfield_13656":null,"customfield_12324":null,"customfield_13655":null,"customfield_12203":null,"customfield_12566":null,"customfield_12558":null,"customfield_13407":null,"customfield_13769":null,"customfield_12319":null,"updated":"2022-07-11T13:03:18.127-0400","customfield_12790":null,"timeoriginalestimate":null,"customfield_12792":null,"customfield_12550":null,"customfield_13760":null,"customfield_12791":null,"description":"Host Onsite Beta for 7/6 at 4pm","customfield_12552":null,"customfield_12794":null,"customfield_13762":null,"customfield_13640":null,"customfield_12551":null,"customfield_13761":null,"customfield_11100":" ","customfield_12554":null,"customfield_11101":null,"customfield_13764":null,"customfield_12553":null,"customfield_13763":null,"customfield_12795":null,"customfield_11102":{"self":"https://arthrex.atlassian.net/rest/api/2/customFieldOption/10500","value":"1-None","id":"10500"},"customfield_13645":null,"customfield_11104":null,"customfield_13765":null,"customfield_12555":null,"customfield_12305":null,"customfield_10005":[{"id":1952,"name":"A Team: 6/20/22 - 6/24/22","state":"closed","boardId":286,"goal":"","startDate":"2022-06-20T13:46:12.904Z","endDate":"2022-06-24T12:12:00.000Z","completeDate":"2022-06-24T20:31:59.550Z"},{"id":1904,"name":"A Team: 5/9/22 - 5/13/22","state":"closed","boardId":286,"goal":"","startDate":"2022-05-09T13:36:27.141Z","endDate":"2022-05-13T21:43:00.000Z","completeDate":"2022-05-13T20:16:27.067Z"},{"id":2001,"name":"A Team: 7/11/22 - 7/15/22","state":"closed","boardId":286,"goal":"Prep for Submission of v1.0.0 Rep App iOS Release","startDate":"2022-07-11T13:56:18.821Z","endDate":"2022-07-16T02:15:00.000Z","completeDate":"2022-07-15T21:39:31.202Z"},{"id":1955,"name":"A Team: 6/27/22 - 7/1/22","state":"closed","boardId":286,"goal":"","startDate":"2022-06-27T13:39:51.053Z","endDate":"2022-07-01T16:03:00.000Z","completeDate":"2022-07-01T20:26:58.126Z"},{"id":1940,"name":"A Team: 6/13/22 - 6/17/22","state":"closed","boardId":286,"goal":"","startDate":"2022-06-13T13:23:11.454Z","endDate":"2022-06-17T13:12:00.000Z","completeDate":"2022-06-17T21:12:57.348Z"},{"id":1861,"name":"A Team: 4/18/22 - 4/22/22","state":"closed","boardId":286,"goal":"","startDate":"2022-04-18T13:19:51.131Z","endDate":"2022-04-22T21:22:00.000Z","completeDate":"2022-04-23T00:50:05.964Z"},{"id":1862,"name":"A Team: 4/25/22 - 4/29/22","state":"closed","boardId":286,"goal":"","startDate":"2022-04-25T13:38:51.319Z","endDate":"2022-04-29T21:00:00.000Z","completeDate":"2022-04-29T20:44:00.021Z"},{"id":1929,"name":"A Team: 5/31/22 - 6/10/22","state":"closed","boardId":286,"goal":"","startDate":"2022-05-31T13:20:11.464Z","endDate":"2022-06-10T14:13:00.000Z","completeDate":"2022-06-10T21:09:52.636Z"},{"id":1881,"name":"A Team: 5/2/22 - 5/6/22","state":"closed","boardId":286,"goal":"","startDate":"2022-05-02T13:24:03.040Z","endDate":"2022-05-06T21:59:00.000Z","completeDate":"2022-05-06T20:33:28.823Z"},{"id":1915,"name":"A Team: 5/16/22 - 5/20/22","state":"closed","boardId":286,"goal":"","startDate":"2022-05-16T13:45:22.501Z","endDate":"2022-05-20T21:11:00.000Z","completeDate":"2022-05-20T20:48:44.357Z"},{"id":1916,"name":"A Team: 5/23/22 - 5/27/22","state":"closed","boardId":286,"goal":"","startDate":"2022-05-23T13:46:32.935Z","endDate":"2022-05-27T18:12:00.000Z","completeDate":"2022-05-27T21:18:43.799Z"},{"id":1965,"name":"A Team: 7/5/22 - 7/8/22","state":"closed","boardId":286,"goal":"","startDate":"2022-07-05T13:38:21.073Z","endDate":"2022-07-08T17:26:00.000Z","completeDate":"2022-07-08T21:28:08.661Z"},{"id":1661,"name":"A Team: 7/18/22 - 7/22/22","state":"active","boardId":286,"goal":"AMOBS v1.0.0 and RAI v1.0.0 Releases","startDate":"2022-07-18T13:46:00.383Z","endDate":"2022-07-23T02:21:00.000Z"}],"customfield_12789":null,"customfield_13636":null,"customfield_12547":null,"customfield_12426":null,"customfield_13757":null,"customfield_12546":null,"customfield_12304":null,"customfield_10006":null,"customfield_13756":null,"customfield_12425":null,"customfield_12788":null,"customfield_12428":null,"customfield_13998":null,"customfield_12307":null,"customfield_12549":null,"customfield_13759":null,"customfield_12548":null,"customfield_12306":null,"customfield_12427":null,"customfield_13758":null,"customfield_12309":null,"customfield_12308":null,"customfield_12429":null,"summary":"Onsite Testflight Beta for Naples Agency 7/6","customfield_12781":null,"customfield_11450":{"self":"https://arthrex.atlassian.net/rest/api/2/customFieldOption/10989","value":"Always","id":"10989"},"customfield_12780":null,"customfield_13993":null,"customfield_12783":null,"customfield_12541":null,"customfield_13751":null,"customfield_12420":null,"customfield_12540":null,"customfield_13991":null,"customfield_12782":null,"customfield_13750":null,"customfield_10000":null,"customfield_13996":null,"customfield_12785":null,"customfield_10001":null,"customfield_12422":null,"customfield_13753":null,"customfield_12784":null,"customfield_12300":"{}","customfield_13997":null,"customfield_13752":null,"customfield_13755":null,"customfield_13994":null,"customfield_12545":null,"customfield_12303":null,"customfield_12787":null,"customfield_13995":null,"customfield_12544":null,"customfield_13754":null,"customfield_12786":null,"customfield_12423":null,"customfield_13746":null,"customfield_12415":null,"customfield_12778":null,"customfield_11447":null,"customfield_13989":null,"customfield_12777":null,"customfield_13745":null,"customfield_12414":null,"customfield_12417":null,"customfield_13987":null,"customfield_11449":{"self":"https://arthrex.atlassian.net/rest/api/2/customFieldOption/10986","value":"Live Site","id":"10986"},"customfield_13748":null,"customfield_13505":[],"customfield_12779":null,"customfield_11448":null,"customfield_12416":null,"customfield_12419":null,"customfield_12418":null,"customfield_13749":null,"comment":{"comments":[],"self":"https://arthrex.atlassian.net/rest/api/2/issue/299481/comment","maxResults":0,"total":0,"startAt":0},"statuscategorychangedate":"2022-07-11T13:03:18.128-0400","customfield_13063":"Testing message","customfield_13062":null,"customfield_14033":null,"customfield_13067":null,"customfield_13066":null,"fixVersions":[],"customfield_10900":null,"customfield_13052":null,"customfield_13294":null,"customfield_13053":null,"epic":null,"customfield_13057":null,"priority":{"self":"https://arthrex.atlassian.net/rest/api/2/priority/4","iconUrl":"https://s3.amazonaws.com/arthrex-public/jira/priorities/minor.png","name":"Minor","id":"4"},"customfield_14028":null,"versions":[],"customfield_13045":null,"customfield_14014":null,"customfield_14015":null,"customfield_13047":null,"customfield_14013":null,"customfield_13046":null,"customfield_14016":null,"customfield_14017":null,"customfield_13391":null,"customfield_13272":null,"customfield_13392":null,"customfield_13274":null,"customfield_13273":null,"aggregateprogress":{"progress":0,"total":0},"customfield_13279":null,"customfield_13380":null,"issuerestriction":{"issuerestrictions":{},"shouldDisplay":false},"customfield_13371":null,"customfield_13494":null,"created":"2022-06-30T09:34:13.275-0400","customfield_13373":null,"customfield_13012":null,"customfield_13375":null,"customfield_13011":null,"customfield_13377":null,"customfield_13376":null,"customfield_13379":null,"customfield_13016":null,"customfield_13378":null,"customfield_13017":null,"customfield_13360":null,"customfield_13362":null,"customfield_13361":null,"customfield_13364":null,"customfield_13001":null,"customfield_13122":null,"customfield_13363":null,"customfield_13000":null,"customfield_13366":"150 GB","customfield_13002":null,"customfield_13365":null,"customfield_13368":null,"customfield_13367":null,"customfield_13369":null,"security":null,"attachment":[],"customfield_13470":null,"customfield_13471":null,"customfield_12385":null,"customfield_13355":null,"customfield_12386":null,"customfield_13357":null,"customfield_13599":null,"customfield_12388":null,"customfield_13356":null,"customfield_13359":null,"customfield_13358":null}},{"expand":"operations,versionedRepresentations,editmeta,changelog,renderedFields","id":"296829","self":"https://arthrex.atlassian.net/rest/agile/1.0/issue/296829","key":"MOB-1053","fields":{"parent":{"id":"279628","key":"MOB-929","self":"https://arthrex.atlassian.net/rest/api/2/issue/279628","fields":{"summary":"UX/UI","status":{"self":"https://arthrex.atlassian.net/rest/api/2/status/3","description":"This issue is being actively worked on at the moment by the assignee.","iconUrl":"https://arthrex.atlassian.net/images/icons/statuses/inprogress.png","name":"Working","id":"3","statusCategory":{"self":"https://arthrex.atlassian.net/rest/api/2/statuscategory/4","id":4,"key":"indeterminate","colorName":"yellow","name":"In Progress"}},"priority":{"self":"https://arthrex.atlassian.net/rest/api/2/priority/4","iconUrl":"https://s3.amazonaws.com/arthrex-public/jira/priorities/minor.png","name":"Minor","id":"4"},"issuetype":{"self":"https://arthrex.atlassian.net/rest/api/2/issuetype/3","id":"3","description":"A task that needs to be done.","iconUrl":"https://arthrex.atlassian.net/rest/api/2/universal_avatar/view/type/issuetype/avatar/10318?size=medium","name":"Task","subtask":false,"avatarId":10318,"hierarchyLevel":0}}},"resolution":{"self":"https://arthrex.atlassian.net/rest/api/2/resolution/10000","id":"10000","description":"The issue is done.","name":"Done"},"customfield_12930":null,"customfield_12923":null,"customfield_12924":null,"customfield_12929":null,"lastViewed":null,"customfield_11700":null,"customfield_12912":null,"customfield_11702":null,"customfield_11701":null,"customfield_12914":null,"aggregatetimeoriginalestimate":null,"customfield_12916":null,"customfield_12915":null,"customfield_12918":null,"customfield_12917":null,"issuelinks":[],"assignee":{"self":"https://arthrex.atlassian.net/rest/api/2/user?accountId=60bac9915fa6f1006fee00b2","accountId":"60bac9915fa6f1006fee00b2","emailAddress":"johnny.ansari@arthrex.com","avatarUrls":{"48x48":"https://secure.gravatar.com/avatar/d887eff1f5130dfab59a6de736562de4?d=https%3A%2F%2Favatar-management--avatars.us-west-2.prod.public.atl-paas.net%2Finitials%2FJA-5.png","24x24":"https://secure.gravatar.com/avatar/d887eff1f5130dfab59a6de736562de4?d=https%3A%2F%2Favatar-management--avatars.us-west-2.prod.public.atl-paas.net%2Finitials%2FJA-5.png","16x16":"https://secure.gravatar.com/avatar/d887eff1f5130dfab59a6de736562de4?d=https%3A%2F%2Favatar-management--avatars.us-west-2.prod.public.atl-paas.net%2Finitials%2FJA-5.png","32x32":"https://secure.gravatar.com/avatar/d887eff1f5130dfab59a6de736562de4?d=https%3A%2F%2Favatar-management--avatars.us-west-2.prod.public.atl-paas.net%2Finitials%2FJA-5.png"},"displayName":"Johnny Ansari","active":true,"timeZone":"America/New_York","accountType":"atlassian"},"customfield_12919":null,"customfield_11810":null,"customfield_12901":null,"customfield_11812":null,"customfield_11811":null,"customfield_11814":null,"customfield_12903":null,"customfield_11813":null,"customfield_12902":null,"customfield_11816":null,"customfield_12905":null,"customfield_11815":null,"customfield_12904":null,"customfield_11818":null,"customfield_11817":null,"customfield_12906":null,"subtasks":[],"customfield_11801":null,"customfield_11800":null,"customfield_11802":null,"customfield_11805":null,"customfield_11804":null,"customfield_11807":null,"closedSprints":[{"id":2001,"self":"https://arthrex.atlassian.net/rest/agile/1.0/sprint/2001","state":"closed","name":"A Team: 7/11/22 - 7/15/22","startDate":"2022-07-11T13:56:18.821Z","endDate":"2022-07-16T02:15:00.000Z","completeDate":"2022-07-15T21:39:31.202Z","originBoardId":286,"goal":"Prep for Submission of v1.0.0 Rep App iOS Release"},{"id":1955,"self":"https://arthrex.atlassian.net/rest/agile/1.0/sprint/1955","state":"closed","name":"A Team: 6/27/22 - 7/1/22","startDate":"2022-06-27T13:39:51.053Z","endDate":"2022-07-01T16:03:00.000Z","completeDate":"2022-07-01T20:26:58.126Z","originBoardId":286,"goal":""},{"id":1940,"self":"https://arthrex.atlassian.net/rest/agile/1.0/sprint/1940","state":"closed","name":"A Team: 6/13/22 - 6/17/22","startDate":"2022-06-13T13:23:11.454Z","endDate":"2022-06-17T13:12:00.000Z","completeDate":"2022-06-17T21:12:57.348Z","originBoardId":286,"goal":""},{"id":1861,"self":"https://arthrex.atlassian.net/rest/agile/1.0/sprint/1861","state":"closed","name":"A Team: 4/18/22 - 4/22/22","startDate":"2022-04-18T13:19:51.131Z","endDate":"2022-04-22T21:22:00.000Z","completeDate":"2022-04-23T00:50:05.964Z","originBoardId":286,"goal":""},{"id":1862,"self":"https://arthrex.atlassian.net/rest/agile/1.0/sprint/1862","state":"closed","name":"A Team: 4/25/22 - 4/29/22","startDate":"2022-04-25T13:38:51.319Z","endDate":"2022-04-29T21:00:00.000Z","completeDate":"2022-04-29T20:44:00.021Z","originBoardId":286,"goal":""},{"id":1929,"self":"https://arthrex.atlassian.net/rest/agile/1.0/sprint/1929","state":"closed","name":"A Team: 5/31/22 - 6/10/22","startDate":"2022-05-31T13:20:11.464Z","endDate":"2022-06-10T14:13:00.000Z","completeDate":"2022-06-10T21:09:52.636Z","originBoardId":286,"goal":""},{"id":1881,"self":"https://arthrex.atlassian.net/rest/agile/1.0/sprint/1881","state":"closed","name":"A Team: 5/2/22 - 5/6/22","startDate":"2022-05-02T13:24:03.040Z","endDate":"2022-05-06T21:59:00.000Z","completeDate":"2022-05-06T20:33:28.823Z","originBoardId":286,"goal":""},{"id":1915,"self":"https://arthrex.atlassian.net/rest/agile/1.0/sprint/1915","state":"closed","name":"A Team: 5/16/22 - 5/20/22","startDate":"2022-05-16T13:45:22.501Z","endDate":"2022-05-20T21:11:00.000Z","completeDate":"2022-05-20T20:48:44.357Z","originBoardId":286,"goal":""},{"id":1916,"self":"https://arthrex.atlassian.net/rest/agile/1.0/sprint/1916","state":"closed","name":"A Team: 5/23/22 - 5/27/22","startDate":"2022-05-23T13:46:32.935Z","endDate":"2022-05-27T18:12:00.000Z","completeDate":"2022-05-27T21:18:43.799Z","originBoardId":286,"goal":""},{"id":1965,"self":"https://arthrex.atlassian.net/rest/agile/1.0/sprint/1965","state":"closed","name":"A Team: 7/5/22 - 7/8/22","startDate":"2022-07-05T13:38:21.073Z","endDate":"2022-07-08T17:26:00.000Z","completeDate":"2022-07-08T21:28:08.661Z","originBoardId":286,"goal":""},{"id":1952,"self":"https://arthrex.atlassian.net/rest/agile/1.0/sprint/1952","state":"closed","name":"A Team: 6/20/22 - 6/24/22","startDate":"2022-06-20T13:46:12.904Z","endDate":"2022-06-24T12:12:00.000Z","completeDate":"2022-06-24T20:31:59.550Z","originBoardId":286,"goal":""},{"id":1904,"self":"https://arthrex.atlassian.net/rest/agile/1.0/sprint/1904","state":"closed","name":"A Team: 5/9/22 - 5/13/22","startDate":"2022-05-09T13:36:27.141Z","endDate":"2022-05-13T21:43:00.000Z","completeDate":"2022-05-13T20:16:27.067Z","originBoardId":286,"goal":""}],"customfield_11806":null,"customfield_11809":null,"votes":{"self":"https://arthrex.atlassian.net/rest/api/2/issue/MOB-1053/votes","votes":0,"hasVoted":false},"worklog":{"startAt":0,"maxResults":20,"total":0,"worklogs":[]},"customfield_11808":null,"issuetype":{"self":"https://arthrex.atlassian.net/rest/api/2/issuetype/5","id":"5","description":"The sub-task of the issue","iconUrl":"https://arthrex.atlassian.net/rest/api/2/universal_avatar/view/type/issuetype/avatar/10316?size=medium","name":"Sub-task","subtask":true,"avatarId":10316,"hierarchyLevel":-1},"sprint":{"id":1661,"self":"https://arthrex.atlassian.net/rest/agile/1.0/sprint/1661","state":"active","name":"A Team: 7/18/22 - 7/22/22","startDate":"2022-07-18T13:46:00.383Z","endDate":"2022-07-23T02:21:00.000Z","originBoardId":286,"goal":"AMOBS v1.0.0 and RAI v1.0.0 Releases"},"customfield_10700":null,"customfield_10701":[],"customfield_10702":null,"customfield_11901":{"self":"https://arthrex.atlassian.net/rest/api/2/customFieldOption/11506","value":"No","id":"11506"},"customfield_14050":null,"timetracking":{},"customfield_10803":null,"customfield_10806":null,"customfield_14047":null,"customfield_14048":null,"customfield_14046":null,"customfield_14049":null,"environment":null,"duedate":null,"customfield_13980":null,"customfield_12772":null,"customfield_13982":null,"customfield_13861":null,"customfield_11441":null,"customfield_13740":null,"customfield_11440":null,"customfield_11443":null,"customfield_13742":null,"customfield_12774":null,"customfield_11200":null,"customfield_12411":null,"customfield_11201":null,"customfield_11442":null,"customfield_13741":null,"customfield_12773":null,"customfield_11202":null,"customfield_13744":null,"customfield_13986":null,"customfield_12413":null,"customfield_13623":null,"customfield_12776":null,"customfield_13985":null,"customfield_12412":null,"customfield_13743":null,"customfield_12775":null,"customfield_12533":null,"customfield_11444":null,"customfield_13614":null,"customfield_13613":null,"customfield_12645":null,"customfield_11435":null,"customfield_11438":null,"customfield_13979":null,"customfield_13737":null,"customfield_13616":null,"customfield_11437":null,"customfield_13615":null,"customfield_13739":null,"customfield_11439":null,"customfield_13617":null,"customfield_13738":null,"customfield_12409":null,"customfield_11430":null,"customfield_12761":null,"customfield_12760":null,"customfield_10100":"2|i02245:","customfield_13610":null,"customfield_11431":null,"customfield_12762":null,"customfield_13975":null,"customfield_11434":null,"customfield_13612":null,"customfield_13611":null,"customfield_11425":null,"customfield_12998":null,"customfield_12756":null,"customfield_12514":null,"customfield_13603":null,"customfield_11303":"3_*:*_1_*:*_941548428_*|*_10000_*:*_1_*:*_869388722_*|*_10001_*:*_1_*:*_0_*|*_10201_*:*_1_*:*_774640909","customfield_11304":null,"customfield_13602":null,"customfield_12755":null,"customfield_12997":null,"customfield_12513":null,"customfield_13605":null,"customfield_11427":null,"customfield_12758":null,"customfield_13726":null,"customfield_13604":null,"customfield_12999":null,"customfield_12757":null,"timeestimate":null,"customfield_13727":null,"customfield_11428":null,"customfield_13969":null,"customfield_12759":null,"customfield_13606":null,"customfield_13729":null,"customfield_13608":null,"status":{"self":"https://arthrex.atlassian.net/rest/api/2/status/10001","description":"","iconUrl":"https://arthrex.atlassian.net/images/icons/subtask.gif","name":"Done","id":"10001","statusCategory":{"self":"https://arthrex.atlassian.net/rest/api/2/statuscategory/3","id":3,"key":"done","colorName":"green","name":"Done"}},"customfield_12750":null,"customfield_12752":null,"customfield_12510":null,"customfield_12751":null,"customfield_11420":null,"customfield_11300":{"self":"https://arthrex.atlassian.net/rest/api/2/customFieldOption/10700","value":"User Stories:1","id":"10700"},"customfield_13601":null,"customfield_12754":null,"customfield_12996":null,"customfield_11301":null,"customfield_11422":null,"customfield_13600":null,"customfield_12753":null,"customfield_12511":null,"customfield_12503":null,"customfield_11414":null,"customfield_12745":null,"customfield_12744":null,"customfield_12502":null,"customfield_12505":null,"customfield_13836":null,"customfield_12747":null,"customfield_13715":null,"customfield_13835":null,"customfield_12746":null,"customfield_11415":null,"customfield_13956":null,"customfield_12504":null,"customfield_12749":null,"customfield_12507":null,"aggregatetimeestimate":null,"customfield_11418":null,"customfield_13716":null,"customfield_12748":null,"customfield_13837":null,"customfield_12508":null,"customfield_11419":null,"creator":{"self":"https://arthrex.atlassian.net/rest/api/2/user?accountId=5dfa6aa75697460cb3d97763","accountId":"5dfa6aa75697460cb3d97763","emailAddress":"patrick.maguschak2@arthrex.com","avatarUrls":{"48x48":"https://avatar-management--avatars.us-west-2.prod.public.atl-paas.net/5dfa6aa75697460cb3d97763/5f2aaf98-63fd-4e3a-a29b-7e163f497fd8/48","24x24":"https://avatar-management--avatars.us-west-2.prod.public.atl-paas.net/5dfa6aa75697460cb3d97763/5f2aaf98-63fd-4e3a-a29b-7e163f497fd8/24","16x16":"https://avatar-management--avatars.us-west-2.prod.public.atl-paas.net/5dfa6aa75697460cb3d97763/5f2aaf98-63fd-4e3a-a29b-7e163f497fd8/16","32x32":"https://avatar-management--avatars.us-west-2.prod.public.atl-paas.net/5dfa6aa75697460cb3d97763/5f2aaf98-63fd-4e3a-a29b-7e163f497fd8/32"},"displayName":"Patrick Maguschak","active":true,"timeZone":"America/New_York","accountType":"atlassian"},"customfield_13830":null,"customfield_10200":null,"customfield_12743":null,"customfield_10202":null,"customfield_13831":null,"customfield_12500":null,"customfield_11403":{"self":"https://arthrex.atlassian.net/rest/api/2/customFieldOption/10806","value":"Hotline","id":"10806"},"customfield_13702":null,"customfield_11402":null,"customfield_11523":null,"customfield_12975":null,"customfield_13701":null,"customfield_13825":null,"customfield_11526":null,"customfield_13704":null,"customfield_13703":null,"customfield_11404":null,"customfield_13824":null,"customfield_13827":null,"customfield_12738":null,"customfield_13705":null,"customfield_13826":null,"customfield_13829":null,"customfield_11529":null,"timespent":null,"customfield_12972":null,"aggregatetimespent":null,"customfield_11401":null,"customfield_13700":null,"customfield_11522":null,"customfield_12974":null,"customfield_11400":null,"customfield_11521":null,"customfield_13933":null,"customfield_13932":null,"customfield_12843":null,"customfield_11512":null,"customfield_11514":null,"customfield_11519":"3_*:*_1_*:*_941548428_*|*_10000_*:*_1_*:*_869388722_*|*_10001_*:*_1_*:*_0_*|*_10201_*:*_1_*:*_774640909","workratio":-1,"customfield_12840":null,"customfield_13931":null,"customfield_10300":null,"customfield_11511":null,"customfield_12842":null,"customfield_13930":null,"customfield_11510":null,"customfield_12841":null,"customfield_10301":null,"customfield_13801":null,"customfield_12833":null,"customfield_11502":null,"customfield_13800":null,"customfield_12832":null,"customfield_11501":{"hasEpicLinkFieldDependency":false,"showField":false,"nonEditableReason":{"reason":"PLUGIN_LICENSE_ERROR","message":"The Parent Link is only available to Jira Premium users."}},"customfield_13803":null,"customfield_11504":null,"customfield_12835":null,"customfield_13802":null,"customfield_12955":null,"customfield_12834":null,"customfield_12837":null,"customfield_13926":null,"customfield_12958":null,"customfield_11506":null,"customfield_13805":null,"customfield_13925":null,"customfield_13804":null,"customfield_11505":null,"customfield_12836":null,"customfield_12839":null,"customfield_12838":null,"customfield_13808":null,"customfield_11500":null,"customfield_12831":null,"customfield_12830":null,"customfield_12822":null,"customfield_12942":null,"customfield_12824":null,"customfield_12823":null,"flagged":false,"customfield_12825":null,"customfield_12828":null,"customfield_12827":null,"customfield_10400":null,"customfield_12932":null,"customfield_12811":null,"customfield_12934":null,"customfield_12933":null,"customfield_12936":null,"customfield_13904":null,"customfield_13903":null,"customfield_12935":null,"customfield_12938":null,"customfield_13906":null,"customfield_13905":null,"customfield_12937":null,"customfield_13908":null,"customfield_12939":null,"customfield_13909":null,"customfield_12490":null,"customfield_12372":null,"customfield_12493":null,"customfield_12492":null,"customfield_12495":null,"customfield_13463":null,"customfield_12374":null,"customfield_12494":null,"customfield_13465":null,"customfield_12376":null,"customfield_13343":null,"customfield_13464":null,"customfield_12496":"{panel:bgColor=#FFC400}\r\nThese fields are used to populate request forms in the customer portal. Do not manually change these fields.\r\n{panel}","customfield_12499":null,"customfield_13467":null,"customfield_13225":null,"customfield_13466":null,"customfield_13469":null,"customfield_13468":null,"customfield_13690":null,"customfield_12480":null,"customfield_13692":null,"customfield_12482":null,"customfield_12481":null,"customfield_13691":null,"customfield_12484":null,"customfield_12000":null,"customfield_13694":null,"customfield_12483":null,"customfield_12362":null,"customfield_13693":null,"customfield_13696":null,"customfield_12002":null,"customfield_13212":null,"customfield_12001":null,"customfield_13211":null,"customfield_13695":null,"customfield_12004":null,"customfield_13335":null,"customfield_13698":null,"customfield_12488":null,"customfield_12003":null,"customfield_13213":null,"customfield_13697":null,"customfield_12489":null,"labels":[],"customfield_12005":null,"customfield_13336":null,"customfield_13699":null,"customfield_13207":null,"customfield_13449":null,"components":[],"customfield_12471":null,"customfield_13681":null,"customfield_13680":null,"customfield_12470":null,"customfield_12473":null,"customfield_13683":null,"customfield_12110":null,"customfield_12472":null,"customfield_13682":null,"customfield_13685":null,"customfield_13322":null,"customfield_12112":null,"customfield_12475":null,"customfield_12111":null,"customfield_12474":null,"customfield_13684":null,"customfield_12114":{"self":"https://arthrex.atlassian.net/rest/api/2/customFieldOption/11922","value":"No","id":"11922"},"customfield_13687":null,"customfield_12477":null,"customfield_13686":null,"customfield_12476":null,"customfield_12479":null,"customfield_13689":null,"customfield_12358":null,"customfield_12357":null,"customfield_13688":null,"customfield_13325":null,"customfield_12478":null,"customfield_12348":"{panel:title=Alert|titleBGColor=#FFC400|bgColor=#FFFAE6}\r\nPlease make sure that the correct issue type is selected. To select a different issue type, move the issue.\r\n{panel}","customfield_12469":null,"customfield_12106":null,"customfield_13679":null,"customfield_12109":null,"customfield_12108":null,"customfield_13672":null,"customfield_12341":null,"customfield_12340":null,"reporter":{"self":"https://arthrex.atlassian.net/rest/api/2/user?accountId=5dfa6aa75697460cb3d97763","accountId":"5dfa6aa75697460cb3d97763","emailAddress":"patrick.maguschak2@arthrex.com","avatarUrls":{"48x48":"https://avatar-management--avatars.us-west-2.prod.public.atl-paas.net/5dfa6aa75697460cb3d97763/5f2aaf98-63fd-4e3a-a29b-7e163f497fd8/48","24x24":"https://avatar-management--avatars.us-west-2.prod.public.atl-paas.net/5dfa6aa75697460cb3d97763/5f2aaf98-63fd-4e3a-a29b-7e163f497fd8/24","16x16":"https://avatar-management--avatars.us-west-2.prod.public.atl-paas.net/5dfa6aa75697460cb3d97763/5f2aaf98-63fd-4e3a-a29b-7e163f497fd8/16","32x32":"https://avatar-management--avatars.us-west-2.prod.public.atl-paas.net/5dfa6aa75697460cb3d97763/5f2aaf98-63fd-4e3a-a29b-7e163f497fd8/32"},"displayName":"Patrick Maguschak","active":true,"timeZone":"America/New_York","accountType":"atlassian"},"customfield_13795":null,"customfield_12101":null,"customfield_13674":null,"customfield_12464":null,"customfield_12343":"{panel:title=Info|titleBGColor=#C0B6F2|bgColor=#EAE6FF}\r\nUse this transition to escalate this issue to another team.\r\n\r\nPlease note that if you select *MRM-DAM Technical*, Jira will automatically create a ticket in Footprints. If you do not wish to create a new Footprints ticket, please select *Disable emails to Footprints* below.\r\n\r\nIf you do not want to be reminded to follow-up on this issue, please select *Disable escalation follow-up* below.\r\n{panel}","customfield_12342":null,"customfield_12463":null,"customfield_13673":null,"customfield_12466":null,"customfield_12103":null,"customfield_13676":null,"customfield_12345":null,"customfield_13797":null,"customfield_13796":null,"customfield_13675":null,"customfield_12344":"{panel:title=Info|titleBGColor=#C0B6F2|bgColor=#EAE6FF}\r\nUse this transition to respond to the reporter and request participants.\r\n\r\nIf you do not want to be reminded to follow-up on this issue, select *Disable customer follow-up* below.\r\n{panel}","customfield_13678":null,"customfield_12468":null,"customfield_13799":null,"customfield_12347":"{panel:bgColor=#FFC400}\r\n*Note*\r\nThese fields are used to populate request forms in the customer portal. Do not manually change these fields.\r\n{panel}","customfield_12467":null,"customfield_12104":null,"customfield_13677":null,"customfield_13798":null,"customfield_12346":null,"progress":{"progress":0,"total":0},"customfield_13780":null,"customfield_12570":null,"customfield_12330":null,"customfield_13782":null,"project":{"self":"https://arthrex.atlassian.net/rest/api/2/project/12262","id":"12262","key":"MOB","name":"A Team","projectTypeKey":"software","simplified":false,"avatarUrls":{"48x48":"https://arthrex.atlassian.net/rest/api/2/universal_avatar/view/type/project/avatar/13447","24x24":"https://arthrex.atlassian.net/rest/api/2/universal_avatar/view/type/project/avatar/13447?size=small","16x16":"https://arthrex.atlassian.net/rest/api/2/universal_avatar/view/type/project/avatar/13447?size=xsmall","32x32":"https://arthrex.atlassian.net/rest/api/2/universal_avatar/view/type/project/avatar/13447?size=medium"},"projectCategory":{"self":"https://arthrex.atlassian.net/rest/api/2/projectCategory/10103","id":"10103","description":"","name":"Digital Media - Mobile"}},"customfield_12571":null,"customfield_12332":null,"customfield_13783":null,"customfield_12331":null,"customfield_12333":null,"customfield_12336":null,"customfield_12335":null,"customfield_13779":null,"customfield_12569":null,"customfield_12327":null,"customfield_12568":null,"customfield_12329":null,"customfield_12328":null,"resolutiondate":"2022-07-21T07:57:38.936-0400","watches":{"self":"https://arthrex.atlassian.net/rest/api/2/issue/MOB-1053/watchers","watchCount":1,"isWatching":false},"customfield_13890":null,"customfield_13771":null,"customfield_13892":null,"customfield_12561":null,"customfield_13891":null,"customfield_13770":null,"customfield_12563":null,"customfield_12321":null,"customfield_13652":null,"customfield_12200":null,"customfield_13772":null,"customfield_12562":null,"customfield_12320":null,"customfield_12202":null,"customfield_12323":null,"customfield_12564":null,"customfield_12201":null,"customfield_12322":null,"customfield_13656":null,"customfield_12567":null,"customfield_12324":null,"customfield_12566":null,"customfield_12203":null,"customfield_13655":null,"customfield_12558":null,"customfield_13407":null,"customfield_13769":null,"customfield_12319":null,"updated":"2022-07-21T07:57:38.973-0400","customfield_12790":null,"timeoriginalestimate":null,"customfield_12792":null,"customfield_13760":null,"customfield_12550":null,"description":"* Surgeon App Hand off (IOS ONLY)\n* Login\n** [Arthrex.com|http://arthrex.com/] Crendentials\n* Settings Section\n** Top right\n* Back to the Playbooks Home List\n* Actions to test while in the playbooks\n** Open a Playbook\n** Test the Readmore Drop Downs\n** Open the drop down arrows\n** Select an asset (It should open in the Rep app)\n** Open an Image (Zoom move around in the image)\n** Switch between Playbook Sections\n** Open all of the ECI sections at the top","customfield_12791":null,"customfield_12794":null,"customfield_12552":null,"customfield_13762":null,"customfield_13761":null,"customfield_12551":null,"customfield_11100":" ","customfield_13640":null,"customfield_11101":null,"customfield_12554":null,"customfield_13764":null,"customfield_12553":null,"customfield_11102":{"self":"https://arthrex.atlassian.net/rest/api/2/customFieldOption/10500","value":"1-None","id":"10500"},"customfield_12795":null,"customfield_13763":null,"customfield_13645":null,"customfield_11104":null,"customfield_12555":null,"customfield_13765":null,"customfield_12789":null,"customfield_13636":null,"customfield_13757":null,"customfield_12426":null,"customfield_10005":[{"id":1952,"name":"A Team: 6/20/22 - 6/24/22","state":"closed","boardId":286,"goal":"","startDate":"2022-06-20T13:46:12.904Z","endDate":"2022-06-24T12:12:00.000Z","completeDate":"2022-06-24T20:31:59.550Z"},{"id":1904,"name":"A Team: 5/9/22 - 5/13/22","state":"closed","boardId":286,"goal":"","startDate":"2022-05-09T13:36:27.141Z","endDate":"2022-05-13T21:43:00.000Z","completeDate":"2022-05-13T20:16:27.067Z"},{"id":2001,"name":"A Team: 7/11/22 - 7/15/22","state":"closed","boardId":286,"goal":"Prep for Submission of v1.0.0 Rep App iOS Release","startDate":"2022-07-11T13:56:18.821Z","endDate":"2022-07-16T02:15:00.000Z","completeDate":"2022-07-15T21:39:31.202Z"},{"id":1955,"name":"A Team: 6/27/22 - 7/1/22","state":"closed","boardId":286,"goal":"","startDate":"2022-06-27T13:39:51.053Z","endDate":"2022-07-01T16:03:00.000Z","completeDate":"2022-07-01T20:26:58.126Z"},{"id":1940,"name":"A Team: 6/13/22 - 6/17/22","state":"closed","boardId":286,"goal":"","startDate":"2022-06-13T13:23:11.454Z","endDate":"2022-06-17T13:12:00.000Z","completeDate":"2022-06-17T21:12:57.348Z"},{"id":1861,"name":"A Team: 4/18/22 - 4/22/22","state":"closed","boardId":286,"goal":"","startDate":"2022-04-18T13:19:51.131Z","endDate":"2022-04-22T21:22:00.000Z","completeDate":"2022-04-23T00:50:05.964Z"},{"id":1862,"name":"A Team: 4/25/22 - 4/29/22","state":"closed","boardId":286,"goal":"","startDate":"2022-04-25T13:38:51.319Z","endDate":"2022-04-29T21:00:00.000Z","completeDate":"2022-04-29T20:44:00.021Z"},{"id":1929,"name":"A Team: 5/31/22 - 6/10/22","state":"closed","boardId":286,"goal":"","startDate":"2022-05-31T13:20:11.464Z","endDate":"2022-06-10T14:13:00.000Z","completeDate":"2022-06-10T21:09:52.636Z"},{"id":1881,"name":"A Team: 5/2/22 - 5/6/22","state":"closed","boardId":286,"goal":"","startDate":"2022-05-02T13:24:03.040Z","endDate":"2022-05-06T21:59:00.000Z","completeDate":"2022-05-06T20:33:28.823Z"},{"id":1915,"name":"A Team: 5/16/22 - 5/20/22","state":"closed","boardId":286,"goal":"","startDate":"2022-05-16T13:45:22.501Z","endDate":"2022-05-20T21:11:00.000Z","completeDate":"2022-05-20T20:48:44.357Z"},{"id":1916,"name":"A Team: 5/23/22 - 5/27/22","state":"closed","boardId":286,"goal":"","startDate":"2022-05-23T13:46:32.935Z","endDate":"2022-05-27T18:12:00.000Z","completeDate":"2022-05-27T21:18:43.799Z"},{"id":1965,"name":"A Team: 7/5/22 - 7/8/22","state":"closed","boardId":286,"goal":"","startDate":"2022-07-05T13:38:21.073Z","endDate":"2022-07-08T17:26:00.000Z","completeDate":"2022-07-08T21:28:08.661Z"},{"id":1661,"name":"A Team: 7/18/22 - 7/22/22","state":"active","boardId":286,"goal":"AMOBS v1.0.0 and RAI v1.0.0 Releases","startDate":"2022-07-18T13:46:00.383Z","endDate":"2022-07-23T02:21:00.000Z"}],"customfield_12547":null,"customfield_12305":null,"customfield_12304":null,"customfield_12546":null,"customfield_10006":null,"customfield_13756":null,"customfield_12425":null,"customfield_12788":null,"customfield_13759":null,"customfield_12428":null,"customfield_12307":null,"customfield_12549":null,"customfield_13998":null,"customfield_12548":null,"customfield_13758":null,"customfield_12427":null,"customfield_12306":null,"customfield_12309":null,"customfield_12308":null,"customfield_12429":null,"summary":"Things to test document for Beta","customfield_12781":null,"customfield_11450":{"self":"https://arthrex.atlassian.net/rest/api/2/customFieldOption/10989","value":"Always","id":"10989"},"customfield_12780":null,"customfield_13993":null,"customfield_12541":null,"customfield_12783":null,"customfield_12420":null,"customfield_13751":null,"customfield_10000":null,"customfield_13991":null,"customfield_12540":null,"customfield_12782":null,"customfield_13750":null,"customfield_13996":null,"customfield_12422":null,"customfield_12785":null,"customfield_13753":null,"customfield_10001":null,"customfield_12784":null,"customfield_12300":"{}","customfield_13752":null,"customfield_13997":null,"customfield_12303":null,"customfield_13994":null,"customfield_13755":null,"customfield_12787":null,"customfield_12545":null,"customfield_12786":null,"customfield_12423":null,"customfield_13754":null,"customfield_12544":null,"customfield_13995":null,"customfield_12415":null,"customfield_12778":null,"customfield_11447":null,"customfield_13989":null,"customfield_13746":null,"customfield_12414":null,"customfield_13745":null,"customfield_12777":null,"customfield_13987":null,"customfield_13748":null,"customfield_12417":null,"customfield_11449":{"self":"https://arthrex.atlassian.net/rest/api/2/customFieldOption/10986","value":"Live Site","id":"10986"},"customfield_11448":null,"customfield_13505":[],"customfield_12779":null,"customfield_12416":null,"customfield_12419":null,"customfield_13749":null,"customfield_12418":null,"comment":{"comments":[],"self":"https://arthrex.atlassian.net/rest/api/2/issue/296829/comment","maxResults":0,"total":0,"startAt":0},"statuscategorychangedate":"2022-07-21T07:57:38.973-0400","customfield_13063":"Testing message","customfield_13062":null,"customfield_14033":null,"customfield_13067":null,"customfield_13066":null,"fixVersions":[],"customfield_10900":null,"customfield_13052":null,"customfield_13294":null,"customfield_13053":null,"epic":null,"customfield_13057":null,"priority":{"self":"https://arthrex.atlassian.net/rest/api/2/priority/4","iconUrl":"https://s3.amazonaws.com/arthrex-public/jira/priorities/minor.png","name":"Minor","id":"4"},"customfield_14028":null,"versions":[],"customfield_13045":null,"customfield_14014":null,"customfield_14015":null,"customfield_13047":null,"customfield_13046":null,"customfield_14013":null,"customfield_14016":null,"customfield_14017":null,"customfield_13391":null,"customfield_13272":null,"customfield_13392":null,"customfield_13274":null,"customfield_13273":null,"aggregateprogress":{"progress":0,"total":0},"customfield_13279":null,"customfield_13380":null,"issuerestriction":{"issuerestrictions":{},"shouldDisplay":false},"customfield_13371":null,"customfield_13373":null,"created":"2022-06-21T09:44:40.938-0400","customfield_13494":null,"customfield_13375":null,"customfield_13012":null,"customfield_13011":null,"customfield_13377":null,"customfield_13376":null,"customfield_13016":null,"customfield_13379":null,"customfield_13378":null,"customfield_13017":null,"customfield_13360":null,"customfield_13362":null,"customfield_13361":null,"customfield_13364":null,"customfield_13001":null,"customfield_13122":null,"customfield_13363":null,"customfield_13000":null,"customfield_13366":"150 GB","customfield_13002":null,"customfield_13365":null,"customfield_13368":null,"customfield_13367":null,"customfield_13369":null,"security":null,"attachment":[],"customfield_13470":null,"customfield_13471":null,"customfield_12385":null,"customfield_13355":null,"customfield_12386":null,"customfield_13599":null,"customfield_13357":null,"customfield_13356":null,"customfield_12388":null,"customfield_13359":null,"customfield_13358":null}},{"expand":"operations,versionedRepresentations,editmeta,changelog,renderedFields","id":"299480","self":"https://arthrex.atlassian.net/rest/agile/1.0/issue/299480","key":"MOB-1065","fields":{"parent":{"id":"279628","key":"MOB-929","self":"https://arthrex.atlassian.net/rest/api/2/issue/279628","fields":{"summary":"UX/UI","status":{"self":"https://arthrex.atlassian.net/rest/api/2/status/3","description":"This issue is being actively worked on at the moment by the assignee.","iconUrl":"https://arthrex.atlassian.net/images/icons/statuses/inprogress.png","name":"Working","id":"3","statusCategory":{"self":"https://arthrex.atlassian.net/rest/api/2/statuscategory/4","id":4,"key":"indeterminate","colorName":"yellow","name":"In Progress"}},"priority":{"self":"https://arthrex.atlassian.net/rest/api/2/priority/4","iconUrl":"https://s3.amazonaws.com/arthrex-public/jira/priorities/minor.png","name":"Minor","id":"4"},"issuetype":{"self":"https://arthrex.atlassian.net/rest/api/2/issuetype/3","id":"3","description":"A task that needs to be done.","iconUrl":"https://arthrex.atlassian.net/rest/api/2/universal_avatar/view/type/issuetype/avatar/10318?size=medium","name":"Task","subtask":false,"avatarId":10318,"hierarchyLevel":0}}},"resolution":{"self":"https://arthrex.atlassian.net/rest/api/2/resolution/10000","id":"10000","description":"The issue is done.","name":"Done"},"customfield_12930":null,"customfield_12923":null,"customfield_12924":null,"customfield_12929":null,"lastViewed":null,"customfield_11700":null,"customfield_11702":null,"customfield_12912":null,"customfield_11701":null,"aggregatetimeoriginalestimate":null,"customfield_12914":null,"customfield_12916":null,"customfield_12915":null,"customfield_12918":null,"customfield_12917":null,"issuelinks":[],"customfield_12919":null,"assignee":{"self":"https://arthrex.atlassian.net/rest/api/2/user?accountId=5dfa6aa75697460cb3d97763","accountId":"5dfa6aa75697460cb3d97763","emailAddress":"patrick.maguschak2@arthrex.com","avatarUrls":{"48x48":"https://avatar-management--avatars.us-west-2.prod.public.atl-paas.net/5dfa6aa75697460cb3d97763/5f2aaf98-63fd-4e3a-a29b-7e163f497fd8/48","24x24":"https://avatar-management--avatars.us-west-2.prod.public.atl-paas.net/5dfa6aa75697460cb3d97763/5f2aaf98-63fd-4e3a-a29b-7e163f497fd8/24","16x16":"https://avatar-management--avatars.us-west-2.prod.public.atl-paas.net/5dfa6aa75697460cb3d97763/5f2aaf98-63fd-4e3a-a29b-7e163f497fd8/16","32x32":"https://avatar-management--avatars.us-west-2.prod.public.atl-paas.net/5dfa6aa75697460cb3d97763/5f2aaf98-63fd-4e3a-a29b-7e163f497fd8/32"},"displayName":"Patrick Maguschak","active":true,"timeZone":"America/New_York","accountType":"atlassian"},"customfield_11810":null,"customfield_12901":null,"customfield_11812":null,"customfield_11811":null,"customfield_11814":null,"customfield_12903":null,"customfield_11813":null,"customfield_12902":null,"customfield_12905":null,"customfield_11816":null,"customfield_12904":null,"customfield_11815":null,"customfield_11818":null,"customfield_12906":null,"customfield_11817":null,"subtasks":[],"customfield_11801":null,"customfield_11800":null,"customfield_11802":null,"customfield_11805":null,"customfield_11804":null,"customfield_11807":null,"closedSprints":[{"id":2001,"self":"https://arthrex.atlassian.net/rest/agile/1.0/sprint/2001","state":"closed","name":"A Team: 7/11/22 - 7/15/22","startDate":"2022-07-11T13:56:18.821Z","endDate":"2022-07-16T02:15:00.000Z","completeDate":"2022-07-15T21:39:31.202Z","originBoardId":286,"goal":"Prep for Submission of v1.0.0 Rep App iOS Release"},{"id":1955,"self":"https://arthrex.atlassian.net/rest/agile/1.0/sprint/1955","state":"closed","name":"A Team: 6/27/22 - 7/1/22","startDate":"2022-06-27T13:39:51.053Z","endDate":"2022-07-01T16:03:00.000Z","completeDate":"2022-07-01T20:26:58.126Z","originBoardId":286,"goal":""},{"id":1940,"self":"https://arthrex.atlassian.net/rest/agile/1.0/sprint/1940","state":"closed","name":"A Team: 6/13/22 - 6/17/22","startDate":"2022-06-13T13:23:11.454Z","endDate":"2022-06-17T13:12:00.000Z","completeDate":"2022-06-17T21:12:57.348Z","originBoardId":286,"goal":""},{"id":1861,"self":"https://arthrex.atlassian.net/rest/agile/1.0/sprint/1861","state":"closed","name":"A Team: 4/18/22 - 4/22/22","startDate":"2022-04-18T13:19:51.131Z","endDate":"2022-04-22T21:22:00.000Z","completeDate":"2022-04-23T00:50:05.964Z","originBoardId":286,"goal":""},{"id":1862,"self":"https://arthrex.atlassian.net/rest/agile/1.0/sprint/1862","state":"closed","name":"A Team: 4/25/22 - 4/29/22","startDate":"2022-04-25T13:38:51.319Z","endDate":"2022-04-29T21:00:00.000Z","completeDate":"2022-04-29T20:44:00.021Z","originBoardId":286,"goal":""},{"id":1929,"self":"https://arthrex.atlassian.net/rest/agile/1.0/sprint/1929","state":"closed","name":"A Team: 5/31/22 - 6/10/22","startDate":"2022-05-31T13:20:11.464Z","endDate":"2022-06-10T14:13:00.000Z","completeDate":"2022-06-10T21:09:52.636Z","originBoardId":286,"goal":""},{"id":1881,"self":"https://arthrex.atlassian.net/rest/agile/1.0/sprint/1881","state":"closed","name":"A Team: 5/2/22 - 5/6/22","startDate":"2022-05-02T13:24:03.040Z","endDate":"2022-05-06T21:59:00.000Z","completeDate":"2022-05-06T20:33:28.823Z","originBoardId":286,"goal":""},{"id":1915,"self":"https://arthrex.atlassian.net/rest/agile/1.0/sprint/1915","state":"closed","name":"A Team: 5/16/22 - 5/20/22","startDate":"2022-05-16T13:45:22.501Z","endDate":"2022-05-20T21:11:00.000Z","completeDate":"2022-05-20T20:48:44.357Z","originBoardId":286,"goal":""},{"id":1916,"self":"https://arthrex.atlassian.net/rest/agile/1.0/sprint/1916","state":"closed","name":"A Team: 5/23/22 - 5/27/22","startDate":"2022-05-23T13:46:32.935Z","endDate":"2022-05-27T18:12:00.000Z","completeDate":"2022-05-27T21:18:43.799Z","originBoardId":286,"goal":""},{"id":1965,"self":"https://arthrex.atlassian.net/rest/agile/1.0/sprint/1965","state":"closed","name":"A Team: 7/5/22 - 7/8/22","startDate":"2022-07-05T13:38:21.073Z","endDate":"2022-07-08T17:26:00.000Z","completeDate":"2022-07-08T21:28:08.661Z","originBoardId":286,"goal":""},{"id":1952,"self":"https://arthrex.atlassian.net/rest/agile/1.0/sprint/1952","state":"closed","name":"A Team: 6/20/22 - 6/24/22","startDate":"2022-06-20T13:46:12.904Z","endDate":"2022-06-24T12:12:00.000Z","completeDate":"2022-06-24T20:31:59.550Z","originBoardId":286,"goal":""},{"id":1904,"self":"https://arthrex.atlassian.net/rest/agile/1.0/sprint/1904","state":"closed","name":"A Team: 5/9/22 - 5/13/22","startDate":"2022-05-09T13:36:27.141Z","endDate":"2022-05-13T21:43:00.000Z","completeDate":"2022-05-13T20:16:27.067Z","originBoardId":286,"goal":""}],"customfield_11806":null,"votes":{"self":"https://arthrex.atlassian.net/rest/api/2/issue/MOB-1065/votes","votes":0,"hasVoted":false},"customfield_11809":null,"customfield_11808":null,"worklog":{"startAt":0,"maxResults":20,"total":0,"worklogs":[]},"issuetype":{"self":"https://arthrex.atlassian.net/rest/api/2/issuetype/5","id":"5","description":"The sub-task of the issue","iconUrl":"https://arthrex.atlassian.net/rest/api/2/universal_avatar/view/type/issuetype/avatar/10316?size=medium","name":"Sub-task","subtask":true,"avatarId":10316,"hierarchyLevel":-1},"sprint":{"id":1661,"self":"https://arthrex.atlassian.net/rest/agile/1.0/sprint/1661","state":"active","name":"A Team: 7/18/22 - 7/22/22","startDate":"2022-07-18T13:46:00.383Z","endDate":"2022-07-23T02:21:00.000Z","originBoardId":286,"goal":"AMOBS v1.0.0 and RAI v1.0.0 Releases"},"customfield_10700":null,"customfield_10701":[],"customfield_10702":null,"customfield_11901":{"self":"https://arthrex.atlassian.net/rest/api/2/customFieldOption/11506","value":"No","id":"11506"},"customfield_14050":null,"timetracking":{},"customfield_10803":null,"customfield_10806":null,"customfield_14047":null,"customfield_14048":null,"customfield_14046":null,"customfield_14049":null,"environment":null,"duedate":null,"customfield_13980":null,"customfield_13740":null,"customfield_13861":null,"customfield_11441":null,"customfield_13982":null,"customfield_12772":null,"customfield_11440":null,"customfield_11443":null,"customfield_12774":null,"customfield_13742":null,"customfield_11200":null,"customfield_12411":null,"customfield_11442":null,"customfield_12773":null,"customfield_13741":null,"customfield_11201":null,"customfield_11202":null,"customfield_12413":null,"customfield_13986":null,"customfield_12776":null,"customfield_13623":null,"customfield_13744":null,"customfield_13743":null,"customfield_12412":null,"customfield_12775":null,"customfield_11444":null,"customfield_13985":null,"customfield_12533":null,"customfield_13614":null,"customfield_12645":null,"customfield_13613":null,"customfield_11435":null,"customfield_13979":null,"customfield_13737":null,"customfield_11438":null,"customfield_13616":null,"customfield_11437":null,"customfield_13615":null,"customfield_13739":null,"customfield_13738":null,"customfield_11439":null,"customfield_13617":null,"customfield_12409":null,"customfield_11430":null,"customfield_12761":null,"customfield_12760":null,"customfield_13610":null,"customfield_10100":"2|i02246:","customfield_12762":null,"customfield_11431":null,"customfield_13612":null,"customfield_11434":null,"customfield_13975":null,"customfield_13611":null,"customfield_11303":"3_*:*_1_*:*_1715492290_*|*_10000_*:*_1_*:*_93114909_*|*_10001_*:*_1_*:*_0","customfield_11425":null,"customfield_13603":null,"customfield_12998":null,"customfield_12514":null,"customfield_12756":null,"customfield_13602":null,"customfield_12513":null,"customfield_12997":null,"customfield_12755":null,"customfield_11304":"2022-07-01T11:27:41.248-0400","customfield_12758":null,"customfield_11427":null,"customfield_13605":null,"customfield_13726":null,"customfield_12999":null,"customfield_13604":null,"customfield_12757":null,"timeestimate":null,"customfield_13969":null,"customfield_11428":null,"customfield_13606":null,"customfield_13727":null,"customfield_12759":null,"customfield_13608":null,"customfield_13729":null,"status":{"self":"https://arthrex.atlassian.net/rest/api/2/status/10001","description":"","iconUrl":"https://arthrex.atlassian.net/images/icons/subtask.gif","name":"Done","id":"10001","statusCategory":{"self":"https://arthrex.atlassian.net/rest/api/2/statuscategory/3","id":3,"key":"done","colorName":"green","name":"Done"}},"customfield_12750":null,"customfield_12510":null,"customfield_12752":null,"customfield_11300":{"self":"https://arthrex.atlassian.net/rest/api/2/customFieldOption/10700","value":"User Stories:1","id":"10700"},"customfield_11420":null,"customfield_12751":null,"customfield_12754":null,"customfield_12996":null,"customfield_13601":null,"customfield_11301":null,"customfield_12511":null,"customfield_13600":null,"customfield_12753":null,"customfield_11422":null,"customfield_11414":null,"customfield_12503":null,"customfield_12745":null,"customfield_12502":null,"customfield_12744":null,"customfield_12747":null,"customfield_12505":null,"customfield_13836":null,"customfield_13715":null,"customfield_12504":null,"customfield_13835":null,"customfield_11415":null,"customfield_13956":null,"customfield_12746":null,"customfield_12749":null,"aggregatetimeestimate":null,"customfield_11418":null,"customfield_12507":null,"customfield_12748":null,"customfield_13716":null,"customfield_13837":null,"customfield_12508":null,"customfield_11419":null,"creator":{"self":"https://arthrex.atlassian.net/rest/api/2/user?accountId=5dfa6aa75697460cb3d97763","accountId":"5dfa6aa75697460cb3d97763","emailAddress":"patrick.maguschak2@arthrex.com","avatarUrls":{"48x48":"https://avatar-management--avatars.us-west-2.prod.public.atl-paas.net/5dfa6aa75697460cb3d97763/5f2aaf98-63fd-4e3a-a29b-7e163f497fd8/48","24x24":"https://avatar-management--avatars.us-west-2.prod.public.atl-paas.net/5dfa6aa75697460cb3d97763/5f2aaf98-63fd-4e3a-a29b-7e163f497fd8/24","16x16":"https://avatar-management--avatars.us-west-2.prod.public.atl-paas.net/5dfa6aa75697460cb3d97763/5f2aaf98-63fd-4e3a-a29b-7e163f497fd8/16","32x32":"https://avatar-management--avatars.us-west-2.prod.public.atl-paas.net/5dfa6aa75697460cb3d97763/5f2aaf98-63fd-4e3a-a29b-7e163f497fd8/32"},"displayName":"Patrick Maguschak","active":true,"timeZone":"America/New_York","accountType":"atlassian"},"customfield_13830":null,"customfield_10200":"Test Flight Beta User List\n\n[https://arthrex.atlassian.net/wiki/spaces/MT/pages/3004825645/BETA+Users+List|https://arthrex.atlassian.net/wiki/spaces/MT/pages/3004825645/BETA+Users+List|smart-link] ","customfield_12743":null,"customfield_13831":null,"customfield_10202":null,"customfield_12500":null,"customfield_13702":null,"customfield_11403":{"self":"https://arthrex.atlassian.net/rest/api/2/customFieldOption/10806","value":"Hotline","id":"10806"},"customfield_13701":null,"customfield_11523":null,"customfield_11402":null,"customfield_12975":null,"customfield_13704":null,"customfield_13825":null,"customfield_11526":null,"customfield_13824":null,"customfield_13703":null,"customfield_11404":null,"customfield_12738":null,"customfield_13827":null,"customfield_13705":null,"customfield_13826":null,"customfield_13829":null,"customfield_11529":null,"timespent":null,"customfield_12972":null,"aggregatetimespent":null,"customfield_13700":null,"customfield_11401":null,"customfield_11522":null,"customfield_12974":null,"customfield_11521":null,"customfield_11400":null,"customfield_13933":null,"customfield_13932":null,"customfield_12843":null,"customfield_11512":null,"customfield_11514":null,"customfield_11519":"3_*:*_1_*:*_1715492290_*|*_10000_*:*_1_*:*_93114909_*|*_10001_*:*_1_*:*_0","workratio":-1,"customfield_12840":null,"customfield_10300":null,"customfield_11511":null,"customfield_12842":null,"customfield_13931":null,"customfield_11510":null,"customfield_10301":null,"customfield_13930":null,"customfield_12841":null,"customfield_13801":null,"customfield_12833":null,"customfield_11502":null,"customfield_13800":null,"customfield_11501":{"hasEpicLinkFieldDependency":false,"showField":false,"nonEditableReason":{"reason":"PLUGIN_LICENSE_ERROR","message":"The Parent Link is only available to Jira Premium users."}},"customfield_12832":null,"customfield_13803":null,"customfield_12835":null,"customfield_11504":null,"customfield_12834":null,"customfield_12955":null,"customfield_13802":null,"customfield_13926":null,"customfield_13805":null,"customfield_12958":null,"customfield_12837":null,"customfield_11506":null,"customfield_12836":null,"customfield_13804":null,"customfield_11505":null,"customfield_13925":null,"customfield_12839":null,"customfield_12838":null,"customfield_13808":null,"customfield_12831":null,"customfield_11500":null,"customfield_12830":null,"customfield_12822":null,"customfield_12942":null,"customfield_12824":null,"customfield_12823":null,"flagged":false,"customfield_12825":null,"customfield_12828":null,"customfield_12827":null,"customfield_10400":null,"customfield_12932":null,"customfield_12811":null,"customfield_12934":null,"customfield_12933":null,"customfield_12936":null,"customfield_13904":null,"customfield_13903":null,"customfield_12935":null,"customfield_12938":null,"customfield_13906":null,"customfield_13905":null,"customfield_12937":null,"customfield_13908":null,"customfield_12939":null,"customfield_13909":null,"customfield_12490":null,"customfield_12372":null,"customfield_12493":null,"customfield_12492":null,"customfield_13463":null,"customfield_12495":null,"customfield_12374":null,"customfield_12494":null,"customfield_12376":null,"customfield_13465":null,"customfield_12496":"{panel:bgColor=#FFC400}\r\nThese fields are used to populate request forms in the customer portal. Do not manually change these fields.\r\n{panel}","customfield_13343":null,"customfield_13464":null,"customfield_13225":null,"customfield_12499":null,"customfield_13467":null,"customfield_13466":null,"customfield_13469":null,"customfield_13468":null,"customfield_13690":null,"customfield_12480":null,"customfield_13692":null,"customfield_12482":null,"customfield_13691":null,"customfield_12481":null,"customfield_12000":null,"customfield_13694":null,"customfield_12484":null,"customfield_12362":null,"customfield_13693":null,"customfield_12483":null,"customfield_12002":null,"customfield_13212":null,"customfield_13696":null,"customfield_12001":null,"customfield_13695":null,"customfield_13211":null,"customfield_13335":null,"customfield_12488":null,"customfield_12004":null,"customfield_13698":null,"customfield_13213":null,"customfield_13697":null,"customfield_12003":null,"labels":[],"customfield_13699":null,"customfield_12005":null,"customfield_13336":null,"customfield_12489":null,"customfield_13449":null,"customfield_13207":null,"components":[],"customfield_13681":null,"customfield_12471":null,"customfield_12470":null,"customfield_13680":null,"customfield_12110":null,"customfield_12473":null,"customfield_13683":null,"customfield_13682":null,"customfield_12472":null,"customfield_12475":null,"customfield_12112":null,"customfield_13685":null,"customfield_13322":null,"customfield_12111":null,"customfield_12474":null,"customfield_13684":null,"customfield_13687":null,"customfield_12477":null,"customfield_12114":{"self":"https://arthrex.atlassian.net/rest/api/2/customFieldOption/11922","value":"No","id":"11922"},"customfield_12476":null,"customfield_13686":null,"customfield_12358":null,"customfield_13689":null,"customfield_12479":null,"customfield_12357":null,"customfield_12478":null,"customfield_13688":null,"customfield_13325":null,"customfield_12469":null,"customfield_13679":null,"customfield_12106":null,"customfield_12348":"{panel:title=Alert|titleBGColor=#FFC400|bgColor=#FFFAE6}\r\nPlease make sure that the correct issue type is selected. To select a different issue type, move the issue.\r\n{panel}","customfield_12109":null,"customfield_12108":null,"customfield_13672":null,"customfield_12341":null,"customfield_12340":null,"reporter":{"self":"https://arthrex.atlassian.net/rest/api/2/user?accountId=5dfa6aa75697460cb3d97763","accountId":"5dfa6aa75697460cb3d97763","emailAddress":"patrick.maguschak2@arthrex.com","avatarUrls":{"48x48":"https://avatar-management--avatars.us-west-2.prod.public.atl-paas.net/5dfa6aa75697460cb3d97763/5f2aaf98-63fd-4e3a-a29b-7e163f497fd8/48","24x24":"https://avatar-management--avatars.us-west-2.prod.public.atl-paas.net/5dfa6aa75697460cb3d97763/5f2aaf98-63fd-4e3a-a29b-7e163f497fd8/24","16x16":"https://avatar-management--avatars.us-west-2.prod.public.atl-paas.net/5dfa6aa75697460cb3d97763/5f2aaf98-63fd-4e3a-a29b-7e163f497fd8/16","32x32":"https://avatar-management--avatars.us-west-2.prod.public.atl-paas.net/5dfa6aa75697460cb3d97763/5f2aaf98-63fd-4e3a-a29b-7e163f497fd8/32"},"displayName":"Patrick Maguschak","active":true,"timeZone":"America/New_York","accountType":"atlassian"},"customfield_12343":"{panel:title=Info|titleBGColor=#C0B6F2|bgColor=#EAE6FF}\r\nUse this transition to escalate this issue to another team.\r\n\r\nPlease note that if you select *MRM-DAM Technical*, Jira will automatically create a ticket in Footprints. If you do not wish to create a new Footprints ticket, please select *Disable emails to Footprints* below.\r\n\r\nIf you do not want to be reminded to follow-up on this issue, please select *Disable escalation follow-up* below.\r\n{panel}","customfield_13795":null,"customfield_13674":null,"customfield_12464":null,"customfield_12101":null,"customfield_13673":null,"customfield_12342":null,"customfield_12463":null,"customfield_13676":null,"customfield_13797":null,"customfield_12103":null,"customfield_12466":null,"customfield_12345":null,"customfield_13675":null,"customfield_13796":null,"customfield_12344":"{panel:title=Info|titleBGColor=#C0B6F2|bgColor=#EAE6FF}\r\nUse this transition to respond to the reporter and request participants.\r\n\r\nIf you do not want to be reminded to follow-up on this issue, select *Disable customer follow-up* below.\r\n{panel}","customfield_12468":null,"customfield_12347":"{panel:bgColor=#FFC400}\r\n*Note*\r\nThese fields are used to populate request forms in the customer portal. Do not manually change these fields.\r\n{panel}","customfield_13799":null,"customfield_13678":null,"customfield_12467":null,"customfield_13677":null,"customfield_12346":null,"customfield_13798":null,"customfield_12104":null,"progress":{"progress":0,"total":0},"customfield_12570":null,"customfield_13780":null,"customfield_12330":null,"customfield_13782":null,"project":{"self":"https://arthrex.atlassian.net/rest/api/2/project/12262","id":"12262","key":"MOB","name":"A Team","projectTypeKey":"software","simplified":false,"avatarUrls":{"48x48":"https://arthrex.atlassian.net/rest/api/2/universal_avatar/view/type/project/avatar/13447","24x24":"https://arthrex.atlassian.net/rest/api/2/universal_avatar/view/type/project/avatar/13447?size=small","16x16":"https://arthrex.atlassian.net/rest/api/2/universal_avatar/view/type/project/avatar/13447?size=xsmall","32x32":"https://arthrex.atlassian.net/rest/api/2/universal_avatar/view/type/project/avatar/13447?size=medium"},"projectCategory":{"self":"https://arthrex.atlassian.net/rest/api/2/projectCategory/10103","id":"10103","description":"","name":"Digital Media - Mobile"}},"customfield_12571":null,"customfield_12332":null,"customfield_13783":null,"customfield_12331":null,"customfield_12333":null,"customfield_12336":null,"customfield_12335":null,"customfield_12569":null,"customfield_13779":null,"customfield_12327":null,"customfield_12568":null,"customfield_12329":null,"customfield_12328":null,"resolutiondate":"2022-07-21T07:57:09.854-0400","watches":{"self":"https://arthrex.atlassian.net/rest/api/2/issue/MOB-1065/watchers","watchCount":3,"isWatching":false},"customfield_13890":null,"customfield_13892":null,"customfield_13771":null,"customfield_12561":null,"customfield_13891":null,"customfield_13770":null,"customfield_12200":null,"customfield_12321":null,"customfield_12563":null,"customfield_13652":null,"customfield_12320":null,"customfield_12562":null,"customfield_13772":null,"customfield_12202":null,"customfield_12323":null,"customfield_12322":null,"customfield_12201":null,"customfield_12564":null,"customfield_13656":null,"customfield_12567":null,"customfield_12566":null,"customfield_12324":null,"customfield_12203":null,"customfield_13655":null,"customfield_12558":null,"customfield_13407":null,"customfield_13769":null,"customfield_12319":null,"updated":"2022-07-21T07:57:09.891-0400","customfield_12790":null,"timeoriginalestimate":null,"customfield_13760":null,"customfield_12792":null,"customfield_12550":null,"customfield_12791":null,"description":"Link to Corp Comm Portal \n\n[https://arthrex.atlassian.net/servicedesk/customer/portal/30|https://arthrex.atlassian.net/servicedesk/customer/portal/30]","customfield_12794":null,"customfield_12552":null,"customfield_13762":null,"customfield_12551":null,"customfield_13640":null,"customfield_11100":" ","customfield_13761":null,"customfield_11101":null,"customfield_13764":null,"customfield_12554":null,"customfield_12553":null,"customfield_13763":null,"customfield_12795":null,"customfield_11102":{"self":"https://arthrex.atlassian.net/rest/api/2/customFieldOption/10500","value":"1-None","id":"10500"},"customfield_13645":null,"customfield_11104":null,"customfield_12555":null,"customfield_13765":null,"customfield_12426":null,"customfield_10005":[{"id":1952,"name":"A Team: 6/20/22 - 6/24/22","state":"closed","boardId":286,"goal":"","startDate":"2022-06-20T13:46:12.904Z","endDate":"2022-06-24T12:12:00.000Z","completeDate":"2022-06-24T20:31:59.550Z"},{"id":1904,"name":"A Team: 5/9/22 - 5/13/22","state":"closed","boardId":286,"goal":"","startDate":"2022-05-09T13:36:27.141Z","endDate":"2022-05-13T21:43:00.000Z","completeDate":"2022-05-13T20:16:27.067Z"},{"id":2001,"name":"A Team: 7/11/22 - 7/15/22","state":"closed","boardId":286,"goal":"Prep for Submission of v1.0.0 Rep App iOS Release","startDate":"2022-07-11T13:56:18.821Z","endDate":"2022-07-16T02:15:00.000Z","completeDate":"2022-07-15T21:39:31.202Z"},{"id":1955,"name":"A Team: 6/27/22 - 7/1/22","state":"closed","boardId":286,"goal":"","startDate":"2022-06-27T13:39:51.053Z","endDate":"2022-07-01T16:03:00.000Z","completeDate":"2022-07-01T20:26:58.126Z"},{"id":1940,"name":"A Team: 6/13/22 - 6/17/22","state":"closed","boardId":286,"goal":"","startDate":"2022-06-13T13:23:11.454Z","endDate":"2022-06-17T13:12:00.000Z","completeDate":"2022-06-17T21:12:57.348Z"},{"id":1861,"name":"A Team: 4/18/22 - 4/22/22","state":"closed","boardId":286,"goal":"","startDate":"2022-04-18T13:19:51.131Z","endDate":"2022-04-22T21:22:00.000Z","completeDate":"2022-04-23T00:50:05.964Z"},{"id":1862,"name":"A Team: 4/25/22 - 4/29/22","state":"closed","boardId":286,"goal":"","startDate":"2022-04-25T13:38:51.319Z","endDate":"2022-04-29T21:00:00.000Z","completeDate":"2022-04-29T20:44:00.021Z"},{"id":1929,"name":"A Team: 5/31/22 - 6/10/22","state":"closed","boardId":286,"goal":"","startDate":"2022-05-31T13:20:11.464Z","endDate":"2022-06-10T14:13:00.000Z","completeDate":"2022-06-10T21:09:52.636Z"},{"id":1881,"name":"A Team: 5/2/22 - 5/6/22","state":"closed","boardId":286,"goal":"","startDate":"2022-05-02T13:24:03.040Z","endDate":"2022-05-06T21:59:00.000Z","completeDate":"2022-05-06T20:33:28.823Z"},{"id":1915,"name":"A Team: 5/16/22 - 5/20/22","state":"closed","boardId":286,"goal":"","startDate":"2022-05-16T13:45:22.501Z","endDate":"2022-05-20T21:11:00.000Z","completeDate":"2022-05-20T20:48:44.357Z"},{"id":1916,"name":"A Team: 5/23/22 - 5/27/22","state":"closed","boardId":286,"goal":"","startDate":"2022-05-23T13:46:32.935Z","endDate":"2022-05-27T18:12:00.000Z","completeDate":"2022-05-27T21:18:43.799Z"},{"id":1965,"name":"A Team: 7/5/22 - 7/8/22","state":"closed","boardId":286,"goal":"","startDate":"2022-07-05T13:38:21.073Z","endDate":"2022-07-08T17:26:00.000Z","completeDate":"2022-07-08T21:28:08.661Z"},{"id":1661,"name":"A Team: 7/18/22 - 7/22/22","state":"active","boardId":286,"goal":"AMOBS v1.0.0 and RAI v1.0.0 Releases","startDate":"2022-07-18T13:46:00.383Z","endDate":"2022-07-23T02:21:00.000Z"}],"customfield_13636":null,"customfield_13757":null,"customfield_12789":null,"customfield_12547":null,"customfield_12305":null,"customfield_12788":null,"customfield_12425":null,"customfield_13756":null,"customfield_10006":null,"customfield_12546":null,"customfield_12304":null,"customfield_13998":null,"customfield_12428":null,"customfield_13759":null,"customfield_12549":null,"customfield_12307":null,"customfield_12306":null,"customfield_12427":null,"customfield_13758":null,"customfield_12548":null,"customfield_12309":null,"customfield_12429":null,"customfield_12308":null,"summary":"Send Out Early Access Email","customfield_12781":null,"customfield_11450":{"self":"https://arthrex.atlassian.net/rest/api/2/customFieldOption/10989","value":"Always","id":"10989"},"customfield_12780":null,"customfield_13993":null,"customfield_13751":null,"customfield_12420":null,"customfield_12541":null,"customfield_12783":null,"customfield_12782":null,"customfield_12540":null,"customfield_10000":null,"customfield_13750":null,"customfield_13991":null,"customfield_12785":null,"customfield_13996":null,"customfield_13753":null,"customfield_12422":null,"customfield_10001":null,"customfield_13752":null,"customfield_12784":null,"customfield_12300":"{}","customfield_13997":null,"customfield_12545":null,"customfield_12303":null,"customfield_12787":null,"customfield_13755":null,"customfield_13994":null,"customfield_12544":null,"customfield_12423":null,"customfield_13995":null,"customfield_12786":null,"customfield_13754":null,"customfield_13746":null,"customfield_13989":null,"customfield_12778":null,"customfield_11447":null,"customfield_12415":null,"customfield_13745":null,"customfield_12777":null,"customfield_12414":null,"customfield_12417":null,"customfield_13987":null,"customfield_11449":{"self":"https://arthrex.atlassian.net/rest/api/2/customFieldOption/10986","value":"Live Site","id":"10986"},"customfield_13748":null,"customfield_11448":null,"customfield_12416":null,"customfield_13505":[],"customfield_12779":null,"customfield_12419":null,"customfield_13749":null,"customfield_12418":null,"comment":{"comments":[{"self":"https://arthrex.atlassian.net/rest/api/2/issue/299480/comment/464623","id":"464623","author":{"self":"https://arthrex.atlassian.net/rest/api/2/user?accountId=60bac9915fa6f1006fee00b2","accountId":"60bac9915fa6f1006fee00b2","emailAddress":"johnny.ansari@arthrex.com","avatarUrls":{"48x48":"https://secure.gravatar.com/avatar/d887eff1f5130dfab59a6de736562de4?d=https%3A%2F%2Favatar-management--avatars.us-west-2.prod.public.atl-paas.net%2Finitials%2FJA-5.png","24x24":"https://secure.gravatar.com/avatar/d887eff1f5130dfab59a6de736562de4?d=https%3A%2F%2Favatar-management--avatars.us-west-2.prod.public.atl-paas.net%2Finitials%2FJA-5.png","16x16":"https://secure.gravatar.com/avatar/d887eff1f5130dfab59a6de736562de4?d=https%3A%2F%2Favatar-management--avatars.us-west-2.prod.public.atl-paas.net%2Finitials%2FJA-5.png","32x32":"https://secure.gravatar.com/avatar/d887eff1f5130dfab59a6de736562de4?d=https%3A%2F%2Favatar-management--avatars.us-west-2.prod.public.atl-paas.net%2Finitials%2FJA-5.png"},"displayName":"Johnny Ansari","active":true,"timeZone":"America/New_York","accountType":"atlassian"},"body":"[~accountid:5f05cbd2e407a4001c0646f7] ans [~accountid:5b1975b2d50d3d56fa78eaa8] \n\nWe need the TestFlight LINK\nand android play store LINK\nI have the email cued up just need to enter the links.","updateAuthor":{"self":"https://arthrex.atlassian.net/rest/api/2/user?accountId=60bac9915fa6f1006fee00b2","accountId":"60bac9915fa6f1006fee00b2","emailAddress":"johnny.ansari@arthrex.com","avatarUrls":{"48x48":"https://secure.gravatar.com/avatar/d887eff1f5130dfab59a6de736562de4?d=https%3A%2F%2Favatar-management--avatars.us-west-2.prod.public.atl-paas.net%2Finitials%2FJA-5.png","24x24":"https://secure.gravatar.com/avatar/d887eff1f5130dfab59a6de736562de4?d=https%3A%2F%2Favatar-management--avatars.us-west-2.prod.public.atl-paas.net%2Finitials%2FJA-5.png","16x16":"https://secure.gravatar.com/avatar/d887eff1f5130dfab59a6de736562de4?d=https%3A%2F%2Favatar-management--avatars.us-west-2.prod.public.atl-paas.net%2Finitials%2FJA-5.png","32x32":"https://secure.gravatar.com/avatar/d887eff1f5130dfab59a6de736562de4?d=https%3A%2F%2Favatar-management--avatars.us-west-2.prod.public.atl-paas.net%2Finitials%2FJA-5.png"},"displayName":"Johnny Ansari","active":true,"timeZone":"America/New_York","accountType":"atlassian"},"created":"2022-07-01T11:27:41.248-0400","updated":"2022-07-01T11:27:41.248-0400","jsdPublic":true},{"self":"https://arthrex.atlassian.net/rest/api/2/issue/299480/comment/464687","id":"464687","author":{"self":"https://arthrex.atlassian.net/rest/api/2/user?accountId=5b1975b2d50d3d56fa78eaa8","accountId":"5b1975b2d50d3d56fa78eaa8","emailAddress":"arie.myrmo@arthrex.com","avatarUrls":{"48x48":"https://avatar-management--avatars.us-west-2.prod.public.atl-paas.net/5b1975b2d50d3d56fa78eaa8/ce1b14c7-4e33-4e6e-8e17-dc95174dc2f6/48","24x24":"https://avatar-management--avatars.us-west-2.prod.public.atl-paas.net/5b1975b2d50d3d56fa78eaa8/ce1b14c7-4e33-4e6e-8e17-dc95174dc2f6/24","16x16":"https://avatar-management--avatars.us-west-2.prod.public.atl-paas.net/5b1975b2d50d3d56fa78eaa8/ce1b14c7-4e33-4e6e-8e17-dc95174dc2f6/16","32x32":"https://avatar-management--avatars.us-west-2.prod.public.atl-paas.net/5b1975b2d50d3d56fa78eaa8/ce1b14c7-4e33-4e6e-8e17-dc95174dc2f6/32"},"displayName":"Arie Myrmo","active":true,"timeZone":"America/New_York","accountType":"atlassian"},"body":"iOS Rep App Beta Link - [https://testflight.apple.com/join/SZGpVhEn|https://testflight.apple.com/join/SZGpVhEn|smart-link] \n\nI will share Android and Surgeon App iOS links next Tuesday when they are available.","updateAuthor":{"self":"https://arthrex.atlassian.net/rest/api/2/user?accountId=5b1975b2d50d3d56fa78eaa8","accountId":"5b1975b2d50d3d56fa78eaa8","emailAddress":"arie.myrmo@arthrex.com","avatarUrls":{"48x48":"https://avatar-management--avatars.us-west-2.prod.public.atl-paas.net/5b1975b2d50d3d56fa78eaa8/ce1b14c7-4e33-4e6e-8e17-dc95174dc2f6/48","24x24":"https://avatar-management--avatars.us-west-2.prod.public.atl-paas.net/5b1975b2d50d3d56fa78eaa8/ce1b14c7-4e33-4e6e-8e17-dc95174dc2f6/24","16x16":"https://avatar-management--avatars.us-west-2.prod.public.atl-paas.net/5b1975b2d50d3d56fa78eaa8/ce1b14c7-4e33-4e6e-8e17-dc95174dc2f6/16","32x32":"https://avatar-management--avatars.us-west-2.prod.public.atl-paas.net/5b1975b2d50d3d56fa78eaa8/ce1b14c7-4e33-4e6e-8e17-dc95174dc2f6/32"},"displayName":"Arie Myrmo","active":true,"timeZone":"America/New_York","accountType":"atlassian"},"created":"2022-07-01T13:25:16.664-0400","updated":"2022-07-01T13:25:16.664-0400","jsdPublic":true},{"self":"https://arthrex.atlassian.net/rest/api/2/issue/299480/comment/465058","id":"465058","author":{"self":"https://arthrex.atlassian.net/rest/api/2/user?accountId=5b1975b2d50d3d56fa78eaa8","accountId":"5b1975b2d50d3d56fa78eaa8","emailAddress":"arie.myrmo@arthrex.com","avatarUrls":{"48x48":"https://avatar-management--avatars.us-west-2.prod.public.atl-paas.net/5b1975b2d50d3d56fa78eaa8/ce1b14c7-4e33-4e6e-8e17-dc95174dc2f6/48","24x24":"https://avatar-management--avatars.us-west-2.prod.public.atl-paas.net/5b1975b2d50d3d56fa78eaa8/ce1b14c7-4e33-4e6e-8e17-dc95174dc2f6/24","16x16":"https://avatar-management--avatars.us-west-2.prod.public.atl-paas.net/5b1975b2d50d3d56fa78eaa8/ce1b14c7-4e33-4e6e-8e17-dc95174dc2f6/16","32x32":"https://avatar-management--avatars.us-west-2.prod.public.atl-paas.net/5b1975b2d50d3d56fa78eaa8/ce1b14c7-4e33-4e6e-8e17-dc95174dc2f6/32"},"displayName":"Arie Myrmo","active":true,"timeZone":"America/New_York","accountType":"atlassian"},"body":"iOS Surgeon App Beta Link - [https://testflight.apple.com/join/xSceyihi|https://testflight.apple.com/join/xSceyihi|smart-link] ","updateAuthor":{"self":"https://arthrex.atlassian.net/rest/api/2/user?accountId=5b1975b2d50d3d56fa78eaa8","accountId":"5b1975b2d50d3d56fa78eaa8","emailAddress":"arie.myrmo@arthrex.com","avatarUrls":{"48x48":"https://avatar-management--avatars.us-west-2.prod.public.atl-paas.net/5b1975b2d50d3d56fa78eaa8/ce1b14c7-4e33-4e6e-8e17-dc95174dc2f6/48","24x24":"https://avatar-management--avatars.us-west-2.prod.public.atl-paas.net/5b1975b2d50d3d56fa78eaa8/ce1b14c7-4e33-4e6e-8e17-dc95174dc2f6/24","16x16":"https://avatar-management--avatars.us-west-2.prod.public.atl-paas.net/5b1975b2d50d3d56fa78eaa8/ce1b14c7-4e33-4e6e-8e17-dc95174dc2f6/16","32x32":"https://avatar-management--avatars.us-west-2.prod.public.atl-paas.net/5b1975b2d50d3d56fa78eaa8/ce1b14c7-4e33-4e6e-8e17-dc95174dc2f6/32"},"displayName":"Arie Myrmo","active":true,"timeZone":"America/New_York","accountType":"atlassian"},"created":"2022-07-05T08:29:09.356-0400","updated":"2022-07-05T08:29:09.356-0400","jsdPublic":true},{"self":"https://arthrex.atlassian.net/rest/api/2/issue/299480/comment/465059","id":"465059","author":{"self":"https://arthrex.atlassian.net/rest/api/2/user?accountId=5b1975b2d50d3d56fa78eaa8","accountId":"5b1975b2d50d3d56fa78eaa8","emailAddress":"arie.myrmo@arthrex.com","avatarUrls":{"48x48":"https://avatar-management--avatars.us-west-2.prod.public.atl-paas.net/5b1975b2d50d3d56fa78eaa8/ce1b14c7-4e33-4e6e-8e17-dc95174dc2f6/48","24x24":"https://avatar-management--avatars.us-west-2.prod.public.atl-paas.net/5b1975b2d50d3d56fa78eaa8/ce1b14c7-4e33-4e6e-8e17-dc95174dc2f6/24","16x16":"https://avatar-management--avatars.us-west-2.prod.public.atl-paas.net/5b1975b2d50d3d56fa78eaa8/ce1b14c7-4e33-4e6e-8e17-dc95174dc2f6/16","32x32":"https://avatar-management--avatars.us-west-2.prod.public.atl-paas.net/5b1975b2d50d3d56fa78eaa8/ce1b14c7-4e33-4e6e-8e17-dc95174dc2f6/32"},"displayName":"Arie Myrmo","active":true,"timeZone":"America/New_York","accountType":"atlassian"},"body":"Android Rep App Link to Closed Testing Build for Beta (for phones) - [https://play.google.com/store/apps/details?id=com.arthrex.repapp|https://play.google.com/store/apps/details?id=com.arthrex.repapp]\n\nfor web - [https://play.google.com/apps/testing/com.arthrex.repapp|https://play.google.com/apps/testing/com.arthrex.repapp]","updateAuthor":{"self":"https://arthrex.atlassian.net/rest/api/2/user?accountId=5b1975b2d50d3d56fa78eaa8","accountId":"5b1975b2d50d3d56fa78eaa8","emailAddress":"arie.myrmo@arthrex.com","avatarUrls":{"48x48":"https://avatar-management--avatars.us-west-2.prod.public.atl-paas.net/5b1975b2d50d3d56fa78eaa8/ce1b14c7-4e33-4e6e-8e17-dc95174dc2f6/48","24x24":"https://avatar-management--avatars.us-west-2.prod.public.atl-paas.net/5b1975b2d50d3d56fa78eaa8/ce1b14c7-4e33-4e6e-8e17-dc95174dc2f6/24","16x16":"https://avatar-management--avatars.us-west-2.prod.public.atl-paas.net/5b1975b2d50d3d56fa78eaa8/ce1b14c7-4e33-4e6e-8e17-dc95174dc2f6/16","32x32":"https://avatar-management--avatars.us-west-2.prod.public.atl-paas.net/5b1975b2d50d3d56fa78eaa8/ce1b14c7-4e33-4e6e-8e17-dc95174dc2f6/32"},"displayName":"Arie Myrmo","active":true,"timeZone":"America/New_York","accountType":"atlassian"},"created":"2022-07-05T08:29:52.096-0400","updated":"2022-07-05T08:29:52.096-0400","jsdPublic":true}],"self":"https://arthrex.atlassian.net/rest/api/2/issue/299480/comment","maxResults":4,"total":4,"startAt":0},"statuscategorychangedate":"2022-07-21T07:57:09.892-0400","customfield_13063":"Testing message","customfield_13062":null,"customfield_14033":null,"customfield_13067":null,"customfield_13066":null,"fixVersions":[],"customfield_10900":null,"customfield_13294":null,"customfield_13052":null,"customfield_13053":null,"epic":null,"customfield_13057":null,"priority":{"self":"https://arthrex.atlassian.net/rest/api/2/priority/4","iconUrl":"https://s3.amazonaws.com/arthrex-public/jira/priorities/minor.png","name":"Minor","id":"4"},"customfield_14028":null,"versions":[],"customfield_13045":null,"customfield_14014":null,"customfield_14015":null,"customfield_13047":null,"customfield_13046":null,"customfield_14013":null,"customfield_14016":null,"customfield_14017":null,"customfield_13391":null,"customfield_13272":null,"customfield_13392":null,"customfield_13274":null,"customfield_13273":null,"aggregateprogress":{"progress":0,"total":0},"customfield_13279":null,"customfield_13380":null,"issuerestriction":{"issuerestrictions":{},"shouldDisplay":false},"customfield_13371":null,"customfield_13373":null,"created":"2022-06-30T09:33:42.733-0400","customfield_13494":null,"customfield_13012":null,"customfield_13375":null,"customfield_13011":null,"customfield_13377":null,"customfield_13376":null,"customfield_13016":null,"customfield_13379":null,"customfield_13378":null,"customfield_13017":null,"customfield_13360":null,"customfield_13362":null,"customfield_13361":null,"customfield_13364":null,"customfield_13122":null,"customfield_13001":null,"customfield_13363":null,"customfield_13000":null,"customfield_13366":"150 GB","customfield_13365":null,"customfield_13002":null,"customfield_13368":null,"customfield_13367":null,"customfield_13369":null,"security":null,"attachment":[],"customfield_13470":null,"customfield_13471":null,"customfield_12385":null,"customfield_13355":null,"customfield_12386":null,"customfield_13599":null,"customfield_13357":null,"customfield_13356":null,"customfield_12388":null,"customfield_13359":null,"customfield_13358":null}},{"expand":"operations,versionedRepresentations,editmeta,changelog,renderedFields","id":"268522","self":"https://arthrex.atlassian.net/rest/agile/1.0/issue/268522","key":"MOB-811","fields":{"parent":{"id":"279628","key":"MOB-929","self":"https://arthrex.atlassian.net/rest/api/2/issue/279628","fields":{"summary":"UX/UI","status":{"self":"https://arthrex.atlassian.net/rest/api/2/status/3","description":"This issue is being actively worked on at the moment by the assignee.","iconUrl":"https://arthrex.atlassian.net/images/icons/statuses/inprogress.png","name":"Working","id":"3","statusCategory":{"self":"https://arthrex.atlassian.net/rest/api/2/statuscategory/4","id":4,"key":"indeterminate","colorName":"yellow","name":"In Progress"}},"priority":{"self":"https://arthrex.atlassian.net/rest/api/2/priority/4","iconUrl":"https://s3.amazonaws.com/arthrex-public/jira/priorities/minor.png","name":"Minor","id":"4"},"issuetype":{"self":"https://arthrex.atlassian.net/rest/api/2/issuetype/3","id":"3","description":"A task that needs to be done.","iconUrl":"https://arthrex.atlassian.net/rest/api/2/universal_avatar/view/type/issuetype/avatar/10318?size=medium","name":"Task","subtask":false,"avatarId":10318,"hierarchyLevel":0}}},"resolution":null,"customfield_12930":null,"customfield_12923":null,"customfield_12924":null,"customfield_12929":null,"lastViewed":null,"customfield_11700":null,"customfield_12912":null,"customfield_11702":null,"customfield_11701":null,"customfield_12914":null,"aggregatetimeoriginalestimate":null,"customfield_12916":null,"customfield_12915":null,"customfield_12918":null,"customfield_12917":null,"issuelinks":[],"assignee":{"self":"https://arthrex.atlassian.net/rest/api/2/user?accountId=60bac9915fa6f1006fee00b2","accountId":"60bac9915fa6f1006fee00b2","emailAddress":"johnny.ansari@arthrex.com","avatarUrls":{"48x48":"https://secure.gravatar.com/avatar/d887eff1f5130dfab59a6de736562de4?d=https%3A%2F%2Favatar-management--avatars.us-west-2.prod.public.atl-paas.net%2Finitials%2FJA-5.png","24x24":"https://secure.gravatar.com/avatar/d887eff1f5130dfab59a6de736562de4?d=https%3A%2F%2Favatar-management--avatars.us-west-2.prod.public.atl-paas.net%2Finitials%2FJA-5.png","16x16":"https://secure.gravatar.com/avatar/d887eff1f5130dfab59a6de736562de4?d=https%3A%2F%2Favatar-management--avatars.us-west-2.prod.public.atl-paas.net%2Finitials%2FJA-5.png","32x32":"https://secure.gravatar.com/avatar/d887eff1f5130dfab59a6de736562de4?d=https%3A%2F%2Favatar-management--avatars.us-west-2.prod.public.atl-paas.net%2Finitials%2FJA-5.png"},"displayName":"Johnny Ansari","active":true,"timeZone":"America/New_York","accountType":"atlassian"},"customfield_12919":null,"customfield_11810":null,"customfield_12901":null,"customfield_11812":null,"customfield_11811":null,"customfield_11814":null,"customfield_12903":null,"customfield_12902":null,"customfield_11813":null,"customfield_11816":null,"customfield_12905":null,"customfield_11815":null,"customfield_12904":null,"customfield_11818":null,"customfield_12906":null,"customfield_11817":null,"subtasks":[],"customfield_11801":null,"customfield_11800":null,"customfield_11802":null,"customfield_11805":null,"customfield_11804":null,"customfield_11807":null,"closedSprints":[{"id":2001,"self":"https://arthrex.atlassian.net/rest/agile/1.0/sprint/2001","state":"closed","name":"A Team: 7/11/22 - 7/15/22","startDate":"2022-07-11T13:56:18.821Z","endDate":"2022-07-16T02:15:00.000Z","completeDate":"2022-07-15T21:39:31.202Z","originBoardId":286,"goal":"Prep for Submission of v1.0.0 Rep App iOS Release"},{"id":1955,"self":"https://arthrex.atlassian.net/rest/agile/1.0/sprint/1955","state":"closed","name":"A Team: 6/27/22 - 7/1/22","startDate":"2022-06-27T13:39:51.053Z","endDate":"2022-07-01T16:03:00.000Z","completeDate":"2022-07-01T20:26:58.126Z","originBoardId":286,"goal":""},{"id":1940,"self":"https://arthrex.atlassian.net/rest/agile/1.0/sprint/1940","state":"closed","name":"A Team: 6/13/22 - 6/17/22","startDate":"2022-06-13T13:23:11.454Z","endDate":"2022-06-17T13:12:00.000Z","completeDate":"2022-06-17T21:12:57.348Z","originBoardId":286,"goal":""},{"id":1861,"self":"https://arthrex.atlassian.net/rest/agile/1.0/sprint/1861","state":"closed","name":"A Team: 4/18/22 - 4/22/22","startDate":"2022-04-18T13:19:51.131Z","endDate":"2022-04-22T21:22:00.000Z","completeDate":"2022-04-23T00:50:05.964Z","originBoardId":286,"goal":""},{"id":1862,"self":"https://arthrex.atlassian.net/rest/agile/1.0/sprint/1862","state":"closed","name":"A Team: 4/25/22 - 4/29/22","startDate":"2022-04-25T13:38:51.319Z","endDate":"2022-04-29T21:00:00.000Z","completeDate":"2022-04-29T20:44:00.021Z","originBoardId":286,"goal":""},{"id":1929,"self":"https://arthrex.atlassian.net/rest/agile/1.0/sprint/1929","state":"closed","name":"A Team: 5/31/22 - 6/10/22","startDate":"2022-05-31T13:20:11.464Z","endDate":"2022-06-10T14:13:00.000Z","completeDate":"2022-06-10T21:09:52.636Z","originBoardId":286,"goal":""},{"id":1881,"self":"https://arthrex.atlassian.net/rest/agile/1.0/sprint/1881","state":"closed","name":"A Team: 5/2/22 - 5/6/22","startDate":"2022-05-02T13:24:03.040Z","endDate":"2022-05-06T21:59:00.000Z","completeDate":"2022-05-06T20:33:28.823Z","originBoardId":286,"goal":""},{"id":1915,"self":"https://arthrex.atlassian.net/rest/agile/1.0/sprint/1915","state":"closed","name":"A Team: 5/16/22 - 5/20/22","startDate":"2022-05-16T13:45:22.501Z","endDate":"2022-05-20T21:11:00.000Z","completeDate":"2022-05-20T20:48:44.357Z","originBoardId":286,"goal":""},{"id":1916,"self":"https://arthrex.atlassian.net/rest/agile/1.0/sprint/1916","state":"closed","name":"A Team: 5/23/22 - 5/27/22","startDate":"2022-05-23T13:46:32.935Z","endDate":"2022-05-27T18:12:00.000Z","completeDate":"2022-05-27T21:18:43.799Z","originBoardId":286,"goal":""},{"id":1965,"self":"https://arthrex.atlassian.net/rest/agile/1.0/sprint/1965","state":"closed","name":"A Team: 7/5/22 - 7/8/22","startDate":"2022-07-05T13:38:21.073Z","endDate":"2022-07-08T17:26:00.000Z","completeDate":"2022-07-08T21:28:08.661Z","originBoardId":286,"goal":""},{"id":1952,"self":"https://arthrex.atlassian.net/rest/agile/1.0/sprint/1952","state":"closed","name":"A Team: 6/20/22 - 6/24/22","startDate":"2022-06-20T13:46:12.904Z","endDate":"2022-06-24T12:12:00.000Z","completeDate":"2022-06-24T20:31:59.550Z","originBoardId":286,"goal":""},{"id":1904,"self":"https://arthrex.atlassian.net/rest/agile/1.0/sprint/1904","state":"closed","name":"A Team: 5/9/22 - 5/13/22","startDate":"2022-05-09T13:36:27.141Z","endDate":"2022-05-13T21:43:00.000Z","completeDate":"2022-05-13T20:16:27.067Z","originBoardId":286,"goal":""}],"customfield_11806":null,"customfield_11809":null,"votes":{"self":"https://arthrex.atlassian.net/rest/api/2/issue/MOB-811/votes","votes":0,"hasVoted":false},"worklog":{"startAt":0,"maxResults":20,"total":0,"worklogs":[]},"customfield_11808":null,"issuetype":{"self":"https://arthrex.atlassian.net/rest/api/2/issuetype/5","id":"5","description":"The sub-task of the issue","iconUrl":"https://arthrex.atlassian.net/rest/api/2/universal_avatar/view/type/issuetype/avatar/10316?size=medium","name":"Sub-task","subtask":true,"avatarId":10316,"hierarchyLevel":-1},"sprint":{"id":1661,"self":"https://arthrex.atlassian.net/rest/agile/1.0/sprint/1661","state":"active","name":"A Team: 7/18/22 - 7/22/22","startDate":"2022-07-18T13:46:00.383Z","endDate":"2022-07-23T02:21:00.000Z","originBoardId":286,"goal":"AMOBS v1.0.0 and RAI v1.0.0 Releases"},"customfield_10700":null,"customfield_10701":[],"customfield_10702":null,"customfield_11901":{"self":"https://arthrex.atlassian.net/rest/api/2/customFieldOption/11506","value":"No","id":"11506"},"customfield_14050":null,"timetracking":{},"customfield_10803":null,"customfield_10806":null,"customfield_14047":null,"customfield_14048":null,"customfield_14046":null,"customfield_14049":null,"environment":null,"duedate":null,"customfield_13980":null,"customfield_13861":null,"customfield_11441":null,"customfield_12772":null,"customfield_13982":null,"customfield_13740":null,"customfield_11440":null,"customfield_12411":null,"customfield_12774":null,"customfield_11443":null,"customfield_13742":null,"customfield_11200":{"self":"https://arthrex.atlassian.net/rest/api/2/customFieldOption/10601","value":"N","id":"10601"},"customfield_11201":null,"customfield_11442":null,"customfield_13741":null,"customfield_12773":null,"customfield_13623":null,"customfield_13744":null,"customfield_13986":null,"customfield_11202":null,"customfield_12413":null,"customfield_12776":null,"customfield_12533":null,"customfield_12412":null,"customfield_11444":null,"customfield_12775":null,"customfield_13743":null,"customfield_13985":null,"customfield_13614":null,"customfield_13613":null,"customfield_11435":null,"customfield_12645":null,"customfield_13979":null,"customfield_11438":null,"customfield_13616":null,"customfield_13737":null,"customfield_13615":null,"customfield_11437":null,"customfield_13739":null,"customfield_11439":null,"customfield_13738":null,"customfield_13617":null,"customfield_12409":null,"customfield_11430":null,"customfield_12761":null,"customfield_12760":null,"customfield_13610":null,"customfield_10100":"2|i02247:","customfield_11431":null,"customfield_12762":null,"customfield_13975":null,"customfield_13612":null,"customfield_11434":null,"customfield_13611":null,"customfield_11425":null,"customfield_12998":null,"customfield_12756":null,"customfield_12514":null,"customfield_13603":null,"customfield_11303":null,"customfield_12513":null,"customfield_11304":null,"customfield_13602":null,"customfield_12755":null,"customfield_12997":null,"customfield_11427":null,"customfield_12758":null,"customfield_13726":null,"customfield_13605":null,"customfield_12999":null,"customfield_12757":null,"customfield_13604":null,"timeestimate":null,"customfield_13727":null,"customfield_13606":null,"customfield_11428":null,"customfield_13969":null,"customfield_12759":null,"customfield_13729":null,"customfield_13608":null,"status":{"self":"https://arthrex.atlassian.net/rest/api/2/status/3","description":"This issue is being actively worked on at the moment by the assignee.","iconUrl":"https://arthrex.atlassian.net/images/icons/statuses/inprogress.png","name":"Working","id":"3","statusCategory":{"self":"https://arthrex.atlassian.net/rest/api/2/statuscategory/4","id":4,"key":"indeterminate","colorName":"yellow","name":"In Progress"}},"customfield_12750":null,"customfield_12752":null,"customfield_12510":null,"customfield_11300":{"self":"https://arthrex.atlassian.net/rest/api/2/customFieldOption/10700","value":"User Stories:1","id":"10700"},"customfield_11420":null,"customfield_12751":null,"customfield_11301":null,"customfield_12754":null,"customfield_12996":null,"customfield_13601":null,"customfield_12753":null,"customfield_13600":null,"customfield_12511":null,"customfield_11422":null,"customfield_11414":null,"customfield_12503":null,"customfield_12745":null,"customfield_12744":null,"customfield_12502":null,"customfield_12505":null,"customfield_13715":null,"customfield_12747":null,"customfield_13836":null,"customfield_11415":null,"customfield_12504":null,"customfield_12746":null,"customfield_13956":null,"customfield_13835":null,"customfield_12749":null,"customfield_11418":null,"aggregatetimeestimate":null,"customfield_12507":null,"customfield_13837":null,"customfield_13716":null,"customfield_12748":null,"customfield_11419":null,"customfield_12508":null,"creator":{"self":"https://arthrex.atlassian.net/rest/api/2/user?accountId=60bac9915fa6f1006fee00b2","accountId":"60bac9915fa6f1006fee00b2","emailAddress":"johnny.ansari@arthrex.com","avatarUrls":{"48x48":"https://secure.gravatar.com/avatar/d887eff1f5130dfab59a6de736562de4?d=https%3A%2F%2Favatar-management--avatars.us-west-2.prod.public.atl-paas.net%2Finitials%2FJA-5.png","24x24":"https://secure.gravatar.com/avatar/d887eff1f5130dfab59a6de736562de4?d=https%3A%2F%2Favatar-management--avatars.us-west-2.prod.public.atl-paas.net%2Finitials%2FJA-5.png","16x16":"https://secure.gravatar.com/avatar/d887eff1f5130dfab59a6de736562de4?d=https%3A%2F%2Favatar-management--avatars.us-west-2.prod.public.atl-paas.net%2Finitials%2FJA-5.png","32x32":"https://secure.gravatar.com/avatar/d887eff1f5130dfab59a6de736562de4?d=https%3A%2F%2Favatar-management--avatars.us-west-2.prod.public.atl-paas.net%2Finitials%2FJA-5.png"},"displayName":"Johnny Ansari","active":true,"timeZone":"America/New_York","accountType":"atlassian"},"customfield_13830":null,"customfield_10200":null,"customfield_12743":null,"customfield_12500":null,"customfield_10202":null,"customfield_13831":null,"customfield_13702":null,"customfield_11403":{"self":"https://arthrex.atlassian.net/rest/api/2/customFieldOption/10806","value":"Hotline","id":"10806"},"customfield_11523":null,"customfield_11402":null,"customfield_13701":null,"customfield_12975":null,"customfield_13704":null,"customfield_11526":null,"customfield_13825":null,"customfield_11404":null,"customfield_13703":null,"customfield_13824":null,"customfield_12738":null,"customfield_13827":null,"customfield_13705":null,"customfield_13826":null,"customfield_13829":null,"customfield_11529":null,"timespent":null,"customfield_12972":null,"aggregatetimespent":null,"customfield_11522":null,"customfield_13700":null,"customfield_12974":null,"customfield_11401":null,"customfield_11400":null,"customfield_11521":null,"customfield_13933":null,"customfield_11512":null,"customfield_12843":null,"customfield_13932":null,"customfield_11514":null,"customfield_11519":null,"workratio":-1,"customfield_12840":null,"customfield_10300":null,"customfield_12842":null,"customfield_13931":null,"customfield_11511":null,"customfield_13930":null,"customfield_11510":null,"customfield_10301":null,"customfield_12841":null,"customfield_12833":null,"customfield_13801":null,"customfield_11502":null,"customfield_12832":null,"customfield_11501":{"hasEpicLinkFieldDependency":false,"showField":false,"nonEditableReason":{"reason":"PLUGIN_LICENSE_ERROR","message":"The Parent Link is only available to Jira Premium users."}},"customfield_13800":null,"customfield_13803":null,"customfield_12835":null,"customfield_11504":null,"customfield_13802":null,"customfield_12834":null,"customfield_12955":null,"customfield_12958":null,"customfield_13926":null,"customfield_13805":null,"customfield_12837":null,"customfield_11506":null,"customfield_13925":null,"customfield_13804":null,"customfield_11505":null,"customfield_12836":null,"customfield_12839":null,"customfield_12838":null,"customfield_13808":null,"customfield_12831":null,"customfield_11500":null,"customfield_12830":null,"customfield_12822":null,"customfield_12942":null,"customfield_12824":null,"customfield_12823":null,"flagged":false,"customfield_12825":null,"customfield_12828":null,"customfield_12827":null,"customfield_10400":null,"customfield_12811":null,"customfield_12932":null,"customfield_12934":null,"customfield_12933":null,"customfield_13904":null,"customfield_12936":null,"customfield_13903":null,"customfield_12935":null,"customfield_13906":null,"customfield_12938":null,"customfield_12937":null,"customfield_13905":null,"customfield_13908":null,"customfield_12939":null,"customfield_13909":null,"customfield_12490":null,"customfield_12372":null,"customfield_12493":null,"customfield_12492":null,"customfield_12374":null,"customfield_12495":null,"customfield_13463":null,"customfield_12494":null,"customfield_12376":null,"customfield_13465":null,"customfield_12496":"{panel:bgColor=#FFC400}\r\nThese fields are used to populate request forms in the customer portal. Do not manually change these fields.\r\n{panel}","customfield_13464":null,"customfield_13343":null,"customfield_12499":null,"customfield_13225":null,"customfield_13467":null,"customfield_13466":null,"customfield_13469":null,"customfield_13468":null,"customfield_12480":null,"customfield_13690":null,"customfield_13692":null,"customfield_12482":null,"customfield_13691":null,"customfield_12481":null,"customfield_13694":null,"customfield_12484":null,"customfield_12000":null,"customfield_12362":null,"customfield_12483":null,"customfield_13693":null,"customfield_12002":null,"customfield_13212":null,"customfield_13696":null,"customfield_12001":null,"customfield_13695":null,"customfield_13211":null,"customfield_13335":null,"customfield_12004":null,"customfield_12488":null,"customfield_13698":null,"customfield_13213":null,"customfield_13697":null,"customfield_12003":null,"customfield_12005":null,"labels":[],"customfield_12489":null,"customfield_13699":null,"customfield_13336":null,"customfield_13449":null,"customfield_13207":null,"components":[],"customfield_12471":null,"customfield_13681":null,"customfield_12470":null,"customfield_13680":null,"customfield_13683":null,"customfield_12473":null,"customfield_12110":null,"customfield_13682":null,"customfield_12472":null,"customfield_13685":null,"customfield_12475":null,"customfield_13322":null,"customfield_12112":null,"customfield_12474":null,"customfield_12111":null,"customfield_13684":null,"customfield_12114":{"self":"https://arthrex.atlassian.net/rest/api/2/customFieldOption/11922","value":"No","id":"11922"},"customfield_12477":null,"customfield_13687":null,"customfield_13686":null,"customfield_12476":null,"customfield_12358":null,"customfield_12479":null,"customfield_13689":null,"customfield_13688":null,"customfield_12357":null,"customfield_13325":null,"customfield_12478":null,"customfield_12348":"{panel:title=Alert|titleBGColor=#FFC400|bgColor=#FFFAE6}\r\nPlease make sure that the correct issue type is selected. To select a different issue type, move the issue.\r\n{panel}","customfield_13679":null,"customfield_12106":null,"customfield_12469":null,"customfield_12109":null,"customfield_12108":null,"customfield_12341":null,"customfield_13672":null,"customfield_12340":null,"customfield_12101":null,"customfield_12464":null,"customfield_13674":null,"reporter":{"self":"https://arthrex.atlassian.net/rest/api/2/user?accountId=5dfa6aa75697460cb3d97763","accountId":"5dfa6aa75697460cb3d97763","emailAddress":"patrick.maguschak2@arthrex.com","avatarUrls":{"48x48":"https://avatar-management--avatars.us-west-2.prod.public.atl-paas.net/5dfa6aa75697460cb3d97763/5f2aaf98-63fd-4e3a-a29b-7e163f497fd8/48","24x24":"https://avatar-management--avatars.us-west-2.prod.public.atl-paas.net/5dfa6aa75697460cb3d97763/5f2aaf98-63fd-4e3a-a29b-7e163f497fd8/24","16x16":"https://avatar-management--avatars.us-west-2.prod.public.atl-paas.net/5dfa6aa75697460cb3d97763/5f2aaf98-63fd-4e3a-a29b-7e163f497fd8/16","32x32":"https://avatar-management--avatars.us-west-2.prod.public.atl-paas.net/5dfa6aa75697460cb3d97763/5f2aaf98-63fd-4e3a-a29b-7e163f497fd8/32"},"displayName":"Patrick Maguschak","active":true,"timeZone":"America/New_York","accountType":"atlassian"},"customfield_12343":"{panel:title=Info|titleBGColor=#C0B6F2|bgColor=#EAE6FF}\r\nUse this transition to escalate this issue to another team.\r\n\r\nPlease note that if you select *MRM-DAM Technical*, Jira will automatically create a ticket in Footprints. If you do not wish to create a new Footprints ticket, please select *Disable emails to Footprints* below.\r\n\r\nIf you do not want to be reminded to follow-up on this issue, please select *Disable escalation follow-up* below.\r\n{panel}","customfield_13795":null,"customfield_13673":null,"customfield_12342":null,"customfield_12463":null,"customfield_12345":null,"customfield_12103":null,"customfield_13676":null,"customfield_13797":null,"customfield_12466":null,"customfield_12344":"{panel:title=Info|titleBGColor=#C0B6F2|bgColor=#EAE6FF}\r\nUse this transition to respond to the reporter and request participants.\r\n\r\nIf you do not want to be reminded to follow-up on this issue, select *Disable customer follow-up* below.\r\n{panel}","customfield_13675":null,"customfield_13796":null,"customfield_12347":"{panel:bgColor=#FFC400}\r\n*Note*\r\nThese fields are used to populate request forms in the customer portal. Do not manually change these fields.\r\n{panel}","customfield_12468":null,"customfield_13678":null,"customfield_13799":null,"customfield_12346":null,"customfield_12467":null,"customfield_13798":null,"customfield_13677":null,"customfield_12104":null,"progress":{"progress":0,"total":0},"customfield_13780":null,"customfield_12570":null,"customfield_13782":null,"customfield_12330":null,"customfield_12571":null,"project":{"self":"https://arthrex.atlassian.net/rest/api/2/project/12262","id":"12262","key":"MOB","name":"A Team","projectTypeKey":"software","simplified":false,"avatarUrls":{"48x48":"https://arthrex.atlassian.net/rest/api/2/universal_avatar/view/type/project/avatar/13447","24x24":"https://arthrex.atlassian.net/rest/api/2/universal_avatar/view/type/project/avatar/13447?size=small","16x16":"https://arthrex.atlassian.net/rest/api/2/universal_avatar/view/type/project/avatar/13447?size=xsmall","32x32":"https://arthrex.atlassian.net/rest/api/2/universal_avatar/view/type/project/avatar/13447?size=medium"},"projectCategory":{"self":"https://arthrex.atlassian.net/rest/api/2/projectCategory/10103","id":"10103","description":"","name":"Digital Media - Mobile"}},"customfield_12332":null,"customfield_13783":null,"customfield_12331":null,"customfield_12333":null,"customfield_12336":null,"customfield_12335":null,"customfield_12327":null,"customfield_13779":null,"customfield_12569":null,"customfield_12568":null,"customfield_12329":null,"customfield_12328":null,"resolutiondate":null,"watches":{"self":"https://arthrex.atlassian.net/rest/api/2/issue/MOB-811/watchers","watchCount":1,"isWatching":false},"customfield_13890":null,"customfield_13892":null,"customfield_13771":null,"customfield_12561":null,"customfield_13891":null,"customfield_13770":null,"customfield_12563":null,"customfield_12200":null,"customfield_13652":null,"customfield_12321":null,"customfield_13772":null,"customfield_12562":null,"customfield_12320":null,"customfield_12323":null,"customfield_12202":null,"customfield_12201":null,"customfield_12322":null,"customfield_12564":null,"customfield_12567":null,"customfield_13656":null,"customfield_13655":null,"customfield_12203":null,"customfield_12324":null,"customfield_12566":null,"customfield_12558":null,"customfield_13407":null,"customfield_13769":null,"customfield_12319":null,"updated":"2022-06-10T13:51:50.959-0400","customfield_12790":null,"timeoriginalestimate":null,"customfield_12792":null,"customfield_13760":null,"customfield_12550":null,"description":null,"customfield_12791":null,"customfield_12794":null,"customfield_12552":null,"customfield_13762":null,"customfield_13761":null,"customfield_13640":null,"customfield_11100":" ","customfield_12551":null,"customfield_11101":null,"customfield_12554":null,"customfield_13764":null,"customfield_13763":null,"customfield_11102":{"self":"https://arthrex.atlassian.net/rest/api/2/customFieldOption/10500","value":"1-None","id":"10500"},"customfield_12795":null,"customfield_12553":null,"customfield_13645":null,"customfield_12555":null,"customfield_13765":null,"customfield_11104":null,"customfield_10005":[{"id":1952,"name":"A Team: 6/20/22 - 6/24/22","state":"closed","boardId":286,"goal":"","startDate":"2022-06-20T13:46:12.904Z","endDate":"2022-06-24T12:12:00.000Z","completeDate":"2022-06-24T20:31:59.550Z"},{"id":1904,"name":"A Team: 5/9/22 - 5/13/22","state":"closed","boardId":286,"goal":"","startDate":"2022-05-09T13:36:27.141Z","endDate":"2022-05-13T21:43:00.000Z","completeDate":"2022-05-13T20:16:27.067Z"},{"id":2001,"name":"A Team: 7/11/22 - 7/15/22","state":"closed","boardId":286,"goal":"Prep for Submission of v1.0.0 Rep App iOS Release","startDate":"2022-07-11T13:56:18.821Z","endDate":"2022-07-16T02:15:00.000Z","completeDate":"2022-07-15T21:39:31.202Z"},{"id":1955,"name":"A Team: 6/27/22 - 7/1/22","state":"closed","boardId":286,"goal":"","startDate":"2022-06-27T13:39:51.053Z","endDate":"2022-07-01T16:03:00.000Z","completeDate":"2022-07-01T20:26:58.126Z"},{"id":1940,"name":"A Team: 6/13/22 - 6/17/22","state":"closed","boardId":286,"goal":"","startDate":"2022-06-13T13:23:11.454Z","endDate":"2022-06-17T13:12:00.000Z","completeDate":"2022-06-17T21:12:57.348Z"},{"id":1861,"name":"A Team: 4/18/22 - 4/22/22","state":"closed","boardId":286,"goal":"","startDate":"2022-04-18T13:19:51.131Z","endDate":"2022-04-22T21:22:00.000Z","completeDate":"2022-04-23T00:50:05.964Z"},{"id":1862,"name":"A Team: 4/25/22 - 4/29/22","state":"closed","boardId":286,"goal":"","startDate":"2022-04-25T13:38:51.319Z","endDate":"2022-04-29T21:00:00.000Z","completeDate":"2022-04-29T20:44:00.021Z"},{"id":1929,"name":"A Team: 5/31/22 - 6/10/22","state":"closed","boardId":286,"goal":"","startDate":"2022-05-31T13:20:11.464Z","endDate":"2022-06-10T14:13:00.000Z","completeDate":"2022-06-10T21:09:52.636Z"},{"id":1881,"name":"A Team: 5/2/22 - 5/6/22","state":"closed","boardId":286,"goal":"","startDate":"2022-05-02T13:24:03.040Z","endDate":"2022-05-06T21:59:00.000Z","completeDate":"2022-05-06T20:33:28.823Z"},{"id":1915,"name":"A Team: 5/16/22 - 5/20/22","state":"closed","boardId":286,"goal":"","startDate":"2022-05-16T13:45:22.501Z","endDate":"2022-05-20T21:11:00.000Z","completeDate":"2022-05-20T20:48:44.357Z"},{"id":1916,"name":"A Team: 5/23/22 - 5/27/22","state":"closed","boardId":286,"goal":"","startDate":"2022-05-23T13:46:32.935Z","endDate":"2022-05-27T18:12:00.000Z","completeDate":"2022-05-27T21:18:43.799Z"},{"id":1965,"name":"A Team: 7/5/22 - 7/8/22","state":"closed","boardId":286,"goal":"","startDate":"2022-07-05T13:38:21.073Z","endDate":"2022-07-08T17:26:00.000Z","completeDate":"2022-07-08T21:28:08.661Z"},{"id":1661,"name":"A Team: 7/18/22 - 7/22/22","state":"active","boardId":286,"goal":"AMOBS v1.0.0 and RAI v1.0.0 Releases","startDate":"2022-07-18T13:46:00.383Z","endDate":"2022-07-23T02:21:00.000Z"}],"customfield_12547":null,"customfield_12305":null,"customfield_12789":null,"customfield_12426":null,"customfield_13757":null,"customfield_13636":null,"customfield_12546":null,"customfield_12425":null,"customfield_10006":null,"customfield_12788":null,"customfield_13756":null,"customfield_12304":null,"customfield_13759":null,"customfield_12307":null,"customfield_13998":null,"customfield_12549":null,"customfield_12428":null,"customfield_12548":null,"customfield_12427":null,"customfield_12306":null,"customfield_13758":null,"customfield_12309":null,"customfield_12429":null,"customfield_12308":null,"summary":"Discover Feed Exploration","customfield_12781":null,"customfield_11450":{"self":"https://arthrex.atlassian.net/rest/api/2/customFieldOption/10989","value":"Always","id":"10989"},"customfield_12780":null,"customfield_13993":null,"customfield_12420":null,"customfield_12541":null,"customfield_12783":null,"customfield_13751":null,"customfield_13991":null,"customfield_12540":null,"customfield_12782":null,"customfield_13750":null,"customfield_10000":null,"customfield_10001":null,"customfield_12785":null,"customfield_13753":null,"customfield_12422":null,"customfield_13996":null,"customfield_12300":"{}","customfield_13997":null,"customfield_12784":null,"customfield_13752":null,"customfield_13994":null,"customfield_13755":null,"customfield_12787":null,"customfield_12303":null,"customfield_12545":null,"customfield_12544":null,"customfield_12786":null,"customfield_13754":null,"customfield_12423":null,"customfield_13995":null,"customfield_12415":null,"customfield_13989":null,"customfield_13746":null,"customfield_12778":null,"customfield_11447":null,"customfield_12414":null,"customfield_12777":null,"customfield_13745":null,"customfield_13748":null,"customfield_11449":{"self":"https://arthrex.atlassian.net/rest/api/2/customFieldOption/10986","value":"Live Site","id":"10986"},"customfield_12417":null,"customfield_13987":null,"customfield_11448":null,"customfield_12416":null,"customfield_13505":[],"customfield_12779":null,"customfield_12419":null,"customfield_13749":null,"customfield_12418":null,"comment":{"comments":[],"self":"https://arthrex.atlassian.net/rest/api/2/issue/268522/comment","maxResults":0,"total":0,"startAt":0},"statuscategorychangedate":"2022-02-21T11:34:43.338-0500","customfield_13063":"Testing message","customfield_13062":null,"customfield_14033":null,"customfield_13067":null,"customfield_13066":null,"fixVersions":[],"customfield_10900":null,"customfield_13294":null,"customfield_13052":null,"customfield_13053":null,"epic":null,"customfield_13057":null,"priority":{"self":"https://arthrex.atlassian.net/rest/api/2/priority/4","iconUrl":"https://s3.amazonaws.com/arthrex-public/jira/priorities/minor.png","name":"Minor","id":"4"},"customfield_14028":null,"versions":[],"customfield_13045":null,"customfield_14014":null,"customfield_14015":null,"customfield_13047":null,"customfield_14013":null,"customfield_13046":null,"customfield_14016":null,"customfield_14017":null,"customfield_13391":null,"customfield_13272":null,"customfield_13392":null,"customfield_13274":null,"customfield_13273":null,"aggregateprogress":{"progress":0,"total":0},"customfield_13279":null,"customfield_13380":null,"issuerestriction":{"issuerestrictions":{},"shouldDisplay":false},"customfield_13371":null,"created":"2022-02-21T11:34:36.759-0500","customfield_13373":null,"customfield_13494":null,"customfield_13375":null,"customfield_13012":null,"customfield_13011":null,"customfield_13377":null,"customfield_13376":null,"customfield_13016":null,"customfield_13379":null,"customfield_13378":null,"customfield_13017":null,"customfield_13360":null,"customfield_13362":null,"customfield_13361":null,"customfield_13364":null,"customfield_13122":null,"customfield_13001":null,"customfield_13363":null,"customfield_13000":null,"customfield_13366":"150 GB","customfield_13365":null,"customfield_13002":null,"customfield_13368":null,"customfield_13367":null,"customfield_13369":null,"security":null,"attachment":[],"customfield_13470":null,"customfield_13471":null,"customfield_12385":null,"customfield_13355":null,"customfield_12386":null,"customfield_13357":null,"customfield_13599":null,"customfield_13356":null,"customfield_12388":null,"customfield_13359":null,"customfield_13358":null}},{"expand":"operations,versionedRepresentations,editmeta,changelog,renderedFields","id":"274752","self":"https://arthrex.atlassian.net/rest/agile/1.0/issue/274752","key":"MOB-854","fields":{"parent":{"id":"279628","key":"MOB-929","self":"https://arthrex.atlassian.net/rest/api/2/issue/279628","fields":{"summary":"UX/UI","status":{"self":"https://arthrex.atlassian.net/rest/api/2/status/3","description":"This issue is being actively worked on at the moment by the assignee.","iconUrl":"https://arthrex.atlassian.net/images/icons/statuses/inprogress.png","name":"Working","id":"3","statusCategory":{"self":"https://arthrex.atlassian.net/rest/api/2/statuscategory/4","id":4,"key":"indeterminate","colorName":"yellow","name":"In Progress"}},"priority":{"self":"https://arthrex.atlassian.net/rest/api/2/priority/4","iconUrl":"https://s3.amazonaws.com/arthrex-public/jira/priorities/minor.png","name":"Minor","id":"4"},"issuetype":{"self":"https://arthrex.atlassian.net/rest/api/2/issuetype/3","id":"3","description":"A task that needs to be done.","iconUrl":"https://arthrex.atlassian.net/rest/api/2/universal_avatar/view/type/issuetype/avatar/10318?size=medium","name":"Task","subtask":false,"avatarId":10318,"hierarchyLevel":0}}},"resolution":{"self":"https://arthrex.atlassian.net/rest/api/2/resolution/10000","id":"10000","description":"The issue is done.","name":"Done"},"customfield_12930":null,"customfield_12923":null,"customfield_12924":null,"customfield_12929":null,"lastViewed":null,"customfield_11700":null,"customfield_12912":null,"customfield_11702":null,"customfield_11701":null,"customfield_12914":null,"aggregatetimeoriginalestimate":null,"customfield_12916":null,"customfield_12915":null,"customfield_12918":null,"customfield_12917":null,"issuelinks":[],"customfield_12919":null,"assignee":{"self":"https://arthrex.atlassian.net/rest/api/2/user?accountId=60bac9915fa6f1006fee00b2","accountId":"60bac9915fa6f1006fee00b2","emailAddress":"johnny.ansari@arthrex.com","avatarUrls":{"48x48":"https://secure.gravatar.com/avatar/d887eff1f5130dfab59a6de736562de4?d=https%3A%2F%2Favatar-management--avatars.us-west-2.prod.public.atl-paas.net%2Finitials%2FJA-5.png","24x24":"https://secure.gravatar.com/avatar/d887eff1f5130dfab59a6de736562de4?d=https%3A%2F%2Favatar-management--avatars.us-west-2.prod.public.atl-paas.net%2Finitials%2FJA-5.png","16x16":"https://secure.gravatar.com/avatar/d887eff1f5130dfab59a6de736562de4?d=https%3A%2F%2Favatar-management--avatars.us-west-2.prod.public.atl-paas.net%2Finitials%2FJA-5.png","32x32":"https://secure.gravatar.com/avatar/d887eff1f5130dfab59a6de736562de4?d=https%3A%2F%2Favatar-management--avatars.us-west-2.prod.public.atl-paas.net%2Finitials%2FJA-5.png"},"displayName":"Johnny Ansari","active":true,"timeZone":"America/New_York","accountType":"atlassian"},"customfield_11810":null,"customfield_12901":null,"customfield_11812":null,"customfield_11811":null,"customfield_12903":null,"customfield_11814":null,"customfield_11813":null,"customfield_12902":null,"customfield_11816":null,"customfield_12905":null,"customfield_11815":null,"customfield_12904":null,"customfield_11818":null,"customfield_11817":null,"customfield_12906":null,"subtasks":[],"customfield_11801":null,"customfield_11800":null,"customfield_11802":null,"customfield_11805":null,"customfield_11804":null,"customfield_11807":null,"closedSprints":[{"id":2001,"self":"https://arthrex.atlassian.net/rest/agile/1.0/sprint/2001","state":"closed","name":"A Team: 7/11/22 - 7/15/22","startDate":"2022-07-11T13:56:18.821Z","endDate":"2022-07-16T02:15:00.000Z","completeDate":"2022-07-15T21:39:31.202Z","originBoardId":286,"goal":"Prep for Submission of v1.0.0 Rep App iOS Release"},{"id":1955,"self":"https://arthrex.atlassian.net/rest/agile/1.0/sprint/1955","state":"closed","name":"A Team: 6/27/22 - 7/1/22","startDate":"2022-06-27T13:39:51.053Z","endDate":"2022-07-01T16:03:00.000Z","completeDate":"2022-07-01T20:26:58.126Z","originBoardId":286,"goal":""},{"id":1940,"self":"https://arthrex.atlassian.net/rest/agile/1.0/sprint/1940","state":"closed","name":"A Team: 6/13/22 - 6/17/22","startDate":"2022-06-13T13:23:11.454Z","endDate":"2022-06-17T13:12:00.000Z","completeDate":"2022-06-17T21:12:57.348Z","originBoardId":286,"goal":""},{"id":1861,"self":"https://arthrex.atlassian.net/rest/agile/1.0/sprint/1861","state":"closed","name":"A Team: 4/18/22 - 4/22/22","startDate":"2022-04-18T13:19:51.131Z","endDate":"2022-04-22T21:22:00.000Z","completeDate":"2022-04-23T00:50:05.964Z","originBoardId":286,"goal":""},{"id":1862,"self":"https://arthrex.atlassian.net/rest/agile/1.0/sprint/1862","state":"closed","name":"A Team: 4/25/22 - 4/29/22","startDate":"2022-04-25T13:38:51.319Z","endDate":"2022-04-29T21:00:00.000Z","completeDate":"2022-04-29T20:44:00.021Z","originBoardId":286,"goal":""},{"id":1929,"self":"https://arthrex.atlassian.net/rest/agile/1.0/sprint/1929","state":"closed","name":"A Team: 5/31/22 - 6/10/22","startDate":"2022-05-31T13:20:11.464Z","endDate":"2022-06-10T14:13:00.000Z","completeDate":"2022-06-10T21:09:52.636Z","originBoardId":286,"goal":""},{"id":1881,"self":"https://arthrex.atlassian.net/rest/agile/1.0/sprint/1881","state":"closed","name":"A Team: 5/2/22 - 5/6/22","startDate":"2022-05-02T13:24:03.040Z","endDate":"2022-05-06T21:59:00.000Z","completeDate":"2022-05-06T20:33:28.823Z","originBoardId":286,"goal":""},{"id":1915,"self":"https://arthrex.atlassian.net/rest/agile/1.0/sprint/1915","state":"closed","name":"A Team: 5/16/22 - 5/20/22","startDate":"2022-05-16T13:45:22.501Z","endDate":"2022-05-20T21:11:00.000Z","completeDate":"2022-05-20T20:48:44.357Z","originBoardId":286,"goal":""},{"id":1916,"self":"https://arthrex.atlassian.net/rest/agile/1.0/sprint/1916","state":"closed","name":"A Team: 5/23/22 - 5/27/22","startDate":"2022-05-23T13:46:32.935Z","endDate":"2022-05-27T18:12:00.000Z","completeDate":"2022-05-27T21:18:43.799Z","originBoardId":286,"goal":""},{"id":1965,"self":"https://arthrex.atlassian.net/rest/agile/1.0/sprint/1965","state":"closed","name":"A Team: 7/5/22 - 7/8/22","startDate":"2022-07-05T13:38:21.073Z","endDate":"2022-07-08T17:26:00.000Z","completeDate":"2022-07-08T21:28:08.661Z","originBoardId":286,"goal":""},{"id":1952,"self":"https://arthrex.atlassian.net/rest/agile/1.0/sprint/1952","state":"closed","name":"A Team: 6/20/22 - 6/24/22","startDate":"2022-06-20T13:46:12.904Z","endDate":"2022-06-24T12:12:00.000Z","completeDate":"2022-06-24T20:31:59.550Z","originBoardId":286,"goal":""},{"id":1904,"self":"https://arthrex.atlassian.net/rest/agile/1.0/sprint/1904","state":"closed","name":"A Team: 5/9/22 - 5/13/22","startDate":"2022-05-09T13:36:27.141Z","endDate":"2022-05-13T21:43:00.000Z","completeDate":"2022-05-13T20:16:27.067Z","originBoardId":286,"goal":""}],"customfield_11806":null,"customfield_11809":null,"votes":{"self":"https://arthrex.atlassian.net/rest/api/2/issue/MOB-854/votes","votes":0,"hasVoted":false},"customfield_11808":null,"worklog":{"startAt":0,"maxResults":20,"total":0,"worklogs":[]},"issuetype":{"self":"https://arthrex.atlassian.net/rest/api/2/issuetype/5","id":"5","description":"The sub-task of the issue","iconUrl":"https://arthrex.atlassian.net/rest/api/2/universal_avatar/view/type/issuetype/avatar/10316?size=medium","name":"Sub-task","subtask":true,"avatarId":10316,"hierarchyLevel":-1},"sprint":{"id":1661,"self":"https://arthrex.atlassian.net/rest/agile/1.0/sprint/1661","state":"active","name":"A Team: 7/18/22 - 7/22/22","startDate":"2022-07-18T13:46:00.383Z","endDate":"2022-07-23T02:21:00.000Z","originBoardId":286,"goal":"AMOBS v1.0.0 and RAI v1.0.0 Releases"},"customfield_10700":null,"customfield_10701":[],"customfield_10702":null,"customfield_11901":{"self":"https://arthrex.atlassian.net/rest/api/2/customFieldOption/11506","value":"No","id":"11506"},"customfield_14050":null,"timetracking":{},"customfield_10803":null,"customfield_10806":null,"customfield_14047":null,"customfield_14048":null,"customfield_14046":null,"customfield_14049":null,"environment":null,"duedate":null,"customfield_13980":null,"customfield_13861":null,"customfield_11441":null,"customfield_12772":null,"customfield_13982":null,"customfield_13740":null,"customfield_11440":null,"customfield_13742":null,"customfield_12774":null,"customfield_11443":null,"customfield_12411":null,"customfield_11200":null,"customfield_11442":null,"customfield_11201":null,"customfield_12773":null,"customfield_13741":null,"customfield_12413":null,"customfield_12776":null,"customfield_11202":null,"customfield_13623":null,"customfield_13744":null,"customfield_13986":null,"customfield_12412":null,"customfield_12533":null,"customfield_13985":null,"customfield_11444":null,"customfield_12775":null,"customfield_13743":null,"customfield_13614":null,"customfield_13613":null,"customfield_12645":null,"customfield_11435":null,"customfield_13616":null,"customfield_11438":null,"customfield_13737":null,"customfield_13979":null,"customfield_13615":null,"customfield_11437":null,"customfield_13739":null,"customfield_13617":null,"customfield_11439":null,"customfield_13738":null,"customfield_12409":null,"customfield_11430":null,"customfield_12761":null,"customfield_12760":null,"customfield_13610":null,"customfield_10100":"2|i02f9l:","customfield_11431":null,"customfield_12762":null,"customfield_13975":null,"customfield_11434":null,"customfield_13612":null,"customfield_13611":null,"customfield_13603":null,"customfield_12998":null,"customfield_12756":null,"customfield_12514":null,"customfield_11303":"3_*:*_1_*:*_2304252312_*|*_10000_*:*_1_*:*_1322680003_*|*_10001_*:*_1_*:*_0_*|*_10201_*:*_1_*:*_3541736128","customfield_11425":null,"customfield_12513":null,"customfield_12755":null,"customfield_13602":null,"customfield_11304":null,"customfield_12997":null,"customfield_11427":null,"customfield_13605":null,"customfield_13726":null,"customfield_12758":null,"customfield_13604":null,"customfield_12757":null,"customfield_12999":null,"timeestimate":null,"customfield_12759":null,"customfield_13969":null,"customfield_13606":null,"customfield_13727":null,"customfield_11428":null,"customfield_13729":null,"customfield_13608":null,"status":{"self":"https://arthrex.atlassian.net/rest/api/2/status/10001","description":"","iconUrl":"https://arthrex.atlassian.net/images/icons/subtask.gif","name":"Done","id":"10001","statusCategory":{"self":"https://arthrex.atlassian.net/rest/api/2/statuscategory/3","id":3,"key":"done","colorName":"green","name":"Done"}},"customfield_12750":null,"customfield_12510":null,"customfield_12752":null,"customfield_11300":{"self":"https://arthrex.atlassian.net/rest/api/2/customFieldOption/10700","value":"User Stories:1","id":"10700"},"customfield_12751":null,"customfield_11420":null,"customfield_12996":null,"customfield_13601":null,"customfield_11301":null,"customfield_12754":null,"customfield_11422":null,"customfield_13600":null,"customfield_12753":null,"customfield_12511":null,"customfield_12745":null,"customfield_11414":null,"customfield_12503":null,"customfield_12744":null,"customfield_12502":null,"customfield_12747":null,"customfield_13836":null,"customfield_12505":null,"customfield_13715":null,"customfield_11415":null,"customfield_12504":null,"customfield_12746":null,"customfield_13835":null,"customfield_13956":null,"customfield_11418":null,"customfield_12507":null,"customfield_12749":null,"aggregatetimeestimate":null,"customfield_13837":null,"customfield_13716":null,"customfield_12748":null,"customfield_12508":null,"customfield_11419":null,"creator":{"self":"https://arthrex.atlassian.net/rest/api/2/user?accountId=5dfa6aa75697460cb3d97763","accountId":"5dfa6aa75697460cb3d97763","emailAddress":"patrick.maguschak2@arthrex.com","avatarUrls":{"48x48":"https://avatar-management--avatars.us-west-2.prod.public.atl-paas.net/5dfa6aa75697460cb3d97763/5f2aaf98-63fd-4e3a-a29b-7e163f497fd8/48","24x24":"https://avatar-management--avatars.us-west-2.prod.public.atl-paas.net/5dfa6aa75697460cb3d97763/5f2aaf98-63fd-4e3a-a29b-7e163f497fd8/24","16x16":"https://avatar-management--avatars.us-west-2.prod.public.atl-paas.net/5dfa6aa75697460cb3d97763/5f2aaf98-63fd-4e3a-a29b-7e163f497fd8/16","32x32":"https://avatar-management--avatars.us-west-2.prod.public.atl-paas.net/5dfa6aa75697460cb3d97763/5f2aaf98-63fd-4e3a-a29b-7e163f497fd8/32"},"displayName":"Patrick Maguschak","active":true,"timeZone":"America/New_York","accountType":"atlassian"},"customfield_13830":null,"customfield_10200":"Google Play Store \n\n* 32-bit PNG (with alpha)\n* Dimensions: 512px by 512px\n* Maximum file size: 1024KB\n\nIOS App Store\n[https://developer.apple.com/design/human-interface-guidelines/ios/icons-and-images/app-icon/|https://developer.apple.com/design/human-interface-guidelines/ios/icons-and-images/app-icon/]\n\n||Attribute||Value||\n|Color space|Display P3 (wide-gamut color), sRGB (color), or Gray Gamma 2.2 (grayscale). See [Color Management|https://developer.apple.com/design/human-interface-guidelines/ios/visual-design/color/#color-management].|\n|Format|PNG|\n|Layers|Flattened with no transparency|\n|Resolution|Varies. See [Image Size and Resolution|https://developer.apple.com/design/human-interface-guidelines/ios/icons-and-images/image-size-and-resolution/].|\n|Shape|Square with no rounded corners|","customfield_12743":null,"customfield_12500":null,"customfield_13831":null,"customfield_10202":null,"customfield_11403":{"self":"https://arthrex.atlassian.net/rest/api/2/customFieldOption/10806","value":"Hotline","id":"10806"},"customfield_13702":null,"customfield_11523":null,"customfield_11402":null,"customfield_13701":null,"customfield_12975":null,"customfield_13825":null,"customfield_11526":null,"customfield_13704":null,"customfield_13703":null,"customfield_13824":null,"customfield_11404":null,"customfield_12738":null,"customfield_13827":null,"customfield_13705":null,"customfield_13826":null,"customfield_13829":null,"customfield_11529":null,"timespent":null,"customfield_12972":null,"aggregatetimespent":null,"customfield_12974":null,"customfield_13700":null,"customfield_11401":null,"customfield_11522":null,"customfield_11400":null,"customfield_11521":null,"customfield_13933":null,"customfield_13932":null,"customfield_12843":null,"customfield_11512":null,"customfield_11514":null,"customfield_11519":"3_*:*_1_*:*_2304252312_*|*_10000_*:*_1_*:*_1322680003_*|*_10001_*:*_1_*:*_0_*|*_10201_*:*_1_*:*_3541736128","workratio":-1,"customfield_12840":null,"customfield_13931":null,"customfield_11511":null,"customfield_10300":null,"customfield_12842":null,"customfield_10301":null,"customfield_11510":null,"customfield_12841":null,"customfield_13930":null,"customfield_13801":null,"customfield_12833":null,"customfield_11502":null,"customfield_13800":null,"customfield_11501":{"hasEpicLinkFieldDependency":false,"showField":false,"nonEditableReason":{"reason":"PLUGIN_LICENSE_ERROR","message":"The Parent Link is only available to Jira Premium users."}},"customfield_12832":null,"customfield_13803":null,"customfield_12835":null,"customfield_11504":null,"customfield_13802":null,"customfield_12955":null,"customfield_12834":null,"customfield_11506":null,"customfield_12837":null,"customfield_13805":null,"customfield_13926":null,"customfield_12958":null,"customfield_12836":null,"customfield_11505":null,"customfield_13925":null,"customfield_13804":null,"customfield_12839":null,"customfield_12838":null,"customfield_13808":null,"customfield_11500":null,"customfield_12831":null,"customfield_12830":null,"customfield_12822":null,"customfield_12942":null,"customfield_12824":null,"customfield_12823":null,"flagged":false,"customfield_12825":null,"customfield_12828":null,"customfield_12827":null,"customfield_10400":null,"customfield_12811":null,"customfield_12932":null,"customfield_12934":null,"customfield_12933":null,"customfield_13904":null,"customfield_12936":null,"customfield_12935":null,"customfield_13903":null,"customfield_13906":null,"customfield_12938":null,"customfield_12937":null,"customfield_13905":null,"customfield_13908":null,"customfield_12939":null,"customfield_13909":null,"customfield_12490":null,"customfield_12493":null,"customfield_12372":null,"customfield_12492":null,"customfield_12374":null,"customfield_13463":null,"customfield_12495":null,"customfield_12494":null,"customfield_13465":null,"customfield_12376":null,"customfield_13464":null,"customfield_12496":"{panel:bgColor=#FFC400}\r\nThese fields are used to populate request forms in the customer portal. Do not manually change these fields.\r\n{panel}","customfield_13343":null,"customfield_13467":null,"customfield_13225":null,"customfield_12499":null,"customfield_13466":null,"customfield_13469":null,"customfield_13468":null,"customfield_12480":null,"customfield_13690":null,"customfield_13692":null,"customfield_12482":null,"customfield_13691":null,"customfield_12481":null,"customfield_12000":null,"customfield_12484":null,"customfield_13694":null,"customfield_12362":null,"customfield_13693":null,"customfield_12483":null,"customfield_12002":null,"customfield_13696":null,"customfield_13212":null,"customfield_12001":null,"customfield_13211":null,"customfield_13695":null,"customfield_12004":null,"customfield_13698":null,"customfield_13335":null,"customfield_12488":null,"customfield_12003":null,"customfield_13213":null,"customfield_13697":null,"customfield_13699":null,"customfield_12005":null,"customfield_13336":null,"customfield_12489":null,"labels":[],"customfield_13449":null,"customfield_13207":null,"components":[],"customfield_12471":null,"customfield_13681":null,"customfield_13680":null,"customfield_12470":null,"customfield_12473":null,"customfield_13683":null,"customfield_12110":null,"customfield_13682":null,"customfield_12472":null,"customfield_13685":null,"customfield_13322":null,"customfield_12475":null,"customfield_12112":null,"customfield_12474":null,"customfield_13684":null,"customfield_12111":null,"customfield_12114":{"self":"https://arthrex.atlassian.net/rest/api/2/customFieldOption/11922","value":"No","id":"11922"},"customfield_13687":null,"customfield_12477":null,"customfield_12476":null,"customfield_13686":null,"customfield_12358":null,"customfield_12479":null,"customfield_13689":null,"customfield_12357":null,"customfield_13688":null,"customfield_13325":null,"customfield_12478":null,"customfield_12106":null,"customfield_13679":null,"customfield_12469":null,"customfield_12348":"{panel:title=Alert|titleBGColor=#FFC400|bgColor=#FFFAE6}\r\nPlease make sure that the correct issue type is selected. To select a different issue type, move the issue.\r\n{panel}","customfield_12109":null,"customfield_12108":null,"customfield_12341":null,"customfield_13672":null,"customfield_12340":null,"customfield_13795":null,"reporter":{"self":"https://arthrex.atlassian.net/rest/api/2/user?accountId=5dfa6aa75697460cb3d97763","accountId":"5dfa6aa75697460cb3d97763","emailAddress":"patrick.maguschak2@arthrex.com","avatarUrls":{"48x48":"https://avatar-management--avatars.us-west-2.prod.public.atl-paas.net/5dfa6aa75697460cb3d97763/5f2aaf98-63fd-4e3a-a29b-7e163f497fd8/48","24x24":"https://avatar-management--avatars.us-west-2.prod.public.atl-paas.net/5dfa6aa75697460cb3d97763/5f2aaf98-63fd-4e3a-a29b-7e163f497fd8/24","16x16":"https://avatar-management--avatars.us-west-2.prod.public.atl-paas.net/5dfa6aa75697460cb3d97763/5f2aaf98-63fd-4e3a-a29b-7e163f497fd8/16","32x32":"https://avatar-management--avatars.us-west-2.prod.public.atl-paas.net/5dfa6aa75697460cb3d97763/5f2aaf98-63fd-4e3a-a29b-7e163f497fd8/32"},"displayName":"Patrick Maguschak","active":true,"timeZone":"America/New_York","accountType":"atlassian"},"customfield_12464":null,"customfield_12101":null,"customfield_13674":null,"customfield_12343":"{panel:title=Info|titleBGColor=#C0B6F2|bgColor=#EAE6FF}\r\nUse this transition to escalate this issue to another team.\r\n\r\nPlease note that if you select *MRM-DAM Technical*, Jira will automatically create a ticket in Footprints. If you do not wish to create a new Footprints ticket, please select *Disable emails to Footprints* below.\r\n\r\nIf you do not want to be reminded to follow-up on this issue, please select *Disable escalation follow-up* below.\r\n{panel}","customfield_12342":null,"customfield_13673":null,"customfield_12463":null,"customfield_13676":null,"customfield_12103":null,"customfield_12466":null,"customfield_13797":null,"customfield_12345":null,"customfield_13675":null,"customfield_13796":null,"customfield_12344":"{panel:title=Info|titleBGColor=#C0B6F2|bgColor=#EAE6FF}\r\nUse this transition to respond to the reporter and request participants.\r\n\r\nIf you do not want to be reminded to follow-up on this issue, select *Disable customer follow-up* below.\r\n{panel}","customfield_13678":null,"customfield_12468":null,"customfield_12347":"{panel:bgColor=#FFC400}\r\n*Note*\r\nThese fields are used to populate request forms in the customer portal. Do not manually change these fields.\r\n{panel}","customfield_13799":null,"customfield_12104":null,"customfield_13798":null,"customfield_12346":null,"customfield_12467":null,"customfield_13677":null,"progress":{"progress":0,"total":0},"customfield_12570":null,"customfield_13780":null,"customfield_12330":null,"customfield_13782":null,"customfield_12571":null,"project":{"self":"https://arthrex.atlassian.net/rest/api/2/project/12262","id":"12262","key":"MOB","name":"A Team","projectTypeKey":"software","simplified":false,"avatarUrls":{"48x48":"https://arthrex.atlassian.net/rest/api/2/universal_avatar/view/type/project/avatar/13447","24x24":"https://arthrex.atlassian.net/rest/api/2/universal_avatar/view/type/project/avatar/13447?size=small","16x16":"https://arthrex.atlassian.net/rest/api/2/universal_avatar/view/type/project/avatar/13447?size=xsmall","32x32":"https://arthrex.atlassian.net/rest/api/2/universal_avatar/view/type/project/avatar/13447?size=medium"},"projectCategory":{"self":"https://arthrex.atlassian.net/rest/api/2/projectCategory/10103","id":"10103","description":"","name":"Digital Media - Mobile"}},"customfield_12332":null,"customfield_12331":null,"customfield_13783":null,"customfield_12333":null,"customfield_12336":null,"customfield_12335":null,"customfield_13779":null,"customfield_12327":null,"customfield_12569":null,"customfield_12568":null,"customfield_12329":null,"customfield_12328":null,"resolutiondate":"2022-06-14T08:52:12.706-0400","watches":{"self":"https://arthrex.atlassian.net/rest/api/2/issue/MOB-854/watchers","watchCount":2,"isWatching":false},"customfield_13890":null,"customfield_13771":null,"customfield_12561":null,"customfield_13892":null,"customfield_13891":null,"customfield_13770":null,"customfield_12321":null,"customfield_13652":null,"customfield_12563":null,"customfield_12200":null,"customfield_13772":null,"customfield_12320":null,"customfield_12562":null,"customfield_12202":null,"customfield_12323":null,"customfield_12322":null,"customfield_12564":null,"customfield_12201":null,"customfield_12567":null,"customfield_13656":null,"customfield_12203":null,"customfield_12566":null,"customfield_13655":null,"customfield_12324":null,"customfield_12558":null,"customfield_13407":null,"customfield_13769":null,"customfield_12319":null,"updated":"2022-06-14T08:52:12.748-0400","customfield_12790":null,"timeoriginalestimate":null,"customfield_12792":null,"customfield_13760":null,"customfield_12550":null,"customfield_12791":null,"description":"Figma: [https://www.figma.com/file/EfuIh1xxesdqjLaW4gHxsy/?node-id=1331%3A7244|https://www.figma.com/file/EfuIh1xxesdqjLaW4gHxsy/?node-id=1331%3A7244|smart-link] ","customfield_13762":null,"customfield_12794":null,"customfield_12552":null,"customfield_11100":" ","customfield_13761":null,"customfield_12551":null,"customfield_13640":null,"customfield_11101":null,"customfield_13764":null,"customfield_12554":null,"customfield_11102":{"self":"https://arthrex.atlassian.net/rest/api/2/customFieldOption/10500","value":"1-None","id":"10500"},"customfield_13763":null,"customfield_12795":null,"customfield_12553":null,"customfield_13645":null,"customfield_13765":null,"customfield_12555":null,"customfield_11104":null,"customfield_10005":[{"id":1952,"name":"A Team: 6/20/22 - 6/24/22","state":"closed","boardId":286,"goal":"","startDate":"2022-06-20T13:46:12.904Z","endDate":"2022-06-24T12:12:00.000Z","completeDate":"2022-06-24T20:31:59.550Z"},{"id":1904,"name":"A Team: 5/9/22 - 5/13/22","state":"closed","boardId":286,"goal":"","startDate":"2022-05-09T13:36:27.141Z","endDate":"2022-05-13T21:43:00.000Z","completeDate":"2022-05-13T20:16:27.067Z"},{"id":2001,"name":"A Team: 7/11/22 - 7/15/22","state":"closed","boardId":286,"goal":"Prep for Submission of v1.0.0 Rep App iOS Release","startDate":"2022-07-11T13:56:18.821Z","endDate":"2022-07-16T02:15:00.000Z","completeDate":"2022-07-15T21:39:31.202Z"},{"id":1955,"name":"A Team: 6/27/22 - 7/1/22","state":"closed","boardId":286,"goal":"","startDate":"2022-06-27T13:39:51.053Z","endDate":"2022-07-01T16:03:00.000Z","completeDate":"2022-07-01T20:26:58.126Z"},{"id":1940,"name":"A Team: 6/13/22 - 6/17/22","state":"closed","boardId":286,"goal":"","startDate":"2022-06-13T13:23:11.454Z","endDate":"2022-06-17T13:12:00.000Z","completeDate":"2022-06-17T21:12:57.348Z"},{"id":1861,"name":"A Team: 4/18/22 - 4/22/22","state":"closed","boardId":286,"goal":"","startDate":"2022-04-18T13:19:51.131Z","endDate":"2022-04-22T21:22:00.000Z","completeDate":"2022-04-23T00:50:05.964Z"},{"id":1862,"name":"A Team: 4/25/22 - 4/29/22","state":"closed","boardId":286,"goal":"","startDate":"2022-04-25T13:38:51.319Z","endDate":"2022-04-29T21:00:00.000Z","completeDate":"2022-04-29T20:44:00.021Z"},{"id":1929,"name":"A Team: 5/31/22 - 6/10/22","state":"closed","boardId":286,"goal":"","startDate":"2022-05-31T13:20:11.464Z","endDate":"2022-06-10T14:13:00.000Z","completeDate":"2022-06-10T21:09:52.636Z"},{"id":1881,"name":"A Team: 5/2/22 - 5/6/22","state":"closed","boardId":286,"goal":"","startDate":"2022-05-02T13:24:03.040Z","endDate":"2022-05-06T21:59:00.000Z","completeDate":"2022-05-06T20:33:28.823Z"},{"id":1915,"name":"A Team: 5/16/22 - 5/20/22","state":"closed","boardId":286,"goal":"","startDate":"2022-05-16T13:45:22.501Z","endDate":"2022-05-20T21:11:00.000Z","completeDate":"2022-05-20T20:48:44.357Z"},{"id":1916,"name":"A Team: 5/23/22 - 5/27/22","state":"closed","boardId":286,"goal":"","startDate":"2022-05-23T13:46:32.935Z","endDate":"2022-05-27T18:12:00.000Z","completeDate":"2022-05-27T21:18:43.799Z"},{"id":1965,"name":"A Team: 7/5/22 - 7/8/22","state":"closed","boardId":286,"goal":"","startDate":"2022-07-05T13:38:21.073Z","endDate":"2022-07-08T17:26:00.000Z","completeDate":"2022-07-08T21:28:08.661Z"},{"id":1661,"name":"A Team: 7/18/22 - 7/22/22","state":"active","boardId":286,"goal":"AMOBS v1.0.0 and RAI v1.0.0 Releases","startDate":"2022-07-18T13:46:00.383Z","endDate":"2022-07-23T02:21:00.000Z"}],"customfield_12547":null,"customfield_12426":null,"customfield_13757":null,"customfield_12789":null,"customfield_13636":null,"customfield_12305":null,"customfield_12304":null,"customfield_12425":null,"customfield_10006":null,"customfield_12546":null,"customfield_13756":null,"customfield_12788":null,"customfield_13998":null,"customfield_13759":null,"customfield_12307":null,"customfield_12549":null,"customfield_12428":null,"customfield_12548":null,"customfield_13758":null,"customfield_12306":null,"customfield_12427":null,"customfield_12309":null,"customfield_12429":null,"customfield_12308":null,"summary":"Rep APP Logo","customfield_12781":null,"customfield_11450":{"self":"https://arthrex.atlassian.net/rest/api/2/customFieldOption/10989","value":"Always","id":"10989"},"customfield_12780":null,"customfield_13993":null,"customfield_12541":null,"customfield_12783":null,"customfield_12420":null,"customfield_13751":null,"customfield_12782":null,"customfield_13750":null,"customfield_12540":null,"customfield_13991":null,"customfield_10000":null,"customfield_13753":null,"customfield_12422":null,"customfield_10001":null,"customfield_13996":null,"customfield_12785":null,"customfield_13997":null,"customfield_12300":"{}","customfield_12784":null,"customfield_13752":null,"customfield_13755":null,"customfield_12303":null,"customfield_13994":null,"customfield_12545":null,"customfield_12787":null,"customfield_12544":null,"customfield_12786":null,"customfield_13754":null,"customfield_13995":null,"customfield_12423":null,"customfield_13746":null,"customfield_12778":null,"customfield_11447":null,"customfield_12415":null,"customfield_13989":null,"customfield_12777":null,"customfield_12414":null,"customfield_13745":null,"customfield_13987":null,"customfield_12417":null,"customfield_11449":{"self":"https://arthrex.atlassian.net/rest/api/2/customFieldOption/10986","value":"Live Site","id":"10986"},"customfield_13748":null,"customfield_12416":null,"customfield_13505":[],"customfield_12779":null,"customfield_11448":null,"customfield_12419":null,"customfield_12418":null,"customfield_13749":null,"comment":{"comments":[],"self":"https://arthrex.atlassian.net/rest/api/2/issue/274752/comment","maxResults":0,"total":0,"startAt":0},"statuscategorychangedate":"2022-06-14T08:52:12.749-0400","customfield_13063":"Testing message","customfield_14033":null,"customfield_13062":null,"customfield_13067":null,"customfield_13066":null,"fixVersions":[],"customfield_10900":null,"customfield_13294":null,"customfield_13052":null,"customfield_13053":null,"epic":null,"customfield_13057":null,"priority":{"self":"https://arthrex.atlassian.net/rest/api/2/priority/4","iconUrl":"https://s3.amazonaws.com/arthrex-public/jira/priorities/minor.png","name":"Minor","id":"4"},"customfield_14028":null,"versions":[],"customfield_14014":null,"customfield_13045":null,"customfield_14015":null,"customfield_13047":null,"customfield_13046":null,"customfield_14013":null,"customfield_14016":null,"customfield_14017":null,"customfield_13391":null,"customfield_13272":null,"customfield_13392":null,"customfield_13274":null,"customfield_13273":null,"aggregateprogress":{"progress":0,"total":0},"customfield_13279":null,"customfield_13380":null,"issuerestriction":{"issuerestrictions":{},"shouldDisplay":false},"customfield_13371":null,"customfield_13373":null,"created":"2022-03-23T09:34:24.359-0400","customfield_13494":null,"customfield_13012":null,"customfield_13375":null,"customfield_13011":null,"customfield_13377":null,"customfield_13376":null,"customfield_13016":null,"customfield_13379":null,"customfield_13378":null,"customfield_13017":null,"customfield_13360":null,"customfield_13362":null,"customfield_13361":null,"customfield_13001":null,"customfield_13364":null,"customfield_13122":null,"customfield_13363":null,"customfield_13000":null,"customfield_13366":"150 GB","customfield_13002":null,"customfield_13365":null,"customfield_13368":null,"customfield_13367":null,"customfield_13369":null,"security":null,"attachment":[],"customfield_13470":null,"customfield_13471":null,"customfield_12385":null,"customfield_13355":null,"customfield_12386":null,"customfield_13599":null,"customfield_13357":null,"customfield_12388":null,"customfield_13356":null,"customfield_13359":null,"customfield_13358":null}},{"expand":"operations,versionedRepresentations,editmeta,changelog,renderedFields","id":"281424","self":"https://arthrex.atlassian.net/rest/agile/1.0/issue/281424","key":"MOB-960","fields":{"parent":{"id":"279628","key":"MOB-929","self":"https://arthrex.atlassian.net/rest/api/2/issue/279628","fields":{"summary":"UX/UI","status":{"self":"https://arthrex.atlassian.net/rest/api/2/status/3","description":"This issue is being actively worked on at the moment by the assignee.","iconUrl":"https://arthrex.atlassian.net/images/icons/statuses/inprogress.png","name":"Working","id":"3","statusCategory":{"self":"https://arthrex.atlassian.net/rest/api/2/statuscategory/4","id":4,"key":"indeterminate","colorName":"yellow","name":"In Progress"}},"priority":{"self":"https://arthrex.atlassian.net/rest/api/2/priority/4","iconUrl":"https://s3.amazonaws.com/arthrex-public/jira/priorities/minor.png","name":"Minor","id":"4"},"issuetype":{"self":"https://arthrex.atlassian.net/rest/api/2/issuetype/3","id":"3","description":"A task that needs to be done.","iconUrl":"https://arthrex.atlassian.net/rest/api/2/universal_avatar/view/type/issuetype/avatar/10318?size=medium","name":"Task","subtask":false,"avatarId":10318,"hierarchyLevel":0}}},"resolution":null,"customfield_12930":null,"customfield_12923":null,"customfield_12924":null,"customfield_12929":null,"lastViewed":null,"customfield_11700":null,"customfield_12912":null,"customfield_11702":null,"customfield_11701":null,"aggregatetimeoriginalestimate":null,"customfield_12914":null,"customfield_12916":null,"customfield_12915":null,"customfield_12918":null,"customfield_12917":null,"issuelinks":[],"assignee":null,"customfield_12919":null,"customfield_11810":null,"customfield_11812":null,"customfield_12901":null,"customfield_11811":null,"customfield_11814":null,"customfield_12903":null,"customfield_12902":null,"customfield_11813":null,"customfield_12905":null,"customfield_11816":null,"customfield_11815":null,"customfield_12904":null,"customfield_11818":null,"customfield_12906":null,"customfield_11817":null,"subtasks":[],"customfield_11801":null,"customfield_11800":null,"customfield_11802":null,"customfield_11805":null,"customfield_11804":null,"customfield_11807":null,"closedSprints":[{"id":2001,"self":"https://arthrex.atlassian.net/rest/agile/1.0/sprint/2001","state":"closed","name":"A Team: 7/11/22 - 7/15/22","startDate":"2022-07-11T13:56:18.821Z","endDate":"2022-07-16T02:15:00.000Z","completeDate":"2022-07-15T21:39:31.202Z","originBoardId":286,"goal":"Prep for Submission of v1.0.0 Rep App iOS Release"},{"id":1955,"self":"https://arthrex.atlassian.net/rest/agile/1.0/sprint/1955","state":"closed","name":"A Team: 6/27/22 - 7/1/22","startDate":"2022-06-27T13:39:51.053Z","endDate":"2022-07-01T16:03:00.000Z","completeDate":"2022-07-01T20:26:58.126Z","originBoardId":286,"goal":""},{"id":1940,"self":"https://arthrex.atlassian.net/rest/agile/1.0/sprint/1940","state":"closed","name":"A Team: 6/13/22 - 6/17/22","startDate":"2022-06-13T13:23:11.454Z","endDate":"2022-06-17T13:12:00.000Z","completeDate":"2022-06-17T21:12:57.348Z","originBoardId":286,"goal":""},{"id":1861,"self":"https://arthrex.atlassian.net/rest/agile/1.0/sprint/1861","state":"closed","name":"A Team: 4/18/22 - 4/22/22","startDate":"2022-04-18T13:19:51.131Z","endDate":"2022-04-22T21:22:00.000Z","completeDate":"2022-04-23T00:50:05.964Z","originBoardId":286,"goal":""},{"id":1862,"self":"https://arthrex.atlassian.net/rest/agile/1.0/sprint/1862","state":"closed","name":"A Team: 4/25/22 - 4/29/22","startDate":"2022-04-25T13:38:51.319Z","endDate":"2022-04-29T21:00:00.000Z","completeDate":"2022-04-29T20:44:00.021Z","originBoardId":286,"goal":""},{"id":1929,"self":"https://arthrex.atlassian.net/rest/agile/1.0/sprint/1929","state":"closed","name":"A Team: 5/31/22 - 6/10/22","startDate":"2022-05-31T13:20:11.464Z","endDate":"2022-06-10T14:13:00.000Z","completeDate":"2022-06-10T21:09:52.636Z","originBoardId":286,"goal":""},{"id":1881,"self":"https://arthrex.atlassian.net/rest/agile/1.0/sprint/1881","state":"closed","name":"A Team: 5/2/22 - 5/6/22","startDate":"2022-05-02T13:24:03.040Z","endDate":"2022-05-06T21:59:00.000Z","completeDate":"2022-05-06T20:33:28.823Z","originBoardId":286,"goal":""},{"id":1915,"self":"https://arthrex.atlassian.net/rest/agile/1.0/sprint/1915","state":"closed","name":"A Team: 5/16/22 - 5/20/22","startDate":"2022-05-16T13:45:22.501Z","endDate":"2022-05-20T21:11:00.000Z","completeDate":"2022-05-20T20:48:44.357Z","originBoardId":286,"goal":""},{"id":1916,"self":"https://arthrex.atlassian.net/rest/agile/1.0/sprint/1916","state":"closed","name":"A Team: 5/23/22 - 5/27/22","startDate":"2022-05-23T13:46:32.935Z","endDate":"2022-05-27T18:12:00.000Z","completeDate":"2022-05-27T21:18:43.799Z","originBoardId":286,"goal":""},{"id":1965,"self":"https://arthrex.atlassian.net/rest/agile/1.0/sprint/1965","state":"closed","name":"A Team: 7/5/22 - 7/8/22","startDate":"2022-07-05T13:38:21.073Z","endDate":"2022-07-08T17:26:00.000Z","completeDate":"2022-07-08T21:28:08.661Z","originBoardId":286,"goal":""},{"id":1952,"self":"https://arthrex.atlassian.net/rest/agile/1.0/sprint/1952","state":"closed","name":"A Team: 6/20/22 - 6/24/22","startDate":"2022-06-20T13:46:12.904Z","endDate":"2022-06-24T12:12:00.000Z","completeDate":"2022-06-24T20:31:59.550Z","originBoardId":286,"goal":""},{"id":1904,"self":"https://arthrex.atlassian.net/rest/agile/1.0/sprint/1904","state":"closed","name":"A Team: 5/9/22 - 5/13/22","startDate":"2022-05-09T13:36:27.141Z","endDate":"2022-05-13T21:43:00.000Z","completeDate":"2022-05-13T20:16:27.067Z","originBoardId":286,"goal":""}],"customfield_11806":null,"customfield_11809":null,"votes":{"self":"https://arthrex.atlassian.net/rest/api/2/issue/MOB-960/votes","votes":0,"hasVoted":false},"worklog":{"startAt":0,"maxResults":20,"total":0,"worklogs":[]},"customfield_11808":null,"issuetype":{"self":"https://arthrex.atlassian.net/rest/api/2/issuetype/5","id":"5","description":"The sub-task of the issue","iconUrl":"https://arthrex.atlassian.net/rest/api/2/universal_avatar/view/type/issuetype/avatar/10316?size=medium","name":"Sub-task","subtask":true,"avatarId":10316,"hierarchyLevel":-1},"sprint":{"id":1661,"self":"https://arthrex.atlassian.net/rest/agile/1.0/sprint/1661","state":"active","name":"A Team: 7/18/22 - 7/22/22","startDate":"2022-07-18T13:46:00.383Z","endDate":"2022-07-23T02:21:00.000Z","originBoardId":286,"goal":"AMOBS v1.0.0 and RAI v1.0.0 Releases"},"customfield_10700":null,"customfield_10701":[],"customfield_10702":null,"customfield_11901":{"self":"https://arthrex.atlassian.net/rest/api/2/customFieldOption/11506","value":"No","id":"11506"},"customfield_14050":null,"timetracking":{},"customfield_10803":null,"customfield_10806":null,"customfield_14047":null,"customfield_14048":null,"customfield_14046":null,"customfield_14049":null,"environment":null,"duedate":null,"customfield_13980":null,"customfield_11441":null,"customfield_13982":null,"customfield_13740":null,"customfield_12772":null,"customfield_13861":null,"customfield_11440":null,"customfield_11443":null,"customfield_12411":null,"customfield_11200":null,"customfield_12774":null,"customfield_13742":null,"customfield_13741":null,"customfield_11201":null,"customfield_12773":null,"customfield_11442":null,"customfield_12413":null,"customfield_13986":null,"customfield_12776":null,"customfield_13744":null,"customfield_13623":null,"customfield_11202":null,"customfield_12775":null,"customfield_11444":null,"customfield_12412":null,"customfield_13985":null,"customfield_13743":null,"customfield_12533":null,"customfield_13614":null,"customfield_11435":null,"customfield_13613":null,"customfield_12645":null,"customfield_13616":null,"customfield_13737":null,"customfield_13979":null,"customfield_11438":null,"customfield_13615":null,"customfield_11437":null,"customfield_13739":null,"customfield_11439":null,"customfield_13738":null,"customfield_13617":null,"customfield_12409":null,"customfield_11430":null,"customfield_12761":null,"customfield_12760":null,"customfield_10100":"2|i02f9l:n","customfield_13610":null,"customfield_12762":null,"customfield_11431":null,"customfield_11434":null,"customfield_13975":null,"customfield_13612":null,"customfield_13611":null,"customfield_11425":null,"customfield_11303":null,"customfield_12756":null,"customfield_13603":null,"customfield_12514":null,"customfield_12998":null,"customfield_11304":"2022-05-24T08:31:28.679-0400","customfield_12755":null,"customfield_12997":null,"customfield_13602":null,"customfield_12513":null,"customfield_13605":null,"customfield_13726":null,"customfield_11427":null,"customfield_12758":null,"customfield_12999":null,"customfield_12757":null,"customfield_13604":null,"timeestimate":null,"customfield_13606":null,"customfield_12759":null,"customfield_13727":null,"customfield_13969":null,"customfield_11428":null,"customfield_13608":null,"customfield_13729":null,"status":{"self":"https://arthrex.atlassian.net/rest/api/2/status/10201","description":"This status is managed internally by JIRA Software","iconUrl":"https://arthrex.atlassian.net/images/icons/subtask.gif","name":"In Review","id":"10201","statusCategory":{"self":"https://arthrex.atlassian.net/rest/api/2/statuscategory/4","id":4,"key":"indeterminate","colorName":"yellow","name":"In Progress"}},"customfield_12750":null,"customfield_12752":null,"customfield_12510":null,"customfield_11300":{"self":"https://arthrex.atlassian.net/rest/api/2/customFieldOption/10700","value":"User Stories:1","id":"10700"},"customfield_11420":null,"customfield_12751":null,"customfield_13601":null,"customfield_12754":null,"customfield_12996":null,"customfield_11301":null,"customfield_11422":null,"customfield_12511":null,"customfield_13600":null,"customfield_12753":null,"customfield_11414":null,"customfield_12503":null,"customfield_12745":null,"customfield_12744":null,"customfield_12502":null,"customfield_12505":null,"customfield_13836":null,"customfield_13715":null,"customfield_12747":null,"customfield_13835":null,"customfield_11415":null,"customfield_12746":null,"customfield_12504":null,"customfield_13956":null,"customfield_12749":null,"customfield_12507":null,"aggregatetimeestimate":null,"customfield_11418":null,"customfield_13716":null,"customfield_12748":null,"customfield_13837":null,"customfield_12508":null,"customfield_11419":null,"creator":{"self":"https://arthrex.atlassian.net/rest/api/2/user?accountId=5dfa6aa75697460cb3d97763","accountId":"5dfa6aa75697460cb3d97763","emailAddress":"patrick.maguschak2@arthrex.com","avatarUrls":{"48x48":"https://avatar-management--avatars.us-west-2.prod.public.atl-paas.net/5dfa6aa75697460cb3d97763/5f2aaf98-63fd-4e3a-a29b-7e163f497fd8/48","24x24":"https://avatar-management--avatars.us-west-2.prod.public.atl-paas.net/5dfa6aa75697460cb3d97763/5f2aaf98-63fd-4e3a-a29b-7e163f497fd8/24","16x16":"https://avatar-management--avatars.us-west-2.prod.public.atl-paas.net/5dfa6aa75697460cb3d97763/5f2aaf98-63fd-4e3a-a29b-7e163f497fd8/16","32x32":"https://avatar-management--avatars.us-west-2.prod.public.atl-paas.net/5dfa6aa75697460cb3d97763/5f2aaf98-63fd-4e3a-a29b-7e163f497fd8/32"},"displayName":"Patrick Maguschak","active":true,"timeZone":"America/New_York","accountType":"atlassian"},"customfield_13830":null,"customfield_10200":null,"customfield_12743":null,"customfield_13831":null,"customfield_12500":null,"customfield_10202":null,"customfield_11403":{"self":"https://arthrex.atlassian.net/rest/api/2/customFieldOption/10806","value":"Hotline","id":"10806"},"customfield_13702":null,"customfield_12975":null,"customfield_13701":null,"customfield_11523":null,"customfield_11402":null,"customfield_13825":null,"customfield_11526":null,"customfield_13704":null,"customfield_11404":null,"customfield_13824":null,"customfield_13703":null,"customfield_12738":null,"customfield_13827":null,"customfield_13705":null,"customfield_13826":null,"customfield_13829":null,"customfield_11529":null,"timespent":null,"customfield_12972":null,"aggregatetimespent":null,"customfield_11522":null,"customfield_12974":null,"customfield_13700":null,"customfield_11401":null,"customfield_11521":null,"customfield_11400":null,"customfield_13933":null,"customfield_12843":null,"customfield_13932":null,"customfield_11512":null,"customfield_11514":null,"customfield_11519":null,"workratio":-1,"customfield_12840":null,"customfield_11511":null,"customfield_13931":null,"customfield_10300":null,"customfield_12842":null,"customfield_12841":null,"customfield_10301":null,"customfield_11510":null,"customfield_13930":null,"customfield_12833":null,"customfield_13801":null,"customfield_11502":null,"customfield_12832":null,"customfield_11501":{"hasEpicLinkFieldDependency":false,"showField":false,"nonEditableReason":{"reason":"PLUGIN_LICENSE_ERROR","message":"The Parent Link is only available to Jira Premium users."}},"customfield_13800":null,"customfield_11504":null,"customfield_13803":null,"customfield_12835":null,"customfield_12834":null,"customfield_13802":null,"customfield_12955":null,"customfield_12837":null,"customfield_13926":null,"customfield_12958":null,"customfield_11506":null,"customfield_13805":null,"customfield_11505":null,"customfield_12836":null,"customfield_13925":null,"customfield_13804":null,"customfield_12839":null,"customfield_12838":null,"customfield_13808":null,"customfield_12831":null,"customfield_11500":null,"customfield_12830":null,"customfield_12822":null,"customfield_12942":null,"customfield_12824":null,"customfield_12823":null,"flagged":false,"customfield_12825":null,"customfield_12828":null,"customfield_12827":null,"customfield_10400":null,"customfield_12811":null,"customfield_12932":null,"customfield_12934":null,"customfield_12933":null,"customfield_13904":null,"customfield_12936":null,"customfield_12935":null,"customfield_13903":null,"customfield_13906":null,"customfield_12938":null,"customfield_12937":null,"customfield_13905":null,"customfield_13908":null,"customfield_12939":null,"customfield_13909":null,"customfield_12490":null,"customfield_12493":null,"customfield_12372":null,"customfield_12492":null,"customfield_13463":null,"customfield_12374":null,"customfield_12495":null,"customfield_12494":null,"customfield_13465":null,"customfield_12376":null,"customfield_13464":null,"customfield_12496":"{panel:bgColor=#FFC400}\r\nThese fields are used to populate request forms in the customer portal. Do not manually change these fields.\r\n{panel}","customfield_13343":null,"customfield_13467":null,"customfield_12499":null,"customfield_13225":null,"customfield_13466":null,"customfield_13469":null,"customfield_13468":null,"customfield_12480":null,"customfield_13690":null,"customfield_13692":null,"customfield_12482":null,"customfield_13691":null,"customfield_12481":null,"customfield_12484":null,"customfield_12000":null,"customfield_13694":null,"customfield_13693":null,"customfield_12362":null,"customfield_12483":null,"customfield_13212":null,"customfield_13696":null,"customfield_12002":null,"customfield_13211":null,"customfield_12001":null,"customfield_13695":null,"customfield_12488":null,"customfield_13698":null,"customfield_13335":null,"customfield_12004":null,"customfield_13213":null,"customfield_13697":null,"customfield_12003":null,"labels":[],"customfield_13699":null,"customfield_12489":null,"customfield_13336":null,"customfield_12005":null,"customfield_13207":null,"customfield_13449":null,"components":[],"customfield_12471":null,"customfield_13681":null,"customfield_12470":null,"customfield_13680":null,"customfield_12110":null,"customfield_12473":null,"customfield_13683":null,"customfield_13682":null,"customfield_12472":null,"customfield_13685":null,"customfield_13322":null,"customfield_12112":null,"customfield_12475":null,"customfield_12111":null,"customfield_13684":null,"customfield_12474":null,"customfield_13687":null,"customfield_12114":{"self":"https://arthrex.atlassian.net/rest/api/2/customFieldOption/11922","value":"No","id":"11922"},"customfield_12477":null,"customfield_13686":null,"customfield_12476":null,"customfield_12358":null,"customfield_13689":null,"customfield_12479":null,"customfield_12478":null,"customfield_13688":null,"customfield_13325":null,"customfield_12357":null,"customfield_12469":null,"customfield_12348":"{panel:title=Alert|titleBGColor=#FFC400|bgColor=#FFFAE6}\r\nPlease make sure that the correct issue type is selected. To select a different issue type, move the issue.\r\n{panel}","customfield_12106":null,"customfield_13679":null,"customfield_12109":null,"customfield_12108":null,"customfield_13672":null,"customfield_12341":null,"customfield_12340":null,"reporter":{"self":"https://arthrex.atlassian.net/rest/api/2/user?accountId=5dfa6aa75697460cb3d97763","accountId":"5dfa6aa75697460cb3d97763","emailAddress":"patrick.maguschak2@arthrex.com","avatarUrls":{"48x48":"https://avatar-management--avatars.us-west-2.prod.public.atl-paas.net/5dfa6aa75697460cb3d97763/5f2aaf98-63fd-4e3a-a29b-7e163f497fd8/48","24x24":"https://avatar-management--avatars.us-west-2.prod.public.atl-paas.net/5dfa6aa75697460cb3d97763/5f2aaf98-63fd-4e3a-a29b-7e163f497fd8/24","16x16":"https://avatar-management--avatars.us-west-2.prod.public.atl-paas.net/5dfa6aa75697460cb3d97763/5f2aaf98-63fd-4e3a-a29b-7e163f497fd8/16","32x32":"https://avatar-management--avatars.us-west-2.prod.public.atl-paas.net/5dfa6aa75697460cb3d97763/5f2aaf98-63fd-4e3a-a29b-7e163f497fd8/32"},"displayName":"Patrick Maguschak","active":true,"timeZone":"America/New_York","accountType":"atlassian"},"customfield_12464":null,"customfield_13674":null,"customfield_12343":"{panel:title=Info|titleBGColor=#C0B6F2|bgColor=#EAE6FF}\r\nUse this transition to escalate this issue to another team.\r\n\r\nPlease note that if you select *MRM-DAM Technical*, Jira will automatically create a ticket in Footprints. If you do not wish to create a new Footprints ticket, please select *Disable emails to Footprints* below.\r\n\r\nIf you do not want to be reminded to follow-up on this issue, please select *Disable escalation follow-up* below.\r\n{panel}","customfield_12101":null,"customfield_13795":null,"customfield_13673":null,"customfield_12463":null,"customfield_12342":null,"customfield_13676":null,"customfield_12103":null,"customfield_12345":null,"customfield_12466":null,"customfield_13797":null,"customfield_13796":null,"customfield_13675":null,"customfield_12344":"{panel:title=Info|titleBGColor=#C0B6F2|bgColor=#EAE6FF}\r\nUse this transition to respond to the reporter and request participants.\r\n\r\nIf you do not want to be reminded to follow-up on this issue, select *Disable customer follow-up* below.\r\n{panel}","customfield_12347":"{panel:bgColor=#FFC400}\r\n*Note*\r\nThese fields are used to populate request forms in the customer portal. Do not manually change these fields.\r\n{panel}","customfield_12468":null,"customfield_13799":null,"customfield_13678":null,"customfield_12104":null,"customfield_13677":null,"customfield_12467":null,"customfield_13798":null,"customfield_12346":null,"progress":{"progress":0,"total":0},"customfield_12570":null,"customfield_13780":null,"customfield_12330":null,"customfield_13782":null,"project":{"self":"https://arthrex.atlassian.net/rest/api/2/project/12262","id":"12262","key":"MOB","name":"A Team","projectTypeKey":"software","simplified":false,"avatarUrls":{"48x48":"https://arthrex.atlassian.net/rest/api/2/universal_avatar/view/type/project/avatar/13447","24x24":"https://arthrex.atlassian.net/rest/api/2/universal_avatar/view/type/project/avatar/13447?size=small","16x16":"https://arthrex.atlassian.net/rest/api/2/universal_avatar/view/type/project/avatar/13447?size=xsmall","32x32":"https://arthrex.atlassian.net/rest/api/2/universal_avatar/view/type/project/avatar/13447?size=medium"},"projectCategory":{"self":"https://arthrex.atlassian.net/rest/api/2/projectCategory/10103","id":"10103","description":"","name":"Digital Media - Mobile"}},"customfield_12571":null,"customfield_12332":null,"customfield_12331":null,"customfield_13783":null,"customfield_12333":null,"customfield_12336":null,"customfield_12335":null,"customfield_12327":null,"customfield_12569":null,"customfield_13779":null,"customfield_12568":null,"customfield_12329":null,"customfield_12328":null,"resolutiondate":null,"watches":{"self":"https://arthrex.atlassian.net/rest/api/2/issue/MOB-960/watchers","watchCount":2,"isWatching":false},"customfield_13890":null,"customfield_12561":null,"customfield_13771":null,"customfield_13892":null,"customfield_13770":null,"customfield_13891":null,"customfield_12563":null,"customfield_12200":null,"customfield_12321":null,"customfield_13652":null,"customfield_13772":null,"customfield_12562":null,"customfield_12320":null,"customfield_12323":null,"customfield_12202":null,"customfield_12564":null,"customfield_12322":null,"customfield_12201":null,"customfield_13656":null,"customfield_12567":null,"customfield_13655":null,"customfield_12566":null,"customfield_12324":null,"customfield_12203":null,"customfield_12558":null,"customfield_13407":null,"customfield_13769":null,"customfield_12319":null,"updated":"2022-05-26T10:13:09.727-0400","customfield_12790":null,"timeoriginalestimate":null,"customfield_13760":null,"customfield_12550":null,"customfield_12792":null,"customfield_12791":null,"description":null,"customfield_12552":null,"customfield_13762":null,"customfield_12794":null,"customfield_12551":null,"customfield_13761":null,"customfield_11100":" ","customfield_13640":null,"customfield_13764":null,"customfield_12554":null,"customfield_11101":null,"customfield_12553":null,"customfield_11102":{"self":"https://arthrex.atlassian.net/rest/api/2/customFieldOption/10500","value":"1-None","id":"10500"},"customfield_12795":null,"customfield_13763":null,"customfield_13645":null,"customfield_13765":null,"customfield_11104":null,"customfield_12555":null,"customfield_12547":null,"customfield_12426":null,"customfield_12789":null,"customfield_12305":null,"customfield_13757":null,"customfield_13636":null,"customfield_10005":[{"id":1952,"name":"A Team: 6/20/22 - 6/24/22","state":"closed","boardId":286,"goal":"","startDate":"2022-06-20T13:46:12.904Z","endDate":"2022-06-24T12:12:00.000Z","completeDate":"2022-06-24T20:31:59.550Z"},{"id":1904,"name":"A Team: 5/9/22 - 5/13/22","state":"closed","boardId":286,"goal":"","startDate":"2022-05-09T13:36:27.141Z","endDate":"2022-05-13T21:43:00.000Z","completeDate":"2022-05-13T20:16:27.067Z"},{"id":2001,"name":"A Team: 7/11/22 - 7/15/22","state":"closed","boardId":286,"goal":"Prep for Submission of v1.0.0 Rep App iOS Release","startDate":"2022-07-11T13:56:18.821Z","endDate":"2022-07-16T02:15:00.000Z","completeDate":"2022-07-15T21:39:31.202Z"},{"id":1955,"name":"A Team: 6/27/22 - 7/1/22","state":"closed","boardId":286,"goal":"","startDate":"2022-06-27T13:39:51.053Z","endDate":"2022-07-01T16:03:00.000Z","completeDate":"2022-07-01T20:26:58.126Z"},{"id":1940,"name":"A Team: 6/13/22 - 6/17/22","state":"closed","boardId":286,"goal":"","startDate":"2022-06-13T13:23:11.454Z","endDate":"2022-06-17T13:12:00.000Z","completeDate":"2022-06-17T21:12:57.348Z"},{"id":1861,"name":"A Team: 4/18/22 - 4/22/22","state":"closed","boardId":286,"goal":"","startDate":"2022-04-18T13:19:51.131Z","endDate":"2022-04-22T21:22:00.000Z","completeDate":"2022-04-23T00:50:05.964Z"},{"id":1862,"name":"A Team: 4/25/22 - 4/29/22","state":"closed","boardId":286,"goal":"","startDate":"2022-04-25T13:38:51.319Z","endDate":"2022-04-29T21:00:00.000Z","completeDate":"2022-04-29T20:44:00.021Z"},{"id":1929,"name":"A Team: 5/31/22 - 6/10/22","state":"closed","boardId":286,"goal":"","startDate":"2022-05-31T13:20:11.464Z","endDate":"2022-06-10T14:13:00.000Z","completeDate":"2022-06-10T21:09:52.636Z"},{"id":1881,"name":"A Team: 5/2/22 - 5/6/22","state":"closed","boardId":286,"goal":"","startDate":"2022-05-02T13:24:03.040Z","endDate":"2022-05-06T21:59:00.000Z","completeDate":"2022-05-06T20:33:28.823Z"},{"id":1915,"name":"A Team: 5/16/22 - 5/20/22","state":"closed","boardId":286,"goal":"","startDate":"2022-05-16T13:45:22.501Z","endDate":"2022-05-20T21:11:00.000Z","completeDate":"2022-05-20T20:48:44.357Z"},{"id":1916,"name":"A Team: 5/23/22 - 5/27/22","state":"closed","boardId":286,"goal":"","startDate":"2022-05-23T13:46:32.935Z","endDate":"2022-05-27T18:12:00.000Z","completeDate":"2022-05-27T21:18:43.799Z"},{"id":1965,"name":"A Team: 7/5/22 - 7/8/22","state":"closed","boardId":286,"goal":"","startDate":"2022-07-05T13:38:21.073Z","endDate":"2022-07-08T17:26:00.000Z","completeDate":"2022-07-08T21:28:08.661Z"},{"id":1661,"name":"A Team: 7/18/22 - 7/22/22","state":"active","boardId":286,"goal":"AMOBS v1.0.0 and RAI v1.0.0 Releases","startDate":"2022-07-18T13:46:00.383Z","endDate":"2022-07-23T02:21:00.000Z"}],"customfield_13756":null,"customfield_12304":null,"customfield_12425":null,"customfield_10006":null,"customfield_12546":null,"customfield_12788":null,"customfield_13759":null,"customfield_12549":null,"customfield_13998":null,"customfield_12307":null,"customfield_12428":null,"customfield_12306":null,"customfield_12548":null,"customfield_13758":null,"customfield_12427":null,"customfield_12309":null,"customfield_12308":null,"customfield_12429":null,"summary":"Arthrex.com Space for Download ","customfield_12781":null,"customfield_11450":{"self":"https://arthrex.atlassian.net/rest/api/2/customFieldOption/10989","value":"Always","id":"10989"},"customfield_12780":null,"customfield_13993":null,"customfield_12541":null,"customfield_12783":null,"customfield_12420":null,"customfield_13751":null,"customfield_13991":null,"customfield_10000":null,"customfield_12540":null,"customfield_13750":null,"customfield_12782":null,"customfield_12422":null,"customfield_13996":null,"customfield_10001":null,"customfield_13753":null,"customfield_12785":null,"customfield_12300":"{}","customfield_12784":null,"customfield_13997":null,"customfield_13752":null,"customfield_12545":null,"customfield_13994":null,"customfield_13755":null,"customfield_12787":null,"customfield_12303":null,"customfield_12786":null,"customfield_12423":null,"customfield_13754":null,"customfield_12544":null,"customfield_13995":null,"customfield_11447":null,"customfield_13989":null,"customfield_12778":null,"customfield_13746":null,"customfield_12415":null,"customfield_13745":null,"customfield_12414":null,"customfield_12777":null,"customfield_13748":null,"customfield_12417":null,"customfield_11449":{"self":"https://arthrex.atlassian.net/rest/api/2/customFieldOption/10986","value":"Live Site","id":"10986"},"customfield_13987":null,"customfield_12416":null,"customfield_13505":[],"customfield_11448":null,"customfield_12779":null,"customfield_12419":null,"customfield_12418":null,"customfield_13749":null,"comment":{"comments":[{"self":"https://arthrex.atlassian.net/rest/api/2/issue/281424/comment/448511","id":"448511","author":{"self":"https://arthrex.atlassian.net/rest/api/2/user?accountId=60bac9915fa6f1006fee00b2","accountId":"60bac9915fa6f1006fee00b2","emailAddress":"johnny.ansari@arthrex.com","avatarUrls":{"48x48":"https://secure.gravatar.com/avatar/d887eff1f5130dfab59a6de736562de4?d=https%3A%2F%2Favatar-management--avatars.us-west-2.prod.public.atl-paas.net%2Finitials%2FJA-5.png","24x24":"https://secure.gravatar.com/avatar/d887eff1f5130dfab59a6de736562de4?d=https%3A%2F%2Favatar-management--avatars.us-west-2.prod.public.atl-paas.net%2Finitials%2FJA-5.png","16x16":"https://secure.gravatar.com/avatar/d887eff1f5130dfab59a6de736562de4?d=https%3A%2F%2Favatar-management--avatars.us-west-2.prod.public.atl-paas.net%2Finitials%2FJA-5.png","32x32":"https://secure.gravatar.com/avatar/d887eff1f5130dfab59a6de736562de4?d=https%3A%2F%2Favatar-management--avatars.us-west-2.prod.public.atl-paas.net%2Finitials%2FJA-5.png"},"displayName":"Johnny Ansari","active":true,"timeZone":"America/New_York","accountType":"atlassian"},"body":"Page Comps here: [https://www.figma.com/file/WssmeRFWg3wDQvdHMBesRh/?node-id=3250%3A47400|https://www.figma.com/file/WssmeRFWg3wDQvdHMBesRh/?node-id=3250%3A47400|smart-link] \n\nFlow WIP here: [https://www.figma.com/file/7YsyEbjSkkEX0cBcVY1VWz/Rep-App---Private%2FBeta-App-%2B-Feedback---Workflow?node-id=0%3A1|https://www.figma.com/file/7YsyEbjSkkEX0cBcVY1VWz/Rep-App---Private%2FBeta-App-%2B-Feedback---Workflow?node-id=0%3A1|smart-link] ","updateAuthor":{"self":"https://arthrex.atlassian.net/rest/api/2/user?accountId=60bac9915fa6f1006fee00b2","accountId":"60bac9915fa6f1006fee00b2","emailAddress":"johnny.ansari@arthrex.com","avatarUrls":{"48x48":"https://secure.gravatar.com/avatar/d887eff1f5130dfab59a6de736562de4?d=https%3A%2F%2Favatar-management--avatars.us-west-2.prod.public.atl-paas.net%2Finitials%2FJA-5.png","24x24":"https://secure.gravatar.com/avatar/d887eff1f5130dfab59a6de736562de4?d=https%3A%2F%2Favatar-management--avatars.us-west-2.prod.public.atl-paas.net%2Finitials%2FJA-5.png","16x16":"https://secure.gravatar.com/avatar/d887eff1f5130dfab59a6de736562de4?d=https%3A%2F%2Favatar-management--avatars.us-west-2.prod.public.atl-paas.net%2Finitials%2FJA-5.png","32x32":"https://secure.gravatar.com/avatar/d887eff1f5130dfab59a6de736562de4?d=https%3A%2F%2Favatar-management--avatars.us-west-2.prod.public.atl-paas.net%2Finitials%2FJA-5.png"},"displayName":"Johnny Ansari","active":true,"timeZone":"America/New_York","accountType":"atlassian"},"created":"2022-05-24T08:31:28.679-0400","updated":"2022-05-26T10:13:09.511-0400","jsdPublic":true}],"self":"https://arthrex.atlassian.net/rest/api/2/issue/281424/comment","maxResults":1,"total":1,"startAt":0},"statuscategorychangedate":"2022-05-12T14:07:48.369-0400","customfield_13063":"Testing message","customfield_13062":null,"customfield_14033":null,"customfield_13067":null,"customfield_13066":null,"fixVersions":[],"customfield_10900":null,"customfield_13294":null,"customfield_13052":null,"customfield_13053":null,"epic":null,"customfield_13057":null,"priority":{"self":"https://arthrex.atlassian.net/rest/api/2/priority/4","iconUrl":"https://s3.amazonaws.com/arthrex-public/jira/priorities/minor.png","name":"Minor","id":"4"},"customfield_14028":null,"versions":[],"customfield_14014":null,"customfield_13045":null,"customfield_14015":null,"customfield_13047":null,"customfield_14013":null,"customfield_13046":null,"customfield_14016":null,"customfield_14017":null,"customfield_13391":null,"customfield_13272":null,"customfield_13392":null,"customfield_13274":null,"customfield_13273":null,"aggregateprogress":{"progress":0,"total":0},"customfield_13279":null,"customfield_13380":null,"issuerestriction":{"issuerestrictions":{},"shouldDisplay":false},"customfield_13371":null,"customfield_13494":null,"customfield_13373":null,"created":"2022-04-20T13:04:51.592-0400","customfield_13375":null,"customfield_13012":null,"customfield_13011":null,"customfield_13377":null,"customfield_13376":null,"customfield_13016":null,"customfield_13379":null,"customfield_13378":null,"customfield_13017":null,"customfield_13360":null,"customfield_13362":null,"customfield_13361":null,"customfield_13001":null,"customfield_13364":null,"customfield_13122":null,"customfield_13363":null,"customfield_13000":null,"customfield_13366":"150 GB","customfield_13365":null,"customfield_13002":null,"customfield_13368":null,"customfield_13367":null,"customfield_13369":null,"security":null,"attachment":[],"customfield_13470":null,"customfield_13471":null,"customfield_12385":null,"customfield_13355":null,"customfield_12386":null,"customfield_13357":null,"customfield_13599":null,"customfield_12388":null,"customfield_13356":null,"customfield_13359":null,"customfield_13358":null}},{"expand":"operations,versionedRepresentations,editmeta,changelog,renderedFields","id":"285994","self":"https://arthrex.atlassian.net/rest/agile/1.0/issue/285994","key":"MOB-992","fields":{"parent":{"id":"279628","key":"MOB-929","self":"https://arthrex.atlassian.net/rest/api/2/issue/279628","fields":{"summary":"UX/UI","status":{"self":"https://arthrex.atlassian.net/rest/api/2/status/3","description":"This issue is being actively worked on at the moment by the assignee.","iconUrl":"https://arthrex.atlassian.net/images/icons/statuses/inprogress.png","name":"Working","id":"3","statusCategory":{"self":"https://arthrex.atlassian.net/rest/api/2/statuscategory/4","id":4,"key":"indeterminate","colorName":"yellow","name":"In Progress"}},"priority":{"self":"https://arthrex.atlassian.net/rest/api/2/priority/4","iconUrl":"https://s3.amazonaws.com/arthrex-public/jira/priorities/minor.png","name":"Minor","id":"4"},"issuetype":{"self":"https://arthrex.atlassian.net/rest/api/2/issuetype/3","id":"3","description":"A task that needs to be done.","iconUrl":"https://arthrex.atlassian.net/rest/api/2/universal_avatar/view/type/issuetype/avatar/10318?size=medium","name":"Task","subtask":false,"avatarId":10318,"hierarchyLevel":0}}},"resolution":{"self":"https://arthrex.atlassian.net/rest/api/2/resolution/10000","id":"10000","description":"The issue is done.","name":"Done"},"customfield_12930":null,"customfield_12923":null,"customfield_12924":null,"customfield_12929":null,"lastViewed":null,"customfield_11700":null,"customfield_12912":null,"customfield_11702":null,"customfield_11701":null,"aggregatetimeoriginalestimate":null,"customfield_12914":null,"customfield_12916":null,"customfield_12915":null,"customfield_12918":null,"customfield_12917":null,"issuelinks":[],"assignee":{"self":"https://arthrex.atlassian.net/rest/api/2/user?accountId=5dfa6aa75697460cb3d97763","accountId":"5dfa6aa75697460cb3d97763","emailAddress":"patrick.maguschak2@arthrex.com","avatarUrls":{"48x48":"https://avatar-management--avatars.us-west-2.prod.public.atl-paas.net/5dfa6aa75697460cb3d97763/5f2aaf98-63fd-4e3a-a29b-7e163f497fd8/48","24x24":"https://avatar-management--avatars.us-west-2.prod.public.atl-paas.net/5dfa6aa75697460cb3d97763/5f2aaf98-63fd-4e3a-a29b-7e163f497fd8/24","16x16":"https://avatar-management--avatars.us-west-2.prod.public.atl-paas.net/5dfa6aa75697460cb3d97763/5f2aaf98-63fd-4e3a-a29b-7e163f497fd8/16","32x32":"https://avatar-management--avatars.us-west-2.prod.public.atl-paas.net/5dfa6aa75697460cb3d97763/5f2aaf98-63fd-4e3a-a29b-7e163f497fd8/32"},"displayName":"Patrick Maguschak","active":true,"timeZone":"America/New_York","accountType":"atlassian"},"customfield_12919":null,"customfield_11810":null,"customfield_12901":null,"customfield_11812":null,"customfield_11811":null,"customfield_11814":null,"customfield_12903":null,"customfield_12902":null,"customfield_11813":null,"customfield_12905":null,"customfield_11816":null,"customfield_11815":null,"customfield_12904":null,"customfield_11818":null,"customfield_11817":null,"customfield_12906":null,"subtasks":[],"customfield_11801":null,"customfield_11800":null,"customfield_11802":null,"customfield_11805":null,"customfield_11804":null,"customfield_11807":null,"closedSprints":[{"id":2001,"self":"https://arthrex.atlassian.net/rest/agile/1.0/sprint/2001","state":"closed","name":"A Team: 7/11/22 - 7/15/22","startDate":"2022-07-11T13:56:18.821Z","endDate":"2022-07-16T02:15:00.000Z","completeDate":"2022-07-15T21:39:31.202Z","originBoardId":286,"goal":"Prep for Submission of v1.0.0 Rep App iOS Release"},{"id":1955,"self":"https://arthrex.atlassian.net/rest/agile/1.0/sprint/1955","state":"closed","name":"A Team: 6/27/22 - 7/1/22","startDate":"2022-06-27T13:39:51.053Z","endDate":"2022-07-01T16:03:00.000Z","completeDate":"2022-07-01T20:26:58.126Z","originBoardId":286,"goal":""},{"id":1940,"self":"https://arthrex.atlassian.net/rest/agile/1.0/sprint/1940","state":"closed","name":"A Team: 6/13/22 - 6/17/22","startDate":"2022-06-13T13:23:11.454Z","endDate":"2022-06-17T13:12:00.000Z","completeDate":"2022-06-17T21:12:57.348Z","originBoardId":286,"goal":""},{"id":1861,"self":"https://arthrex.atlassian.net/rest/agile/1.0/sprint/1861","state":"closed","name":"A Team: 4/18/22 - 4/22/22","startDate":"2022-04-18T13:19:51.131Z","endDate":"2022-04-22T21:22:00.000Z","completeDate":"2022-04-23T00:50:05.964Z","originBoardId":286,"goal":""},{"id":1862,"self":"https://arthrex.atlassian.net/rest/agile/1.0/sprint/1862","state":"closed","name":"A Team: 4/25/22 - 4/29/22","startDate":"2022-04-25T13:38:51.319Z","endDate":"2022-04-29T21:00:00.000Z","completeDate":"2022-04-29T20:44:00.021Z","originBoardId":286,"goal":""},{"id":1929,"self":"https://arthrex.atlassian.net/rest/agile/1.0/sprint/1929","state":"closed","name":"A Team: 5/31/22 - 6/10/22","startDate":"2022-05-31T13:20:11.464Z","endDate":"2022-06-10T14:13:00.000Z","completeDate":"2022-06-10T21:09:52.636Z","originBoardId":286,"goal":""},{"id":1881,"self":"https://arthrex.atlassian.net/rest/agile/1.0/sprint/1881","state":"closed","name":"A Team: 5/2/22 - 5/6/22","startDate":"2022-05-02T13:24:03.040Z","endDate":"2022-05-06T21:59:00.000Z","completeDate":"2022-05-06T20:33:28.823Z","originBoardId":286,"goal":""},{"id":1915,"self":"https://arthrex.atlassian.net/rest/agile/1.0/sprint/1915","state":"closed","name":"A Team: 5/16/22 - 5/20/22","startDate":"2022-05-16T13:45:22.501Z","endDate":"2022-05-20T21:11:00.000Z","completeDate":"2022-05-20T20:48:44.357Z","originBoardId":286,"goal":""},{"id":1916,"self":"https://arthrex.atlassian.net/rest/agile/1.0/sprint/1916","state":"closed","name":"A Team: 5/23/22 - 5/27/22","startDate":"2022-05-23T13:46:32.935Z","endDate":"2022-05-27T18:12:00.000Z","completeDate":"2022-05-27T21:18:43.799Z","originBoardId":286,"goal":""},{"id":1965,"self":"https://arthrex.atlassian.net/rest/agile/1.0/sprint/1965","state":"closed","name":"A Team: 7/5/22 - 7/8/22","startDate":"2022-07-05T13:38:21.073Z","endDate":"2022-07-08T17:26:00.000Z","completeDate":"2022-07-08T21:28:08.661Z","originBoardId":286,"goal":""},{"id":1952,"self":"https://arthrex.atlassian.net/rest/agile/1.0/sprint/1952","state":"closed","name":"A Team: 6/20/22 - 6/24/22","startDate":"2022-06-20T13:46:12.904Z","endDate":"2022-06-24T12:12:00.000Z","completeDate":"2022-06-24T20:31:59.550Z","originBoardId":286,"goal":""},{"id":1904,"self":"https://arthrex.atlassian.net/rest/agile/1.0/sprint/1904","state":"closed","name":"A Team: 5/9/22 - 5/13/22","startDate":"2022-05-09T13:36:27.141Z","endDate":"2022-05-13T21:43:00.000Z","completeDate":"2022-05-13T20:16:27.067Z","originBoardId":286,"goal":""}],"customfield_11806":null,"customfield_11809":null,"votes":{"self":"https://arthrex.atlassian.net/rest/api/2/issue/MOB-992/votes","votes":0,"hasVoted":false},"customfield_11808":null,"worklog":{"startAt":0,"maxResults":20,"total":0,"worklogs":[]},"issuetype":{"self":"https://arthrex.atlassian.net/rest/api/2/issuetype/5","id":"5","description":"The sub-task of the issue","iconUrl":"https://arthrex.atlassian.net/rest/api/2/universal_avatar/view/type/issuetype/avatar/10316?size=medium","name":"Sub-task","subtask":true,"avatarId":10316,"hierarchyLevel":-1},"sprint":{"id":1661,"self":"https://arthrex.atlassian.net/rest/agile/1.0/sprint/1661","state":"active","name":"A Team: 7/18/22 - 7/22/22","startDate":"2022-07-18T13:46:00.383Z","endDate":"2022-07-23T02:21:00.000Z","originBoardId":286,"goal":"AMOBS v1.0.0 and RAI v1.0.0 Releases"},"customfield_10700":null,"customfield_10701":[],"customfield_10702":null,"customfield_11901":{"self":"https://arthrex.atlassian.net/rest/api/2/customFieldOption/11506","value":"No","id":"11506"},"customfield_14050":null,"timetracking":{},"customfield_10803":null,"customfield_10806":null,"customfield_14047":null,"customfield_14048":null,"customfield_14046":null,"customfield_14049":null,"environment":null,"duedate":null,"customfield_13980":null,"customfield_11441":null,"customfield_13861":null,"customfield_13982":null,"customfield_12772":null,"customfield_13740":null,"customfield_11440":null,"customfield_11200":null,"customfield_11443":null,"customfield_13742":null,"customfield_12411":null,"customfield_12774":null,"customfield_13741":null,"customfield_11442":null,"customfield_12773":null,"customfield_11201":null,"customfield_13986":null,"customfield_13744":null,"customfield_12413":null,"customfield_11202":null,"customfield_13623":null,"customfield_12776":null,"customfield_13985":null,"customfield_11444":null,"customfield_13743":null,"customfield_12412":null,"customfield_12775":null,"customfield_12533":null,"customfield_13614":null,"customfield_11435":null,"customfield_13613":null,"customfield_12645":null,"customfield_13979":null,"customfield_13616":null,"customfield_11438":null,"customfield_13737":null,"customfield_11437":null,"customfield_13615":null,"customfield_13739":null,"customfield_11439":null,"customfield_13617":null,"customfield_13738":null,"customfield_12409":null,"customfield_12761":null,"customfield_11430":null,"customfield_12760":null,"customfield_13610":null,"customfield_10100":"2|i02f9l:o","customfield_12762":null,"customfield_11431":null,"customfield_13612":null,"customfield_13975":null,"customfield_11434":null,"customfield_13611":null,"customfield_11303":"3_*:*_1_*:*_691337453_*|*_10000_*:*_1_*:*_616156823_*|*_10001_*:*_1_*:*_0_*|*_10201_*:*_2_*:*_2406306638","customfield_13603":null,"customfield_12998":null,"customfield_12756":null,"customfield_11425":null,"customfield_12514":null,"customfield_12997":null,"customfield_12755":null,"customfield_12513":null,"customfield_11304":"2022-05-24T08:31:50.166-0400","customfield_13602":null,"customfield_13605":null,"customfield_11427":null,"customfield_12758":null,"customfield_13726":null,"customfield_12757":null,"customfield_12999":null,"customfield_13604":null,"timeestimate":null,"customfield_13606":null,"customfield_13727":null,"customfield_12759":null,"customfield_11428":null,"customfield_13969":null,"customfield_13608":null,"customfield_13729":null,"status":{"self":"https://arthrex.atlassian.net/rest/api/2/status/10001","description":"","iconUrl":"https://arthrex.atlassian.net/images/icons/subtask.gif","name":"Done","id":"10001","statusCategory":{"self":"https://arthrex.atlassian.net/rest/api/2/statuscategory/3","id":3,"key":"done","colorName":"green","name":"Done"}},"customfield_12750":null,"customfield_12752":null,"customfield_12510":null,"customfield_11300":{"self":"https://arthrex.atlassian.net/rest/api/2/customFieldOption/10700","value":"User Stories:1","id":"10700"},"customfield_11420":null,"customfield_12751":null,"customfield_12996":null,"customfield_13601":null,"customfield_12754":null,"customfield_11301":null,"customfield_13600":null,"customfield_12511":null,"customfield_12753":null,"customfield_11422":null,"customfield_12745":null,"customfield_12503":null,"customfield_11414":null,"customfield_12744":null,"customfield_12502":null,"customfield_13836":null,"customfield_12505":null,"customfield_12747":null,"customfield_13715":null,"customfield_12504":null,"customfield_13956":null,"customfield_12746":null,"customfield_13835":null,"customfield_11415":null,"customfield_11418":null,"customfield_12749":null,"aggregatetimeestimate":null,"customfield_12507":null,"customfield_13716":null,"customfield_13837":null,"customfield_12748":null,"customfield_12508":null,"customfield_11419":null,"creator":{"self":"https://arthrex.atlassian.net/rest/api/2/user?accountId=5dfa6aa75697460cb3d97763","accountId":"5dfa6aa75697460cb3d97763","emailAddress":"patrick.maguschak2@arthrex.com","avatarUrls":{"48x48":"https://avatar-management--avatars.us-west-2.prod.public.atl-paas.net/5dfa6aa75697460cb3d97763/5f2aaf98-63fd-4e3a-a29b-7e163f497fd8/48","24x24":"https://avatar-management--avatars.us-west-2.prod.public.atl-paas.net/5dfa6aa75697460cb3d97763/5f2aaf98-63fd-4e3a-a29b-7e163f497fd8/24","16x16":"https://avatar-management--avatars.us-west-2.prod.public.atl-paas.net/5dfa6aa75697460cb3d97763/5f2aaf98-63fd-4e3a-a29b-7e163f497fd8/16","32x32":"https://avatar-management--avatars.us-west-2.prod.public.atl-paas.net/5dfa6aa75697460cb3d97763/5f2aaf98-63fd-4e3a-a29b-7e163f497fd8/32"},"displayName":"Patrick Maguschak","active":true,"timeZone":"America/New_York","accountType":"atlassian"},"customfield_13830":null,"customfield_10200":null,"customfield_12743":null,"customfield_12500":null,"customfield_13831":null,"customfield_10202":null,"customfield_13702":null,"customfield_11403":{"self":"https://arthrex.atlassian.net/rest/api/2/customFieldOption/10806","value":"Hotline","id":"10806"},"customfield_11402":null,"customfield_13701":null,"customfield_12975":null,"customfield_11523":null,"customfield_13825":null,"customfield_13704":null,"customfield_11526":null,"customfield_11404":null,"customfield_13824":null,"customfield_13703":null,"customfield_12738":null,"customfield_13827":null,"customfield_13826":null,"customfield_13705":null,"customfield_13829":null,"customfield_11529":null,"timespent":null,"aggregatetimespent":null,"customfield_12972":null,"customfield_11522":null,"customfield_11401":null,"customfield_13700":null,"customfield_12974":null,"customfield_11400":null,"customfield_11521":null,"customfield_13933":null,"customfield_11512":null,"customfield_13932":null,"customfield_12843":null,"customfield_11514":null,"customfield_11519":"3_*:*_1_*:*_691337453_*|*_10000_*:*_1_*:*_616156823_*|*_10001_*:*_1_*:*_0_*|*_10201_*:*_2_*:*_2406306638","workratio":-1,"customfield_12840":null,"customfield_10300":null,"customfield_12842":null,"customfield_13931":null,"customfield_11511":null,"customfield_13930":null,"customfield_10301":null,"customfield_11510":null,"customfield_12841":null,"customfield_12833":null,"customfield_11502":null,"customfield_13801":null,"customfield_11501":{"hasEpicLinkFieldDependency":false,"showField":false,"nonEditableReason":{"reason":"PLUGIN_LICENSE_ERROR","message":"The Parent Link is only available to Jira Premium users."}},"customfield_12832":null,"customfield_13800":null,"customfield_11504":null,"customfield_12835":null,"customfield_13803":null,"customfield_12834":null,"customfield_12955":null,"customfield_13802":null,"customfield_13805":null,"customfield_12958":null,"customfield_13926":null,"customfield_11506":null,"customfield_12837":null,"customfield_11505":null,"customfield_13804":null,"customfield_12836":null,"customfield_13925":null,"customfield_12839":null,"customfield_12838":null,"customfield_13808":null,"customfield_12831":null,"customfield_11500":null,"customfield_12830":null,"customfield_12822":null,"customfield_12942":null,"customfield_12824":null,"customfield_12823":null,"flagged":false,"customfield_12825":null,"customfield_12828":null,"customfield_12827":null,"customfield_10400":null,"customfield_12932":null,"customfield_12811":null,"customfield_12934":null,"customfield_12933":null,"customfield_13904":null,"customfield_12936":null,"customfield_12935":null,"customfield_13903":null,"customfield_12938":null,"customfield_13906":null,"customfield_12937":null,"customfield_13905":null,"customfield_13908":null,"customfield_12939":null,"customfield_13909":null,"customfield_12490":null,"customfield_12372":null,"customfield_12493":null,"customfield_12492":null,"customfield_12374":null,"customfield_13463":null,"customfield_12495":null,"customfield_12494":null,"customfield_12376":null,"customfield_13465":null,"customfield_13464":null,"customfield_12496":"{panel:bgColor=#FFC400}\r\nThese fields are used to populate request forms in the customer portal. Do not manually change these fields.\r\n{panel}","customfield_13343":null,"customfield_12499":null,"customfield_13467":null,"customfield_13225":null,"customfield_13466":null,"customfield_13469":null,"customfield_13468":null,"customfield_13690":null,"customfield_12480":null,"customfield_12482":null,"customfield_13692":null,"customfield_13691":null,"customfield_12481":null,"customfield_12000":null,"customfield_12484":null,"customfield_13694":null,"customfield_13693":null,"customfield_12483":null,"customfield_12362":null,"customfield_13696":null,"customfield_13212":null,"customfield_12002":null,"customfield_12001":null,"customfield_13211":null,"customfield_13695":null,"customfield_12004":null,"customfield_13698":null,"customfield_13335":null,"customfield_12488":null,"customfield_13213":null,"customfield_13697":null,"customfield_12003":null,"labels":[],"customfield_13699":null,"customfield_13336":null,"customfield_12489":null,"customfield_12005":null,"customfield_13449":null,"customfield_13207":null,"components":[],"customfield_13681":null,"customfield_12471":null,"customfield_12470":null,"customfield_13680":null,"customfield_13683":null,"customfield_12110":null,"customfield_12473":null,"customfield_13682":null,"customfield_12472":null,"customfield_12112":null,"customfield_12475":null,"customfield_13322":null,"customfield_13685":null,"customfield_13684":null,"customfield_12474":null,"customfield_12111":null,"customfield_13687":null,"customfield_12477":null,"customfield_12114":{"self":"https://arthrex.atlassian.net/rest/api/2/customFieldOption/11922","value":"No","id":"11922"},"customfield_12476":null,"customfield_13686":null,"customfield_13689":null,"customfield_12479":null,"customfield_12358":null,"customfield_13325":null,"customfield_12357":null,"customfield_13688":null,"customfield_12478":null,"customfield_12348":"{panel:title=Alert|titleBGColor=#FFC400|bgColor=#FFFAE6}\r\nPlease make sure that the correct issue type is selected. To select a different issue type, move the issue.\r\n{panel}","customfield_12469":null,"customfield_12106":null,"customfield_13679":null,"customfield_12109":null,"customfield_12108":null,"customfield_12341":null,"customfield_13672":null,"customfield_12340":null,"customfield_13674":null,"reporter":{"self":"https://arthrex.atlassian.net/rest/api/2/user?accountId=5dfa6aa75697460cb3d97763","accountId":"5dfa6aa75697460cb3d97763","emailAddress":"patrick.maguschak2@arthrex.com","avatarUrls":{"48x48":"https://avatar-management--avatars.us-west-2.prod.public.atl-paas.net/5dfa6aa75697460cb3d97763/5f2aaf98-63fd-4e3a-a29b-7e163f497fd8/48","24x24":"https://avatar-management--avatars.us-west-2.prod.public.atl-paas.net/5dfa6aa75697460cb3d97763/5f2aaf98-63fd-4e3a-a29b-7e163f497fd8/24","16x16":"https://avatar-management--avatars.us-west-2.prod.public.atl-paas.net/5dfa6aa75697460cb3d97763/5f2aaf98-63fd-4e3a-a29b-7e163f497fd8/16","32x32":"https://avatar-management--avatars.us-west-2.prod.public.atl-paas.net/5dfa6aa75697460cb3d97763/5f2aaf98-63fd-4e3a-a29b-7e163f497fd8/32"},"displayName":"Patrick Maguschak","active":true,"timeZone":"America/New_York","accountType":"atlassian"},"customfield_12101":null,"customfield_12343":"{panel:title=Info|titleBGColor=#C0B6F2|bgColor=#EAE6FF}\r\nUse this transition to escalate this issue to another team.\r\n\r\nPlease note that if you select *MRM-DAM Technical*, Jira will automatically create a ticket in Footprints. If you do not wish to create a new Footprints ticket, please select *Disable emails to Footprints* below.\r\n\r\nIf you do not want to be reminded to follow-up on this issue, please select *Disable escalation follow-up* below.\r\n{panel}","customfield_13795":null,"customfield_12464":null,"customfield_12463":null,"customfield_12342":null,"customfield_13673":null,"customfield_12103":null,"customfield_13676":null,"customfield_12466":null,"customfield_12345":null,"customfield_13797":null,"customfield_13796":null,"customfield_12344":"{panel:title=Info|titleBGColor=#C0B6F2|bgColor=#EAE6FF}\r\nUse this transition to respond to the reporter and request participants.\r\n\r\nIf you do not want to be reminded to follow-up on this issue, select *Disable customer follow-up* below.\r\n{panel}","customfield_13675":null,"customfield_12347":"{panel:bgColor=#FFC400}\r\n*Note*\r\nThese fields are used to populate request forms in the customer portal. Do not manually change these fields.\r\n{panel}","customfield_12468":null,"customfield_13678":null,"customfield_13799":null,"customfield_13798":null,"customfield_12104":null,"customfield_12346":null,"customfield_12467":null,"customfield_13677":null,"progress":{"progress":0,"total":0},"customfield_12570":null,"customfield_13780":null,"customfield_13782":null,"customfield_12330":null,"customfield_12571":null,"project":{"self":"https://arthrex.atlassian.net/rest/api/2/project/12262","id":"12262","key":"MOB","name":"A Team","projectTypeKey":"software","simplified":false,"avatarUrls":{"48x48":"https://arthrex.atlassian.net/rest/api/2/universal_avatar/view/type/project/avatar/13447","24x24":"https://arthrex.atlassian.net/rest/api/2/universal_avatar/view/type/project/avatar/13447?size=small","16x16":"https://arthrex.atlassian.net/rest/api/2/universal_avatar/view/type/project/avatar/13447?size=xsmall","32x32":"https://arthrex.atlassian.net/rest/api/2/universal_avatar/view/type/project/avatar/13447?size=medium"},"projectCategory":{"self":"https://arthrex.atlassian.net/rest/api/2/projectCategory/10103","id":"10103","description":"","name":"Digital Media - Mobile"}},"customfield_12332":null,"customfield_12331":null,"customfield_13783":null,"customfield_12333":null,"customfield_12336":null,"customfield_12335":null,"customfield_12327":null,"customfield_12569":null,"customfield_13779":null,"customfield_12568":null,"customfield_12329":null,"customfield_12328":null,"resolutiondate":"2022-06-24T08:50:41.249-0400","watches":{"self":"https://arthrex.atlassian.net/rest/api/2/issue/MOB-992/watchers","watchCount":2,"isWatching":false},"customfield_13890":null,"customfield_12561":null,"customfield_13771":null,"customfield_13892":null,"customfield_13891":null,"customfield_13770":null,"customfield_12200":null,"customfield_13652":null,"customfield_12563":null,"customfield_12321":null,"customfield_12320":null,"customfield_12562":null,"customfield_13772":null,"customfield_12202":null,"customfield_12323":null,"customfield_12201":null,"customfield_12564":null,"customfield_12322":null,"customfield_12567":null,"customfield_13656":null,"customfield_12566":null,"customfield_12324":null,"customfield_13655":null,"customfield_12203":null,"customfield_12558":null,"customfield_13407":null,"customfield_13769":null,"customfield_12319":null,"updated":"2022-06-24T08:50:41.283-0400","customfield_12790":null,"timeoriginalestimate":null,"customfield_13760":null,"customfield_12550":null,"customfield_12792":null,"description":null,"customfield_12791":null,"customfield_12794":null,"customfield_13762":null,"customfield_12552":null,"customfield_13640":null,"customfield_12551":null,"customfield_13761":null,"customfield_11100":" ","customfield_11101":null,"customfield_13764":null,"customfield_12554":null,"customfield_12795":null,"customfield_13763":null,"customfield_11102":{"self":"https://arthrex.atlassian.net/rest/api/2/customFieldOption/10500","value":"1-None","id":"10500"},"customfield_12553":null,"customfield_13645":null,"customfield_12555":null,"customfield_13765":null,"customfield_11104":null,"customfield_12305":null,"customfield_12789":null,"customfield_13757":null,"customfield_12426":null,"customfield_12547":null,"customfield_13636":null,"customfield_10005":[{"id":1952,"name":"A Team: 6/20/22 - 6/24/22","state":"closed","boardId":286,"goal":"","startDate":"2022-06-20T13:46:12.904Z","endDate":"2022-06-24T12:12:00.000Z","completeDate":"2022-06-24T20:31:59.550Z"},{"id":1904,"name":"A Team: 5/9/22 - 5/13/22","state":"closed","boardId":286,"goal":"","startDate":"2022-05-09T13:36:27.141Z","endDate":"2022-05-13T21:43:00.000Z","completeDate":"2022-05-13T20:16:27.067Z"},{"id":2001,"name":"A Team: 7/11/22 - 7/15/22","state":"closed","boardId":286,"goal":"Prep for Submission of v1.0.0 Rep App iOS Release","startDate":"2022-07-11T13:56:18.821Z","endDate":"2022-07-16T02:15:00.000Z","completeDate":"2022-07-15T21:39:31.202Z"},{"id":1955,"name":"A Team: 6/27/22 - 7/1/22","state":"closed","boardId":286,"goal":"","startDate":"2022-06-27T13:39:51.053Z","endDate":"2022-07-01T16:03:00.000Z","completeDate":"2022-07-01T20:26:58.126Z"},{"id":1940,"name":"A Team: 6/13/22 - 6/17/22","state":"closed","boardId":286,"goal":"","startDate":"2022-06-13T13:23:11.454Z","endDate":"2022-06-17T13:12:00.000Z","completeDate":"2022-06-17T21:12:57.348Z"},{"id":1861,"name":"A Team: 4/18/22 - 4/22/22","state":"closed","boardId":286,"goal":"","startDate":"2022-04-18T13:19:51.131Z","endDate":"2022-04-22T21:22:00.000Z","completeDate":"2022-04-23T00:50:05.964Z"},{"id":1862,"name":"A Team: 4/25/22 - 4/29/22","state":"closed","boardId":286,"goal":"","startDate":"2022-04-25T13:38:51.319Z","endDate":"2022-04-29T21:00:00.000Z","completeDate":"2022-04-29T20:44:00.021Z"},{"id":1929,"name":"A Team: 5/31/22 - 6/10/22","state":"closed","boardId":286,"goal":"","startDate":"2022-05-31T13:20:11.464Z","endDate":"2022-06-10T14:13:00.000Z","completeDate":"2022-06-10T21:09:52.636Z"},{"id":1881,"name":"A Team: 5/2/22 - 5/6/22","state":"closed","boardId":286,"goal":"","startDate":"2022-05-02T13:24:03.040Z","endDate":"2022-05-06T21:59:00.000Z","completeDate":"2022-05-06T20:33:28.823Z"},{"id":1915,"name":"A Team: 5/16/22 - 5/20/22","state":"closed","boardId":286,"goal":"","startDate":"2022-05-16T13:45:22.501Z","endDate":"2022-05-20T21:11:00.000Z","completeDate":"2022-05-20T20:48:44.357Z"},{"id":1916,"name":"A Team: 5/23/22 - 5/27/22","state":"closed","boardId":286,"goal":"","startDate":"2022-05-23T13:46:32.935Z","endDate":"2022-05-27T18:12:00.000Z","completeDate":"2022-05-27T21:18:43.799Z"},{"id":1965,"name":"A Team: 7/5/22 - 7/8/22","state":"closed","boardId":286,"goal":"","startDate":"2022-07-05T13:38:21.073Z","endDate":"2022-07-08T17:26:00.000Z","completeDate":"2022-07-08T21:28:08.661Z"},{"id":1661,"name":"A Team: 7/18/22 - 7/22/22","state":"active","boardId":286,"goal":"AMOBS v1.0.0 and RAI v1.0.0 Releases","startDate":"2022-07-18T13:46:00.383Z","endDate":"2022-07-23T02:21:00.000Z"}],"customfield_13756":null,"customfield_10006":null,"customfield_12425":null,"customfield_12546":null,"customfield_12304":null,"customfield_12788":null,"customfield_13998":null,"customfield_12549":null,"customfield_13759":null,"customfield_12428":null,"customfield_12307":null,"customfield_12427":null,"customfield_12548":null,"customfield_13758":null,"customfield_12306":null,"customfield_12309":null,"customfield_12308":null,"customfield_12429":null,"summary":"Beta Feedback Work","customfield_11450":{"self":"https://arthrex.atlassian.net/rest/api/2/customFieldOption/10989","value":"Always","id":"10989"},"customfield_12781":null,"customfield_13993":null,"customfield_12780":null,"customfield_12783":null,"customfield_13751":null,"customfield_12541":null,"customfield_12420":null,"customfield_12782":null,"customfield_13991":null,"customfield_10000":null,"customfield_12540":null,"customfield_13750":null,"customfield_10001":null,"customfield_13753":null,"customfield_12785":null,"customfield_12422":null,"customfield_13996":null,"customfield_13997":null,"customfield_13752":null,"customfield_12784":null,"customfield_12300":"{}","customfield_13994":null,"customfield_13755":null,"customfield_12787":null,"customfield_12545":null,"customfield_12303":null,"customfield_12423":null,"customfield_13995":null,"customfield_12544":null,"customfield_13754":null,"customfield_12786":null,"customfield_13746":null,"customfield_12778":null,"customfield_12415":null,"customfield_13989":null,"customfield_11447":null,"customfield_12414":null,"customfield_13745":null,"customfield_12777":null,"customfield_13987":null,"customfield_11449":{"self":"https://arthrex.atlassian.net/rest/api/2/customFieldOption/10986","value":"Live Site","id":"10986"},"customfield_12417":null,"customfield_13748":null,"customfield_13505":[],"customfield_11448":null,"customfield_12779":null,"customfield_12416":null,"customfield_12419":null,"customfield_13749":null,"customfield_12418":null,"comment":{"comments":[{"self":"https://arthrex.atlassian.net/rest/api/2/issue/285994/comment/448512","id":"448512","author":{"self":"https://arthrex.atlassian.net/rest/api/2/user?accountId=60bac9915fa6f1006fee00b2","accountId":"60bac9915fa6f1006fee00b2","emailAddress":"johnny.ansari@arthrex.com","avatarUrls":{"48x48":"https://secure.gravatar.com/avatar/d887eff1f5130dfab59a6de736562de4?d=https%3A%2F%2Favatar-management--avatars.us-west-2.prod.public.atl-paas.net%2Finitials%2FJA-5.png","24x24":"https://secure.gravatar.com/avatar/d887eff1f5130dfab59a6de736562de4?d=https%3A%2F%2Favatar-management--avatars.us-west-2.prod.public.atl-paas.net%2Finitials%2FJA-5.png","16x16":"https://secure.gravatar.com/avatar/d887eff1f5130dfab59a6de736562de4?d=https%3A%2F%2Favatar-management--avatars.us-west-2.prod.public.atl-paas.net%2Finitials%2FJA-5.png","32x32":"https://secure.gravatar.com/avatar/d887eff1f5130dfab59a6de736562de4?d=https%3A%2F%2Favatar-management--avatars.us-west-2.prod.public.atl-paas.net%2Finitials%2FJA-5.png"},"displayName":"Johnny Ansari","active":true,"timeZone":"America/New_York","accountType":"atlassian"},"body":"[https://www.figma.com/file/WssmeRFWg3wDQvdHMBesRh/?node-id=3250%3A47400|https://www.figma.com/file/WssmeRFWg3wDQvdHMBesRh/?node-id=3250%3A47400|smart-link] ","updateAuthor":{"self":"https://arthrex.atlassian.net/rest/api/2/user?accountId=60bac9915fa6f1006fee00b2","accountId":"60bac9915fa6f1006fee00b2","emailAddress":"johnny.ansari@arthrex.com","avatarUrls":{"48x48":"https://secure.gravatar.com/avatar/d887eff1f5130dfab59a6de736562de4?d=https%3A%2F%2Favatar-management--avatars.us-west-2.prod.public.atl-paas.net%2Finitials%2FJA-5.png","24x24":"https://secure.gravatar.com/avatar/d887eff1f5130dfab59a6de736562de4?d=https%3A%2F%2Favatar-management--avatars.us-west-2.prod.public.atl-paas.net%2Finitials%2FJA-5.png","16x16":"https://secure.gravatar.com/avatar/d887eff1f5130dfab59a6de736562de4?d=https%3A%2F%2Favatar-management--avatars.us-west-2.prod.public.atl-paas.net%2Finitials%2FJA-5.png","32x32":"https://secure.gravatar.com/avatar/d887eff1f5130dfab59a6de736562de4?d=https%3A%2F%2Favatar-management--avatars.us-west-2.prod.public.atl-paas.net%2Finitials%2FJA-5.png"},"displayName":"Johnny Ansari","active":true,"timeZone":"America/New_York","accountType":"atlassian"},"created":"2022-05-24T08:31:50.166-0400","updated":"2022-05-24T15:59:25.541-0400","jsdPublic":true}],"self":"https://arthrex.atlassian.net/rest/api/2/issue/285994/comment","maxResults":1,"total":1,"startAt":0},"statuscategorychangedate":"2022-06-24T08:50:41.283-0400","customfield_13063":"Testing message","customfield_13062":null,"customfield_14033":null,"customfield_13067":null,"customfield_13066":null,"fixVersions":[],"customfield_10900":null,"customfield_13052":null,"customfield_13294":null,"customfield_13053":null,"epic":null,"customfield_13057":null,"priority":{"self":"https://arthrex.atlassian.net/rest/api/2/priority/4","iconUrl":"https://s3.amazonaws.com/arthrex-public/jira/priorities/minor.png","name":"Minor","id":"4"},"customfield_14028":null,"versions":[],"customfield_13045":null,"customfield_14014":null,"customfield_14015":null,"customfield_13047":null,"customfield_14013":null,"customfield_13046":null,"customfield_14016":null,"customfield_14017":null,"customfield_13391":null,"customfield_13272":null,"customfield_13392":null,"customfield_13274":null,"customfield_13273":null,"aggregateprogress":{"progress":0,"total":0},"customfield_13279":null,"customfield_13380":null,"issuerestriction":{"issuerestrictions":{},"shouldDisplay":false},"customfield_13371":null,"customfield_13494":null,"created":"2022-05-12T09:14:00.395-0400","customfield_13373":null,"customfield_13012":null,"customfield_13375":null,"customfield_13011":null,"customfield_13377":null,"customfield_13376":null,"customfield_13379":null,"customfield_13016":null,"customfield_13378":null,"customfield_13017":null,"customfield_13360":null,"customfield_13362":null,"customfield_13361":null,"customfield_13122":null,"customfield_13001":null,"customfield_13364":null,"customfield_13363":null,"customfield_13000":null,"customfield_13366":"150 GB","customfield_13365":null,"customfield_13002":null,"customfield_13368":null,"customfield_13367":null,"customfield_13369":null,"security":null,"attachment":[],"customfield_13470":null,"customfield_13471":null,"customfield_12385":null,"customfield_13355":null,"customfield_12386":null,"customfield_13357":null,"customfield_13599":null,"customfield_12388":null,"customfield_13356":null,"customfield_13359":null,"customfield_13358":null}},{"expand":"operations,versionedRepresentations,editmeta,changelog,renderedFields","id":"293230","self":"https://arthrex.atlassian.net/rest/agile/1.0/issue/293230","key":"MOB-1014","fields":{"parent":{"id":"279628","key":"MOB-929","self":"https://arthrex.atlassian.net/rest/api/2/issue/279628","fields":{"summary":"UX/UI","status":{"self":"https://arthrex.atlassian.net/rest/api/2/status/3","description":"This issue is being actively worked on at the moment by the assignee.","iconUrl":"https://arthrex.atlassian.net/images/icons/statuses/inprogress.png","name":"Working","id":"3","statusCategory":{"self":"https://arthrex.atlassian.net/rest/api/2/statuscategory/4","id":4,"key":"indeterminate","colorName":"yellow","name":"In Progress"}},"priority":{"self":"https://arthrex.atlassian.net/rest/api/2/priority/4","iconUrl":"https://s3.amazonaws.com/arthrex-public/jira/priorities/minor.png","name":"Minor","id":"4"},"issuetype":{"self":"https://arthrex.atlassian.net/rest/api/2/issuetype/3","id":"3","description":"A task that needs to be done.","iconUrl":"https://arthrex.atlassian.net/rest/api/2/universal_avatar/view/type/issuetype/avatar/10318?size=medium","name":"Task","subtask":false,"avatarId":10318,"hierarchyLevel":0}}},"resolution":null,"customfield_12930":null,"customfield_12923":null,"customfield_12924":null,"customfield_12929":null,"lastViewed":null,"customfield_11700":null,"customfield_12912":null,"customfield_11702":null,"customfield_11701":null,"aggregatetimeoriginalestimate":null,"customfield_12914":null,"customfield_12916":null,"customfield_12915":null,"customfield_12918":null,"customfield_12917":null,"issuelinks":[],"customfield_12919":null,"assignee":{"self":"https://arthrex.atlassian.net/rest/api/2/user?accountId=5dfa6aa75697460cb3d97763","accountId":"5dfa6aa75697460cb3d97763","emailAddress":"patrick.maguschak2@arthrex.com","avatarUrls":{"48x48":"https://avatar-management--avatars.us-west-2.prod.public.atl-paas.net/5dfa6aa75697460cb3d97763/5f2aaf98-63fd-4e3a-a29b-7e163f497fd8/48","24x24":"https://avatar-management--avatars.us-west-2.prod.public.atl-paas.net/5dfa6aa75697460cb3d97763/5f2aaf98-63fd-4e3a-a29b-7e163f497fd8/24","16x16":"https://avatar-management--avatars.us-west-2.prod.public.atl-paas.net/5dfa6aa75697460cb3d97763/5f2aaf98-63fd-4e3a-a29b-7e163f497fd8/16","32x32":"https://avatar-management--avatars.us-west-2.prod.public.atl-paas.net/5dfa6aa75697460cb3d97763/5f2aaf98-63fd-4e3a-a29b-7e163f497fd8/32"},"displayName":"Patrick Maguschak","active":true,"timeZone":"America/New_York","accountType":"atlassian"},"customfield_11810":null,"customfield_11812":null,"customfield_12901":{"self":"https://arthrex.atlassian.net/rest/api/2/customFieldOption/16645","value":"N/A","id":"16645"},"customfield_11811":null,"customfield_12903":null,"customfield_11814":null,"customfield_12902":null,"customfield_11813":null,"customfield_12905":null,"customfield_11816":null,"customfield_11815":null,"customfield_12904":null,"customfield_11818":null,"customfield_12906":null,"customfield_11817":null,"subtasks":[],"customfield_11801":null,"customfield_11800":null,"customfield_11802":null,"customfield_11805":null,"customfield_11804":null,"customfield_11807":null,"closedSprints":[{"id":2001,"self":"https://arthrex.atlassian.net/rest/agile/1.0/sprint/2001","state":"closed","name":"A Team: 7/11/22 - 7/15/22","startDate":"2022-07-11T13:56:18.821Z","endDate":"2022-07-16T02:15:00.000Z","completeDate":"2022-07-15T21:39:31.202Z","originBoardId":286,"goal":"Prep for Submission of v1.0.0 Rep App iOS Release"},{"id":1955,"self":"https://arthrex.atlassian.net/rest/agile/1.0/sprint/1955","state":"closed","name":"A Team: 6/27/22 - 7/1/22","startDate":"2022-06-27T13:39:51.053Z","endDate":"2022-07-01T16:03:00.000Z","completeDate":"2022-07-01T20:26:58.126Z","originBoardId":286,"goal":""},{"id":1940,"self":"https://arthrex.atlassian.net/rest/agile/1.0/sprint/1940","state":"closed","name":"A Team: 6/13/22 - 6/17/22","startDate":"2022-06-13T13:23:11.454Z","endDate":"2022-06-17T13:12:00.000Z","completeDate":"2022-06-17T21:12:57.348Z","originBoardId":286,"goal":""},{"id":1861,"self":"https://arthrex.atlassian.net/rest/agile/1.0/sprint/1861","state":"closed","name":"A Team: 4/18/22 - 4/22/22","startDate":"2022-04-18T13:19:51.131Z","endDate":"2022-04-22T21:22:00.000Z","completeDate":"2022-04-23T00:50:05.964Z","originBoardId":286,"goal":""},{"id":1862,"self":"https://arthrex.atlassian.net/rest/agile/1.0/sprint/1862","state":"closed","name":"A Team: 4/25/22 - 4/29/22","startDate":"2022-04-25T13:38:51.319Z","endDate":"2022-04-29T21:00:00.000Z","completeDate":"2022-04-29T20:44:00.021Z","originBoardId":286,"goal":""},{"id":1929,"self":"https://arthrex.atlassian.net/rest/agile/1.0/sprint/1929","state":"closed","name":"A Team: 5/31/22 - 6/10/22","startDate":"2022-05-31T13:20:11.464Z","endDate":"2022-06-10T14:13:00.000Z","completeDate":"2022-06-10T21:09:52.636Z","originBoardId":286,"goal":""},{"id":1881,"self":"https://arthrex.atlassian.net/rest/agile/1.0/sprint/1881","state":"closed","name":"A Team: 5/2/22 - 5/6/22","startDate":"2022-05-02T13:24:03.040Z","endDate":"2022-05-06T21:59:00.000Z","completeDate":"2022-05-06T20:33:28.823Z","originBoardId":286,"goal":""},{"id":1915,"self":"https://arthrex.atlassian.net/rest/agile/1.0/sprint/1915","state":"closed","name":"A Team: 5/16/22 - 5/20/22","startDate":"2022-05-16T13:45:22.501Z","endDate":"2022-05-20T21:11:00.000Z","completeDate":"2022-05-20T20:48:44.357Z","originBoardId":286,"goal":""},{"id":1916,"self":"https://arthrex.atlassian.net/rest/agile/1.0/sprint/1916","state":"closed","name":"A Team: 5/23/22 - 5/27/22","startDate":"2022-05-23T13:46:32.935Z","endDate":"2022-05-27T18:12:00.000Z","completeDate":"2022-05-27T21:18:43.799Z","originBoardId":286,"goal":""},{"id":1965,"self":"https://arthrex.atlassian.net/rest/agile/1.0/sprint/1965","state":"closed","name":"A Team: 7/5/22 - 7/8/22","startDate":"2022-07-05T13:38:21.073Z","endDate":"2022-07-08T17:26:00.000Z","completeDate":"2022-07-08T21:28:08.661Z","originBoardId":286,"goal":""},{"id":1952,"self":"https://arthrex.atlassian.net/rest/agile/1.0/sprint/1952","state":"closed","name":"A Team: 6/20/22 - 6/24/22","startDate":"2022-06-20T13:46:12.904Z","endDate":"2022-06-24T12:12:00.000Z","completeDate":"2022-06-24T20:31:59.550Z","originBoardId":286,"goal":""},{"id":1904,"self":"https://arthrex.atlassian.net/rest/agile/1.0/sprint/1904","state":"closed","name":"A Team: 5/9/22 - 5/13/22","startDate":"2022-05-09T13:36:27.141Z","endDate":"2022-05-13T21:43:00.000Z","completeDate":"2022-05-13T20:16:27.067Z","originBoardId":286,"goal":""}],"customfield_11806":null,"customfield_11809":null,"votes":{"self":"https://arthrex.atlassian.net/rest/api/2/issue/MOB-1014/votes","votes":0,"hasVoted":false},"customfield_11808":null,"worklog":{"startAt":0,"maxResults":20,"total":0,"worklogs":[]},"issuetype":{"self":"https://arthrex.atlassian.net/rest/api/2/issuetype/5","id":"5","description":"The sub-task of the issue","iconUrl":"https://arthrex.atlassian.net/rest/api/2/universal_avatar/view/type/issuetype/avatar/10316?size=medium","name":"Sub-task","subtask":true,"avatarId":10316,"hierarchyLevel":-1},"sprint":{"id":1661,"self":"https://arthrex.atlassian.net/rest/agile/1.0/sprint/1661","state":"active","name":"A Team: 7/18/22 - 7/22/22","startDate":"2022-07-18T13:46:00.383Z","endDate":"2022-07-23T02:21:00.000Z","originBoardId":286,"goal":"AMOBS v1.0.0 and RAI v1.0.0 Releases"},"customfield_10700":null,"customfield_10701":[],"customfield_10702":null,"customfield_11901":{"self":"https://arthrex.atlassian.net/rest/api/2/customFieldOption/11506","value":"No","id":"11506"},"customfield_14050":null,"timetracking":{},"customfield_10803":null,"customfield_10806":null,"customfield_14047":null,"customfield_14048":null,"customfield_14046":null,"customfield_14049":null,"environment":null,"duedate":null,"customfield_13980":null,"customfield_11441":null,"customfield_13861":null,"customfield_13982":null,"customfield_12772":null,"customfield_13740":null,"customfield_11440":null,"customfield_11200":null,"customfield_13742":null,"customfield_12774":null,"customfield_11443":null,"customfield_12411":null,"customfield_11442":null,"customfield_12773":null,"customfield_11201":null,"customfield_13741":null,"customfield_11202":null,"customfield_13623":null,"customfield_13986":null,"customfield_12413":null,"customfield_13744":null,"customfield_12776":null,"customfield_13985":null,"customfield_11444":null,"customfield_12775":null,"customfield_13743":null,"customfield_12533":null,"customfield_12412":null,"customfield_13614":null,"customfield_11435":null,"customfield_12645":null,"customfield_13613":null,"customfield_11438":null,"customfield_13616":null,"customfield_13979":null,"customfield_13737":null,"customfield_13615":null,"customfield_11437":null,"customfield_13739":null,"customfield_13738":null,"customfield_11439":null,"customfield_13617":null,"customfield_12409":null,"customfield_11430":null,"customfield_12761":null,"customfield_12760":null,"customfield_13610":null,"customfield_10100":"2|i02f9l:p","customfield_11431":null,"customfield_12762":null,"customfield_13975":null,"customfield_13612":null,"customfield_11434":null,"customfield_13611":null,"customfield_11425":null,"customfield_12756":null,"customfield_12514":null,"customfield_12998":null,"customfield_13603":null,"customfield_11303":null,"customfield_12755":null,"customfield_11304":null,"customfield_13602":null,"customfield_12513":null,"customfield_12997":null,"customfield_13726":null,"customfield_12758":null,"customfield_13605":null,"customfield_11427":null,"customfield_12757":null,"customfield_13604":null,"customfield_12999":null,"timeestimate":null,"customfield_13606":null,"customfield_12759":null,"customfield_13969":null,"customfield_11428":null,"customfield_13727":null,"customfield_13729":null,"customfield_13608":null,"status":{"self":"https://arthrex.atlassian.net/rest/api/2/status/10201","description":"This status is managed internally by JIRA Software","iconUrl":"https://arthrex.atlassian.net/images/icons/subtask.gif","name":"In Review","id":"10201","statusCategory":{"self":"https://arthrex.atlassian.net/rest/api/2/statuscategory/4","id":4,"key":"indeterminate","colorName":"yellow","name":"In Progress"}},"customfield_12750":null,"customfield_12752":null,"customfield_12510":null,"customfield_12751":null,"customfield_11300":{"self":"https://arthrex.atlassian.net/rest/api/2/customFieldOption/10700","value":"User Stories:1","id":"10700"},"customfield_11420":null,"customfield_12996":null,"customfield_12754":null,"customfield_11301":null,"customfield_13601":null,"customfield_13600":null,"customfield_11422":null,"customfield_12753":null,"customfield_12511":null,"customfield_12745":null,"customfield_12503":null,"customfield_11414":null,"customfield_12744":null,"customfield_12502":null,"customfield_12747":null,"customfield_13715":null,"customfield_13836":null,"customfield_12505":null,"customfield_13835":null,"customfield_11415":null,"customfield_12504":null,"customfield_12746":null,"customfield_13956":null,"aggregatetimeestimate":null,"customfield_12749":null,"customfield_11418":null,"customfield_12507":null,"customfield_13716":null,"customfield_13837":null,"customfield_12748":null,"customfield_11419":null,"customfield_12508":null,"creator":{"self":"https://arthrex.atlassian.net/rest/api/2/user?accountId=5dfa6aa75697460cb3d97763","accountId":"5dfa6aa75697460cb3d97763","emailAddress":"patrick.maguschak2@arthrex.com","avatarUrls":{"48x48":"https://avatar-management--avatars.us-west-2.prod.public.atl-paas.net/5dfa6aa75697460cb3d97763/5f2aaf98-63fd-4e3a-a29b-7e163f497fd8/48","24x24":"https://avatar-management--avatars.us-west-2.prod.public.atl-paas.net/5dfa6aa75697460cb3d97763/5f2aaf98-63fd-4e3a-a29b-7e163f497fd8/24","16x16":"https://avatar-management--avatars.us-west-2.prod.public.atl-paas.net/5dfa6aa75697460cb3d97763/5f2aaf98-63fd-4e3a-a29b-7e163f497fd8/16","32x32":"https://avatar-management--avatars.us-west-2.prod.public.atl-paas.net/5dfa6aa75697460cb3d97763/5f2aaf98-63fd-4e3a-a29b-7e163f497fd8/32"},"displayName":"Patrick Maguschak","active":true,"timeZone":"America/New_York","accountType":"atlassian"},"customfield_13830":null,"customfield_10200":null,"customfield_12743":null,"customfield_10202":null,"customfield_13831":null,"customfield_12500":null,"customfield_11403":{"self":"https://arthrex.atlassian.net/rest/api/2/customFieldOption/10806","value":"Hotline","id":"10806"},"customfield_13702":null,"customfield_13701":null,"customfield_12975":null,"customfield_11523":null,"customfield_11402":null,"customfield_13825":null,"customfield_11526":null,"customfield_13704":null,"customfield_13824":null,"customfield_11404":null,"customfield_13703":null,"customfield_12738":null,"customfield_13827":null,"customfield_13705":null,"customfield_13826":null,"customfield_13829":null,"customfield_11529":null,"timespent":null,"aggregatetimespent":null,"customfield_12972":null,"customfield_11522":null,"customfield_11401":null,"customfield_13700":null,"customfield_12974":null,"customfield_11400":null,"customfield_11521":null,"customfield_13933":null,"customfield_11512":null,"customfield_12843":null,"customfield_13932":null,"customfield_11514":null,"customfield_11519":null,"workratio":-1,"customfield_12840":null,"customfield_10300":null,"customfield_13931":null,"customfield_11511":null,"customfield_12842":null,"customfield_13930":null,"customfield_10301":null,"customfield_11510":null,"customfield_12841":null,"customfield_13801":null,"customfield_12833":null,"customfield_11502":null,"customfield_11501":{"hasEpicLinkFieldDependency":false,"showField":false,"nonEditableReason":{"reason":"PLUGIN_LICENSE_ERROR","message":"The Parent Link is only available to Jira Premium users."}},"customfield_12832":null,"customfield_13800":null,"customfield_12835":null,"customfield_11504":null,"customfield_13803":null,"customfield_12955":null,"customfield_13802":null,"customfield_12834":null,"customfield_11506":null,"customfield_12837":null,"customfield_13926":null,"customfield_12958":null,"customfield_13805":null,"customfield_11505":null,"customfield_13804":null,"customfield_13925":null,"customfield_12836":null,"customfield_12839":null,"customfield_12838":null,"customfield_13808":null,"customfield_11500":null,"customfield_12831":null,"customfield_12830":null,"customfield_12822":null,"customfield_12942":null,"customfield_12824":null,"customfield_12823":null,"flagged":false,"customfield_12825":null,"customfield_12828":null,"customfield_12827":null,"customfield_10400":null,"customfield_12811":null,"customfield_12932":null,"customfield_12934":null,"customfield_12933":null,"customfield_12936":null,"customfield_13904":null,"customfield_12935":null,"customfield_13903":null,"customfield_13906":null,"customfield_12938":null,"customfield_13905":null,"customfield_12937":null,"customfield_13908":null,"customfield_12939":null,"customfield_13909":null,"customfield_12490":null,"customfield_12372":null,"customfield_12493":null,"customfield_12492":null,"customfield_12495":null,"customfield_12374":null,"customfield_13463":null,"customfield_12494":null,"customfield_12376":null,"customfield_13465":null,"customfield_12496":"{panel:bgColor=#FFC400}\r\nThese fields are used to populate request forms in the customer portal. Do not manually change these fields.\r\n{panel}","customfield_13343":null,"customfield_13464":null,"customfield_12499":null,"customfield_13467":null,"customfield_13225":null,"customfield_13466":null,"customfield_13469":null,"customfield_13468":null,"customfield_13690":null,"customfield_12480":null,"customfield_13692":null,"customfield_12482":null,"customfield_12481":null,"customfield_13691":null,"customfield_13694":null,"customfield_12000":null,"customfield_12484":null,"customfield_12483":null,"customfield_12362":null,"customfield_13693":null,"customfield_13212":null,"customfield_13696":null,"customfield_12002":null,"customfield_13211":null,"customfield_12001":null,"customfield_13695":null,"customfield_12488":null,"customfield_12004":null,"customfield_13698":null,"customfield_13335":null,"customfield_12003":null,"customfield_13213":null,"customfield_13697":null,"customfield_12489":null,"labels":[],"customfield_12005":null,"customfield_13336":null,"customfield_13699":null,"customfield_13449":null,"customfield_13207":null,"components":[],"customfield_12471":null,"customfield_13681":null,"customfield_13680":null,"customfield_12470":null,"customfield_12473":null,"customfield_13683":null,"customfield_12110":null,"customfield_12472":null,"customfield_13682":null,"customfield_13685":null,"customfield_12112":null,"customfield_12475":null,"customfield_13322":null,"customfield_12474":null,"customfield_13684":null,"customfield_12111":null,"customfield_12477":null,"customfield_12114":{"self":"https://arthrex.atlassian.net/rest/api/2/customFieldOption/11922","value":"No","id":"11922"},"customfield_13687":null,"customfield_13686":null,"customfield_12476":null,"customfield_13689":null,"customfield_12358":null,"customfield_12479":null,"customfield_12357":null,"customfield_13688":null,"customfield_13325":null,"customfield_12478":null,"customfield_13679":null,"customfield_12106":null,"customfield_12469":null,"customfield_12348":"{panel:title=Alert|titleBGColor=#FFC400|bgColor=#FFFAE6}\r\nPlease make sure that the correct issue type is selected. To select a different issue type, move the issue.\r\n{panel}","customfield_12109":null,"customfield_12108":null,"customfield_13672":null,"customfield_12341":null,"customfield_12340":null,"customfield_13674":null,"reporter":{"self":"https://arthrex.atlassian.net/rest/api/2/user?accountId=5dfa6aa75697460cb3d97763","accountId":"5dfa6aa75697460cb3d97763","emailAddress":"patrick.maguschak2@arthrex.com","avatarUrls":{"48x48":"https://avatar-management--avatars.us-west-2.prod.public.atl-paas.net/5dfa6aa75697460cb3d97763/5f2aaf98-63fd-4e3a-a29b-7e163f497fd8/48","24x24":"https://avatar-management--avatars.us-west-2.prod.public.atl-paas.net/5dfa6aa75697460cb3d97763/5f2aaf98-63fd-4e3a-a29b-7e163f497fd8/24","16x16":"https://avatar-management--avatars.us-west-2.prod.public.atl-paas.net/5dfa6aa75697460cb3d97763/5f2aaf98-63fd-4e3a-a29b-7e163f497fd8/16","32x32":"https://avatar-management--avatars.us-west-2.prod.public.atl-paas.net/5dfa6aa75697460cb3d97763/5f2aaf98-63fd-4e3a-a29b-7e163f497fd8/32"},"displayName":"Patrick Maguschak","active":true,"timeZone":"America/New_York","accountType":"atlassian"},"customfield_13795":null,"customfield_12464":null,"customfield_12343":"{panel:title=Info|titleBGColor=#C0B6F2|bgColor=#EAE6FF}\r\nUse this transition to escalate this issue to another team.\r\n\r\nPlease note that if you select *MRM-DAM Technical*, Jira will automatically create a ticket in Footprints. If you do not wish to create a new Footprints ticket, please select *Disable emails to Footprints* below.\r\n\r\nIf you do not want to be reminded to follow-up on this issue, please select *Disable escalation follow-up* below.\r\n{panel}","customfield_12101":null,"customfield_12463":null,"customfield_12342":null,"customfield_13673":null,"customfield_13676":null,"customfield_13797":null,"customfield_12103":null,"customfield_12345":null,"customfield_12466":null,"customfield_13675":null,"customfield_12344":"{panel:title=Info|titleBGColor=#C0B6F2|bgColor=#EAE6FF}\r\nUse this transition to respond to the reporter and request participants.\r\n\r\nIf you do not want to be reminded to follow-up on this issue, select *Disable customer follow-up* below.\r\n{panel}","customfield_13796":null,"customfield_12347":"{panel:bgColor=#FFC400}\r\n*Note*\r\nThese fields are used to populate request forms in the customer portal. Do not manually change these fields.\r\n{panel}","customfield_13678":null,"customfield_13799":null,"customfield_12468":null,"customfield_13677":null,"customfield_12467":null,"customfield_12346":null,"customfield_12104":null,"customfield_13798":null,"progress":{"progress":0,"total":0},"customfield_12570":null,"customfield_13780":null,"customfield_13782":null,"customfield_12330":null,"customfield_12571":null,"project":{"self":"https://arthrex.atlassian.net/rest/api/2/project/12262","id":"12262","key":"MOB","name":"A Team","projectTypeKey":"software","simplified":false,"avatarUrls":{"48x48":"https://arthrex.atlassian.net/rest/api/2/universal_avatar/view/type/project/avatar/13447","24x24":"https://arthrex.atlassian.net/rest/api/2/universal_avatar/view/type/project/avatar/13447?size=small","16x16":"https://arthrex.atlassian.net/rest/api/2/universal_avatar/view/type/project/avatar/13447?size=xsmall","32x32":"https://arthrex.atlassian.net/rest/api/2/universal_avatar/view/type/project/avatar/13447?size=medium"},"projectCategory":{"self":"https://arthrex.atlassian.net/rest/api/2/projectCategory/10103","id":"10103","description":"","name":"Digital Media - Mobile"}},"customfield_12332":null,"customfield_12331":null,"customfield_13783":null,"customfield_12333":null,"customfield_12336":null,"customfield_12335":null,"customfield_13779":null,"customfield_12327":null,"customfield_12569":null,"customfield_12568":null,"customfield_12329":null,"customfield_12328":null,"resolutiondate":null,"watches":{"self":"https://arthrex.atlassian.net/rest/api/2/issue/MOB-1014/watchers","watchCount":1,"isWatching":false},"customfield_13890":null,"customfield_12561":null,"customfield_13771":null,"customfield_13892":null,"customfield_13770":null,"customfield_13891":null,"customfield_13652":null,"customfield_12563":null,"customfield_12200":null,"customfield_12321":null,"customfield_13772":null,"customfield_12320":null,"customfield_12562":null,"customfield_12202":null,"customfield_12323":null,"customfield_12564":null,"customfield_12201":null,"customfield_12322":null,"customfield_12567":null,"customfield_13656":null,"customfield_12566":null,"customfield_12203":null,"customfield_13655":null,"customfield_12324":null,"customfield_12558":null,"customfield_13407":null,"customfield_13769":null,"customfield_12319":null,"updated":"2022-06-22T16:13:20.595-0400","customfield_12790":null,"timeoriginalestimate":null,"customfield_13760":null,"customfield_12550":null,"customfield_12792":null,"customfield_12791":null,"description":"* We will need all the screenshots of the Rep App that we are planning on launching for MVP \n* [Login|https://www.figma.com/file/WssmeRFWg3wDQvdHMBesRh/Rep-App---Working---Pre-MVP-22?node-id=764%3A9564]. Will switch to this when we implement Dark Mode in the future \n** Incorrect PW verbiage as well \n** [Forgot PW screen|https://www.figma.com/file/WssmeRFWg3wDQvdHMBesRh/Rep-App---Working---Pre-MVP-22?node-id=2839%3A42816]\n* Playbook list (PM to Confirm with Rachel) \n* Playbook Details\n* [Settings|https://www.figma.com/file/WssmeRFWg3wDQvdHMBesRh/Rep-App---Working---Pre-MVP-22?node-id=3122%3A45367]\n** log out \n** a content update \n** privacy settings \n* ICONs Attached\n\n\n\nConfirm with Devs\n\nSurgeon app\n\n* [Hand off  |https://www.figma.com/file/WssmeRFWg3wDQvdHMBesRh/Rep-App---Working---Pre-MVP-22?node-id=2665%3A40493]\n* [New Banner Announcement|https://arthrex.atlassian.net/browse/SURG-6355]","customfield_12552":null,"customfield_13762":null,"customfield_12794":null,"customfield_12551":null,"customfield_13761":null,"customfield_11100":" ","customfield_13640":null,"customfield_13764":null,"customfield_11101":null,"customfield_12554":null,"customfield_11102":{"self":"https://arthrex.atlassian.net/rest/api/2/customFieldOption/10500","value":"1-None","id":"10500"},"customfield_13763":null,"customfield_12795":null,"customfield_12553":null,"customfield_13645":null,"customfield_13765":null,"customfield_12555":null,"customfield_11104":null,"customfield_12305":null,"customfield_13757":null,"customfield_12426":null,"customfield_13636":null,"customfield_10005":[{"id":1952,"name":"A Team: 6/20/22 - 6/24/22","state":"closed","boardId":286,"goal":"","startDate":"2022-06-20T13:46:12.904Z","endDate":"2022-06-24T12:12:00.000Z","completeDate":"2022-06-24T20:31:59.550Z"},{"id":1904,"name":"A Team: 5/9/22 - 5/13/22","state":"closed","boardId":286,"goal":"","startDate":"2022-05-09T13:36:27.141Z","endDate":"2022-05-13T21:43:00.000Z","completeDate":"2022-05-13T20:16:27.067Z"},{"id":2001,"name":"A Team: 7/11/22 - 7/15/22","state":"closed","boardId":286,"goal":"Prep for Submission of v1.0.0 Rep App iOS Release","startDate":"2022-07-11T13:56:18.821Z","endDate":"2022-07-16T02:15:00.000Z","completeDate":"2022-07-15T21:39:31.202Z"},{"id":1955,"name":"A Team: 6/27/22 - 7/1/22","state":"closed","boardId":286,"goal":"","startDate":"2022-06-27T13:39:51.053Z","endDate":"2022-07-01T16:03:00.000Z","completeDate":"2022-07-01T20:26:58.126Z"},{"id":1940,"name":"A Team: 6/13/22 - 6/17/22","state":"closed","boardId":286,"goal":"","startDate":"2022-06-13T13:23:11.454Z","endDate":"2022-06-17T13:12:00.000Z","completeDate":"2022-06-17T21:12:57.348Z"},{"id":1861,"name":"A Team: 4/18/22 - 4/22/22","state":"closed","boardId":286,"goal":"","startDate":"2022-04-18T13:19:51.131Z","endDate":"2022-04-22T21:22:00.000Z","completeDate":"2022-04-23T00:50:05.964Z"},{"id":1862,"name":"A Team: 4/25/22 - 4/29/22","state":"closed","boardId":286,"goal":"","startDate":"2022-04-25T13:38:51.319Z","endDate":"2022-04-29T21:00:00.000Z","completeDate":"2022-04-29T20:44:00.021Z"},{"id":1929,"name":"A Team: 5/31/22 - 6/10/22","state":"closed","boardId":286,"goal":"","startDate":"2022-05-31T13:20:11.464Z","endDate":"2022-06-10T14:13:00.000Z","completeDate":"2022-06-10T21:09:52.636Z"},{"id":1881,"name":"A Team: 5/2/22 - 5/6/22","state":"closed","boardId":286,"goal":"","startDate":"2022-05-02T13:24:03.040Z","endDate":"2022-05-06T21:59:00.000Z","completeDate":"2022-05-06T20:33:28.823Z"},{"id":1915,"name":"A Team: 5/16/22 - 5/20/22","state":"closed","boardId":286,"goal":"","startDate":"2022-05-16T13:45:22.501Z","endDate":"2022-05-20T21:11:00.000Z","completeDate":"2022-05-20T20:48:44.357Z"},{"id":1916,"name":"A Team: 5/23/22 - 5/27/22","state":"closed","boardId":286,"goal":"","startDate":"2022-05-23T13:46:32.935Z","endDate":"2022-05-27T18:12:00.000Z","completeDate":"2022-05-27T21:18:43.799Z"},{"id":1965,"name":"A Team: 7/5/22 - 7/8/22","state":"closed","boardId":286,"goal":"","startDate":"2022-07-05T13:38:21.073Z","endDate":"2022-07-08T17:26:00.000Z","completeDate":"2022-07-08T21:28:08.661Z"},{"id":1661,"name":"A Team: 7/18/22 - 7/22/22","state":"active","boardId":286,"goal":"AMOBS v1.0.0 and RAI v1.0.0 Releases","startDate":"2022-07-18T13:46:00.383Z","endDate":"2022-07-23T02:21:00.000Z"}],"customfield_12547":null,"customfield_12789":null,"customfield_13756":null,"customfield_12425":null,"customfield_10006":null,"customfield_12788":null,"customfield_12546":null,"customfield_12304":null,"customfield_13998":null,"customfield_12307":null,"customfield_12428":null,"customfield_12549":null,"customfield_13759":null,"customfield_13758":null,"customfield_12306":null,"customfield_12427":null,"customfield_12548":null,"customfield_12309":null,"customfield_12308":null,"customfield_12429":null,"summary":"MRM Assets for the REP App","customfield_12781":null,"customfield_11450":{"self":"https://arthrex.atlassian.net/rest/api/2/customFieldOption/10989","value":"Always","id":"10989"},"customfield_13993":null,"customfield_12780":null,"customfield_12420":null,"customfield_12783":null,"customfield_13751":null,"customfield_12541":null,"customfield_13991":null,"customfield_12782":null,"customfield_12540":null,"customfield_10000":null,"customfield_13750":null,"customfield_10001":null,"customfield_12422":null,"customfield_13753":null,"customfield_13996":null,"customfield_12785":null,"customfield_12784":null,"customfield_12300":"{}","customfield_13752":null,"customfield_13997":null,"customfield_12303":null,"customfield_13755":null,"customfield_13994":null,"customfield_12787":null,"customfield_12545":null,"customfield_13995":null,"customfield_12786":null,"customfield_12423":null,"customfield_13754":null,"customfield_12544":null,"customfield_11447":null,"customfield_12415":null,"customfield_12778":null,"customfield_13746":null,"customfield_13989":null,"customfield_12414":null,"customfield_12777":null,"customfield_13745":null,"customfield_13748":null,"customfield_12417":null,"customfield_13987":null,"customfield_11449":{"self":"https://arthrex.atlassian.net/rest/api/2/customFieldOption/10986","value":"Live Site","id":"10986"},"customfield_12416":null,"customfield_12779":null,"customfield_13505":[],"customfield_11448":null,"customfield_12419":null,"customfield_13749":null,"customfield_12418":null,"comment":{"comments":[{"self":"https://arthrex.atlassian.net/rest/api/2/issue/293230/comment/455264","id":"455264","author":{"self":"https://arthrex.atlassian.net/rest/api/2/user?accountId=5dfa6aa75697460cb3d97763","accountId":"5dfa6aa75697460cb3d97763","emailAddress":"patrick.maguschak2@arthrex.com","avatarUrls":{"48x48":"https://avatar-management--avatars.us-west-2.prod.public.atl-paas.net/5dfa6aa75697460cb3d97763/5f2aaf98-63fd-4e3a-a29b-7e163f497fd8/48","24x24":"https://avatar-management--avatars.us-west-2.prod.public.atl-paas.net/5dfa6aa75697460cb3d97763/5f2aaf98-63fd-4e3a-a29b-7e163f497fd8/24","16x16":"https://avatar-management--avatars.us-west-2.prod.public.atl-paas.net/5dfa6aa75697460cb3d97763/5f2aaf98-63fd-4e3a-a29b-7e163f497fd8/16","32x32":"https://avatar-management--avatars.us-west-2.prod.public.atl-paas.net/5dfa6aa75697460cb3d97763/5f2aaf98-63fd-4e3a-a29b-7e163f497fd8/32"},"displayName":"Patrick Maguschak","active":true,"timeZone":"America/New_York","accountType":"atlassian"},"body":"[https://www.figma.com/file/WssmeRFWg3wDQvdHMBesRh/Rep-App---Working---Pre-MVP-22?node-id=1326%3A19206|https://www.figma.com/file/WssmeRFWg3wDQvdHMBesRh/Rep-App---Working---Pre-MVP-22?node-id=1326%3A19206|smart-link] ","updateAuthor":{"self":"https://arthrex.atlassian.net/rest/api/2/user?accountId=5dfa6aa75697460cb3d97763","accountId":"5dfa6aa75697460cb3d97763","emailAddress":"patrick.maguschak2@arthrex.com","avatarUrls":{"48x48":"https://avatar-management--avatars.us-west-2.prod.public.atl-paas.net/5dfa6aa75697460cb3d97763/5f2aaf98-63fd-4e3a-a29b-7e163f497fd8/48","24x24":"https://avatar-management--avatars.us-west-2.prod.public.atl-paas.net/5dfa6aa75697460cb3d97763/5f2aaf98-63fd-4e3a-a29b-7e163f497fd8/24","16x16":"https://avatar-management--avatars.us-west-2.prod.public.atl-paas.net/5dfa6aa75697460cb3d97763/5f2aaf98-63fd-4e3a-a29b-7e163f497fd8/16","32x32":"https://avatar-management--avatars.us-west-2.prod.public.atl-paas.net/5dfa6aa75697460cb3d97763/5f2aaf98-63fd-4e3a-a29b-7e163f497fd8/32"},"displayName":"Patrick Maguschak","active":true,"timeZone":"America/New_York","accountType":"atlassian"},"created":"2022-06-09T13:08:04.280-0400","updated":"2022-06-09T13:08:04.280-0400","jsdPublic":true}],"self":"https://arthrex.atlassian.net/rest/api/2/issue/293230/comment","maxResults":1,"total":1,"startAt":0},"statuscategorychangedate":"2022-06-15T08:03:40.535-0400","customfield_13063":"Testing message","customfield_14033":null,"customfield_13062":null,"customfield_13067":null,"customfield_13066":null,"fixVersions":[],"customfield_10900":null,"customfield_13052":null,"customfield_13294":null,"customfield_13053":null,"epic":null,"customfield_13057":null,"priority":{"self":"https://arthrex.atlassian.net/rest/api/2/priority/3","iconUrl":"https://s3.amazonaws.com/arthrex-public/jira/priorities/major.png","name":"Major","id":"3"},"customfield_14028":null,"versions":[],"customfield_13045":null,"customfield_14014":null,"customfield_14015":null,"customfield_13047":null,"customfield_14013":null,"customfield_13046":null,"customfield_14016":null,"customfield_14017":null,"customfield_13391":null,"customfield_13272":null,"customfield_13392":null,"customfield_13274":null,"customfield_13273":null,"aggregateprogress":{"progress":0,"total":0},"customfield_13279":null,"customfield_13380":null,"issuerestriction":{"issuerestrictions":{},"shouldDisplay":false},"customfield_13371":null,"customfield_13373":null,"created":"2022-06-09T09:40:44.340-0400","customfield_13494":null,"customfield_13012":null,"customfield_13375":null,"customfield_13011":null,"customfield_13377":null,"customfield_13376":null,"customfield_13379":null,"customfield_13016":null,"customfield_13378":null,"customfield_13017":null,"customfield_13360":null,"customfield_13362":null,"customfield_13361":null,"customfield_13364":null,"customfield_13122":null,"customfield_13001":null,"customfield_13000":null,"customfield_13363":null,"customfield_13366":"150 GB","customfield_13365":null,"customfield_13002":null,"customfield_13368":null,"customfield_13367":null,"customfield_13369":null,"security":null,"attachment":[{"self":"https://arthrex.atlassian.net/rest/api/2/attachment/224183","id":"224183","filename":"REP APP LOGO.png","author":{"self":"https://arthrex.atlassian.net/rest/api/2/user?accountId=5dfa6aa75697460cb3d97763","accountId":"5dfa6aa75697460cb3d97763","emailAddress":"patrick.maguschak2@arthrex.com","avatarUrls":{"48x48":"https://avatar-management--avatars.us-west-2.prod.public.atl-paas.net/5dfa6aa75697460cb3d97763/5f2aaf98-63fd-4e3a-a29b-7e163f497fd8/48","24x24":"https://avatar-management--avatars.us-west-2.prod.public.atl-paas.net/5dfa6aa75697460cb3d97763/5f2aaf98-63fd-4e3a-a29b-7e163f497fd8/24","16x16":"https://avatar-management--avatars.us-west-2.prod.public.atl-paas.net/5dfa6aa75697460cb3d97763/5f2aaf98-63fd-4e3a-a29b-7e163f497fd8/16","32x32":"https://avatar-management--avatars.us-west-2.prod.public.atl-paas.net/5dfa6aa75697460cb3d97763/5f2aaf98-63fd-4e3a-a29b-7e163f497fd8/32"},"displayName":"Patrick Maguschak","active":true,"timeZone":"America/New_York","accountType":"atlassian"},"created":"2022-06-15T08:01:40.097-0400","size":219723,"mimeType":"image/png","content":"https://arthrex.atlassian.net/rest/api/2/attachment/content/224183","thumbnail":"https://arthrex.atlassian.net/rest/api/2/attachment/thumbnail/224183"}],"customfield_13470":null,"customfield_13471":null,"customfield_12385":null,"customfield_13355":null,"customfield_12386":null,"customfield_13599":null,"customfield_13357":null,"customfield_13356":null,"customfield_12388":null,"customfield_13359":null,"customfield_13358":null}},{"expand":"operations,versionedRepresentations,editmeta,changelog,renderedFields","id":"295340","self":"https://arthrex.atlassian.net/rest/agile/1.0/issue/295340","key":"MOB-1033","fields":{"parent":{"id":"279628","key":"MOB-929","self":"https://arthrex.atlassian.net/rest/api/2/issue/279628","fields":{"summary":"UX/UI","status":{"self":"https://arthrex.atlassian.net/rest/api/2/status/3","description":"This issue is being actively worked on at the moment by the assignee.","iconUrl":"https://arthrex.atlassian.net/images/icons/statuses/inprogress.png","name":"Working","id":"3","statusCategory":{"self":"https://arthrex.atlassian.net/rest/api/2/statuscategory/4","id":4,"key":"indeterminate","colorName":"yellow","name":"In Progress"}},"priority":{"self":"https://arthrex.atlassian.net/rest/api/2/priority/4","iconUrl":"https://s3.amazonaws.com/arthrex-public/jira/priorities/minor.png","name":"Minor","id":"4"},"issuetype":{"self":"https://arthrex.atlassian.net/rest/api/2/issuetype/3","id":"3","description":"A task that needs to be done.","iconUrl":"https://arthrex.atlassian.net/rest/api/2/universal_avatar/view/type/issuetype/avatar/10318?size=medium","name":"Task","subtask":false,"avatarId":10318,"hierarchyLevel":0}}},"resolution":{"self":"https://arthrex.atlassian.net/rest/api/2/resolution/10000","id":"10000","description":"The issue is done.","name":"Done"},"customfield_12930":null,"customfield_12923":null,"customfield_12924":null,"customfield_12929":null,"lastViewed":null,"customfield_11700":null,"customfield_12912":null,"customfield_11702":null,"customfield_11701":null,"aggregatetimeoriginalestimate":null,"customfield_12914":null,"customfield_12916":null,"customfield_12915":null,"customfield_12918":null,"customfield_12917":null,"issuelinks":[],"customfield_12919":null,"assignee":{"self":"https://arthrex.atlassian.net/rest/api/2/user?accountId=60bac9915fa6f1006fee00b2","accountId":"60bac9915fa6f1006fee00b2","emailAddress":"johnny.ansari@arthrex.com","avatarUrls":{"48x48":"https://secure.gravatar.com/avatar/d887eff1f5130dfab59a6de736562de4?d=https%3A%2F%2Favatar-management--avatars.us-west-2.prod.public.atl-paas.net%2Finitials%2FJA-5.png","24x24":"https://secure.gravatar.com/avatar/d887eff1f5130dfab59a6de736562de4?d=https%3A%2F%2Favatar-management--avatars.us-west-2.prod.public.atl-paas.net%2Finitials%2FJA-5.png","16x16":"https://secure.gravatar.com/avatar/d887eff1f5130dfab59a6de736562de4?d=https%3A%2F%2Favatar-management--avatars.us-west-2.prod.public.atl-paas.net%2Finitials%2FJA-5.png","32x32":"https://secure.gravatar.com/avatar/d887eff1f5130dfab59a6de736562de4?d=https%3A%2F%2Favatar-management--avatars.us-west-2.prod.public.atl-paas.net%2Finitials%2FJA-5.png"},"displayName":"Johnny Ansari","active":true,"timeZone":"America/New_York","accountType":"atlassian"},"customfield_11810":null,"customfield_11812":null,"customfield_12901":null,"customfield_11811":null,"customfield_11814":null,"customfield_12903":null,"customfield_12902":null,"customfield_11813":null,"customfield_12905":null,"customfield_11816":null,"customfield_11815":null,"customfield_12904":null,"customfield_11818":null,"customfield_12906":null,"customfield_11817":null,"subtasks":[],"customfield_11801":null,"customfield_11800":null,"customfield_11802":null,"customfield_11805":null,"customfield_11804":null,"customfield_11807":null,"closedSprints":[{"id":2001,"self":"https://arthrex.atlassian.net/rest/agile/1.0/sprint/2001","state":"closed","name":"A Team: 7/11/22 - 7/15/22","startDate":"2022-07-11T13:56:18.821Z","endDate":"2022-07-16T02:15:00.000Z","completeDate":"2022-07-15T21:39:31.202Z","originBoardId":286,"goal":"Prep for Submission of v1.0.0 Rep App iOS Release"},{"id":1955,"self":"https://arthrex.atlassian.net/rest/agile/1.0/sprint/1955","state":"closed","name":"A Team: 6/27/22 - 7/1/22","startDate":"2022-06-27T13:39:51.053Z","endDate":"2022-07-01T16:03:00.000Z","completeDate":"2022-07-01T20:26:58.126Z","originBoardId":286,"goal":""},{"id":1940,"self":"https://arthrex.atlassian.net/rest/agile/1.0/sprint/1940","state":"closed","name":"A Team: 6/13/22 - 6/17/22","startDate":"2022-06-13T13:23:11.454Z","endDate":"2022-06-17T13:12:00.000Z","completeDate":"2022-06-17T21:12:57.348Z","originBoardId":286,"goal":""},{"id":1861,"self":"https://arthrex.atlassian.net/rest/agile/1.0/sprint/1861","state":"closed","name":"A Team: 4/18/22 - 4/22/22","startDate":"2022-04-18T13:19:51.131Z","endDate":"2022-04-22T21:22:00.000Z","completeDate":"2022-04-23T00:50:05.964Z","originBoardId":286,"goal":""},{"id":1862,"self":"https://arthrex.atlassian.net/rest/agile/1.0/sprint/1862","state":"closed","name":"A Team: 4/25/22 - 4/29/22","startDate":"2022-04-25T13:38:51.319Z","endDate":"2022-04-29T21:00:00.000Z","completeDate":"2022-04-29T20:44:00.021Z","originBoardId":286,"goal":""},{"id":1929,"self":"https://arthrex.atlassian.net/rest/agile/1.0/sprint/1929","state":"closed","name":"A Team: 5/31/22 - 6/10/22","startDate":"2022-05-31T13:20:11.464Z","endDate":"2022-06-10T14:13:00.000Z","completeDate":"2022-06-10T21:09:52.636Z","originBoardId":286,"goal":""},{"id":1881,"self":"https://arthrex.atlassian.net/rest/agile/1.0/sprint/1881","state":"closed","name":"A Team: 5/2/22 - 5/6/22","startDate":"2022-05-02T13:24:03.040Z","endDate":"2022-05-06T21:59:00.000Z","completeDate":"2022-05-06T20:33:28.823Z","originBoardId":286,"goal":""},{"id":1915,"self":"https://arthrex.atlassian.net/rest/agile/1.0/sprint/1915","state":"closed","name":"A Team: 5/16/22 - 5/20/22","startDate":"2022-05-16T13:45:22.501Z","endDate":"2022-05-20T21:11:00.000Z","completeDate":"2022-05-20T20:48:44.357Z","originBoardId":286,"goal":""},{"id":1916,"self":"https://arthrex.atlassian.net/rest/agile/1.0/sprint/1916","state":"closed","name":"A Team: 5/23/22 - 5/27/22","startDate":"2022-05-23T13:46:32.935Z","endDate":"2022-05-27T18:12:00.000Z","completeDate":"2022-05-27T21:18:43.799Z","originBoardId":286,"goal":""},{"id":1965,"self":"https://arthrex.atlassian.net/rest/agile/1.0/sprint/1965","state":"closed","name":"A Team: 7/5/22 - 7/8/22","startDate":"2022-07-05T13:38:21.073Z","endDate":"2022-07-08T17:26:00.000Z","completeDate":"2022-07-08T21:28:08.661Z","originBoardId":286,"goal":""},{"id":1952,"self":"https://arthrex.atlassian.net/rest/agile/1.0/sprint/1952","state":"closed","name":"A Team: 6/20/22 - 6/24/22","startDate":"2022-06-20T13:46:12.904Z","endDate":"2022-06-24T12:12:00.000Z","completeDate":"2022-06-24T20:31:59.550Z","originBoardId":286,"goal":""},{"id":1904,"self":"https://arthrex.atlassian.net/rest/agile/1.0/sprint/1904","state":"closed","name":"A Team: 5/9/22 - 5/13/22","startDate":"2022-05-09T13:36:27.141Z","endDate":"2022-05-13T21:43:00.000Z","completeDate":"2022-05-13T20:16:27.067Z","originBoardId":286,"goal":""}],"customfield_11806":null,"customfield_11809":null,"votes":{"self":"https://arthrex.atlassian.net/rest/api/2/issue/MOB-1033/votes","votes":0,"hasVoted":false},"customfield_11808":null,"worklog":{"startAt":0,"maxResults":20,"total":0,"worklogs":[]},"issuetype":{"self":"https://arthrex.atlassian.net/rest/api/2/issuetype/5","id":"5","description":"The sub-task of the issue","iconUrl":"https://arthrex.atlassian.net/rest/api/2/universal_avatar/view/type/issuetype/avatar/10316?size=medium","name":"Sub-task","subtask":true,"avatarId":10316,"hierarchyLevel":-1},"sprint":{"id":1661,"self":"https://arthrex.atlassian.net/rest/agile/1.0/sprint/1661","state":"active","name":"A Team: 7/18/22 - 7/22/22","startDate":"2022-07-18T13:46:00.383Z","endDate":"2022-07-23T02:21:00.000Z","originBoardId":286,"goal":"AMOBS v1.0.0 and RAI v1.0.0 Releases"},"customfield_10700":null,"customfield_10701":[],"customfield_10702":null,"customfield_11901":{"self":"https://arthrex.atlassian.net/rest/api/2/customFieldOption/11506","value":"No","id":"11506"},"customfield_14050":null,"timetracking":{},"customfield_10803":null,"customfield_10806":null,"customfield_14047":null,"customfield_14048":null,"customfield_14046":null,"customfield_14049":null,"environment":null,"duedate":null,"customfield_13980":null,"customfield_13861":null,"customfield_11441":null,"customfield_12772":null,"customfield_13740":null,"customfield_13982":null,"customfield_11440":null,"customfield_12411":null,"customfield_11200":null,"customfield_11443":null,"customfield_13742":null,"customfield_12774":null,"customfield_11201":null,"customfield_13741":null,"customfield_12773":null,"customfield_11442":null,"customfield_13744":null,"customfield_12413":null,"customfield_13623":null,"customfield_13986":null,"customfield_11202":null,"customfield_12776":null,"customfield_13985":null,"customfield_12533":null,"customfield_12412":null,"customfield_11444":null,"customfield_13743":null,"customfield_12775":null,"customfield_13614":null,"customfield_12645":null,"customfield_13613":null,"customfield_11435":null,"customfield_11438":null,"customfield_13737":null,"customfield_13616":null,"customfield_13979":null,"customfield_13615":null,"customfield_11437":null,"customfield_13739":null,"customfield_11439":null,"customfield_13617":null,"customfield_13738":null,"customfield_12409":null,"customfield_11430":null,"customfield_12761":null,"customfield_12760":null,"customfield_10100":"2|i02f9l:v","customfield_13610":null,"customfield_11431":null,"customfield_12762":null,"customfield_13975":null,"customfield_13612":null,"customfield_11434":null,"customfield_13611":null,"customfield_13603":null,"customfield_11303":"3_*:*_1_*:*_431742020_*|*_10000_*:*_1_*:*_694279455_*|*_10001_*:*_1_*:*_0","customfield_12514":null,"customfield_12998":null,"customfield_11425":null,"customfield_12756":null,"customfield_11304":null,"customfield_12755":null,"customfield_12513":null,"customfield_13602":null,"customfield_12997":null,"customfield_11427":null,"customfield_12758":null,"customfield_13726":null,"customfield_13605":null,"customfield_12999":null,"customfield_12757":null,"customfield_13604":null,"timeestimate":null,"customfield_13727":null,"customfield_11428":null,"customfield_12759":null,"customfield_13969":null,"customfield_13606":null,"customfield_13729":null,"customfield_13608":null,"status":{"self":"https://arthrex.atlassian.net/rest/api/2/status/10001","description":"","iconUrl":"https://arthrex.atlassian.net/images/icons/subtask.gif","name":"Done","id":"10001","statusCategory":{"self":"https://arthrex.atlassian.net/rest/api/2/statuscategory/3","id":3,"key":"done","colorName":"green","name":"Done"}},"customfield_12750":null,"customfield_12752":null,"customfield_12510":null,"customfield_11420":null,"customfield_11300":{"self":"https://arthrex.atlassian.net/rest/api/2/customFieldOption/10700","value":"User Stories:1","id":"10700"},"customfield_12751":null,"customfield_12754":null,"customfield_12996":null,"customfield_13601":null,"customfield_11301":null,"customfield_11422":null,"customfield_12511":null,"customfield_13600":null,"customfield_12753":null,"customfield_11414":null,"customfield_12745":null,"customfield_12503":null,"customfield_12744":null,"customfield_12502":null,"customfield_12505":null,"customfield_12747":null,"customfield_13715":null,"customfield_13836":null,"customfield_12746":null,"customfield_13835":null,"customfield_11415":null,"customfield_13956":null,"customfield_12504":null,"customfield_12507":null,"customfield_12749":null,"customfield_11418":null,"aggregatetimeestimate":null,"customfield_13716":null,"customfield_13837":null,"customfield_12748":null,"customfield_11419":null,"customfield_12508":null,"creator":{"self":"https://arthrex.atlassian.net/rest/api/2/user?accountId=5dfa6aa75697460cb3d97763","accountId":"5dfa6aa75697460cb3d97763","emailAddress":"patrick.maguschak2@arthrex.com","avatarUrls":{"48x48":"https://avatar-management--avatars.us-west-2.prod.public.atl-paas.net/5dfa6aa75697460cb3d97763/5f2aaf98-63fd-4e3a-a29b-7e163f497fd8/48","24x24":"https://avatar-management--avatars.us-west-2.prod.public.atl-paas.net/5dfa6aa75697460cb3d97763/5f2aaf98-63fd-4e3a-a29b-7e163f497fd8/24","16x16":"https://avatar-management--avatars.us-west-2.prod.public.atl-paas.net/5dfa6aa75697460cb3d97763/5f2aaf98-63fd-4e3a-a29b-7e163f497fd8/16","32x32":"https://avatar-management--avatars.us-west-2.prod.public.atl-paas.net/5dfa6aa75697460cb3d97763/5f2aaf98-63fd-4e3a-a29b-7e163f497fd8/32"},"displayName":"Patrick Maguschak","active":true,"timeZone":"America/New_York","accountType":"atlassian"},"customfield_13830":null,"customfield_10200":null,"customfield_12743":null,"customfield_10202":null,"customfield_12500":null,"customfield_13831":null,"customfield_13702":null,"customfield_11403":{"self":"https://arthrex.atlassian.net/rest/api/2/customFieldOption/10806","value":"Hotline","id":"10806"},"customfield_13701":null,"customfield_11523":null,"customfield_11402":null,"customfield_12975":null,"customfield_11526":null,"customfield_13704":null,"customfield_13825":null,"customfield_11404":null,"customfield_13703":null,"customfield_13824":null,"customfield_13827":null,"customfield_12738":null,"customfield_13826":null,"customfield_13705":null,"customfield_13829":null,"customfield_11529":null,"timespent":null,"aggregatetimespent":null,"customfield_12972":null,"customfield_12974":null,"customfield_11522":null,"customfield_11401":null,"customfield_13700":null,"customfield_11521":null,"customfield_11400":null,"customfield_13933":null,"customfield_13932":null,"customfield_12843":null,"customfield_11512":null,"customfield_11514":null,"customfield_11519":"3_*:*_1_*:*_431742020_*|*_10000_*:*_1_*:*_694279455_*|*_10001_*:*_1_*:*_0","workratio":-1,"customfield_12840":null,"customfield_11511":null,"customfield_13931":null,"customfield_12842":null,"customfield_10300":null,"customfield_13930":null,"customfield_10301":null,"customfield_12841":null,"customfield_11510":null,"customfield_11502":null,"customfield_13801":null,"customfield_12833":null,"customfield_13800":null,"customfield_11501":{"hasEpicLinkFieldDependency":false,"showField":false,"nonEditableReason":{"reason":"PLUGIN_LICENSE_ERROR","message":"The Parent Link is only available to Jira Premium users."}},"customfield_12832":null,"customfield_11504":null,"customfield_13803":null,"customfield_12835":null,"customfield_12834":null,"customfield_13802":null,"customfield_12955":null,"customfield_12958":null,"customfield_12837":null,"customfield_13926":null,"customfield_13805":null,"customfield_11506":null,"customfield_13804":null,"customfield_12836":null,"customfield_11505":null,"customfield_13925":null,"customfield_12839":null,"customfield_12838":null,"customfield_13808":null,"customfield_12831":null,"customfield_11500":null,"customfield_12830":null,"customfield_12822":null,"customfield_12942":null,"customfield_12824":null,"customfield_12823":null,"flagged":false,"customfield_12825":null,"customfield_12828":null,"customfield_12827":null,"customfield_10400":null,"customfield_12811":null,"customfield_12932":null,"customfield_12934":null,"customfield_12933":null,"customfield_13904":null,"customfield_12936":null,"customfield_13903":null,"customfield_12935":null,"customfield_13906":null,"customfield_12938":null,"customfield_12937":null,"customfield_13905":null,"customfield_13908":null,"customfield_12939":null,"customfield_13909":null,"customfield_12490":null,"customfield_12493":null,"customfield_12372":null,"customfield_12492":null,"customfield_12374":null,"customfield_13463":null,"customfield_12495":null,"customfield_12494":null,"customfield_12376":null,"customfield_13465":null,"customfield_13464":null,"customfield_13343":null,"customfield_12496":"{panel:bgColor=#FFC400}\r\nThese fields are used to populate request forms in the customer portal. Do not manually change these fields.\r\n{panel}","customfield_13467":null,"customfield_12499":null,"customfield_13225":null,"customfield_13466":null,"customfield_13469":null,"customfield_13468":null,"customfield_13690":null,"customfield_12480":null,"customfield_13692":null,"customfield_12482":null,"customfield_13691":null,"customfield_12481":null,"customfield_13694":null,"customfield_12000":null,"customfield_12484":null,"customfield_12362":null,"customfield_12483":null,"customfield_13693":null,"customfield_13212":null,"customfield_13696":null,"customfield_12002":null,"customfield_13695":null,"customfield_12001":null,"customfield_13211":null,"customfield_13698":null,"customfield_13335":null,"customfield_12004":null,"customfield_12488":null,"customfield_13213":null,"customfield_12003":null,"customfield_13697":null,"customfield_12489":null,"labels":[],"customfield_12005":null,"customfield_13336":null,"customfield_13699":null,"customfield_13207":null,"customfield_13449":null,"components":[],"customfield_13681":null,"customfield_12471":null,"customfield_13680":null,"customfield_12470":null,"customfield_12110":null,"customfield_13683":null,"customfield_12473":null,"customfield_13682":null,"customfield_12472":null,"customfield_13322":null,"customfield_12112":null,"customfield_12475":null,"customfield_13685":null,"customfield_13684":null,"customfield_12474":null,"customfield_12111":null,"customfield_12114":{"self":"https://arthrex.atlassian.net/rest/api/2/customFieldOption/11922","value":"No","id":"11922"},"customfield_12477":null,"customfield_13687":null,"customfield_12476":null,"customfield_13686":null,"customfield_12479":null,"customfield_12358":null,"customfield_13689":null,"customfield_12478":null,"customfield_13688":null,"customfield_13325":null,"customfield_12357":null,"customfield_12348":"{panel:title=Alert|titleBGColor=#FFC400|bgColor=#FFFAE6}\r\nPlease make sure that the correct issue type is selected. To select a different issue type, move the issue.\r\n{panel}","customfield_12469":null,"customfield_13679":null,"customfield_12106":null,"customfield_12109":null,"customfield_12108":null,"customfield_12341":null,"customfield_13672":null,"customfield_12340":null,"customfield_12464":null,"customfield_12343":"{panel:title=Info|titleBGColor=#C0B6F2|bgColor=#EAE6FF}\r\nUse this transition to escalate this issue to another team.\r\n\r\nPlease note that if you select *MRM-DAM Technical*, Jira will automatically create a ticket in Footprints. If you do not wish to create a new Footprints ticket, please select *Disable emails to Footprints* below.\r\n\r\nIf you do not want to be reminded to follow-up on this issue, please select *Disable escalation follow-up* below.\r\n{panel}","reporter":{"self":"https://arthrex.atlassian.net/rest/api/2/user?accountId=5dfa6aa75697460cb3d97763","accountId":"5dfa6aa75697460cb3d97763","emailAddress":"patrick.maguschak2@arthrex.com","avatarUrls":{"48x48":"https://avatar-management--avatars.us-west-2.prod.public.atl-paas.net/5dfa6aa75697460cb3d97763/5f2aaf98-63fd-4e3a-a29b-7e163f497fd8/48","24x24":"https://avatar-management--avatars.us-west-2.prod.public.atl-paas.net/5dfa6aa75697460cb3d97763/5f2aaf98-63fd-4e3a-a29b-7e163f497fd8/24","16x16":"https://avatar-management--avatars.us-west-2.prod.public.atl-paas.net/5dfa6aa75697460cb3d97763/5f2aaf98-63fd-4e3a-a29b-7e163f497fd8/16","32x32":"https://avatar-management--avatars.us-west-2.prod.public.atl-paas.net/5dfa6aa75697460cb3d97763/5f2aaf98-63fd-4e3a-a29b-7e163f497fd8/32"},"displayName":"Patrick Maguschak","active":true,"timeZone":"America/New_York","accountType":"atlassian"},"customfield_12101":null,"customfield_13795":null,"customfield_13674":null,"customfield_12463":null,"customfield_13673":null,"customfield_12342":null,"customfield_12466":null,"customfield_13797":null,"customfield_12103":null,"customfield_12345":null,"customfield_13676":null,"customfield_13796":null,"customfield_12344":"{panel:title=Info|titleBGColor=#C0B6F2|bgColor=#EAE6FF}\r\nUse this transition to respond to the reporter and request participants.\r\n\r\nIf you do not want to be reminded to follow-up on this issue, select *Disable customer follow-up* below.\r\n{panel}","customfield_13675":null,"customfield_13799":null,"customfield_12468":null,"customfield_13678":null,"customfield_12347":"{panel:bgColor=#FFC400}\r\n*Note*\r\nThese fields are used to populate request forms in the customer portal. Do not manually change these fields.\r\n{panel}","customfield_12104":null,"customfield_12467":null,"customfield_12346":null,"customfield_13798":null,"customfield_13677":null,"progress":{"progress":0,"total":0},"customfield_13780":null,"customfield_12570":null,"customfield_13782":null,"customfield_12330":null,"customfield_12571":null,"project":{"self":"https://arthrex.atlassian.net/rest/api/2/project/12262","id":"12262","key":"MOB","name":"A Team","projectTypeKey":"software","simplified":false,"avatarUrls":{"48x48":"https://arthrex.atlassian.net/rest/api/2/universal_avatar/view/type/project/avatar/13447","24x24":"https://arthrex.atlassian.net/rest/api/2/universal_avatar/view/type/project/avatar/13447?size=small","16x16":"https://arthrex.atlassian.net/rest/api/2/universal_avatar/view/type/project/avatar/13447?size=xsmall","32x32":"https://arthrex.atlassian.net/rest/api/2/universal_avatar/view/type/project/avatar/13447?size=medium"},"projectCategory":{"self":"https://arthrex.atlassian.net/rest/api/2/projectCategory/10103","id":"10103","description":"","name":"Digital Media - Mobile"}},"customfield_12332":null,"customfield_13783":null,"customfield_12331":null,"customfield_12333":null,"customfield_12336":null,"customfield_12335":null,"customfield_12327":null,"customfield_13779":null,"customfield_12569":null,"customfield_12568":null,"customfield_12329":null,"customfield_12328":null,"resolutiondate":"2022-06-28T08:49:53.546-0400","watches":{"self":"https://arthrex.atlassian.net/rest/api/2/issue/MOB-1033/watchers","watchCount":1,"isWatching":false},"customfield_13890":null,"customfield_12561":null,"customfield_13892":null,"customfield_13771":null,"customfield_13770":null,"customfield_13891":null,"customfield_12563":null,"customfield_13652":null,"customfield_12200":null,"customfield_12321":null,"customfield_12320":null,"customfield_13772":null,"customfield_12562":null,"customfield_12323":null,"customfield_12202":null,"customfield_12564":null,"customfield_12322":null,"customfield_12201":null,"customfield_12567":null,"customfield_13656":null,"customfield_12203":null,"customfield_12324":null,"customfield_13655":null,"customfield_12566":null,"customfield_12558":null,"customfield_13407":null,"customfield_13769":null,"customfield_12319":null,"updated":"2022-06-28T08:49:53.778-0400","customfield_12790":null,"timeoriginalestimate":null,"customfield_12550":null,"customfield_12792":null,"customfield_13760":null,"description":"Need the on boarding Announcement mocked up to so that we can run it through the MRM \nFull Text can be found here\n[https://arthrex.atlassian.net/browse/SURG-6355|https://arthrex.atlassian.net/browse/SURG-6355|smart-link] ","customfield_12791":null,"customfield_12794":null,"customfield_13762":null,"customfield_12552":null,"customfield_13761":null,"customfield_12551":null,"customfield_13640":null,"customfield_11100":" ","customfield_13764":null,"customfield_12554":null,"customfield_11101":null,"customfield_12553":null,"customfield_12795":null,"customfield_11102":{"self":"https://arthrex.atlassian.net/rest/api/2/customFieldOption/10500","value":"1-None","id":"10500"},"customfield_13763":null,"customfield_13645":null,"customfield_12555":null,"customfield_13765":null,"customfield_11104":null,"customfield_13636":null,"customfield_13757":null,"customfield_10005":[{"id":1952,"name":"A Team: 6/20/22 - 6/24/22","state":"closed","boardId":286,"goal":"","startDate":"2022-06-20T13:46:12.904Z","endDate":"2022-06-24T12:12:00.000Z","completeDate":"2022-06-24T20:31:59.550Z"},{"id":1904,"name":"A Team: 5/9/22 - 5/13/22","state":"closed","boardId":286,"goal":"","startDate":"2022-05-09T13:36:27.141Z","endDate":"2022-05-13T21:43:00.000Z","completeDate":"2022-05-13T20:16:27.067Z"},{"id":2001,"name":"A Team: 7/11/22 - 7/15/22","state":"closed","boardId":286,"goal":"Prep for Submission of v1.0.0 Rep App iOS Release","startDate":"2022-07-11T13:56:18.821Z","endDate":"2022-07-16T02:15:00.000Z","completeDate":"2022-07-15T21:39:31.202Z"},{"id":1955,"name":"A Team: 6/27/22 - 7/1/22","state":"closed","boardId":286,"goal":"","startDate":"2022-06-27T13:39:51.053Z","endDate":"2022-07-01T16:03:00.000Z","completeDate":"2022-07-01T20:26:58.126Z"},{"id":1940,"name":"A Team: 6/13/22 - 6/17/22","state":"closed","boardId":286,"goal":"","startDate":"2022-06-13T13:23:11.454Z","endDate":"2022-06-17T13:12:00.000Z","completeDate":"2022-06-17T21:12:57.348Z"},{"id":1861,"name":"A Team: 4/18/22 - 4/22/22","state":"closed","boardId":286,"goal":"","startDate":"2022-04-18T13:19:51.131Z","endDate":"2022-04-22T21:22:00.000Z","completeDate":"2022-04-23T00:50:05.964Z"},{"id":1862,"name":"A Team: 4/25/22 - 4/29/22","state":"closed","boardId":286,"goal":"","startDate":"2022-04-25T13:38:51.319Z","endDate":"2022-04-29T21:00:00.000Z","completeDate":"2022-04-29T20:44:00.021Z"},{"id":1929,"name":"A Team: 5/31/22 - 6/10/22","state":"closed","boardId":286,"goal":"","startDate":"2022-05-31T13:20:11.464Z","endDate":"2022-06-10T14:13:00.000Z","completeDate":"2022-06-10T21:09:52.636Z"},{"id":1881,"name":"A Team: 5/2/22 - 5/6/22","state":"closed","boardId":286,"goal":"","startDate":"2022-05-02T13:24:03.040Z","endDate":"2022-05-06T21:59:00.000Z","completeDate":"2022-05-06T20:33:28.823Z"},{"id":1915,"name":"A Team: 5/16/22 - 5/20/22","state":"closed","boardId":286,"goal":"","startDate":"2022-05-16T13:45:22.501Z","endDate":"2022-05-20T21:11:00.000Z","completeDate":"2022-05-20T20:48:44.357Z"},{"id":1916,"name":"A Team: 5/23/22 - 5/27/22","state":"closed","boardId":286,"goal":"","startDate":"2022-05-23T13:46:32.935Z","endDate":"2022-05-27T18:12:00.000Z","completeDate":"2022-05-27T21:18:43.799Z"},{"id":1965,"name":"A Team: 7/5/22 - 7/8/22","state":"closed","boardId":286,"goal":"","startDate":"2022-07-05T13:38:21.073Z","endDate":"2022-07-08T17:26:00.000Z","completeDate":"2022-07-08T21:28:08.661Z"},{"id":1661,"name":"A Team: 7/18/22 - 7/22/22","state":"active","boardId":286,"goal":"AMOBS v1.0.0 and RAI v1.0.0 Releases","startDate":"2022-07-18T13:46:00.383Z","endDate":"2022-07-23T02:21:00.000Z"}],"customfield_12305":null,"customfield_12547":null,"customfield_12426":null,"customfield_12789":null,"customfield_12788":null,"customfield_10006":null,"customfield_12304":null,"customfield_13756":null,"customfield_12425":null,"customfield_12546":null,"customfield_13998":null,"customfield_12307":null,"customfield_13759":null,"customfield_12549":null,"customfield_12428":null,"customfield_13758":null,"customfield_12427":null,"customfield_12548":null,"customfield_12306":null,"customfield_12309":null,"customfield_12308":null,"customfield_12429":null,"summary":"Additional on boarding screen/view ","customfield_12781":null,"customfield_11450":{"self":"https://arthrex.atlassian.net/rest/api/2/customFieldOption/10989","value":"Always","id":"10989"},"customfield_12780":null,"customfield_13993":null,"customfield_12420":null,"customfield_13751":null,"customfield_12783":null,"customfield_12541":null,"customfield_13991":null,"customfield_13750":null,"customfield_10000":null,"customfield_12540":null,"customfield_12782":null,"customfield_12422":null,"customfield_13753":null,"customfield_13996":null,"customfield_10001":null,"customfield_12785":null,"customfield_12300":"{}","customfield_13997":null,"customfield_12784":null,"customfield_13752":null,"customfield_12545":null,"customfield_12787":null,"customfield_13755":null,"customfield_12303":null,"customfield_13994":null,"customfield_12544":null,"customfield_12423":null,"customfield_13995":null,"customfield_12786":null,"customfield_13754":null,"customfield_13746":null,"customfield_12778":null,"customfield_12415":null,"customfield_13989":null,"customfield_11447":null,"customfield_12414":null,"customfield_13745":null,"customfield_12777":null,"customfield_11449":{"self":"https://arthrex.atlassian.net/rest/api/2/customFieldOption/10986","value":"Live Site","id":"10986"},"customfield_13987":null,"customfield_13748":null,"customfield_12417":null,"customfield_11448":null,"customfield_12416":null,"customfield_13505":[],"customfield_12779":null,"customfield_12419":null,"customfield_13749":null,"customfield_12418":null,"comment":{"comments":[],"self":"https://arthrex.atlassian.net/rest/api/2/issue/295340/comment","maxResults":0,"total":0,"startAt":0},"statuscategorychangedate":"2022-06-28T08:49:53.778-0400","customfield_13063":"Testing message","customfield_13062":null,"customfield_14033":null,"customfield_13067":null,"customfield_13066":null,"fixVersions":[],"customfield_10900":null,"customfield_13294":null,"customfield_13052":null,"customfield_13053":null,"epic":null,"customfield_13057":null,"priority":{"self":"https://arthrex.atlassian.net/rest/api/2/priority/4","iconUrl":"https://s3.amazonaws.com/arthrex-public/jira/priorities/minor.png","name":"Minor","id":"4"},"customfield_14028":null,"versions":[],"customfield_14014":null,"customfield_13045":null,"customfield_14015":null,"customfield_13047":null,"customfield_14013":null,"customfield_13046":null,"customfield_14016":null,"customfield_14017":null,"customfield_13391":null,"customfield_13272":null,"customfield_13392":null,"customfield_13274":null,"customfield_13273":null,"aggregateprogress":{"progress":0,"total":0},"customfield_13279":null,"customfield_13380":null,"issuerestriction":{"issuerestrictions":{},"shouldDisplay":false},"customfield_13371":null,"customfield_13373":null,"created":"2022-06-15T08:02:52.333-0400","customfield_13494":null,"customfield_13375":null,"customfield_13012":null,"customfield_13011":null,"customfield_13377":null,"customfield_13376":null,"customfield_13379":null,"customfield_13016":null,"customfield_13378":null,"customfield_13017":null,"customfield_13360":null,"customfield_13362":null,"customfield_13361":null,"customfield_13122":null,"customfield_13001":null,"customfield_13364":null,"customfield_13000":null,"customfield_13363":null,"customfield_13366":"150 GB","customfield_13365":null,"customfield_13002":null,"customfield_13368":null,"customfield_13367":null,"customfield_13369":null,"security":null,"attachment":[],"customfield_13470":null,"customfield_13471":null,"customfield_12385":null,"customfield_13355":null,"customfield_12386":null,"customfield_13599":null,"customfield_13357":null,"customfield_12388":null,"customfield_13356":null,"customfield_13359":null,"customfield_13358":null}},{"expand":"operations,versionedRepresentations,editmeta,changelog,renderedFields","id":"279629","self":"https://arthrex.atlassian.net/rest/agile/1.0/issue/279629","key":"MOB-930","fields":{"parent":{"id":"279628","key":"MOB-929","self":"https://arthrex.atlassian.net/rest/api/2/issue/279628","fields":{"summary":"UX/UI","status":{"self":"https://arthrex.atlassian.net/rest/api/2/status/3","description":"This issue is being actively worked on at the moment by the assignee.","iconUrl":"https://arthrex.atlassian.net/images/icons/statuses/inprogress.png","name":"Working","id":"3","statusCategory":{"self":"https://arthrex.atlassian.net/rest/api/2/statuscategory/4","id":4,"key":"indeterminate","colorName":"yellow","name":"In Progress"}},"priority":{"self":"https://arthrex.atlassian.net/rest/api/2/priority/4","iconUrl":"https://s3.amazonaws.com/arthrex-public/jira/priorities/minor.png","name":"Minor","id":"4"},"issuetype":{"self":"https://arthrex.atlassian.net/rest/api/2/issuetype/3","id":"3","description":"A task that needs to be done.","iconUrl":"https://arthrex.atlassian.net/rest/api/2/universal_avatar/view/type/issuetype/avatar/10318?size=medium","name":"Task","subtask":false,"avatarId":10318,"hierarchyLevel":0}}},"resolution":{"self":"https://arthrex.atlassian.net/rest/api/2/resolution/10000","id":"10000","description":"The issue is done.","name":"Done"},"customfield_12930":null,"customfield_12923":null,"customfield_12924":null,"customfield_12929":null,"lastViewed":null,"customfield_11700":null,"customfield_12912":null,"customfield_11702":null,"customfield_11701":null,"aggregatetimeoriginalestimate":null,"customfield_12914":null,"customfield_12916":null,"customfield_12915":null,"customfield_12918":null,"customfield_12917":null,"issuelinks":[],"assignee":{"self":"https://arthrex.atlassian.net/rest/api/2/user?accountId=60bac9915fa6f1006fee00b2","accountId":"60bac9915fa6f1006fee00b2","emailAddress":"johnny.ansari@arthrex.com","avatarUrls":{"48x48":"https://secure.gravatar.com/avatar/d887eff1f5130dfab59a6de736562de4?d=https%3A%2F%2Favatar-management--avatars.us-west-2.prod.public.atl-paas.net%2Finitials%2FJA-5.png","24x24":"https://secure.gravatar.com/avatar/d887eff1f5130dfab59a6de736562de4?d=https%3A%2F%2Favatar-management--avatars.us-west-2.prod.public.atl-paas.net%2Finitials%2FJA-5.png","16x16":"https://secure.gravatar.com/avatar/d887eff1f5130dfab59a6de736562de4?d=https%3A%2F%2Favatar-management--avatars.us-west-2.prod.public.atl-paas.net%2Finitials%2FJA-5.png","32x32":"https://secure.gravatar.com/avatar/d887eff1f5130dfab59a6de736562de4?d=https%3A%2F%2Favatar-management--avatars.us-west-2.prod.public.atl-paas.net%2Finitials%2FJA-5.png"},"displayName":"Johnny Ansari","active":true,"timeZone":"America/New_York","accountType":"atlassian"},"customfield_12919":null,"customfield_11810":null,"customfield_11812":null,"customfield_12901":null,"customfield_11811":null,"customfield_11814":null,"customfield_12903":null,"customfield_11813":null,"customfield_12902":null,"customfield_11816":null,"customfield_12905":null,"customfield_12904":null,"customfield_11815":null,"customfield_11818":null,"customfield_12906":null,"customfield_11817":null,"subtasks":[],"customfield_11801":null,"customfield_11800":null,"customfield_11802":null,"customfield_11805":null,"customfield_11804":null,"customfield_11807":null,"closedSprints":[{"id":2001,"self":"https://arthrex.atlassian.net/rest/agile/1.0/sprint/2001","state":"closed","name":"A Team: 7/11/22 - 7/15/22","startDate":"2022-07-11T13:56:18.821Z","endDate":"2022-07-16T02:15:00.000Z","completeDate":"2022-07-15T21:39:31.202Z","originBoardId":286,"goal":"Prep for Submission of v1.0.0 Rep App iOS Release"},{"id":1955,"self":"https://arthrex.atlassian.net/rest/agile/1.0/sprint/1955","state":"closed","name":"A Team: 6/27/22 - 7/1/22","startDate":"2022-06-27T13:39:51.053Z","endDate":"2022-07-01T16:03:00.000Z","completeDate":"2022-07-01T20:26:58.126Z","originBoardId":286,"goal":""},{"id":1940,"self":"https://arthrex.atlassian.net/rest/agile/1.0/sprint/1940","state":"closed","name":"A Team: 6/13/22 - 6/17/22","startDate":"2022-06-13T13:23:11.454Z","endDate":"2022-06-17T13:12:00.000Z","completeDate":"2022-06-17T21:12:57.348Z","originBoardId":286,"goal":""},{"id":1861,"self":"https://arthrex.atlassian.net/rest/agile/1.0/sprint/1861","state":"closed","name":"A Team: 4/18/22 - 4/22/22","startDate":"2022-04-18T13:19:51.131Z","endDate":"2022-04-22T21:22:00.000Z","completeDate":"2022-04-23T00:50:05.964Z","originBoardId":286,"goal":""},{"id":1862,"self":"https://arthrex.atlassian.net/rest/agile/1.0/sprint/1862","state":"closed","name":"A Team: 4/25/22 - 4/29/22","startDate":"2022-04-25T13:38:51.319Z","endDate":"2022-04-29T21:00:00.000Z","completeDate":"2022-04-29T20:44:00.021Z","originBoardId":286,"goal":""},{"id":1929,"self":"https://arthrex.atlassian.net/rest/agile/1.0/sprint/1929","state":"closed","name":"A Team: 5/31/22 - 6/10/22","startDate":"2022-05-31T13:20:11.464Z","endDate":"2022-06-10T14:13:00.000Z","completeDate":"2022-06-10T21:09:52.636Z","originBoardId":286,"goal":""},{"id":1881,"self":"https://arthrex.atlassian.net/rest/agile/1.0/sprint/1881","state":"closed","name":"A Team: 5/2/22 - 5/6/22","startDate":"2022-05-02T13:24:03.040Z","endDate":"2022-05-06T21:59:00.000Z","completeDate":"2022-05-06T20:33:28.823Z","originBoardId":286,"goal":""},{"id":1915,"self":"https://arthrex.atlassian.net/rest/agile/1.0/sprint/1915","state":"closed","name":"A Team: 5/16/22 - 5/20/22","startDate":"2022-05-16T13:45:22.501Z","endDate":"2022-05-20T21:11:00.000Z","completeDate":"2022-05-20T20:48:44.357Z","originBoardId":286,"goal":""},{"id":1916,"self":"https://arthrex.atlassian.net/rest/agile/1.0/sprint/1916","state":"closed","name":"A Team: 5/23/22 - 5/27/22","startDate":"2022-05-23T13:46:32.935Z","endDate":"2022-05-27T18:12:00.000Z","completeDate":"2022-05-27T21:18:43.799Z","originBoardId":286,"goal":""},{"id":1965,"self":"https://arthrex.atlassian.net/rest/agile/1.0/sprint/1965","state":"closed","name":"A Team: 7/5/22 - 7/8/22","startDate":"2022-07-05T13:38:21.073Z","endDate":"2022-07-08T17:26:00.000Z","completeDate":"2022-07-08T21:28:08.661Z","originBoardId":286,"goal":""},{"id":1952,"self":"https://arthrex.atlassian.net/rest/agile/1.0/sprint/1952","state":"closed","name":"A Team: 6/20/22 - 6/24/22","startDate":"2022-06-20T13:46:12.904Z","endDate":"2022-06-24T12:12:00.000Z","completeDate":"2022-06-24T20:31:59.550Z","originBoardId":286,"goal":""},{"id":1904,"self":"https://arthrex.atlassian.net/rest/agile/1.0/sprint/1904","state":"closed","name":"A Team: 5/9/22 - 5/13/22","startDate":"2022-05-09T13:36:27.141Z","endDate":"2022-05-13T21:43:00.000Z","completeDate":"2022-05-13T20:16:27.067Z","originBoardId":286,"goal":""}],"customfield_11806":null,"votes":{"self":"https://arthrex.atlassian.net/rest/api/2/issue/MOB-930/votes","votes":0,"hasVoted":false},"customfield_11809":null,"worklog":{"startAt":0,"maxResults":20,"total":0,"worklogs":[]},"customfield_11808":null,"issuetype":{"self":"https://arthrex.atlassian.net/rest/api/2/issuetype/5","id":"5","description":"The sub-task of the issue","iconUrl":"https://arthrex.atlassian.net/rest/api/2/universal_avatar/view/type/issuetype/avatar/10316?size=medium","name":"Sub-task","subtask":true,"avatarId":10316,"hierarchyLevel":-1},"sprint":{"id":1661,"self":"https://arthrex.atlassian.net/rest/agile/1.0/sprint/1661","state":"active","name":"A Team: 7/18/22 - 7/22/22","startDate":"2022-07-18T13:46:00.383Z","endDate":"2022-07-23T02:21:00.000Z","originBoardId":286,"goal":"AMOBS v1.0.0 and RAI v1.0.0 Releases"},"customfield_10700":null,"customfield_10701":[],"customfield_10702":null,"customfield_11901":{"self":"https://arthrex.atlassian.net/rest/api/2/customFieldOption/11506","value":"No","id":"11506"},"customfield_14050":null,"timetracking":{},"customfield_10803":null,"customfield_10806":null,"customfield_14047":null,"customfield_14048":null,"customfield_14046":null,"customfield_14049":null,"environment":null,"duedate":null,"customfield_13980":null,"customfield_13861":null,"customfield_13982":null,"customfield_13740":null,"customfield_11441":null,"customfield_12772":null,"customfield_11440":null,"customfield_12774":null,"customfield_11443":null,"customfield_12411":null,"customfield_11200":null,"customfield_13742":null,"customfield_11442":null,"customfield_13741":null,"customfield_12773":null,"customfield_11201":null,"customfield_13744":null,"customfield_13986":null,"customfield_12776":null,"customfield_12413":null,"customfield_13623":null,"customfield_11202":null,"customfield_12533":null,"customfield_12775":null,"customfield_13985":null,"customfield_12412":null,"customfield_13743":null,"customfield_11444":null,"customfield_13614":null,"customfield_11435":null,"customfield_13613":null,"customfield_12645":null,"customfield_13616":null,"customfield_13979":null,"customfield_11438":null,"customfield_13737":null,"customfield_13615":null,"customfield_11437":null,"customfield_13739":null,"customfield_13738":null,"customfield_13617":null,"customfield_11439":null,"customfield_12409":null,"customfield_12761":null,"customfield_11430":null,"customfield_12760":null,"customfield_13610":null,"customfield_10100":"2|i02f9m:","customfield_11431":null,"customfield_12762":null,"customfield_13612":null,"customfield_11434":null,"customfield_13975":null,"customfield_13611":null,"customfield_13603":null,"customfield_12756":null,"customfield_11425":null,"customfield_12998":null,"customfield_12514":null,"customfield_11303":"3_*:*_1_*:*_359749294_*|*_10000_*:*_1_*:*_6217152997_*|*_10001_*:*_1_*:*_0","customfield_13602":null,"customfield_12755":null,"customfield_11304":null,"customfield_12513":null,"customfield_12997":null,"customfield_13605":null,"customfield_12758":null,"customfield_13726":null,"customfield_11427":null,"customfield_12999":null,"customfield_12757":null,"customfield_13604":null,"timeestimate":null,"customfield_13727":null,"customfield_13969":null,"customfield_11428":null,"customfield_12759":null,"customfield_13606":null,"customfield_13729":null,"customfield_13608":null,"status":{"self":"https://arthrex.atlassian.net/rest/api/2/status/10001","description":"","iconUrl":"https://arthrex.atlassian.net/images/icons/subtask.gif","name":"Done","id":"10001","statusCategory":{"self":"https://arthrex.atlassian.net/rest/api/2/statuscategory/3","id":3,"key":"done","colorName":"green","name":"Done"}},"customfield_12750":null,"customfield_12510":null,"customfield_12752":null,"customfield_11300":{"self":"https://arthrex.atlassian.net/rest/api/2/customFieldOption/10700","value":"User Stories:1","id":"10700"},"customfield_12751":null,"customfield_11420":null,"customfield_11301":null,"customfield_12996":null,"customfield_12754":null,"customfield_13601":null,"customfield_12753":null,"customfield_11422":null,"customfield_13600":null,"customfield_12511":null,"customfield_12745":null,"customfield_12503":null,"customfield_11414":null,"customfield_12744":null,"customfield_12502":null,"customfield_13715":null,"customfield_13836":null,"customfield_12505":null,"customfield_12747":null,"customfield_12504":null,"customfield_11415":null,"customfield_13956":null,"customfield_12746":null,"customfield_13835":null,"customfield_11418":null,"customfield_12507":null,"aggregatetimeestimate":null,"customfield_12749":null,"customfield_12748":null,"customfield_13837":null,"customfield_13716":null,"customfield_12508":null,"customfield_11419":null,"creator":{"self":"https://arthrex.atlassian.net/rest/api/2/user?accountId=5dfa6aa75697460cb3d97763","accountId":"5dfa6aa75697460cb3d97763","emailAddress":"patrick.maguschak2@arthrex.com","avatarUrls":{"48x48":"https://avatar-management--avatars.us-west-2.prod.public.atl-paas.net/5dfa6aa75697460cb3d97763/5f2aaf98-63fd-4e3a-a29b-7e163f497fd8/48","24x24":"https://avatar-management--avatars.us-west-2.prod.public.atl-paas.net/5dfa6aa75697460cb3d97763/5f2aaf98-63fd-4e3a-a29b-7e163f497fd8/24","16x16":"https://avatar-management--avatars.us-west-2.prod.public.atl-paas.net/5dfa6aa75697460cb3d97763/5f2aaf98-63fd-4e3a-a29b-7e163f497fd8/16","32x32":"https://avatar-management--avatars.us-west-2.prod.public.atl-paas.net/5dfa6aa75697460cb3d97763/5f2aaf98-63fd-4e3a-a29b-7e163f497fd8/32"},"displayName":"Patrick Maguschak","active":true,"timeZone":"America/New_York","accountType":"atlassian"},"customfield_13830":null,"customfield_10200":"h1. [https://arthrex.atlassian.net/wiki/spaces/MT/pages/2914910217/Copy+of+App+Store+guidelines|https://arthrex.atlassian.net/wiki/spaces/MT/pages/2914910217/Copy+of+App+Store+guidelines|smart-link] ","customfield_12743":null,"customfield_13831":null,"customfield_10202":null,"customfield_12500":null,"customfield_11403":{"self":"https://arthrex.atlassian.net/rest/api/2/customFieldOption/10806","value":"Hotline","id":"10806"},"customfield_13702":null,"customfield_11402":null,"customfield_12975":null,"customfield_13701":null,"customfield_11523":null,"customfield_13704":null,"customfield_13825":null,"customfield_11526":null,"customfield_13703":null,"customfield_13824":null,"customfield_11404":null,"customfield_13827":null,"customfield_12738":null,"customfield_13826":null,"customfield_13705":null,"customfield_13829":null,"customfield_11529":null,"timespent":null,"customfield_12972":null,"aggregatetimespent":null,"customfield_12974":null,"customfield_13700":null,"customfield_11522":null,"customfield_11401":null,"customfield_11521":null,"customfield_11400":null,"customfield_13933":null,"customfield_13932":null,"customfield_12843":null,"customfield_11512":null,"customfield_11514":null,"customfield_11519":"3_*:*_1_*:*_359749294_*|*_10000_*:*_1_*:*_6217152997_*|*_10001_*:*_1_*:*_0","workratio":-1,"customfield_12840":null,"customfield_10300":null,"customfield_11511":null,"customfield_12842":null,"customfield_13931":null,"customfield_11510":null,"customfield_12841":null,"customfield_10301":null,"customfield_13930":null,"customfield_12833":null,"customfield_13801":null,"customfield_11502":null,"customfield_12832":null,"customfield_11501":{"hasEpicLinkFieldDependency":false,"showField":false,"nonEditableReason":{"reason":"PLUGIN_LICENSE_ERROR","message":"The Parent Link is only available to Jira Premium users."}},"customfield_13800":null,"customfield_12835":null,"customfield_11504":null,"customfield_13803":null,"customfield_12955":null,"customfield_12834":null,"customfield_13802":null,"customfield_11506":null,"customfield_13926":null,"customfield_12958":null,"customfield_12837":null,"customfield_13805":null,"customfield_13925":null,"customfield_11505":null,"customfield_13804":null,"customfield_12836":null,"customfield_12839":null,"customfield_12838":null,"customfield_13808":null,"customfield_12831":null,"customfield_11500":null,"customfield_12830":null,"customfield_12822":null,"customfield_12942":null,"customfield_12824":null,"customfield_12823":null,"flagged":false,"customfield_12825":null,"customfield_12828":null,"customfield_12827":null,"customfield_10400":null,"customfield_12811":null,"customfield_12932":null,"customfield_12934":null,"customfield_12933":null,"customfield_13904":null,"customfield_12936":null,"customfield_13903":null,"customfield_12935":null,"customfield_13906":null,"customfield_12938":null,"customfield_13905":null,"customfield_12937":null,"customfield_13908":null,"customfield_12939":null,"customfield_13909":null,"customfield_12490":null,"customfield_12372":null,"customfield_12493":null,"customfield_12492":null,"customfield_12495":null,"customfield_13463":null,"customfield_12374":null,"customfield_12494":null,"customfield_12376":null,"customfield_13465":null,"customfield_12496":"{panel:bgColor=#FFC400}\r\nThese fields are used to populate request forms in the customer portal. Do not manually change these fields.\r\n{panel}","customfield_13464":null,"customfield_13343":null,"customfield_12499":null,"customfield_13225":null,"customfield_13467":null,"customfield_13466":null,"customfield_13469":null,"customfield_13468":null,"customfield_12480":null,"customfield_13690":null,"customfield_13692":null,"customfield_12482":null,"customfield_12481":null,"customfield_13691":null,"customfield_13694":null,"customfield_12484":null,"customfield_12000":null,"customfield_12362":null,"customfield_12483":null,"customfield_13693":null,"customfield_13212":null,"customfield_12002":null,"customfield_13696":null,"customfield_12001":null,"customfield_13695":null,"customfield_13211":null,"customfield_12004":null,"customfield_12488":null,"customfield_13335":null,"customfield_13698":null,"customfield_13213":null,"customfield_12003":null,"customfield_13697":null,"customfield_12489":null,"customfield_12005":null,"customfield_13699":null,"labels":[],"customfield_13336":null,"customfield_13449":null,"customfield_13207":null,"components":[],"customfield_12471":null,"customfield_13681":null,"customfield_13680":null,"customfield_12470":null,"customfield_13683":null,"customfield_12473":null,"customfield_12110":null,"customfield_12472":null,"customfield_13682":null,"customfield_12475":null,"customfield_13322":null,"customfield_12112":null,"customfield_13685":null,"customfield_13684":null,"customfield_12474":null,"customfield_12111":null,"customfield_12114":{"self":"https://arthrex.atlassian.net/rest/api/2/customFieldOption/11922","value":"No","id":"11922"},"customfield_13687":null,"customfield_12477":null,"customfield_13686":null,"customfield_12476":null,"customfield_12479":null,"customfield_12358":null,"customfield_13689":null,"customfield_12478":null,"customfield_12357":null,"customfield_13688":null,"customfield_13325":null,"customfield_12469":null,"customfield_13679":null,"customfield_12106":null,"customfield_12348":"{panel:title=Alert|titleBGColor=#FFC400|bgColor=#FFFAE6}\r\nPlease make sure that the correct issue type is selected. To select a different issue type, move the issue.\r\n{panel}","customfield_12109":null,"customfield_12108":null,"customfield_12341":null,"customfield_13672":null,"customfield_12340":null,"customfield_13674":null,"reporter":{"self":"https://arthrex.atlassian.net/rest/api/2/user?accountId=5dfa6aa75697460cb3d97763","accountId":"5dfa6aa75697460cb3d97763","emailAddress":"patrick.maguschak2@arthrex.com","avatarUrls":{"48x48":"https://avatar-management--avatars.us-west-2.prod.public.atl-paas.net/5dfa6aa75697460cb3d97763/5f2aaf98-63fd-4e3a-a29b-7e163f497fd8/48","24x24":"https://avatar-management--avatars.us-west-2.prod.public.atl-paas.net/5dfa6aa75697460cb3d97763/5f2aaf98-63fd-4e3a-a29b-7e163f497fd8/24","16x16":"https://avatar-management--avatars.us-west-2.prod.public.atl-paas.net/5dfa6aa75697460cb3d97763/5f2aaf98-63fd-4e3a-a29b-7e163f497fd8/16","32x32":"https://avatar-management--avatars.us-west-2.prod.public.atl-paas.net/5dfa6aa75697460cb3d97763/5f2aaf98-63fd-4e3a-a29b-7e163f497fd8/32"},"displayName":"Patrick Maguschak","active":true,"timeZone":"America/New_York","accountType":"atlassian"},"customfield_12343":"{panel:title=Info|titleBGColor=#C0B6F2|bgColor=#EAE6FF}\r\nUse this transition to escalate this issue to another team.\r\n\r\nPlease note that if you select *MRM-DAM Technical*, Jira will automatically create a ticket in Footprints. If you do not wish to create a new Footprints ticket, please select *Disable emails to Footprints* below.\r\n\r\nIf you do not want to be reminded to follow-up on this issue, please select *Disable escalation follow-up* below.\r\n{panel}","customfield_12101":null,"customfield_12464":null,"customfield_13795":null,"customfield_12342":null,"customfield_12463":null,"customfield_13673":null,"customfield_12103":null,"customfield_12345":null,"customfield_13676":null,"customfield_13797":null,"customfield_12466":null,"customfield_13675":null,"customfield_12344":"{panel:title=Info|titleBGColor=#C0B6F2|bgColor=#EAE6FF}\r\nUse this transition to respond to the reporter and request participants.\r\n\r\nIf you do not want to be reminded to follow-up on this issue, select *Disable customer follow-up* below.\r\n{panel}","customfield_13796":null,"customfield_13799":null,"customfield_13678":null,"customfield_12347":"{panel:bgColor=#FFC400}\r\n*Note*\r\nThese fields are used to populate request forms in the customer portal. Do not manually change these fields.\r\n{panel}","customfield_12468":null,"customfield_12346":null,"customfield_12104":null,"customfield_13798":null,"customfield_12467":null,"customfield_13677":null,"progress":{"progress":0,"total":0},"customfield_12570":null,"customfield_13780":null,"customfield_13782":null,"customfield_12330":null,"customfield_12571":null,"project":{"self":"https://arthrex.atlassian.net/rest/api/2/project/12262","id":"12262","key":"MOB","name":"A Team","projectTypeKey":"software","simplified":false,"avatarUrls":{"48x48":"https://arthrex.atlassian.net/rest/api/2/universal_avatar/view/type/project/avatar/13447","24x24":"https://arthrex.atlassian.net/rest/api/2/universal_avatar/view/type/project/avatar/13447?size=small","16x16":"https://arthrex.atlassian.net/rest/api/2/universal_avatar/view/type/project/avatar/13447?size=xsmall","32x32":"https://arthrex.atlassian.net/rest/api/2/universal_avatar/view/type/project/avatar/13447?size=medium"},"projectCategory":{"self":"https://arthrex.atlassian.net/rest/api/2/projectCategory/10103","id":"10103","description":"","name":"Digital Media - Mobile"}},"customfield_12332":null,"customfield_12331":null,"customfield_13783":null,"customfield_12333":null,"customfield_12336":null,"customfield_12335":null,"customfield_12327":null,"customfield_13779":null,"customfield_12569":null,"customfield_12568":null,"customfield_12329":null,"customfield_12328":null,"resolutiondate":"2022-06-27T12:50:01.305-0400","watches":{"self":"https://arthrex.atlassian.net/rest/api/2/issue/MOB-930/watchers","watchCount":1,"isWatching":false},"customfield_13890":null,"customfield_12561":null,"customfield_13771":null,"customfield_13892":null,"customfield_13770":null,"customfield_13891":null,"customfield_12321":null,"customfield_12200":null,"customfield_12563":null,"customfield_13652":null,"customfield_12562":null,"customfield_12320":null,"customfield_13772":null,"customfield_12202":null,"customfield_12323":null,"customfield_12564":null,"customfield_12201":null,"customfield_12322":null,"customfield_12567":null,"customfield_13656":null,"customfield_12203":null,"customfield_12566":null,"customfield_12324":null,"customfield_13655":null,"customfield_12558":null,"customfield_13407":null,"customfield_13769":null,"customfield_12319":null,"updated":"2022-06-27T12:50:01.339-0400","customfield_12790":null,"timeoriginalestimate":null,"customfield_12792":null,"customfield_12550":null,"customfield_13760":null,"customfield_12791":null,"description":"iPhone 6.5\" \niPhone 5.5\"\nIpad Pro 12.9\"\n\nIpad Pro 12.9\"","customfield_13762":null,"customfield_12794":null,"customfield_12552":null,"customfield_13640":null,"customfield_13761":null,"customfield_12551":null,"customfield_11100":" ","customfield_13764":null,"customfield_11101":null,"customfield_12554":null,"customfield_11102":{"self":"https://arthrex.atlassian.net/rest/api/2/customFieldOption/10500","value":"1-None","id":"10500"},"customfield_12553":null,"customfield_12795":null,"customfield_13763":null,"customfield_13645":null,"customfield_12555":null,"customfield_11104":null,"customfield_13765":null,"customfield_13636":null,"customfield_10005":[{"id":1952,"name":"A Team: 6/20/22 - 6/24/22","state":"closed","boardId":286,"goal":"","startDate":"2022-06-20T13:46:12.904Z","endDate":"2022-06-24T12:12:00.000Z","completeDate":"2022-06-24T20:31:59.550Z"},{"id":1904,"name":"A Team: 5/9/22 - 5/13/22","state":"closed","boardId":286,"goal":"","startDate":"2022-05-09T13:36:27.141Z","endDate":"2022-05-13T21:43:00.000Z","completeDate":"2022-05-13T20:16:27.067Z"},{"id":2001,"name":"A Team: 7/11/22 - 7/15/22","state":"closed","boardId":286,"goal":"Prep for Submission of v1.0.0 Rep App iOS Release","startDate":"2022-07-11T13:56:18.821Z","endDate":"2022-07-16T02:15:00.000Z","completeDate":"2022-07-15T21:39:31.202Z"},{"id":1955,"name":"A Team: 6/27/22 - 7/1/22","state":"closed","boardId":286,"goal":"","startDate":"2022-06-27T13:39:51.053Z","endDate":"2022-07-01T16:03:00.000Z","completeDate":"2022-07-01T20:26:58.126Z"},{"id":1940,"name":"A Team: 6/13/22 - 6/17/22","state":"closed","boardId":286,"goal":"","startDate":"2022-06-13T13:23:11.454Z","endDate":"2022-06-17T13:12:00.000Z","completeDate":"2022-06-17T21:12:57.348Z"},{"id":1861,"name":"A Team: 4/18/22 - 4/22/22","state":"closed","boardId":286,"goal":"","startDate":"2022-04-18T13:19:51.131Z","endDate":"2022-04-22T21:22:00.000Z","completeDate":"2022-04-23T00:50:05.964Z"},{"id":1862,"name":"A Team: 4/25/22 - 4/29/22","state":"closed","boardId":286,"goal":"","startDate":"2022-04-25T13:38:51.319Z","endDate":"2022-04-29T21:00:00.000Z","completeDate":"2022-04-29T20:44:00.021Z"},{"id":1929,"name":"A Team: 5/31/22 - 6/10/22","state":"closed","boardId":286,"goal":"","startDate":"2022-05-31T13:20:11.464Z","endDate":"2022-06-10T14:13:00.000Z","completeDate":"2022-06-10T21:09:52.636Z"},{"id":1881,"name":"A Team: 5/2/22 - 5/6/22","state":"closed","boardId":286,"goal":"","startDate":"2022-05-02T13:24:03.040Z","endDate":"2022-05-06T21:59:00.000Z","completeDate":"2022-05-06T20:33:28.823Z"},{"id":1915,"name":"A Team: 5/16/22 - 5/20/22","state":"closed","boardId":286,"goal":"","startDate":"2022-05-16T13:45:22.501Z","endDate":"2022-05-20T21:11:00.000Z","completeDate":"2022-05-20T20:48:44.357Z"},{"id":1916,"name":"A Team: 5/23/22 - 5/27/22","state":"closed","boardId":286,"goal":"","startDate":"2022-05-23T13:46:32.935Z","endDate":"2022-05-27T18:12:00.000Z","completeDate":"2022-05-27T21:18:43.799Z"},{"id":1965,"name":"A Team: 7/5/22 - 7/8/22","state":"closed","boardId":286,"goal":"","startDate":"2022-07-05T13:38:21.073Z","endDate":"2022-07-08T17:26:00.000Z","completeDate":"2022-07-08T21:28:08.661Z"},{"id":1661,"name":"A Team: 7/18/22 - 7/22/22","state":"active","boardId":286,"goal":"AMOBS v1.0.0 and RAI v1.0.0 Releases","startDate":"2022-07-18T13:46:00.383Z","endDate":"2022-07-23T02:21:00.000Z"}],"customfield_12426":null,"customfield_13757":null,"customfield_12789":null,"customfield_12547":null,"customfield_12305":null,"customfield_12546":null,"customfield_12788":null,"customfield_13756":null,"customfield_12304":null,"customfield_10006":null,"customfield_12425":null,"customfield_13759":null,"customfield_12307":null,"customfield_13998":null,"customfield_12428":null,"customfield_12549":null,"customfield_13758":null,"customfield_12306":null,"customfield_12548":null,"customfield_12427":null,"customfield_12309":null,"customfield_12429":null,"customfield_12308":null,"summary":"App Store Requirements ","customfield_12781":null,"customfield_11450":{"self":"https://arthrex.atlassian.net/rest/api/2/customFieldOption/10989","value":"Always","id":"10989"},"customfield_12780":null,"customfield_13993":null,"customfield_12541":null,"customfield_12783":null,"customfield_12420":null,"customfield_13751":null,"customfield_13991":null,"customfield_12540":null,"customfield_10000":null,"customfield_13750":null,"customfield_12782":null,"customfield_13996":null,"customfield_12422":null,"customfield_10001":null,"customfield_12785":null,"customfield_13753":null,"customfield_13752":null,"customfield_12784":null,"customfield_12300":"{}","customfield_13997":null,"customfield_13755":null,"customfield_12545":null,"customfield_13994":null,"customfield_12303":null,"customfield_12787":null,"customfield_13754":null,"customfield_12544":null,"customfield_12786":null,"customfield_13995":null,"customfield_12423":null,"customfield_11447":null,"customfield_13989":null,"customfield_13746":null,"customfield_12415":null,"customfield_12778":null,"customfield_12777":null,"customfield_12414":null,"customfield_13745":null,"customfield_13748":null,"customfield_13987":null,"customfield_12417":null,"customfield_11449":{"self":"https://arthrex.atlassian.net/rest/api/2/customFieldOption/10986","value":"Live Site","id":"10986"},"customfield_12416":null,"customfield_12779":null,"customfield_13505":[],"customfield_11448":null,"customfield_12419":null,"customfield_13749":null,"customfield_12418":null,"comment":{"comments":[{"self":"https://arthrex.atlassian.net/rest/api/2/issue/279629/comment/437227","id":"437227","author":{"self":"https://arthrex.atlassian.net/rest/api/2/user?accountId=5dfa6aa75697460cb3d97763","accountId":"5dfa6aa75697460cb3d97763","emailAddress":"patrick.maguschak2@arthrex.com","avatarUrls":{"48x48":"https://avatar-management--avatars.us-west-2.prod.public.atl-paas.net/5dfa6aa75697460cb3d97763/5f2aaf98-63fd-4e3a-a29b-7e163f497fd8/48","24x24":"https://avatar-management--avatars.us-west-2.prod.public.atl-paas.net/5dfa6aa75697460cb3d97763/5f2aaf98-63fd-4e3a-a29b-7e163f497fd8/24","16x16":"https://avatar-management--avatars.us-west-2.prod.public.atl-paas.net/5dfa6aa75697460cb3d97763/5f2aaf98-63fd-4e3a-a29b-7e163f497fd8/16","32x32":"https://avatar-management--avatars.us-west-2.prod.public.atl-paas.net/5dfa6aa75697460cb3d97763/5f2aaf98-63fd-4e3a-a29b-7e163f497fd8/32"},"displayName":"Patrick Maguschak","active":true,"timeZone":"America/New_York","accountType":"atlassian"},"body":"!Screen Shot 2022-04-20 at 11.45.13 AM.png|width=841,height=800!\n\nOld App Images","updateAuthor":{"self":"https://arthrex.atlassian.net/rest/api/2/user?accountId=5dfa6aa75697460cb3d97763","accountId":"5dfa6aa75697460cb3d97763","emailAddress":"patrick.maguschak2@arthrex.com","avatarUrls":{"48x48":"https://avatar-management--avatars.us-west-2.prod.public.atl-paas.net/5dfa6aa75697460cb3d97763/5f2aaf98-63fd-4e3a-a29b-7e163f497fd8/48","24x24":"https://avatar-management--avatars.us-west-2.prod.public.atl-paas.net/5dfa6aa75697460cb3d97763/5f2aaf98-63fd-4e3a-a29b-7e163f497fd8/24","16x16":"https://avatar-management--avatars.us-west-2.prod.public.atl-paas.net/5dfa6aa75697460cb3d97763/5f2aaf98-63fd-4e3a-a29b-7e163f497fd8/16","32x32":"https://avatar-management--avatars.us-west-2.prod.public.atl-paas.net/5dfa6aa75697460cb3d97763/5f2aaf98-63fd-4e3a-a29b-7e163f497fd8/32"},"displayName":"Patrick Maguschak","active":true,"timeZone":"America/New_York","accountType":"atlassian"},"created":"2022-04-20T11:45:52.842-0400","updated":"2022-04-20T11:45:52.842-0400","jsdPublic":true}],"self":"https://arthrex.atlassian.net/rest/api/2/issue/279629/comment","maxResults":1,"total":1,"startAt":0},"statuscategorychangedate":"2022-06-27T12:50:01.339-0400","customfield_13063":"Testing message","customfield_13062":null,"customfield_14033":null,"customfield_13067":null,"customfield_13066":null,"fixVersions":[],"customfield_10900":null,"customfield_13294":null,"customfield_13052":null,"customfield_13053":null,"epic":null,"customfield_13057":null,"priority":{"self":"https://arthrex.atlassian.net/rest/api/2/priority/4","iconUrl":"https://s3.amazonaws.com/arthrex-public/jira/priorities/minor.png","name":"Minor","id":"4"},"customfield_14028":null,"versions":[],"customfield_14014":null,"customfield_13045":null,"customfield_14015":null,"customfield_13047":null,"customfield_13046":null,"customfield_14013":null,"customfield_14016":null,"customfield_14017":null,"customfield_13391":null,"customfield_13272":null,"customfield_13392":null,"customfield_13274":null,"customfield_13273":null,"aggregateprogress":{"progress":0,"total":0},"customfield_13279":null,"customfield_13380":null,"issuerestriction":{"issuerestrictions":{},"shouldDisplay":false},"customfield_13371":null,"customfield_13494":null,"created":"2022-04-12T09:54:59.070-0400","customfield_13373":null,"customfield_13012":null,"customfield_13375":null,"customfield_13011":null,"customfield_13377":null,"customfield_13376":null,"customfield_13016":null,"customfield_13379":null,"customfield_13378":null,"customfield_13017":null,"customfield_13360":null,"customfield_13362":null,"customfield_13361":null,"customfield_13122":null,"customfield_13001":null,"customfield_13364":null,"customfield_13363":null,"customfield_13000":null,"customfield_13366":"150 GB","customfield_13365":null,"customfield_13002":null,"customfield_13368":null,"customfield_13367":null,"customfield_13369":null,"security":null,"attachment":[{"self":"https://arthrex.atlassian.net/rest/api/2/attachment/214245","id":"214245","filename":"Screen Shot 2022-04-20 at 11.45.13 AM.png","author":{"self":"https://arthrex.atlassian.net/rest/api/2/user?accountId=5dfa6aa75697460cb3d97763","accountId":"5dfa6aa75697460cb3d97763","emailAddress":"patrick.maguschak2@arthrex.com","avatarUrls":{"48x48":"https://avatar-management--avatars.us-west-2.prod.public.atl-paas.net/5dfa6aa75697460cb3d97763/5f2aaf98-63fd-4e3a-a29b-7e163f497fd8/48","24x24":"https://avatar-management--avatars.us-west-2.prod.public.atl-paas.net/5dfa6aa75697460cb3d97763/5f2aaf98-63fd-4e3a-a29b-7e163f497fd8/24","16x16":"https://avatar-management--avatars.us-west-2.prod.public.atl-paas.net/5dfa6aa75697460cb3d97763/5f2aaf98-63fd-4e3a-a29b-7e163f497fd8/16","32x32":"https://avatar-management--avatars.us-west-2.prod.public.atl-paas.net/5dfa6aa75697460cb3d97763/5f2aaf98-63fd-4e3a-a29b-7e163f497fd8/32"},"displayName":"Patrick Maguschak","active":true,"timeZone":"America/New_York","accountType":"atlassian"},"created":"2022-04-20T11:45:52.270-0400","size":1255003,"mimeType":"image/png","content":"https://arthrex.atlassian.net/rest/api/2/attachment/content/214245","thumbnail":"https://arthrex.atlassian.net/rest/api/2/attachment/thumbnail/214245"}],"customfield_13470":null,"customfield_13471":null,"customfield_12385":null,"customfield_13355":null,"customfield_12386":null,"customfield_13357":null,"customfield_13599":null,"customfield_12388":null,"customfield_13356":null,"customfield_13359":null,"customfield_13358":null}},{"expand":"operations,versionedRepresentations,editmeta,changelog,renderedFields","id":"281398","self":"https://arthrex.atlassian.net/rest/agile/1.0/issue/281398","key":"MOB-954","fields":{"parent":{"id":"279628","key":"MOB-929","self":"https://arthrex.atlassian.net/rest/api/2/issue/279628","fields":{"summary":"UX/UI","status":{"self":"https://arthrex.atlassian.net/rest/api/2/status/3","description":"This issue is being actively worked on at the moment by the assignee.","iconUrl":"https://arthrex.atlassian.net/images/icons/statuses/inprogress.png","name":"Working","id":"3","statusCategory":{"self":"https://arthrex.atlassian.net/rest/api/2/statuscategory/4","id":4,"key":"indeterminate","colorName":"yellow","name":"In Progress"}},"priority":{"self":"https://arthrex.atlassian.net/rest/api/2/priority/4","iconUrl":"https://s3.amazonaws.com/arthrex-public/jira/priorities/minor.png","name":"Minor","id":"4"},"issuetype":{"self":"https://arthrex.atlassian.net/rest/api/2/issuetype/3","id":"3","description":"A task that needs to be done.","iconUrl":"https://arthrex.atlassian.net/rest/api/2/universal_avatar/view/type/issuetype/avatar/10318?size=medium","name":"Task","subtask":false,"avatarId":10318,"hierarchyLevel":0}}},"resolution":{"self":"https://arthrex.atlassian.net/rest/api/2/resolution/10000","id":"10000","description":"The issue is done.","name":"Done"},"customfield_12930":null,"customfield_12923":null,"customfield_12924":null,"customfield_12929":null,"lastViewed":null,"customfield_11700":null,"customfield_11702":null,"customfield_12912":null,"customfield_11701":null,"customfield_12914":null,"aggregatetimeoriginalestimate":null,"customfield_12916":null,"customfield_12915":null,"customfield_12918":null,"customfield_12917":null,"issuelinks":[],"customfield_12919":null,"assignee":{"self":"https://arthrex.atlassian.net/rest/api/2/user?accountId=60bac9915fa6f1006fee00b2","accountId":"60bac9915fa6f1006fee00b2","emailAddress":"johnny.ansari@arthrex.com","avatarUrls":{"48x48":"https://secure.gravatar.com/avatar/d887eff1f5130dfab59a6de736562de4?d=https%3A%2F%2Favatar-management--avatars.us-west-2.prod.public.atl-paas.net%2Finitials%2FJA-5.png","24x24":"https://secure.gravatar.com/avatar/d887eff1f5130dfab59a6de736562de4?d=https%3A%2F%2Favatar-management--avatars.us-west-2.prod.public.atl-paas.net%2Finitials%2FJA-5.png","16x16":"https://secure.gravatar.com/avatar/d887eff1f5130dfab59a6de736562de4?d=https%3A%2F%2Favatar-management--avatars.us-west-2.prod.public.atl-paas.net%2Finitials%2FJA-5.png","32x32":"https://secure.gravatar.com/avatar/d887eff1f5130dfab59a6de736562de4?d=https%3A%2F%2Favatar-management--avatars.us-west-2.prod.public.atl-paas.net%2Finitials%2FJA-5.png"},"displayName":"Johnny Ansari","active":true,"timeZone":"America/New_York","accountType":"atlassian"},"customfield_11810":null,"customfield_11812":null,"customfield_12901":null,"customfield_11811":null,"customfield_12903":null,"customfield_11814":null,"customfield_11813":null,"customfield_12902":null,"customfield_12905":null,"customfield_11816":null,"customfield_12904":null,"customfield_11815":null,"customfield_11818":null,"customfield_12906":null,"customfield_11817":null,"subtasks":[],"customfield_11801":null,"customfield_11800":null,"customfield_11802":null,"customfield_11805":null,"customfield_11804":null,"customfield_11807":null,"closedSprints":[{"id":2001,"self":"https://arthrex.atlassian.net/rest/agile/1.0/sprint/2001","state":"closed","name":"A Team: 7/11/22 - 7/15/22","startDate":"2022-07-11T13:56:18.821Z","endDate":"2022-07-16T02:15:00.000Z","completeDate":"2022-07-15T21:39:31.202Z","originBoardId":286,"goal":"Prep for Submission of v1.0.0 Rep App iOS Release"},{"id":1955,"self":"https://arthrex.atlassian.net/rest/agile/1.0/sprint/1955","state":"closed","name":"A Team: 6/27/22 - 7/1/22","startDate":"2022-06-27T13:39:51.053Z","endDate":"2022-07-01T16:03:00.000Z","completeDate":"2022-07-01T20:26:58.126Z","originBoardId":286,"goal":""},{"id":1940,"self":"https://arthrex.atlassian.net/rest/agile/1.0/sprint/1940","state":"closed","name":"A Team: 6/13/22 - 6/17/22","startDate":"2022-06-13T13:23:11.454Z","endDate":"2022-06-17T13:12:00.000Z","completeDate":"2022-06-17T21:12:57.348Z","originBoardId":286,"goal":""},{"id":1861,"self":"https://arthrex.atlassian.net/rest/agile/1.0/sprint/1861","state":"closed","name":"A Team: 4/18/22 - 4/22/22","startDate":"2022-04-18T13:19:51.131Z","endDate":"2022-04-22T21:22:00.000Z","completeDate":"2022-04-23T00:50:05.964Z","originBoardId":286,"goal":""},{"id":1862,"self":"https://arthrex.atlassian.net/rest/agile/1.0/sprint/1862","state":"closed","name":"A Team: 4/25/22 - 4/29/22","startDate":"2022-04-25T13:38:51.319Z","endDate":"2022-04-29T21:00:00.000Z","completeDate":"2022-04-29T20:44:00.021Z","originBoardId":286,"goal":""},{"id":1929,"self":"https://arthrex.atlassian.net/rest/agile/1.0/sprint/1929","state":"closed","name":"A Team: 5/31/22 - 6/10/22","startDate":"2022-05-31T13:20:11.464Z","endDate":"2022-06-10T14:13:00.000Z","completeDate":"2022-06-10T21:09:52.636Z","originBoardId":286,"goal":""},{"id":1881,"self":"https://arthrex.atlassian.net/rest/agile/1.0/sprint/1881","state":"closed","name":"A Team: 5/2/22 - 5/6/22","startDate":"2022-05-02T13:24:03.040Z","endDate":"2022-05-06T21:59:00.000Z","completeDate":"2022-05-06T20:33:28.823Z","originBoardId":286,"goal":""},{"id":1915,"self":"https://arthrex.atlassian.net/rest/agile/1.0/sprint/1915","state":"closed","name":"A Team: 5/16/22 - 5/20/22","startDate":"2022-05-16T13:45:22.501Z","endDate":"2022-05-20T21:11:00.000Z","completeDate":"2022-05-20T20:48:44.357Z","originBoardId":286,"goal":""},{"id":1916,"self":"https://arthrex.atlassian.net/rest/agile/1.0/sprint/1916","state":"closed","name":"A Team: 5/23/22 - 5/27/22","startDate":"2022-05-23T13:46:32.935Z","endDate":"2022-05-27T18:12:00.000Z","completeDate":"2022-05-27T21:18:43.799Z","originBoardId":286,"goal":""},{"id":1965,"self":"https://arthrex.atlassian.net/rest/agile/1.0/sprint/1965","state":"closed","name":"A Team: 7/5/22 - 7/8/22","startDate":"2022-07-05T13:38:21.073Z","endDate":"2022-07-08T17:26:00.000Z","completeDate":"2022-07-08T21:28:08.661Z","originBoardId":286,"goal":""},{"id":1952,"self":"https://arthrex.atlassian.net/rest/agile/1.0/sprint/1952","state":"closed","name":"A Team: 6/20/22 - 6/24/22","startDate":"2022-06-20T13:46:12.904Z","endDate":"2022-06-24T12:12:00.000Z","completeDate":"2022-06-24T20:31:59.550Z","originBoardId":286,"goal":""},{"id":1904,"self":"https://arthrex.atlassian.net/rest/agile/1.0/sprint/1904","state":"closed","name":"A Team: 5/9/22 - 5/13/22","startDate":"2022-05-09T13:36:27.141Z","endDate":"2022-05-13T21:43:00.000Z","completeDate":"2022-05-13T20:16:27.067Z","originBoardId":286,"goal":""}],"customfield_11806":null,"votes":{"self":"https://arthrex.atlassian.net/rest/api/2/issue/MOB-954/votes","votes":0,"hasVoted":false},"customfield_11809":null,"customfield_11808":null,"worklog":{"startAt":0,"maxResults":20,"total":0,"worklogs":[]},"issuetype":{"self":"https://arthrex.atlassian.net/rest/api/2/issuetype/5","id":"5","description":"The sub-task of the issue","iconUrl":"https://arthrex.atlassian.net/rest/api/2/universal_avatar/view/type/issuetype/avatar/10316?size=medium","name":"Sub-task","subtask":true,"avatarId":10316,"hierarchyLevel":-1},"sprint":{"id":1661,"self":"https://arthrex.atlassian.net/rest/agile/1.0/sprint/1661","state":"active","name":"A Team: 7/18/22 - 7/22/22","startDate":"2022-07-18T13:46:00.383Z","endDate":"2022-07-23T02:21:00.000Z","originBoardId":286,"goal":"AMOBS v1.0.0 and RAI v1.0.0 Releases"},"customfield_10700":null,"customfield_10701":[],"customfield_10702":null,"customfield_11901":{"self":"https://arthrex.atlassian.net/rest/api/2/customFieldOption/11506","value":"No","id":"11506"},"customfield_14050":null,"timetracking":{},"customfield_10803":null,"customfield_10806":null,"customfield_14047":null,"customfield_14048":null,"customfield_14046":null,"customfield_14049":null,"environment":null,"duedate":null,"customfield_13980":null,"customfield_13861":null,"customfield_11441":null,"customfield_13740":null,"customfield_13982":null,"customfield_12772":null,"customfield_11440":null,"customfield_11200":null,"customfield_11443":null,"customfield_13742":null,"customfield_12411":null,"customfield_12774":null,"customfield_11201":null,"customfield_12773":null,"customfield_13741":null,"customfield_11442":null,"customfield_11202":null,"customfield_13986":null,"customfield_13623":null,"customfield_13744":null,"customfield_12776":null,"customfield_12413":null,"customfield_11444":null,"customfield_13985":null,"customfield_12412":null,"customfield_12533":null,"customfield_12775":null,"customfield_13743":null,"customfield_13614":null,"customfield_11435":null,"customfield_13613":null,"customfield_12645":null,"customfield_13737":null,"customfield_13616":null,"customfield_11438":null,"customfield_13979":null,"customfield_13615":null,"customfield_11437":null,"customfield_13739":null,"customfield_13738":null,"customfield_11439":null,"customfield_13617":null,"customfield_12409":null,"customfield_12761":null,"customfield_11430":null,"customfield_12760":null,"customfield_13610":null,"customfield_10100":"2|i02f9m:c","customfield_11431":null,"customfield_12762":null,"customfield_11434":null,"customfield_13975":null,"customfield_13612":null,"customfield_13611":null,"customfield_12998":null,"customfield_12514":null,"customfield_11303":"3_*:*_1_*:*_359755762_*|*_10000_*:*_1_*:*_5519609428_*|*_10001_*:*_1_*:*_0","customfield_12756":null,"customfield_13603":null,"customfield_11425":null,"customfield_12997":null,"customfield_12755":null,"customfield_11304":null,"customfield_12513":null,"customfield_13602":null,"customfield_12758":null,"customfield_13605":null,"customfield_13726":null,"customfield_11427":null,"customfield_13604":null,"customfield_12757":null,"customfield_12999":null,"timeestimate":null,"customfield_13727":null,"customfield_11428":null,"customfield_12759":null,"customfield_13969":null,"customfield_13606":null,"customfield_13729":null,"customfield_13608":null,"status":{"self":"https://arthrex.atlassian.net/rest/api/2/status/10001","description":"","iconUrl":"https://arthrex.atlassian.net/images/icons/subtask.gif","name":"Done","id":"10001","statusCategory":{"self":"https://arthrex.atlassian.net/rest/api/2/statuscategory/3","id":3,"key":"done","colorName":"green","name":"Done"}},"customfield_12750":null,"customfield_12752":null,"customfield_12510":null,"customfield_12751":null,"customfield_11420":null,"customfield_11300":{"self":"https://arthrex.atlassian.net/rest/api/2/customFieldOption/10700","value":"User Stories:1","id":"10700"},"customfield_12996":null,"customfield_11301":null,"customfield_12754":null,"customfield_13601":null,"customfield_13600":null,"customfield_11422":null,"customfield_12753":null,"customfield_12511":null,"customfield_12745":null,"customfield_11414":null,"customfield_12503":null,"customfield_12502":null,"customfield_12744":null,"customfield_12505":null,"customfield_13715":null,"customfield_13836":null,"customfield_12747":null,"customfield_11415":null,"customfield_12746":null,"customfield_12504":null,"customfield_13956":null,"customfield_13835":null,"customfield_12749":null,"aggregatetimeestimate":null,"customfield_11418":null,"customfield_12507":null,"customfield_12748":null,"customfield_13837":null,"customfield_13716":null,"customfield_11419":null,"customfield_12508":null,"creator":{"self":"https://arthrex.atlassian.net/rest/api/2/user?accountId=5dfa6aa75697460cb3d97763","accountId":"5dfa6aa75697460cb3d97763","emailAddress":"patrick.maguschak2@arthrex.com","avatarUrls":{"48x48":"https://avatar-management--avatars.us-west-2.prod.public.atl-paas.net/5dfa6aa75697460cb3d97763/5f2aaf98-63fd-4e3a-a29b-7e163f497fd8/48","24x24":"https://avatar-management--avatars.us-west-2.prod.public.atl-paas.net/5dfa6aa75697460cb3d97763/5f2aaf98-63fd-4e3a-a29b-7e163f497fd8/24","16x16":"https://avatar-management--avatars.us-west-2.prod.public.atl-paas.net/5dfa6aa75697460cb3d97763/5f2aaf98-63fd-4e3a-a29b-7e163f497fd8/16","32x32":"https://avatar-management--avatars.us-west-2.prod.public.atl-paas.net/5dfa6aa75697460cb3d97763/5f2aaf98-63fd-4e3a-a29b-7e163f497fd8/32"},"displayName":"Patrick Maguschak","active":true,"timeZone":"America/New_York","accountType":"atlassian"},"customfield_13830":null,"customfield_10200":null,"customfield_12743":null,"customfield_12500":null,"customfield_13831":null,"customfield_10202":null,"customfield_11403":{"self":"https://arthrex.atlassian.net/rest/api/2/customFieldOption/10806","value":"Hotline","id":"10806"},"customfield_13702":null,"customfield_13701":null,"customfield_11402":null,"customfield_12975":null,"customfield_11523":null,"customfield_11526":null,"customfield_13825":null,"customfield_13704":null,"customfield_13703":null,"customfield_13824":null,"customfield_11404":null,"customfield_12738":null,"customfield_13827":null,"customfield_13705":null,"customfield_13826":null,"customfield_13829":null,"customfield_11529":null,"timespent":null,"customfield_12972":null,"aggregatetimespent":null,"customfield_11401":null,"customfield_13700":null,"customfield_11522":null,"customfield_12974":null,"customfield_11521":null,"customfield_11400":null,"customfield_13933":null,"customfield_11512":null,"customfield_12843":null,"customfield_13932":null,"customfield_11514":null,"customfield_11519":"3_*:*_1_*:*_359755762_*|*_10000_*:*_1_*:*_5519609428_*|*_10001_*:*_1_*:*_0","workratio":-1,"customfield_12840":null,"customfield_10300":null,"customfield_13931":null,"customfield_11511":null,"customfield_12842":null,"customfield_10301":null,"customfield_13930":null,"customfield_11510":null,"customfield_12841":null,"customfield_11502":null,"customfield_13801":null,"customfield_12833":null,"customfield_11501":{"hasEpicLinkFieldDependency":false,"showField":false,"nonEditableReason":{"reason":"PLUGIN_LICENSE_ERROR","message":"The Parent Link is only available to Jira Premium users."}},"customfield_12832":null,"customfield_13800":null,"customfield_13803":null,"customfield_12835":null,"customfield_11504":null,"customfield_12834":null,"customfield_13802":null,"customfield_12955":null,"customfield_12837":null,"customfield_12958":null,"customfield_13805":null,"customfield_13926":null,"customfield_11506":null,"customfield_13925":null,"customfield_12836":null,"customfield_13804":null,"customfield_11505":null,"customfield_12839":null,"customfield_12838":null,"customfield_13808":null,"customfield_11500":null,"customfield_12831":null,"customfield_12830":null,"customfield_12822":null,"customfield_12942":null,"customfield_12824":null,"customfield_12823":null,"flagged":false,"customfield_12825":null,"customfield_12828":null,"customfield_12827":null,"customfield_10400":null,"customfield_12932":null,"customfield_12811":null,"customfield_12934":null,"customfield_12933":null,"customfield_13904":null,"customfield_12936":null,"customfield_12935":null,"customfield_13903":null,"customfield_12938":null,"customfield_13906":null,"customfield_13905":null,"customfield_12937":null,"customfield_13908":null,"customfield_12939":null,"customfield_13909":null,"customfield_12490":null,"customfield_12372":null,"customfield_12493":null,"customfield_12492":null,"customfield_13463":null,"customfield_12495":null,"customfield_12374":null,"customfield_12494":null,"customfield_13465":null,"customfield_12376":null,"customfield_12496":"{panel:bgColor=#FFC400}\r\nThese fields are used to populate request forms in the customer portal. Do not manually change these fields.\r\n{panel}","customfield_13343":null,"customfield_13464":null,"customfield_13467":null,"customfield_12499":null,"customfield_13225":null,"customfield_13466":null,"customfield_13469":null,"customfield_13468":null,"customfield_12480":null,"customfield_13690":null,"customfield_13692":null,"customfield_12482":null,"customfield_12481":null,"customfield_13691":null,"customfield_12000":null,"customfield_13694":null,"customfield_12484":null,"customfield_12483":null,"customfield_12362":null,"customfield_13693":null,"customfield_13212":null,"customfield_13696":null,"customfield_12002":null,"customfield_13695":null,"customfield_12001":null,"customfield_13211":null,"customfield_13335":null,"customfield_12004":null,"customfield_12488":null,"customfield_13698":null,"customfield_13697":null,"customfield_13213":null,"customfield_12003":null,"labels":[],"customfield_13699":null,"customfield_12005":null,"customfield_12489":null,"customfield_13336":null,"customfield_13449":null,"customfield_13207":null,"components":[],"customfield_13681":null,"customfield_12471":null,"customfield_12470":null,"customfield_13680":null,"customfield_12473":null,"customfield_12110":null,"customfield_13683":null,"customfield_13682":null,"customfield_12472":null,"customfield_12112":null,"customfield_13685":null,"customfield_12475":null,"customfield_13322":null,"customfield_12111":null,"customfield_13684":null,"customfield_12474":null,"customfield_13687":null,"customfield_12114":{"self":"https://arthrex.atlassian.net/rest/api/2/customFieldOption/11922","value":"No","id":"11922"},"customfield_12477":null,"customfield_12476":null,"customfield_13686":null,"customfield_12358":null,"customfield_12479":null,"customfield_13689":null,"customfield_13688":null,"customfield_13325":null,"customfield_12478":null,"customfield_12357":null,"customfield_12469":null,"customfield_12106":null,"customfield_13679":null,"customfield_12348":"{panel:title=Alert|titleBGColor=#FFC400|bgColor=#FFFAE6}\r\nPlease make sure that the correct issue type is selected. To select a different issue type, move the issue.\r\n{panel}","customfield_12109":null,"customfield_12108":null,"customfield_13672":null,"customfield_12341":null,"customfield_12340":null,"customfield_12343":"{panel:title=Info|titleBGColor=#C0B6F2|bgColor=#EAE6FF}\r\nUse this transition to escalate this issue to another team.\r\n\r\nPlease note that if you select *MRM-DAM Technical*, Jira will automatically create a ticket in Footprints. If you do not wish to create a new Footprints ticket, please select *Disable emails to Footprints* below.\r\n\r\nIf you do not want to be reminded to follow-up on this issue, please select *Disable escalation follow-up* below.\r\n{panel}","customfield_13795":null,"customfield_12101":null,"customfield_12464":null,"reporter":{"self":"https://arthrex.atlassian.net/rest/api/2/user?accountId=5dfa6aa75697460cb3d97763","accountId":"5dfa6aa75697460cb3d97763","emailAddress":"patrick.maguschak2@arthrex.com","avatarUrls":{"48x48":"https://avatar-management--avatars.us-west-2.prod.public.atl-paas.net/5dfa6aa75697460cb3d97763/5f2aaf98-63fd-4e3a-a29b-7e163f497fd8/48","24x24":"https://avatar-management--avatars.us-west-2.prod.public.atl-paas.net/5dfa6aa75697460cb3d97763/5f2aaf98-63fd-4e3a-a29b-7e163f497fd8/24","16x16":"https://avatar-management--avatars.us-west-2.prod.public.atl-paas.net/5dfa6aa75697460cb3d97763/5f2aaf98-63fd-4e3a-a29b-7e163f497fd8/16","32x32":"https://avatar-management--avatars.us-west-2.prod.public.atl-paas.net/5dfa6aa75697460cb3d97763/5f2aaf98-63fd-4e3a-a29b-7e163f497fd8/32"},"displayName":"Patrick Maguschak","active":true,"timeZone":"America/New_York","accountType":"atlassian"},"customfield_13674":null,"customfield_13673":null,"customfield_12342":null,"customfield_12463":null,"customfield_13676":null,"customfield_12103":null,"customfield_12466":null,"customfield_13797":null,"customfield_12345":null,"customfield_13796":null,"customfield_12344":"{panel:title=Info|titleBGColor=#C0B6F2|bgColor=#EAE6FF}\r\nUse this transition to respond to the reporter and request participants.\r\n\r\nIf you do not want to be reminded to follow-up on this issue, select *Disable customer follow-up* below.\r\n{panel}","customfield_13675":null,"customfield_12468":null,"customfield_13678":null,"customfield_12347":"{panel:bgColor=#FFC400}\r\n*Note*\r\nThese fields are used to populate request forms in the customer portal. Do not manually change these fields.\r\n{panel}","customfield_13799":null,"customfield_12467":null,"customfield_12104":null,"customfield_13798":null,"customfield_13677":null,"customfield_12346":null,"progress":{"progress":0,"total":0},"customfield_12570":null,"customfield_13780":null,"customfield_12330":null,"customfield_13782":null,"project":{"self":"https://arthrex.atlassian.net/rest/api/2/project/12262","id":"12262","key":"MOB","name":"A Team","projectTypeKey":"software","simplified":false,"avatarUrls":{"48x48":"https://arthrex.atlassian.net/rest/api/2/universal_avatar/view/type/project/avatar/13447","24x24":"https://arthrex.atlassian.net/rest/api/2/universal_avatar/view/type/project/avatar/13447?size=small","16x16":"https://arthrex.atlassian.net/rest/api/2/universal_avatar/view/type/project/avatar/13447?size=xsmall","32x32":"https://arthrex.atlassian.net/rest/api/2/universal_avatar/view/type/project/avatar/13447?size=medium"},"projectCategory":{"self":"https://arthrex.atlassian.net/rest/api/2/projectCategory/10103","id":"10103","description":"","name":"Digital Media - Mobile"}},"customfield_12571":null,"customfield_12332":null,"customfield_12331":null,"customfield_13783":null,"customfield_12333":null,"customfield_12336":null,"customfield_12335":null,"customfield_12569":null,"customfield_13779":null,"customfield_12327":null,"customfield_12568":null,"customfield_12329":null,"customfield_12328":null,"resolutiondate":"2022-06-27T12:50:07.997-0400","watches":{"self":"https://arthrex.atlassian.net/rest/api/2/issue/MOB-954/watchers","watchCount":1,"isWatching":false},"customfield_13890":null,"customfield_12561":null,"customfield_13771":null,"customfield_13892":null,"customfield_13891":null,"customfield_13770":null,"customfield_12563":null,"customfield_13652":null,"customfield_12321":null,"customfield_12200":null,"customfield_12562":null,"customfield_12320":null,"customfield_13772":null,"customfield_12323":null,"customfield_12202":null,"customfield_12564":null,"customfield_12322":null,"customfield_12201":null,"customfield_12567":null,"customfield_13656":null,"customfield_13655":null,"customfield_12566":null,"customfield_12203":null,"customfield_12324":null,"customfield_12558":null,"customfield_13407":null,"customfield_13769":null,"customfield_12319":null,"updated":"2022-06-27T12:50:08.024-0400","customfield_12790":null,"timeoriginalestimate":null,"customfield_13760":null,"customfield_12550":null,"customfield_12792":null,"description":"[https://www.arthrex.com/mobile-applications|https://www.arthrex.com/mobile-applications]","customfield_12791":null,"customfield_12552":null,"customfield_12794":null,"customfield_13762":null,"customfield_11100":" ","customfield_13640":null,"customfield_12551":null,"customfield_13761":null,"customfield_13764":null,"customfield_11101":null,"customfield_12554":null,"customfield_12553":null,"customfield_11102":{"self":"https://arthrex.atlassian.net/rest/api/2/customFieldOption/10500","value":"1-None","id":"10500"},"customfield_12795":null,"customfield_13763":null,"customfield_13645":null,"customfield_11104":null,"customfield_12555":null,"customfield_13765":null,"customfield_10005":[{"id":1952,"name":"A Team: 6/20/22 - 6/24/22","state":"closed","boardId":286,"goal":"","startDate":"2022-06-20T13:46:12.904Z","endDate":"2022-06-24T12:12:00.000Z","completeDate":"2022-06-24T20:31:59.550Z"},{"id":1904,"name":"A Team: 5/9/22 - 5/13/22","state":"closed","boardId":286,"goal":"","startDate":"2022-05-09T13:36:27.141Z","endDate":"2022-05-13T21:43:00.000Z","completeDate":"2022-05-13T20:16:27.067Z"},{"id":2001,"name":"A Team: 7/11/22 - 7/15/22","state":"closed","boardId":286,"goal":"Prep for Submission of v1.0.0 Rep App iOS Release","startDate":"2022-07-11T13:56:18.821Z","endDate":"2022-07-16T02:15:00.000Z","completeDate":"2022-07-15T21:39:31.202Z"},{"id":1955,"name":"A Team: 6/27/22 - 7/1/22","state":"closed","boardId":286,"goal":"","startDate":"2022-06-27T13:39:51.053Z","endDate":"2022-07-01T16:03:00.000Z","completeDate":"2022-07-01T20:26:58.126Z"},{"id":1940,"name":"A Team: 6/13/22 - 6/17/22","state":"closed","boardId":286,"goal":"","startDate":"2022-06-13T13:23:11.454Z","endDate":"2022-06-17T13:12:00.000Z","completeDate":"2022-06-17T21:12:57.348Z"},{"id":1861,"name":"A Team: 4/18/22 - 4/22/22","state":"closed","boardId":286,"goal":"","startDate":"2022-04-18T13:19:51.131Z","endDate":"2022-04-22T21:22:00.000Z","completeDate":"2022-04-23T00:50:05.964Z"},{"id":1862,"name":"A Team: 4/25/22 - 4/29/22","state":"closed","boardId":286,"goal":"","startDate":"2022-04-25T13:38:51.319Z","endDate":"2022-04-29T21:00:00.000Z","completeDate":"2022-04-29T20:44:00.021Z"},{"id":1929,"name":"A Team: 5/31/22 - 6/10/22","state":"closed","boardId":286,"goal":"","startDate":"2022-05-31T13:20:11.464Z","endDate":"2022-06-10T14:13:00.000Z","completeDate":"2022-06-10T21:09:52.636Z"},{"id":1881,"name":"A Team: 5/2/22 - 5/6/22","state":"closed","boardId":286,"goal":"","startDate":"2022-05-02T13:24:03.040Z","endDate":"2022-05-06T21:59:00.000Z","completeDate":"2022-05-06T20:33:28.823Z"},{"id":1915,"name":"A Team: 5/16/22 - 5/20/22","state":"closed","boardId":286,"goal":"","startDate":"2022-05-16T13:45:22.501Z","endDate":"2022-05-20T21:11:00.000Z","completeDate":"2022-05-20T20:48:44.357Z"},{"id":1916,"name":"A Team: 5/23/22 - 5/27/22","state":"closed","boardId":286,"goal":"","startDate":"2022-05-23T13:46:32.935Z","endDate":"2022-05-27T18:12:00.000Z","completeDate":"2022-05-27T21:18:43.799Z"},{"id":1965,"name":"A Team: 7/5/22 - 7/8/22","state":"closed","boardId":286,"goal":"","startDate":"2022-07-05T13:38:21.073Z","endDate":"2022-07-08T17:26:00.000Z","completeDate":"2022-07-08T21:28:08.661Z"},{"id":1661,"name":"A Team: 7/18/22 - 7/22/22","state":"active","boardId":286,"goal":"AMOBS v1.0.0 and RAI v1.0.0 Releases","startDate":"2022-07-18T13:46:00.383Z","endDate":"2022-07-23T02:21:00.000Z"}],"customfield_12547":null,"customfield_12789":null,"customfield_13757":null,"customfield_12426":null,"customfield_12305":null,"customfield_13636":null,"customfield_13756":null,"customfield_12425":null,"customfield_12304":null,"customfield_12546":null,"customfield_10006":null,"customfield_12788":null,"customfield_12549":null,"customfield_12428":null,"customfield_12307":null,"customfield_13998":null,"customfield_13759":null,"customfield_12548":null,"customfield_12427":null,"customfield_12306":null,"customfield_13758":null,"customfield_12309":null,"customfield_12308":null,"customfield_12429":null,"summary":"Future state visuals for App Store Images","customfield_11450":{"self":"https://arthrex.atlassian.net/rest/api/2/customFieldOption/10989","value":"Always","id":"10989"},"customfield_12781":null,"customfield_13993":null,"customfield_12780":null,"customfield_12420":null,"customfield_12783":null,"customfield_12541":null,"customfield_13751":null,"customfield_13750":null,"customfield_13991":null,"customfield_12782":null,"customfield_10000":null,"customfield_12540":null,"customfield_13753":null,"customfield_10001":null,"customfield_13996":null,"customfield_12785":null,"customfield_12422":null,"customfield_12784":null,"customfield_12300":"{}","customfield_13997":null,"customfield_13752":null,"customfield_12545":null,"customfield_13994":null,"customfield_12303":null,"customfield_12787":null,"customfield_13755":null,"customfield_12544":null,"customfield_13995":null,"customfield_12786":null,"customfield_12423":null,"customfield_13754":null,"customfield_11447":null,"customfield_12778":null,"customfield_12415":null,"customfield_13746":null,"customfield_13989":null,"customfield_13745":null,"customfield_12777":null,"customfield_12414":null,"customfield_12417":null,"customfield_13748":null,"customfield_11449":{"self":"https://arthrex.atlassian.net/rest/api/2/customFieldOption/10986","value":"Live Site","id":"10986"},"customfield_13987":null,"customfield_13505":[],"customfield_12416":null,"customfield_12779":null,"customfield_11448":null,"customfield_12419":null,"customfield_13749":null,"customfield_12418":null,"comment":{"comments":[],"self":"https://arthrex.atlassian.net/rest/api/2/issue/281398/comment","maxResults":0,"total":0,"startAt":0},"statuscategorychangedate":"2022-06-27T12:50:08.025-0400","customfield_13063":"Testing message","customfield_13062":null,"customfield_14033":null,"customfield_13067":null,"customfield_13066":null,"fixVersions":[],"customfield_10900":null,"customfield_13294":null,"customfield_13052":null,"customfield_13053":null,"epic":null,"customfield_13057":null,"priority":{"self":"https://arthrex.atlassian.net/rest/api/2/priority/4","iconUrl":"https://s3.amazonaws.com/arthrex-public/jira/priorities/minor.png","name":"Minor","id":"4"},"customfield_14028":null,"versions":[],"customfield_13045":null,"customfield_14014":null,"customfield_14015":null,"customfield_13047":null,"customfield_13046":null,"customfield_14013":null,"customfield_14016":null,"customfield_14017":null,"customfield_13391":null,"customfield_13272":null,"customfield_13392":null,"customfield_13274":null,"customfield_13273":null,"aggregateprogress":{"progress":0,"total":0},"customfield_13279":null,"customfield_13380":null,"issuerestriction":{"issuerestrictions":{},"shouldDisplay":false},"customfield_13371":null,"customfield_13373":null,"customfield_13494":null,"created":"2022-04-20T11:40:42.859-0400","customfield_13012":null,"customfield_13375":null,"customfield_13011":null,"customfield_13377":null,"customfield_13376":null,"customfield_13016":null,"customfield_13379":null,"customfield_13378":null,"customfield_13017":null,"customfield_13360":null,"customfield_13362":null,"customfield_13361":null,"customfield_13122":null,"customfield_13001":null,"customfield_13364":null,"customfield_13000":null,"customfield_13363":null,"customfield_13366":"150 GB","customfield_13365":null,"customfield_13002":null,"customfield_13368":null,"customfield_13367":null,"customfield_13369":null,"security":null,"attachment":[],"customfield_13470":null,"customfield_13471":null,"customfield_12385":null,"customfield_13355":null,"customfield_12386":null,"customfield_13599":null,"customfield_13357":null,"customfield_12388":null,"customfield_13356":null,"customfield_13359":null,"customfield_13358":null}},{"expand":"operations,versionedRepresentations,editmeta,changelog,renderedFields","id":"299482","self":"https://arthrex.atlassian.net/rest/agile/1.0/issue/299482","key":"MOB-1067","fields":{"parent":{"id":"279628","key":"MOB-929","self":"https://arthrex.atlassian.net/rest/api/2/issue/279628","fields":{"summary":"UX/UI","status":{"self":"https://arthrex.atlassian.net/rest/api/2/status/3","description":"This issue is being actively worked on at the moment by the assignee.","iconUrl":"https://arthrex.atlassian.net/images/icons/statuses/inprogress.png","name":"Working","id":"3","statusCategory":{"self":"https://arthrex.atlassian.net/rest/api/2/statuscategory/4","id":4,"key":"indeterminate","colorName":"yellow","name":"In Progress"}},"priority":{"self":"https://arthrex.atlassian.net/rest/api/2/priority/4","iconUrl":"https://s3.amazonaws.com/arthrex-public/jira/priorities/minor.png","name":"Minor","id":"4"},"issuetype":{"self":"https://arthrex.atlassian.net/rest/api/2/issuetype/3","id":"3","description":"A task that needs to be done.","iconUrl":"https://arthrex.atlassian.net/rest/api/2/universal_avatar/view/type/issuetype/avatar/10318?size=medium","name":"Task","subtask":false,"avatarId":10318,"hierarchyLevel":0}}},"resolution":{"self":"https://arthrex.atlassian.net/rest/api/2/resolution/10000","id":"10000","description":"The issue is done.","name":"Done"},"customfield_12930":null,"customfield_12923":null,"customfield_12924":null,"customfield_12929":null,"lastViewed":null,"customfield_11700":null,"customfield_11702":null,"customfield_12912":null,"customfield_11701":null,"customfield_12914":null,"aggregatetimeoriginalestimate":null,"customfield_12916":null,"customfield_12915":null,"customfield_12918":null,"customfield_12917":null,"issuelinks":[],"assignee":{"self":"https://arthrex.atlassian.net/rest/api/2/user?accountId=60bac9915fa6f1006fee00b2","accountId":"60bac9915fa6f1006fee00b2","emailAddress":"johnny.ansari@arthrex.com","avatarUrls":{"48x48":"https://secure.gravatar.com/avatar/d887eff1f5130dfab59a6de736562de4?d=https%3A%2F%2Favatar-management--avatars.us-west-2.prod.public.atl-paas.net%2Finitials%2FJA-5.png","24x24":"https://secure.gravatar.com/avatar/d887eff1f5130dfab59a6de736562de4?d=https%3A%2F%2Favatar-management--avatars.us-west-2.prod.public.atl-paas.net%2Finitials%2FJA-5.png","16x16":"https://secure.gravatar.com/avatar/d887eff1f5130dfab59a6de736562de4?d=https%3A%2F%2Favatar-management--avatars.us-west-2.prod.public.atl-paas.net%2Finitials%2FJA-5.png","32x32":"https://secure.gravatar.com/avatar/d887eff1f5130dfab59a6de736562de4?d=https%3A%2F%2Favatar-management--avatars.us-west-2.prod.public.atl-paas.net%2Finitials%2FJA-5.png"},"displayName":"Johnny Ansari","active":true,"timeZone":"America/New_York","accountType":"atlassian"},"customfield_12919":null,"customfield_11810":null,"customfield_11812":null,"customfield_12901":null,"customfield_11811":null,"customfield_12903":null,"customfield_11814":null,"customfield_12902":null,"customfield_11813":null,"customfield_11816":null,"customfield_12905":null,"customfield_11815":null,"customfield_12904":null,"customfield_11818":null,"customfield_11817":null,"customfield_12906":null,"subtasks":[],"customfield_11801":null,"customfield_11800":null,"customfield_11802":null,"customfield_11805":null,"customfield_11804":null,"customfield_11807":null,"closedSprints":[{"id":2001,"self":"https://arthrex.atlassian.net/rest/agile/1.0/sprint/2001","state":"closed","name":"A Team: 7/11/22 - 7/15/22","startDate":"2022-07-11T13:56:18.821Z","endDate":"2022-07-16T02:15:00.000Z","completeDate":"2022-07-15T21:39:31.202Z","originBoardId":286,"goal":"Prep for Submission of v1.0.0 Rep App iOS Release"},{"id":1955,"self":"https://arthrex.atlassian.net/rest/agile/1.0/sprint/1955","state":"closed","name":"A Team: 6/27/22 - 7/1/22","startDate":"2022-06-27T13:39:51.053Z","endDate":"2022-07-01T16:03:00.000Z","completeDate":"2022-07-01T20:26:58.126Z","originBoardId":286,"goal":""},{"id":1940,"self":"https://arthrex.atlassian.net/rest/agile/1.0/sprint/1940","state":"closed","name":"A Team: 6/13/22 - 6/17/22","startDate":"2022-06-13T13:23:11.454Z","endDate":"2022-06-17T13:12:00.000Z","completeDate":"2022-06-17T21:12:57.348Z","originBoardId":286,"goal":""},{"id":1861,"self":"https://arthrex.atlassian.net/rest/agile/1.0/sprint/1861","state":"closed","name":"A Team: 4/18/22 - 4/22/22","startDate":"2022-04-18T13:19:51.131Z","endDate":"2022-04-22T21:22:00.000Z","completeDate":"2022-04-23T00:50:05.964Z","originBoardId":286,"goal":""},{"id":1862,"self":"https://arthrex.atlassian.net/rest/agile/1.0/sprint/1862","state":"closed","name":"A Team: 4/25/22 - 4/29/22","startDate":"2022-04-25T13:38:51.319Z","endDate":"2022-04-29T21:00:00.000Z","completeDate":"2022-04-29T20:44:00.021Z","originBoardId":286,"goal":""},{"id":1929,"self":"https://arthrex.atlassian.net/rest/agile/1.0/sprint/1929","state":"closed","name":"A Team: 5/31/22 - 6/10/22","startDate":"2022-05-31T13:20:11.464Z","endDate":"2022-06-10T14:13:00.000Z","completeDate":"2022-06-10T21:09:52.636Z","originBoardId":286,"goal":""},{"id":1881,"self":"https://arthrex.atlassian.net/rest/agile/1.0/sprint/1881","state":"closed","name":"A Team: 5/2/22 - 5/6/22","startDate":"2022-05-02T13:24:03.040Z","endDate":"2022-05-06T21:59:00.000Z","completeDate":"2022-05-06T20:33:28.823Z","originBoardId":286,"goal":""},{"id":1915,"self":"https://arthrex.atlassian.net/rest/agile/1.0/sprint/1915","state":"closed","name":"A Team: 5/16/22 - 5/20/22","startDate":"2022-05-16T13:45:22.501Z","endDate":"2022-05-20T21:11:00.000Z","completeDate":"2022-05-20T20:48:44.357Z","originBoardId":286,"goal":""},{"id":1916,"self":"https://arthrex.atlassian.net/rest/agile/1.0/sprint/1916","state":"closed","name":"A Team: 5/23/22 - 5/27/22","startDate":"2022-05-23T13:46:32.935Z","endDate":"2022-05-27T18:12:00.000Z","completeDate":"2022-05-27T21:18:43.799Z","originBoardId":286,"goal":""},{"id":1965,"self":"https://arthrex.atlassian.net/rest/agile/1.0/sprint/1965","state":"closed","name":"A Team: 7/5/22 - 7/8/22","startDate":"2022-07-05T13:38:21.073Z","endDate":"2022-07-08T17:26:00.000Z","completeDate":"2022-07-08T21:28:08.661Z","originBoardId":286,"goal":""},{"id":1952,"self":"https://arthrex.atlassian.net/rest/agile/1.0/sprint/1952","state":"closed","name":"A Team: 6/20/22 - 6/24/22","startDate":"2022-06-20T13:46:12.904Z","endDate":"2022-06-24T12:12:00.000Z","completeDate":"2022-06-24T20:31:59.550Z","originBoardId":286,"goal":""},{"id":1904,"self":"https://arthrex.atlassian.net/rest/agile/1.0/sprint/1904","state":"closed","name":"A Team: 5/9/22 - 5/13/22","startDate":"2022-05-09T13:36:27.141Z","endDate":"2022-05-13T21:43:00.000Z","completeDate":"2022-05-13T20:16:27.067Z","originBoardId":286,"goal":""}],"customfield_11806":null,"votes":{"self":"https://arthrex.atlassian.net/rest/api/2/issue/MOB-1067/votes","votes":0,"hasVoted":false},"customfield_11809":null,"worklog":{"startAt":0,"maxResults":20,"total":0,"worklogs":[]},"customfield_11808":null,"issuetype":{"self":"https://arthrex.atlassian.net/rest/api/2/issuetype/5","id":"5","description":"The sub-task of the issue","iconUrl":"https://arthrex.atlassian.net/rest/api/2/universal_avatar/view/type/issuetype/avatar/10316?size=medium","name":"Sub-task","subtask":true,"avatarId":10316,"hierarchyLevel":-1},"sprint":{"id":1661,"self":"https://arthrex.atlassian.net/rest/agile/1.0/sprint/1661","state":"active","name":"A Team: 7/18/22 - 7/22/22","startDate":"2022-07-18T13:46:00.383Z","endDate":"2022-07-23T02:21:00.000Z","originBoardId":286,"goal":"AMOBS v1.0.0 and RAI v1.0.0 Releases"},"customfield_10700":null,"customfield_10701":[],"customfield_10702":null,"customfield_11901":{"self":"https://arthrex.atlassian.net/rest/api/2/customFieldOption/11506","value":"No","id":"11506"},"customfield_14050":null,"timetracking":{},"customfield_10803":null,"customfield_10806":null,"customfield_14047":null,"customfield_14048":null,"customfield_14046":null,"customfield_14049":null,"environment":null,"duedate":null,"customfield_13980":null,"customfield_13740":null,"customfield_13861":null,"customfield_12772":null,"customfield_11441":null,"customfield_13982":null,"customfield_11440":null,"customfield_12411":null,"customfield_12774":null,"customfield_11443":null,"customfield_11200":null,"customfield_13742":null,"customfield_13741":null,"customfield_12773":null,"customfield_11442":null,"customfield_11201":null,"customfield_12776":null,"customfield_12413":null,"customfield_13744":null,"customfield_13623":null,"customfield_13986":null,"customfield_11202":null,"customfield_12412":null,"customfield_13985":null,"customfield_11444":null,"customfield_12775":null,"customfield_12533":null,"customfield_13743":null,"customfield_13614":null,"customfield_11435":null,"customfield_13613":null,"customfield_12645":null,"customfield_11438":null,"customfield_13737":null,"customfield_13616":null,"customfield_13979":null,"customfield_11437":null,"customfield_13615":null,"customfield_13739":null,"customfield_13617":null,"customfield_11439":null,"customfield_13738":null,"customfield_12409":null,"customfield_12761":null,"customfield_11430":null,"customfield_12760":null,"customfield_13610":null,"customfield_10100":"2|i02f9m:j","customfield_11431":null,"customfield_12762":null,"customfield_13612":null,"customfield_11434":null,"customfield_13975":null,"customfield_13611":null,"customfield_11303":"3_*:*_1_*:*_584558726_*|*_10000_*:*_1_*:*_449607059_*|*_10001_*:*_1_*:*_0_*|*_10201_*:*_1_*:*_774407436","customfield_12756":null,"customfield_12998":null,"customfield_11425":null,"customfield_12514":null,"customfield_13603":null,"customfield_13602":null,"customfield_12755":null,"customfield_12513":null,"customfield_11304":null,"customfield_12997":null,"customfield_13605":null,"customfield_12758":null,"customfield_11427":null,"customfield_13726":null,"customfield_12999":null,"customfield_13604":null,"customfield_12757":null,"timeestimate":null,"customfield_13606":null,"customfield_12759":null,"customfield_13727":null,"customfield_11428":null,"customfield_13969":null,"customfield_13729":null,"customfield_13608":null,"status":{"self":"https://arthrex.atlassian.net/rest/api/2/status/10001","description":"","iconUrl":"https://arthrex.atlassian.net/images/icons/subtask.gif","name":"Done","id":"10001","statusCategory":{"self":"https://arthrex.atlassian.net/rest/api/2/statuscategory/3","id":3,"key":"done","colorName":"green","name":"Done"}},"customfield_12750":null,"customfield_12752":null,"customfield_12510":null,"customfield_12751":null,"customfield_11300":{"self":"https://arthrex.atlassian.net/rest/api/2/customFieldOption/10700","value":"User Stories:1","id":"10700"},"customfield_11420":null,"customfield_12996":null,"customfield_13601":null,"customfield_11301":null,"customfield_12754":null,"customfield_12753":null,"customfield_12511":null,"customfield_11422":null,"customfield_13600":null,"customfield_12503":null,"customfield_12745":null,"customfield_11414":null,"customfield_12502":null,"customfield_12744":null,"customfield_12747":null,"customfield_13836":null,"customfield_13715":null,"customfield_12505":null,"customfield_13956":null,"customfield_12504":null,"customfield_13835":null,"customfield_12746":null,"customfield_11415":null,"customfield_12507":null,"aggregatetimeestimate":null,"customfield_12749":null,"customfield_11418":null,"customfield_12748":null,"customfield_13837":null,"customfield_13716":null,"customfield_11419":null,"customfield_12508":null,"creator":{"self":"https://arthrex.atlassian.net/rest/api/2/user?accountId=5dfa6aa75697460cb3d97763","accountId":"5dfa6aa75697460cb3d97763","emailAddress":"patrick.maguschak2@arthrex.com","avatarUrls":{"48x48":"https://avatar-management--avatars.us-west-2.prod.public.atl-paas.net/5dfa6aa75697460cb3d97763/5f2aaf98-63fd-4e3a-a29b-7e163f497fd8/48","24x24":"https://avatar-management--avatars.us-west-2.prod.public.atl-paas.net/5dfa6aa75697460cb3d97763/5f2aaf98-63fd-4e3a-a29b-7e163f497fd8/24","16x16":"https://avatar-management--avatars.us-west-2.prod.public.atl-paas.net/5dfa6aa75697460cb3d97763/5f2aaf98-63fd-4e3a-a29b-7e163f497fd8/16","32x32":"https://avatar-management--avatars.us-west-2.prod.public.atl-paas.net/5dfa6aa75697460cb3d97763/5f2aaf98-63fd-4e3a-a29b-7e163f497fd8/32"},"displayName":"Patrick Maguschak","active":true,"timeZone":"America/New_York","accountType":"atlassian"},"customfield_13830":null,"customfield_10200":null,"customfield_12743":null,"customfield_13831":null,"customfield_10202":null,"customfield_12500":null,"customfield_13702":null,"customfield_11403":{"self":"https://arthrex.atlassian.net/rest/api/2/customFieldOption/10806","value":"Hotline","id":"10806"},"customfield_12975":null,"customfield_11402":null,"customfield_11523":null,"customfield_13701":null,"customfield_13704":null,"customfield_13825":null,"customfield_11526":null,"customfield_13824":null,"customfield_13703":null,"customfield_11404":null,"customfield_12738":null,"customfield_13827":null,"customfield_13705":null,"customfield_13826":null,"customfield_13829":null,"customfield_11529":null,"timespent":null,"aggregatetimespent":null,"customfield_12972":null,"customfield_13700":null,"customfield_12974":null,"customfield_11522":null,"customfield_11401":null,"customfield_11521":null,"customfield_11400":null,"customfield_13933":null,"customfield_12843":null,"customfield_11512":null,"customfield_13932":null,"customfield_11514":null,"customfield_11519":"3_*:*_1_*:*_584558726_*|*_10000_*:*_1_*:*_449607059_*|*_10001_*:*_1_*:*_0_*|*_10201_*:*_1_*:*_774407436","workratio":-1,"customfield_12840":null,"customfield_10300":null,"customfield_12842":null,"customfield_13931":null,"customfield_11511":null,"customfield_10301":null,"customfield_12841":null,"customfield_11510":null,"customfield_13930":null,"customfield_13801":null,"customfield_12833":null,"customfield_11502":null,"customfield_13800":null,"customfield_11501":{"hasEpicLinkFieldDependency":false,"showField":false,"nonEditableReason":{"reason":"PLUGIN_LICENSE_ERROR","message":"The Parent Link is only available to Jira Premium users."}},"customfield_12832":null,"customfield_11504":null,"customfield_12835":null,"customfield_13803":null,"customfield_12955":null,"customfield_13802":null,"customfield_12834":null,"customfield_13926":null,"customfield_11506":null,"customfield_13805":null,"customfield_12958":null,"customfield_12837":null,"customfield_12836":null,"customfield_13925":null,"customfield_11505":null,"customfield_13804":null,"customfield_12839":null,"customfield_12838":null,"customfield_13808":null,"customfield_12831":null,"customfield_11500":null,"customfield_12830":null,"customfield_12822":null,"customfield_12942":null,"customfield_12824":null,"customfield_12823":null,"flagged":false,"customfield_12825":null,"customfield_12828":null,"customfield_12827":null,"customfield_10400":null,"customfield_12932":null,"customfield_12811":null,"customfield_12934":null,"customfield_12933":null,"customfield_12936":null,"customfield_13904":null,"customfield_12935":null,"customfield_13903":null,"customfield_13906":null,"customfield_12938":null,"customfield_13905":null,"customfield_12937":null,"customfield_13908":null,"customfield_12939":null,"customfield_13909":null,"customfield_12490":null,"customfield_12493":null,"customfield_12372":null,"customfield_12492":null,"customfield_12495":null,"customfield_12374":null,"customfield_13463":null,"customfield_12494":null,"customfield_13465":null,"customfield_12376":null,"customfield_13343":null,"customfield_13464":null,"customfield_12496":"{panel:bgColor=#FFC400}\r\nThese fields are used to populate request forms in the customer portal. Do not manually change these fields.\r\n{panel}","customfield_12499":null,"customfield_13225":null,"customfield_13467":null,"customfield_13466":null,"customfield_13469":null,"customfield_13468":null,"customfield_12480":null,"customfield_13690":null,"customfield_13692":null,"customfield_12482":null,"customfield_13691":null,"customfield_12481":null,"customfield_12484":null,"customfield_12000":null,"customfield_13694":null,"customfield_12362":null,"customfield_13693":null,"customfield_12483":null,"customfield_13212":null,"customfield_12002":null,"customfield_13696":null,"customfield_13211":null,"customfield_12001":null,"customfield_13695":null,"customfield_13335":null,"customfield_12488":null,"customfield_12004":null,"customfield_13698":null,"customfield_13213":null,"customfield_12003":null,"customfield_13697":null,"customfield_12005":null,"customfield_12489":null,"labels":[],"customfield_13336":null,"customfield_13699":null,"customfield_13449":null,"customfield_13207":null,"components":[],"customfield_12471":null,"customfield_13681":null,"customfield_12470":null,"customfield_13680":null,"customfield_12473":null,"customfield_13683":null,"customfield_12110":null,"customfield_12472":null,"customfield_13682":null,"customfield_13322":null,"customfield_12475":null,"customfield_13685":null,"customfield_12112":null,"customfield_12474":null,"customfield_12111":null,"customfield_13684":null,"customfield_13687":null,"customfield_12114":{"self":"https://arthrex.atlassian.net/rest/api/2/customFieldOption/11922","value":"No","id":"11922"},"customfield_12477":null,"customfield_13686":null,"customfield_12476":null,"customfield_12479":null,"customfield_13689":null,"customfield_12358":null,"customfield_12357":null,"customfield_13325":null,"customfield_13688":null,"customfield_12478":null,"customfield_12348":"{panel:title=Alert|titleBGColor=#FFC400|bgColor=#FFFAE6}\r\nPlease make sure that the correct issue type is selected. To select a different issue type, move the issue.\r\n{panel}","customfield_12469":null,"customfield_12106":null,"customfield_13679":null,"customfield_12109":null,"customfield_12108":null,"customfield_13672":null,"customfield_12341":null,"customfield_12340":null,"customfield_13795":null,"customfield_12464":null,"customfield_12343":"{panel:title=Info|titleBGColor=#C0B6F2|bgColor=#EAE6FF}\r\nUse this transition to escalate this issue to another team.\r\n\r\nPlease note that if you select *MRM-DAM Technical*, Jira will automatically create a ticket in Footprints. If you do not wish to create a new Footprints ticket, please select *Disable emails to Footprints* below.\r\n\r\nIf you do not want to be reminded to follow-up on this issue, please select *Disable escalation follow-up* below.\r\n{panel}","reporter":{"self":"https://arthrex.atlassian.net/rest/api/2/user?accountId=5dfa6aa75697460cb3d97763","accountId":"5dfa6aa75697460cb3d97763","emailAddress":"patrick.maguschak2@arthrex.com","avatarUrls":{"48x48":"https://avatar-management--avatars.us-west-2.prod.public.atl-paas.net/5dfa6aa75697460cb3d97763/5f2aaf98-63fd-4e3a-a29b-7e163f497fd8/48","24x24":"https://avatar-management--avatars.us-west-2.prod.public.atl-paas.net/5dfa6aa75697460cb3d97763/5f2aaf98-63fd-4e3a-a29b-7e163f497fd8/24","16x16":"https://avatar-management--avatars.us-west-2.prod.public.atl-paas.net/5dfa6aa75697460cb3d97763/5f2aaf98-63fd-4e3a-a29b-7e163f497fd8/16","32x32":"https://avatar-management--avatars.us-west-2.prod.public.atl-paas.net/5dfa6aa75697460cb3d97763/5f2aaf98-63fd-4e3a-a29b-7e163f497fd8/32"},"displayName":"Patrick Maguschak","active":true,"timeZone":"America/New_York","accountType":"atlassian"},"customfield_12101":null,"customfield_13674":null,"customfield_12342":null,"customfield_13673":null,"customfield_12463":null,"customfield_12466":null,"customfield_13797":null,"customfield_13676":null,"customfield_12103":null,"customfield_12345":null,"customfield_12344":"{panel:title=Info|titleBGColor=#C0B6F2|bgColor=#EAE6FF}\r\nUse this transition to respond to the reporter and request participants.\r\n\r\nIf you do not want to be reminded to follow-up on this issue, select *Disable customer follow-up* below.\r\n{panel}","customfield_13675":null,"customfield_13796":null,"customfield_13799":null,"customfield_12347":"{panel:bgColor=#FFC400}\r\n*Note*\r\nThese fields are used to populate request forms in the customer portal. Do not manually change these fields.\r\n{panel}","customfield_13678":null,"customfield_12468":null,"customfield_13677":null,"customfield_13798":null,"customfield_12467":null,"customfield_12104":null,"customfield_12346":null,"progress":{"progress":0,"total":0},"customfield_12570":null,"customfield_13780":null,"customfield_12330":null,"customfield_13782":null,"project":{"self":"https://arthrex.atlassian.net/rest/api/2/project/12262","id":"12262","key":"MOB","name":"A Team","projectTypeKey":"software","simplified":false,"avatarUrls":{"48x48":"https://arthrex.atlassian.net/rest/api/2/universal_avatar/view/type/project/avatar/13447","24x24":"https://arthrex.atlassian.net/rest/api/2/universal_avatar/view/type/project/avatar/13447?size=small","16x16":"https://arthrex.atlassian.net/rest/api/2/universal_avatar/view/type/project/avatar/13447?size=xsmall","32x32":"https://arthrex.atlassian.net/rest/api/2/universal_avatar/view/type/project/avatar/13447?size=medium"},"projectCategory":{"self":"https://arthrex.atlassian.net/rest/api/2/projectCategory/10103","id":"10103","description":"","name":"Digital Media - Mobile"}},"customfield_12571":null,"customfield_12332":null,"customfield_13783":null,"customfield_12331":null,"customfield_12333":null,"customfield_12336":null,"customfield_12335":null,"customfield_12327":null,"customfield_12569":null,"customfield_13779":null,"customfield_12568":null,"customfield_12329":null,"customfield_12328":null,"resolutiondate":"2022-07-21T07:57:47.035-0400","watches":{"self":"https://arthrex.atlassian.net/rest/api/2/issue/MOB-1067/watchers","watchCount":1,"isWatching":false},"customfield_13890":null,"customfield_12561":null,"customfield_13771":null,"customfield_13892":null,"customfield_13891":null,"customfield_13770":null,"customfield_12321":null,"customfield_13652":null,"customfield_12563":null,"customfield_12200":null,"customfield_12320":null,"customfield_13772":null,"customfield_12562":null,"customfield_12323":null,"customfield_12202":null,"customfield_12564":null,"customfield_12322":null,"customfield_12201":null,"customfield_12567":null,"customfield_13656":null,"customfield_12566":null,"customfield_12203":null,"customfield_13655":null,"customfield_12324":null,"customfield_12558":null,"customfield_13407":null,"customfield_13769":null,"customfield_12319":null,"updated":"2022-07-21T07:57:47.065-0400","customfield_12790":null,"timeoriginalestimate":null,"customfield_13760":null,"customfield_12550":null,"customfield_12792":null,"customfield_12791":null,"description":null,"customfield_12552":null,"customfield_13762":null,"customfield_12794":null,"customfield_11100":" ","customfield_13761":null,"customfield_13640":null,"customfield_12551":null,"customfield_11101":null,"customfield_12554":null,"customfield_13764":null,"customfield_12553":null,"customfield_11102":{"self":"https://arthrex.atlassian.net/rest/api/2/customFieldOption/10500","value":"1-None","id":"10500"},"customfield_12795":null,"customfield_13763":null,"customfield_13645":null,"customfield_13765":null,"customfield_11104":null,"customfield_12555":null,"customfield_10005":[{"id":1952,"name":"A Team: 6/20/22 - 6/24/22","state":"closed","boardId":286,"goal":"","startDate":"2022-06-20T13:46:12.904Z","endDate":"2022-06-24T12:12:00.000Z","completeDate":"2022-06-24T20:31:59.550Z"},{"id":1904,"name":"A Team: 5/9/22 - 5/13/22","state":"closed","boardId":286,"goal":"","startDate":"2022-05-09T13:36:27.141Z","endDate":"2022-05-13T21:43:00.000Z","completeDate":"2022-05-13T20:16:27.067Z"},{"id":2001,"name":"A Team: 7/11/22 - 7/15/22","state":"closed","boardId":286,"goal":"Prep for Submission of v1.0.0 Rep App iOS Release","startDate":"2022-07-11T13:56:18.821Z","endDate":"2022-07-16T02:15:00.000Z","completeDate":"2022-07-15T21:39:31.202Z"},{"id":1955,"name":"A Team: 6/27/22 - 7/1/22","state":"closed","boardId":286,"goal":"","startDate":"2022-06-27T13:39:51.053Z","endDate":"2022-07-01T16:03:00.000Z","completeDate":"2022-07-01T20:26:58.126Z"},{"id":1940,"name":"A Team: 6/13/22 - 6/17/22","state":"closed","boardId":286,"goal":"","startDate":"2022-06-13T13:23:11.454Z","endDate":"2022-06-17T13:12:00.000Z","completeDate":"2022-06-17T21:12:57.348Z"},{"id":1861,"name":"A Team: 4/18/22 - 4/22/22","state":"closed","boardId":286,"goal":"","startDate":"2022-04-18T13:19:51.131Z","endDate":"2022-04-22T21:22:00.000Z","completeDate":"2022-04-23T00:50:05.964Z"},{"id":1862,"name":"A Team: 4/25/22 - 4/29/22","state":"closed","boardId":286,"goal":"","startDate":"2022-04-25T13:38:51.319Z","endDate":"2022-04-29T21:00:00.000Z","completeDate":"2022-04-29T20:44:00.021Z"},{"id":1929,"name":"A Team: 5/31/22 - 6/10/22","state":"closed","boardId":286,"goal":"","startDate":"2022-05-31T13:20:11.464Z","endDate":"2022-06-10T14:13:00.000Z","completeDate":"2022-06-10T21:09:52.636Z"},{"id":1881,"name":"A Team: 5/2/22 - 5/6/22","state":"closed","boardId":286,"goal":"","startDate":"2022-05-02T13:24:03.040Z","endDate":"2022-05-06T21:59:00.000Z","completeDate":"2022-05-06T20:33:28.823Z"},{"id":1915,"name":"A Team: 5/16/22 - 5/20/22","state":"closed","boardId":286,"goal":"","startDate":"2022-05-16T13:45:22.501Z","endDate":"2022-05-20T21:11:00.000Z","completeDate":"2022-05-20T20:48:44.357Z"},{"id":1916,"name":"A Team: 5/23/22 - 5/27/22","state":"closed","boardId":286,"goal":"","startDate":"2022-05-23T13:46:32.935Z","endDate":"2022-05-27T18:12:00.000Z","completeDate":"2022-05-27T21:18:43.799Z"},{"id":1965,"name":"A Team: 7/5/22 - 7/8/22","state":"closed","boardId":286,"goal":"","startDate":"2022-07-05T13:38:21.073Z","endDate":"2022-07-08T17:26:00.000Z","completeDate":"2022-07-08T21:28:08.661Z"},{"id":1661,"name":"A Team: 7/18/22 - 7/22/22","state":"active","boardId":286,"goal":"AMOBS v1.0.0 and RAI v1.0.0 Releases","startDate":"2022-07-18T13:46:00.383Z","endDate":"2022-07-23T02:21:00.000Z"}],"customfield_12426":null,"customfield_12789":null,"customfield_13636":null,"customfield_12547":null,"customfield_13757":null,"customfield_12305":null,"customfield_10006":null,"customfield_12304":null,"customfield_12425":null,"customfield_13756":null,"customfield_12788":null,"customfield_12546":null,"customfield_12428":null,"customfield_13998":null,"customfield_12307":null,"customfield_13759":null,"customfield_12549":null,"customfield_13758":null,"customfield_12427":null,"customfield_12306":null,"customfield_12548":null,"customfield_12309":null,"customfield_12429":null,"customfield_12308":null,"summary":"Craft Early Access Email for Gotham ","customfield_12781":null,"customfield_11450":{"self":"https://arthrex.atlassian.net/rest/api/2/customFieldOption/10989","value":"Always","id":"10989"},"customfield_12780":null,"customfield_13993":null,"customfield_12420":null,"customfield_12541":null,"customfield_12783":null,"customfield_13751":null,"customfield_12540":null,"customfield_10000":null,"customfield_13750":null,"customfield_13991":null,"customfield_12782":null,"customfield_13996":null,"customfield_13753":null,"customfield_12785":null,"customfield_12422":null,"customfield_10001":null,"customfield_13752":null,"customfield_12300":"{}","customfield_13997":null,"customfield_12784":null,"customfield_12303":null,"customfield_13755":null,"customfield_13994":null,"customfield_12545":null,"customfield_12787":null,"customfield_12423":null,"customfield_13754":null,"customfield_12786":null,"customfield_12544":null,"customfield_13995":null,"customfield_13989":null,"customfield_11447":null,"customfield_12778":null,"customfield_13746":null,"customfield_12415":null,"customfield_13745":null,"customfield_12414":null,"customfield_12777":null,"customfield_13987":null,"customfield_13748":null,"customfield_12417":null,"customfield_11449":{"self":"https://arthrex.atlassian.net/rest/api/2/customFieldOption/10986","value":"Live Site","id":"10986"},"customfield_12779":null,"customfield_12416":null,"customfield_13505":[],"customfield_11448":null,"customfield_12419":null,"customfield_13749":null,"customfield_12418":null,"comment":{"comments":[],"self":"https://arthrex.atlassian.net/rest/api/2/issue/299482/comment","maxResults":0,"total":0,"startAt":0},"statuscategorychangedate":"2022-07-21T07:57:47.065-0400","customfield_13063":"Testing message","customfield_14033":null,"customfield_13062":null,"customfield_13067":null,"customfield_13066":null,"fixVersions":[],"customfield_10900":null,"customfield_13052":null,"customfield_13294":null,"customfield_13053":null,"epic":null,"customfield_13057":null,"priority":{"self":"https://arthrex.atlassian.net/rest/api/2/priority/4","iconUrl":"https://s3.amazonaws.com/arthrex-public/jira/priorities/minor.png","name":"Minor","id":"4"},"customfield_14028":null,"versions":[],"customfield_14014":null,"customfield_13045":null,"customfield_14015":null,"customfield_13047":null,"customfield_14013":null,"customfield_13046":null,"customfield_14016":null,"customfield_14017":null,"customfield_13391":null,"customfield_13272":null,"customfield_13392":null,"customfield_13274":null,"customfield_13273":null,"aggregateprogress":{"progress":0,"total":0},"customfield_13279":null,"customfield_13380":null,"issuerestriction":{"issuerestrictions":{},"shouldDisplay":false},"customfield_13371":null,"created":"2022-06-30T09:34:53.865-0400","customfield_13494":null,"customfield_13373":null,"customfield_13375":null,"customfield_13012":null,"customfield_13011":null,"customfield_13377":null,"customfield_13376":null,"customfield_13016":null,"customfield_13379":null,"customfield_13378":null,"customfield_13017":null,"customfield_13360":null,"customfield_13362":null,"customfield_13361":null,"customfield_13364":null,"customfield_13001":null,"customfield_13122":null,"customfield_13000":null,"customfield_13363":null,"customfield_13366":"150 GB","customfield_13002":null,"customfield_13365":null,"customfield_13368":null,"customfield_13367":null,"customfield_13369":null,"security":null,"attachment":[{"self":"https://arthrex.atlassian.net/rest/api/2/attachment/227111","id":"227111","filename":"Beta-Program-Email.docx","author":{"self":"https://arthrex.atlassian.net/rest/api/2/user?accountId=5dfa6aa75697460cb3d97763","accountId":"5dfa6aa75697460cb3d97763","emailAddress":"patrick.maguschak2@arthrex.com","avatarUrls":{"48x48":"https://avatar-management--avatars.us-west-2.prod.public.atl-paas.net/5dfa6aa75697460cb3d97763/5f2aaf98-63fd-4e3a-a29b-7e163f497fd8/48","24x24":"https://avatar-management--avatars.us-west-2.prod.public.atl-paas.net/5dfa6aa75697460cb3d97763/5f2aaf98-63fd-4e3a-a29b-7e163f497fd8/24","16x16":"https://avatar-management--avatars.us-west-2.prod.public.atl-paas.net/5dfa6aa75697460cb3d97763/5f2aaf98-63fd-4e3a-a29b-7e163f497fd8/16","32x32":"https://avatar-management--avatars.us-west-2.prod.public.atl-paas.net/5dfa6aa75697460cb3d97763/5f2aaf98-63fd-4e3a-a29b-7e163f497fd8/32"},"displayName":"Patrick Maguschak","active":true,"timeZone":"America/New_York","accountType":"atlassian"},"created":"2022-06-30T09:35:38.507-0400","size":15845,"mimeType":"application/vnd.openxmlformats-officedocument.wordprocessingml.document","content":"https://arthrex.atlassian.net/rest/api/2/attachment/content/227111"}],"customfield_13470":null,"customfield_13471":null,"customfield_12385":null,"customfield_13355":null,"customfield_12386":null,"customfield_13599":null,"customfield_13357":null,"customfield_13356":null,"customfield_12388":null,"customfield_13359":null,"customfield_13358":null}},{"expand":"operations,versionedRepresentations,editmeta,changelog,renderedFields","id":"296824","self":"https://arthrex.atlassian.net/rest/agile/1.0/issue/296824","key":"MOB-1052","fields":{"parent":{"id":"279628","key":"MOB-929","self":"https://arthrex.atlassian.net/rest/api/2/issue/279628","fields":{"summary":"UX/UI","status":{"self":"https://arthrex.atlassian.net/rest/api/2/status/3","description":"This issue is being actively worked on at the moment by the assignee.","iconUrl":"https://arthrex.atlassian.net/images/icons/statuses/inprogress.png","name":"Working","id":"3","statusCategory":{"self":"https://arthrex.atlassian.net/rest/api/2/statuscategory/4","id":4,"key":"indeterminate","colorName":"yellow","name":"In Progress"}},"priority":{"self":"https://arthrex.atlassian.net/rest/api/2/priority/4","iconUrl":"https://s3.amazonaws.com/arthrex-public/jira/priorities/minor.png","name":"Minor","id":"4"},"issuetype":{"self":"https://arthrex.atlassian.net/rest/api/2/issuetype/3","id":"3","description":"A task that needs to be done.","iconUrl":"https://arthrex.atlassian.net/rest/api/2/universal_avatar/view/type/issuetype/avatar/10318?size=medium","name":"Task","subtask":false,"avatarId":10318,"hierarchyLevel":0}}},"resolution":null,"customfield_12930":null,"customfield_12923":null,"customfield_12924":null,"customfield_12929":null,"lastViewed":null,"customfield_11700":null,"customfield_11702":null,"customfield_12912":null,"customfield_11701":null,"customfield_12914":null,"aggregatetimeoriginalestimate":null,"customfield_12916":null,"customfield_12915":null,"customfield_12918":null,"customfield_12917":null,"issuelinks":[],"customfield_12919":null,"assignee":{"self":"https://arthrex.atlassian.net/rest/api/2/user?accountId=5dfa6aa75697460cb3d97763","accountId":"5dfa6aa75697460cb3d97763","emailAddress":"patrick.maguschak2@arthrex.com","avatarUrls":{"48x48":"https://avatar-management--avatars.us-west-2.prod.public.atl-paas.net/5dfa6aa75697460cb3d97763/5f2aaf98-63fd-4e3a-a29b-7e163f497fd8/48","24x24":"https://avatar-management--avatars.us-west-2.prod.public.atl-paas.net/5dfa6aa75697460cb3d97763/5f2aaf98-63fd-4e3a-a29b-7e163f497fd8/24","16x16":"https://avatar-management--avatars.us-west-2.prod.public.atl-paas.net/5dfa6aa75697460cb3d97763/5f2aaf98-63fd-4e3a-a29b-7e163f497fd8/16","32x32":"https://avatar-management--avatars.us-west-2.prod.public.atl-paas.net/5dfa6aa75697460cb3d97763/5f2aaf98-63fd-4e3a-a29b-7e163f497fd8/32"},"displayName":"Patrick Maguschak","active":true,"timeZone":"America/New_York","accountType":"atlassian"},"customfield_11810":null,"customfield_11812":null,"customfield_12901":null,"customfield_11811":null,"customfield_11814":null,"customfield_12903":null,"customfield_11813":null,"customfield_12902":null,"customfield_11816":null,"customfield_12905":null,"customfield_11815":null,"customfield_12904":null,"customfield_11818":null,"customfield_12906":null,"customfield_11817":null,"subtasks":[],"customfield_11801":null,"customfield_11800":null,"customfield_11802":null,"customfield_11805":null,"customfield_11804":null,"customfield_11807":null,"closedSprints":[{"id":2001,"self":"https://arthrex.atlassian.net/rest/agile/1.0/sprint/2001","state":"closed","name":"A Team: 7/11/22 - 7/15/22","startDate":"2022-07-11T13:56:18.821Z","endDate":"2022-07-16T02:15:00.000Z","completeDate":"2022-07-15T21:39:31.202Z","originBoardId":286,"goal":"Prep for Submission of v1.0.0 Rep App iOS Release"},{"id":1955,"self":"https://arthrex.atlassian.net/rest/agile/1.0/sprint/1955","state":"closed","name":"A Team: 6/27/22 - 7/1/22","startDate":"2022-06-27T13:39:51.053Z","endDate":"2022-07-01T16:03:00.000Z","completeDate":"2022-07-01T20:26:58.126Z","originBoardId":286,"goal":""},{"id":1940,"self":"https://arthrex.atlassian.net/rest/agile/1.0/sprint/1940","state":"closed","name":"A Team: 6/13/22 - 6/17/22","startDate":"2022-06-13T13:23:11.454Z","endDate":"2022-06-17T13:12:00.000Z","completeDate":"2022-06-17T21:12:57.348Z","originBoardId":286,"goal":""},{"id":1861,"self":"https://arthrex.atlassian.net/rest/agile/1.0/sprint/1861","state":"closed","name":"A Team: 4/18/22 - 4/22/22","startDate":"2022-04-18T13:19:51.131Z","endDate":"2022-04-22T21:22:00.000Z","completeDate":"2022-04-23T00:50:05.964Z","originBoardId":286,"goal":""},{"id":1862,"self":"https://arthrex.atlassian.net/rest/agile/1.0/sprint/1862","state":"closed","name":"A Team: 4/25/22 - 4/29/22","startDate":"2022-04-25T13:38:51.319Z","endDate":"2022-04-29T21:00:00.000Z","completeDate":"2022-04-29T20:44:00.021Z","originBoardId":286,"goal":""},{"id":1929,"self":"https://arthrex.atlassian.net/rest/agile/1.0/sprint/1929","state":"closed","name":"A Team: 5/31/22 - 6/10/22","startDate":"2022-05-31T13:20:11.464Z","endDate":"2022-06-10T14:13:00.000Z","completeDate":"2022-06-10T21:09:52.636Z","originBoardId":286,"goal":""},{"id":1881,"self":"https://arthrex.atlassian.net/rest/agile/1.0/sprint/1881","state":"closed","name":"A Team: 5/2/22 - 5/6/22","startDate":"2022-05-02T13:24:03.040Z","endDate":"2022-05-06T21:59:00.000Z","completeDate":"2022-05-06T20:33:28.823Z","originBoardId":286,"goal":""},{"id":1915,"self":"https://arthrex.atlassian.net/rest/agile/1.0/sprint/1915","state":"closed","name":"A Team: 5/16/22 - 5/20/22","startDate":"2022-05-16T13:45:22.501Z","endDate":"2022-05-20T21:11:00.000Z","completeDate":"2022-05-20T20:48:44.357Z","originBoardId":286,"goal":""},{"id":1916,"self":"https://arthrex.atlassian.net/rest/agile/1.0/sprint/1916","state":"closed","name":"A Team: 5/23/22 - 5/27/22","startDate":"2022-05-23T13:46:32.935Z","endDate":"2022-05-27T18:12:00.000Z","completeDate":"2022-05-27T21:18:43.799Z","originBoardId":286,"goal":""},{"id":1965,"self":"https://arthrex.atlassian.net/rest/agile/1.0/sprint/1965","state":"closed","name":"A Team: 7/5/22 - 7/8/22","startDate":"2022-07-05T13:38:21.073Z","endDate":"2022-07-08T17:26:00.000Z","completeDate":"2022-07-08T21:28:08.661Z","originBoardId":286,"goal":""},{"id":1952,"self":"https://arthrex.atlassian.net/rest/agile/1.0/sprint/1952","state":"closed","name":"A Team: 6/20/22 - 6/24/22","startDate":"2022-06-20T13:46:12.904Z","endDate":"2022-06-24T12:12:00.000Z","completeDate":"2022-06-24T20:31:59.550Z","originBoardId":286,"goal":""},{"id":1904,"self":"https://arthrex.atlassian.net/rest/agile/1.0/sprint/1904","state":"closed","name":"A Team: 5/9/22 - 5/13/22","startDate":"2022-05-09T13:36:27.141Z","endDate":"2022-05-13T21:43:00.000Z","completeDate":"2022-05-13T20:16:27.067Z","originBoardId":286,"goal":""}],"customfield_11806":null,"customfield_11809":null,"votes":{"self":"https://arthrex.atlassian.net/rest/api/2/issue/MOB-1052/votes","votes":0,"hasVoted":false},"customfield_11808":null,"worklog":{"startAt":0,"maxResults":20,"total":0,"worklogs":[]},"issuetype":{"self":"https://arthrex.atlassian.net/rest/api/2/issuetype/5","id":"5","description":"The sub-task of the issue","iconUrl":"https://arthrex.atlassian.net/rest/api/2/universal_avatar/view/type/issuetype/avatar/10316?size=medium","name":"Sub-task","subtask":true,"avatarId":10316,"hierarchyLevel":-1},"sprint":{"id":1661,"self":"https://arthrex.atlassian.net/rest/agile/1.0/sprint/1661","state":"active","name":"A Team: 7/18/22 - 7/22/22","startDate":"2022-07-18T13:46:00.383Z","endDate":"2022-07-23T02:21:00.000Z","originBoardId":286,"goal":"AMOBS v1.0.0 and RAI v1.0.0 Releases"},"customfield_10700":null,"customfield_10701":[],"customfield_10702":null,"customfield_11901":{"self":"https://arthrex.atlassian.net/rest/api/2/customFieldOption/11506","value":"No","id":"11506"},"customfield_14050":null,"timetracking":{},"customfield_10803":null,"customfield_10806":null,"customfield_14047":null,"customfield_14048":null,"customfield_14046":null,"customfield_14049":null,"environment":null,"duedate":null,"customfield_13980":null,"customfield_12772":null,"customfield_13861":null,"customfield_11441":null,"customfield_13982":null,"customfield_13740":null,"customfield_11440":null,"customfield_12774":null,"customfield_11443":null,"customfield_11200":null,"customfield_13742":null,"customfield_12411":null,"customfield_11442":null,"customfield_12773":null,"customfield_11201":null,"customfield_13741":null,"customfield_13986":null,"customfield_12776":null,"customfield_12413":null,"customfield_11202":null,"customfield_13623":null,"customfield_13744":null,"customfield_12775":null,"customfield_12412":null,"customfield_12533":null,"customfield_13743":null,"customfield_13985":null,"customfield_11444":null,"customfield_13614":null,"customfield_11435":null,"customfield_12645":null,"customfield_13613":null,"customfield_13737":null,"customfield_13616":null,"customfield_11438":null,"customfield_13979":null,"customfield_11437":null,"customfield_13615":null,"customfield_13739":null,"customfield_11439":null,"customfield_13617":null,"customfield_13738":null,"customfield_12409":null,"customfield_12761":null,"customfield_11430":null,"customfield_12760":null,"customfield_13610":null,"customfield_10100":"2|i02f9m:k","customfield_11431":null,"customfield_12762":null,"customfield_13975":null,"customfield_13612":null,"customfield_11434":null,"customfield_13611":null,"customfield_12756":null,"customfield_12998":null,"customfield_11303":null,"customfield_13603":null,"customfield_11425":null,"customfield_12514":null,"customfield_11304":null,"customfield_12513":null,"customfield_12755":null,"customfield_13602":null,"customfield_12997":null,"customfield_13605":null,"customfield_12758":null,"customfield_11427":null,"customfield_13726":null,"customfield_12999":null,"customfield_13604":null,"customfield_12757":null,"timeestimate":null,"customfield_13969":null,"customfield_13727":null,"customfield_11428":null,"customfield_13606":null,"customfield_12759":null,"customfield_13729":null,"customfield_13608":null,"status":{"self":"https://arthrex.atlassian.net/rest/api/2/status/10201","description":"This status is managed internally by JIRA Software","iconUrl":"https://arthrex.atlassian.net/images/icons/subtask.gif","name":"In Review","id":"10201","statusCategory":{"self":"https://arthrex.atlassian.net/rest/api/2/statuscategory/4","id":4,"key":"indeterminate","colorName":"yellow","name":"In Progress"}},"customfield_12750":null,"customfield_12752":null,"customfield_12510":null,"customfield_11300":{"self":"https://arthrex.atlassian.net/rest/api/2/customFieldOption/10700","value":"User Stories:1","id":"10700"},"customfield_11420":null,"customfield_12751":null,"customfield_12754":null,"customfield_13601":null,"customfield_12996":null,"customfield_11301":null,"customfield_13600":null,"customfield_12753":null,"customfield_12511":null,"customfield_11422":null,"customfield_12745":null,"customfield_11414":null,"customfield_12503":null,"customfield_12502":null,"customfield_12744":null,"customfield_13836":null,"customfield_13715":null,"customfield_12747":null,"customfield_12505":null,"customfield_13835":null,"customfield_11415":null,"customfield_13956":null,"customfield_12746":null,"customfield_12504":null,"customfield_12507":null,"customfield_12749":null,"aggregatetimeestimate":null,"customfield_11418":null,"customfield_12748":null,"customfield_13716":null,"customfield_13837":null,"customfield_11419":null,"customfield_12508":null,"creator":{"self":"https://arthrex.atlassian.net/rest/api/2/user?accountId=5dfa6aa75697460cb3d97763","accountId":"5dfa6aa75697460cb3d97763","emailAddress":"patrick.maguschak2@arthrex.com","avatarUrls":{"48x48":"https://avatar-management--avatars.us-west-2.prod.public.atl-paas.net/5dfa6aa75697460cb3d97763/5f2aaf98-63fd-4e3a-a29b-7e163f497fd8/48","24x24":"https://avatar-management--avatars.us-west-2.prod.public.atl-paas.net/5dfa6aa75697460cb3d97763/5f2aaf98-63fd-4e3a-a29b-7e163f497fd8/24","16x16":"https://avatar-management--avatars.us-west-2.prod.public.atl-paas.net/5dfa6aa75697460cb3d97763/5f2aaf98-63fd-4e3a-a29b-7e163f497fd8/16","32x32":"https://avatar-management--avatars.us-west-2.prod.public.atl-paas.net/5dfa6aa75697460cb3d97763/5f2aaf98-63fd-4e3a-a29b-7e163f497fd8/32"},"displayName":"Patrick Maguschak","active":true,"timeZone":"America/New_York","accountType":"atlassian"},"customfield_13830":null,"customfield_10200":null,"customfield_12743":null,"customfield_13831":null,"customfield_10202":null,"customfield_12500":null,"customfield_13702":null,"customfield_11403":{"self":"https://arthrex.atlassian.net/rest/api/2/customFieldOption/10806","value":"Hotline","id":"10806"},"customfield_11523":null,"customfield_13701":null,"customfield_12975":null,"customfield_11402":null,"customfield_13704":null,"customfield_13825":null,"customfield_11526":null,"customfield_13824":null,"customfield_11404":null,"customfield_13703":null,"customfield_12738":null,"customfield_13827":null,"customfield_13826":null,"customfield_13705":null,"customfield_13829":null,"customfield_11529":null,"timespent":null,"aggregatetimespent":null,"customfield_12972":null,"customfield_11522":null,"customfield_11401":null,"customfield_12974":null,"customfield_13700":null,"customfield_11521":null,"customfield_11400":null,"customfield_13933":null,"customfield_12843":null,"customfield_13932":null,"customfield_11512":null,"customfield_11514":null,"customfield_11519":null,"workratio":-1,"customfield_12840":null,"customfield_10300":null,"customfield_13931":null,"customfield_12842":null,"customfield_11511":null,"customfield_12841":null,"customfield_10301":null,"customfield_11510":null,"customfield_13930":null,"customfield_13801":null,"customfield_12833":null,"customfield_11502":null,"customfield_12832":null,"customfield_13800":null,"customfield_11501":{"hasEpicLinkFieldDependency":false,"showField":false,"nonEditableReason":{"reason":"PLUGIN_LICENSE_ERROR","message":"The Parent Link is only available to Jira Premium users."}},"customfield_12835":null,"customfield_13803":null,"customfield_11504":null,"customfield_13802":null,"customfield_12955":null,"customfield_12834":null,"customfield_12958":null,"customfield_13926":null,"customfield_11506":null,"customfield_13805":null,"customfield_12837":null,"customfield_13925":null,"customfield_12836":null,"customfield_13804":null,"customfield_11505":null,"customfield_12839":null,"customfield_12838":null,"customfield_13808":null,"customfield_12831":null,"customfield_11500":null,"customfield_12830":null,"customfield_12822":null,"customfield_12942":null,"customfield_12824":null,"customfield_12823":null,"flagged":false,"customfield_12825":null,"customfield_12828":null,"customfield_12827":null,"customfield_10400":null,"customfield_12811":null,"customfield_12932":null,"customfield_12934":null,"customfield_12933":null,"customfield_13904":null,"customfield_12936":null,"customfield_12935":null,"customfield_13903":null,"customfield_12938":null,"customfield_13906":null,"customfield_12937":null,"customfield_13905":null,"customfield_13908":null,"customfield_12939":null,"customfield_13909":null,"customfield_12490":null,"customfield_12493":null,"customfield_12372":null,"customfield_12492":null,"customfield_13463":null,"customfield_12495":null,"customfield_12374":null,"customfield_12494":null,"customfield_12376":null,"customfield_13465":null,"customfield_13343":null,"customfield_12496":"{panel:bgColor=#FFC400}\r\nThese fields are used to populate request forms in the customer portal. Do not manually change these fields.\r\n{panel}","customfield_13464":null,"customfield_13225":null,"customfield_13467":null,"customfield_12499":null,"customfield_13466":null,"customfield_13469":null,"customfield_13468":null,"customfield_12480":null,"customfield_13690":null,"customfield_13692":null,"customfield_12482":null,"customfield_13691":null,"customfield_12481":null,"customfield_12000":null,"customfield_13694":null,"customfield_12484":null,"customfield_12362":null,"customfield_12483":null,"customfield_13693":null,"customfield_13212":null,"customfield_13696":null,"customfield_12002":null,"customfield_12001":null,"customfield_13695":null,"customfield_13211":null,"customfield_12488":null,"customfield_12004":null,"customfield_13335":null,"customfield_13698":null,"customfield_12003":null,"customfield_13213":null,"customfield_13697":null,"labels":[],"customfield_13699":null,"customfield_12489":null,"customfield_12005":null,"customfield_13336":null,"customfield_13207":null,"customfield_13449":null,"components":[],"customfield_12471":null,"customfield_13681":null,"customfield_12470":null,"customfield_13680":null,"customfield_12110":null,"customfield_12473":null,"customfield_13683":null,"customfield_13682":null,"customfield_12472":null,"customfield_12112":null,"customfield_13685":null,"customfield_13322":null,"customfield_12475":null,"customfield_12111":null,"customfield_12474":null,"customfield_13684":null,"customfield_12114":{"self":"https://arthrex.atlassian.net/rest/api/2/customFieldOption/11922","value":"No","id":"11922"},"customfield_13687":null,"customfield_12477":null,"customfield_12476":null,"customfield_13686":null,"customfield_12479":null,"customfield_12358":null,"customfield_13689":null,"customfield_12357":null,"customfield_12478":null,"customfield_13688":null,"customfield_13325":null,"customfield_12469":null,"customfield_13679":null,"customfield_12348":"{panel:title=Alert|titleBGColor=#FFC400|bgColor=#FFFAE6}\r\nPlease make sure that the correct issue type is selected. To select a different issue type, move the issue.\r\n{panel}","customfield_12106":null,"customfield_12109":null,"customfield_12108":null,"customfield_13672":null,"customfield_12341":null,"customfield_12340":null,"reporter":{"self":"https://arthrex.atlassian.net/rest/api/2/user?accountId=5dfa6aa75697460cb3d97763","accountId":"5dfa6aa75697460cb3d97763","emailAddress":"patrick.maguschak2@arthrex.com","avatarUrls":{"48x48":"https://avatar-management--avatars.us-west-2.prod.public.atl-paas.net/5dfa6aa75697460cb3d97763/5f2aaf98-63fd-4e3a-a29b-7e163f497fd8/48","24x24":"https://avatar-management--avatars.us-west-2.prod.public.atl-paas.net/5dfa6aa75697460cb3d97763/5f2aaf98-63fd-4e3a-a29b-7e163f497fd8/24","16x16":"https://avatar-management--avatars.us-west-2.prod.public.atl-paas.net/5dfa6aa75697460cb3d97763/5f2aaf98-63fd-4e3a-a29b-7e163f497fd8/16","32x32":"https://avatar-management--avatars.us-west-2.prod.public.atl-paas.net/5dfa6aa75697460cb3d97763/5f2aaf98-63fd-4e3a-a29b-7e163f497fd8/32"},"displayName":"Patrick Maguschak","active":true,"timeZone":"America/New_York","accountType":"atlassian"},"customfield_13674":null,"customfield_13795":null,"customfield_12464":null,"customfield_12101":null,"customfield_12343":"{panel:title=Info|titleBGColor=#C0B6F2|bgColor=#EAE6FF}\r\nUse this transition to escalate this issue to another team.\r\n\r\nPlease note that if you select *MRM-DAM Technical*, Jira will automatically create a ticket in Footprints. If you do not wish to create a new Footprints ticket, please select *Disable emails to Footprints* below.\r\n\r\nIf you do not want to be reminded to follow-up on this issue, please select *Disable escalation follow-up* below.\r\n{panel}","customfield_12463":null,"customfield_13673":null,"customfield_12342":null,"customfield_13797":null,"customfield_12103":null,"customfield_12466":null,"customfield_12345":null,"customfield_13676":null,"customfield_13675":null,"customfield_12344":"{panel:title=Info|titleBGColor=#C0B6F2|bgColor=#EAE6FF}\r\nUse this transition to respond to the reporter and request participants.\r\n\r\nIf you do not want to be reminded to follow-up on this issue, select *Disable customer follow-up* below.\r\n{panel}","customfield_13796":null,"customfield_13799":null,"customfield_12347":"{panel:bgColor=#FFC400}\r\n*Note*\r\nThese fields are used to populate request forms in the customer portal. Do not manually change these fields.\r\n{panel}","customfield_13678":null,"customfield_12468":null,"customfield_12346":null,"customfield_12467":null,"customfield_12104":null,"customfield_13798":null,"customfield_13677":null,"progress":{"progress":0,"total":0},"customfield_12570":null,"customfield_13780":null,"customfield_13782":null,"customfield_12330":null,"customfield_12571":null,"project":{"self":"https://arthrex.atlassian.net/rest/api/2/project/12262","id":"12262","key":"MOB","name":"A Team","projectTypeKey":"software","simplified":false,"avatarUrls":{"48x48":"https://arthrex.atlassian.net/rest/api/2/universal_avatar/view/type/project/avatar/13447","24x24":"https://arthrex.atlassian.net/rest/api/2/universal_avatar/view/type/project/avatar/13447?size=small","16x16":"https://arthrex.atlassian.net/rest/api/2/universal_avatar/view/type/project/avatar/13447?size=xsmall","32x32":"https://arthrex.atlassian.net/rest/api/2/universal_avatar/view/type/project/avatar/13447?size=medium"},"projectCategory":{"self":"https://arthrex.atlassian.net/rest/api/2/projectCategory/10103","id":"10103","description":"","name":"Digital Media - Mobile"}},"customfield_12332":null,"customfield_13783":null,"customfield_12331":null,"customfield_12333":null,"customfield_12336":null,"customfield_12335":null,"customfield_13779":null,"customfield_12327":null,"customfield_12569":null,"customfield_12568":null,"customfield_12329":null,"customfield_12328":null,"resolutiondate":null,"watches":{"self":"https://arthrex.atlassian.net/rest/api/2/issue/MOB-1052/watchers","watchCount":1,"isWatching":false},"customfield_13890":null,"customfield_13771":null,"customfield_12561":null,"customfield_13892":null,"customfield_13770":null,"customfield_13891":null,"customfield_12321":null,"customfield_13652":null,"customfield_12563":null,"customfield_12200":null,"customfield_13772":null,"customfield_12562":null,"customfield_12320":null,"customfield_12202":null,"customfield_12323":null,"customfield_12322":null,"customfield_12564":null,"customfield_12201":null,"customfield_13656":null,"customfield_12567":null,"customfield_12566":null,"customfield_12324":null,"customfield_13655":null,"customfield_12203":null,"customfield_12558":null,"customfield_13407":null,"customfield_13769":null,"customfield_12319":null,"updated":"2022-07-22T08:51:07.518-0400","customfield_12790":null,"timeoriginalestimate":null,"customfield_12792":null,"customfield_12550":null,"customfield_13760":null,"customfield_12791":null,"description":null,"customfield_12794":null,"customfield_12552":null,"customfield_13762":null,"customfield_12551":null,"customfield_11100":" ","customfield_13761":null,"customfield_13640":null,"customfield_12554":null,"customfield_11101":null,"customfield_13764":null,"customfield_12795":null,"customfield_11102":{"self":"https://arthrex.atlassian.net/rest/api/2/customFieldOption/10500","value":"1-None","id":"10500"},"customfield_13763":null,"customfield_12553":null,"customfield_13645":null,"customfield_13765":null,"customfield_12555":null,"customfield_11104":null,"customfield_12789":null,"customfield_12426":null,"customfield_12305":null,"customfield_12547":null,"customfield_10005":[{"id":1952,"name":"A Team: 6/20/22 - 6/24/22","state":"closed","boardId":286,"goal":"","startDate":"2022-06-20T13:46:12.904Z","endDate":"2022-06-24T12:12:00.000Z","completeDate":"2022-06-24T20:31:59.550Z"},{"id":1904,"name":"A Team: 5/9/22 - 5/13/22","state":"closed","boardId":286,"goal":"","startDate":"2022-05-09T13:36:27.141Z","endDate":"2022-05-13T21:43:00.000Z","completeDate":"2022-05-13T20:16:27.067Z"},{"id":2001,"name":"A Team: 7/11/22 - 7/15/22","state":"closed","boardId":286,"goal":"Prep for Submission of v1.0.0 Rep App iOS Release","startDate":"2022-07-11T13:56:18.821Z","endDate":"2022-07-16T02:15:00.000Z","completeDate":"2022-07-15T21:39:31.202Z"},{"id":1955,"name":"A Team: 6/27/22 - 7/1/22","state":"closed","boardId":286,"goal":"","startDate":"2022-06-27T13:39:51.053Z","endDate":"2022-07-01T16:03:00.000Z","completeDate":"2022-07-01T20:26:58.126Z"},{"id":1940,"name":"A Team: 6/13/22 - 6/17/22","state":"closed","boardId":286,"goal":"","startDate":"2022-06-13T13:23:11.454Z","endDate":"2022-06-17T13:12:00.000Z","completeDate":"2022-06-17T21:12:57.348Z"},{"id":1861,"name":"A Team: 4/18/22 - 4/22/22","state":"closed","boardId":286,"goal":"","startDate":"2022-04-18T13:19:51.131Z","endDate":"2022-04-22T21:22:00.000Z","completeDate":"2022-04-23T00:50:05.964Z"},{"id":1862,"name":"A Team: 4/25/22 - 4/29/22","state":"closed","boardId":286,"goal":"","startDate":"2022-04-25T13:38:51.319Z","endDate":"2022-04-29T21:00:00.000Z","completeDate":"2022-04-29T20:44:00.021Z"},{"id":1929,"name":"A Team: 5/31/22 - 6/10/22","state":"closed","boardId":286,"goal":"","startDate":"2022-05-31T13:20:11.464Z","endDate":"2022-06-10T14:13:00.000Z","completeDate":"2022-06-10T21:09:52.636Z"},{"id":1881,"name":"A Team: 5/2/22 - 5/6/22","state":"closed","boardId":286,"goal":"","startDate":"2022-05-02T13:24:03.040Z","endDate":"2022-05-06T21:59:00.000Z","completeDate":"2022-05-06T20:33:28.823Z"},{"id":1915,"name":"A Team: 5/16/22 - 5/20/22","state":"closed","boardId":286,"goal":"","startDate":"2022-05-16T13:45:22.501Z","endDate":"2022-05-20T21:11:00.000Z","completeDate":"2022-05-20T20:48:44.357Z"},{"id":1916,"name":"A Team: 5/23/22 - 5/27/22","state":"closed","boardId":286,"goal":"","startDate":"2022-05-23T13:46:32.935Z","endDate":"2022-05-27T18:12:00.000Z","completeDate":"2022-05-27T21:18:43.799Z"},{"id":1965,"name":"A Team: 7/5/22 - 7/8/22","state":"closed","boardId":286,"goal":"","startDate":"2022-07-05T13:38:21.073Z","endDate":"2022-07-08T17:26:00.000Z","completeDate":"2022-07-08T21:28:08.661Z"},{"id":1661,"name":"A Team: 7/18/22 - 7/22/22","state":"active","boardId":286,"goal":"AMOBS v1.0.0 and RAI v1.0.0 Releases","startDate":"2022-07-18T13:46:00.383Z","endDate":"2022-07-23T02:21:00.000Z"}],"customfield_13757":null,"customfield_13636":null,"customfield_12546":null,"customfield_12425":null,"customfield_10006":null,"customfield_13756":null,"customfield_12304":null,"customfield_12788":null,"customfield_12549":null,"customfield_13998":null,"customfield_13759":null,"customfield_12307":null,"customfield_12428":null,"customfield_12548":null,"customfield_13758":null,"customfield_12306":null,"customfield_12427":null,"customfield_12309":null,"customfield_12308":null,"customfield_12429":null,"summary":"Post Early Access Survey for Gotham Beta","customfield_12781":null,"customfield_11450":{"self":"https://arthrex.atlassian.net/rest/api/2/customFieldOption/10989","value":"Always","id":"10989"},"customfield_12780":null,"customfield_13993":null,"customfield_12420":null,"customfield_12541":null,"customfield_13751":null,"customfield_12783":null,"customfield_12540":null,"customfield_10000":null,"customfield_13750":null,"customfield_12782":null,"customfield_13991":null,"customfield_12785":null,"customfield_10001":null,"customfield_13996":null,"customfield_12422":null,"customfield_13753":null,"customfield_13752":null,"customfield_12784":null,"customfield_13997":null,"customfield_12300":"{}","customfield_13755":null,"customfield_12303":null,"customfield_13994":null,"customfield_12787":null,"customfield_12545":null,"customfield_12423":null,"customfield_13754":null,"customfield_12786":null,"customfield_12544":null,"customfield_13995":null,"customfield_13989":null,"customfield_12415":null,"customfield_11447":null,"customfield_12778":null,"customfield_13746":null,"customfield_12414":null,"customfield_13745":null,"customfield_12777":null,"customfield_12417":null,"customfield_11449":{"self":"https://arthrex.atlassian.net/rest/api/2/customFieldOption/10986","value":"Live Site","id":"10986"},"customfield_13987":null,"customfield_13748":null,"customfield_12779":null,"customfield_12416":null,"customfield_13505":[],"customfield_11448":null,"customfield_12419":null,"customfield_13749":null,"customfield_12418":null,"comment":{"comments":[],"self":"https://arthrex.atlassian.net/rest/api/2/issue/296824/comment","maxResults":0,"total":0,"startAt":0},"statuscategorychangedate":"2022-07-21T07:57:17.855-0400","customfield_13063":"Testing message","customfield_13062":null,"customfield_14033":null,"customfield_13067":null,"customfield_13066":null,"fixVersions":[],"customfield_10900":null,"customfield_13052":null,"customfield_13294":null,"customfield_13053":null,"epic":null,"customfield_13057":null,"priority":{"self":"https://arthrex.atlassian.net/rest/api/2/priority/4","iconUrl":"https://s3.amazonaws.com/arthrex-public/jira/priorities/minor.png","name":"Minor","id":"4"},"customfield_14028":null,"versions":[],"customfield_13045":null,"customfield_14014":null,"customfield_14015":null,"customfield_13047":null,"customfield_13046":null,"customfield_14013":null,"customfield_14016":null,"customfield_14017":null,"customfield_13391":null,"customfield_13272":null,"customfield_13392":null,"customfield_13274":null,"customfield_13273":null,"aggregateprogress":{"progress":0,"total":0},"customfield_13279":null,"customfield_13380":null,"issuerestriction":{"issuerestrictions":{},"shouldDisplay":false},"customfield_13371":null,"customfield_13373":null,"created":"2022-06-21T09:43:01.698-0400","customfield_13494":null,"customfield_13375":null,"customfield_13012":null,"customfield_13011":null,"customfield_13377":null,"customfield_13376":null,"customfield_13016":null,"customfield_13379":null,"customfield_13378":null,"customfield_13017":null,"customfield_13360":null,"customfield_13362":null,"customfield_13361":null,"customfield_13001":null,"customfield_13122":null,"customfield_13364":null,"customfield_13363":null,"customfield_13000":null,"customfield_13366":"150 GB","customfield_13365":null,"customfield_13002":null,"customfield_13368":null,"customfield_13367":null,"customfield_13369":null,"security":null,"attachment":[],"customfield_13470":null,"customfield_13471":null,"customfield_12385":null,"customfield_13355":null,"customfield_12386":null,"customfield_13357":null,"customfield_13599":null,"customfield_12388":null,"customfield_13356":null,"customfield_13359":null,"customfield_13358":null}},{"expand":"operations,versionedRepresentations,editmeta,changelog,renderedFields","id":"296823","self":"https://arthrex.atlassian.net/rest/agile/1.0/issue/296823","key":"MOB-1051","fields":{"parent":{"id":"279628","key":"MOB-929","self":"https://arthrex.atlassian.net/rest/api/2/issue/279628","fields":{"summary":"UX/UI","status":{"self":"https://arthrex.atlassian.net/rest/api/2/status/3","description":"This issue is being actively worked on at the moment by the assignee.","iconUrl":"https://arthrex.atlassian.net/images/icons/statuses/inprogress.png","name":"Working","id":"3","statusCategory":{"self":"https://arthrex.atlassian.net/rest/api/2/statuscategory/4","id":4,"key":"indeterminate","colorName":"yellow","name":"In Progress"}},"priority":{"self":"https://arthrex.atlassian.net/rest/api/2/priority/4","iconUrl":"https://s3.amazonaws.com/arthrex-public/jira/priorities/minor.png","n